[
    {
        "user_input": "Welche Kurse sollte ich im ersten Semester belegen?",
        "reference": "Laut dem exemplarischen Studienverlaufsplan solltest du im ersten Semester folgende Kurse belegen: Mathematische Grundlagen, Einf\u00fchrung in die computationelle Logik, Einf\u00fchrung in die Computerlinguistik, Einf\u00fchrung in die Programmierung mit Python, Morphologie und Syntax.",
        "response": "Dazu enthalten die bereitgestellten Dokumente keine Informationen.",
        "retrieved_contexts": [
            "n<br>\n**Empfohlenes Studiensemester:** 4. Fachsemester (Sommersemester) | 5. Fachsemester (Wintersemester)<br>\n**H\u00e4ufigkeit des Angebots:** Jedes Semester<br>\n**Geplante Gruppengr\u00f6\u00dfe:** Nach Vorgabe der gew\u00e4hlten Veranstaltungen<br>\n**Kontaktzeit:** Nach Vorgabe der gew\u00e4hlten Veranstaltungen<br>\n**Selbststudium:** Nach Vorgabe der gew\u00e4hlten Veranstaltungen<br>\n**ECTS-Leistungspunkte f\u00fcr die Modulpr\u00fcfung:** Nach Vorgabe der gew\u00e4hlten Veranstaltungen<br>\n**Inhalte:** M\u00f6gliche Inhalte sind Themen d",
            "r (a) mit \u00dcbung (b) und Seminar (c) mit \u00dcbung (d)<br>\n**Empfohlenes Studiensemester:** a: 1. Fachsemester (Wintersemester) | b: 1. Fachsemester (Wintersemester) | c: 2. Fachsemester (Sommersemester) | d: 2. Fachsemester (Sommersemester) | Pr\u00fcfung im 2. Fachsemester (Sommersemester)<br>\n**H\u00e4ufigkeit des Angebots:** a: Jedes Wintersemester | b: Jedes Wintersemester | c: Jedes Sommersemester | d: Jedes Sommersemester<br>\n**Geplante Gruppengr\u00f6\u00dfe:** a: Ca. 60 Studierende | b: Ca. 60 Studierende | c: ",
            " 1 Semester<br>\n**Lehrveranstaltungen und Lehrformen:** a: Parsing (Seminar) / 4301 | b: \u00dcbung zu Parsing (\u00dcbung) / 4302<br>\n**Belegung:** Seminar (a) und \u00dcbung (b)<br>\n**Empfohlenes Studiensemester:** a: 4. Fachsemester (Sommersemester) | b: 4. Fachsemester (Sommersemester)<br>\n**H\u00e4ufigkeit des Angebots:** a: Jedes Sommersemester | b: Jedes Sommersemester<br>\n**Geplante Gruppengr\u00f6\u00dfe:** a: Ca. 60 Studierende | b: Ca. 60 Studierende<br>\n**Kontaktzeit:** a: 2 SWS / 30 Stunden / 1 ECTS-Leistungspun",
            "2 | c: Fortgeschrittene Python-Programmierung mit NLP-Anwendungen (Seminar) / 2303 | d: Fortgeschrittene Python-Programmierung mit NLP-Anwendungen (\u00dcbung) / 2304<br>\n**Belegung:** Seminar (a) mit \u00dcbung (b) und Seminar (c) mit \u00dcbung (d)<br>\n**Empfohlenes Studiensemester:** a: 1. Fachsemester (Wintersemester) | b: 1. Fachsemester (Wintersemester) | c: 2. Fachsemester (Sommersemester) | d: 2. Fachsemester (Sommersemester) | Pr\u00fcfung im 2. Fachsemester (Sommersemester)<br>\n**H\u00e4ufigkeit des Angebots:*"
        ]
    },
    {
        "user_input": "Kann ich mit dem Studium in Computerlinguistik auch im Sommersemester anfangen?",
        "reference": "Nein, das Studium ist f\u00fcr einen Beginn im Wintersemester ausgelegt.",
        "response": "Ja, mit dem Studium in Computerlinguistik kann man im Sommersemester anfangen.",
        "retrieved_contexts": [
            "# BA Computerlinguistik PO 2025\n**Vorl\u00e4ufige Lesefassung Stand 26.09.2025**\n\n## Studiengang\u00fcbersicht\n\n| Merkmal | Details |\n| :--- | :--- |\n| **Integrierter Studiengang** | Computerlinguistik |\n| **Studienbeginn** | Nur im Wintersemester |\n| **Studienumfang** | 180 ECTS-Leistungspunkte (LP) |\n| **Notwendige Vorkenntnisse** | Kenntnisse des Englischen (Niveau B1, vergleichbar mit erfolgreichem vierj\u00e4hrigem Schulunterricht an einer weiterf\u00fchrenden Schule) |\n| **Prop\u00e4deutikum im Profilbildungsberei",
            " a: thematisches Seminar in der Computerlinguistik (Seminar) / 5301<br>\n**Belegung:** Seminar (a)<br>\n**Empfohlenes Studiensemester:** a: 6. Fachsemester (Sommersemester) | Pr\u00fcfung im 6. Fachsemester (Sommersemester)<br>\n**H\u00e4ufigkeit des Angebots:** a: Jedes Sommersemester<br>\n**Geplante Gruppengr\u00f6\u00dfe:** a: Ca. 30 Studierende<br>\n**Kontaktzeit:** a: 4 SWS/60 Stunden / 2 ECTS-Leistungspunkte<br>\n**Selbststudium:** a: 90 Stunden / 3 ECTS-Leistungspunkte<br>\n**ECTS-Leistungspunkte f\u00fcr die Modulpr\u00fcfu",
            "omputerlinguistik | | Pnr. 5201 | 6 LP | 4 SWS |\n| Seminar nach Wahl im Bereich Computerlinguistik | | Pnr. 5202 | 6 LP | 4 SWS |\n| **Profilbildungsbereich** | | | **1 LP** | |\n\n### 6. Semester Bachelor Computerlinguistik\n*Summe: 3 Module, 1 MP, Bachelorarbeit, 2 Veranstaltungen, 8 SWS, 30 LP, davon 1 LP im PBB*\n\n| Modul / Veranstaltung | MP | SL | LP | SWS |\n| :--- | :--- | :--- | :--- | :--- |\n| **Vertiefungsmodul - Computerlinguistik 2** | **1 MP** | **1 SL** | **9 LP** | **4 SWS** |\n| Semina",
            "load:** 450 Stunden<br>\n**Dauer:** 1 Semester<br>\n**Lehrveranstaltungen und Lehrformen:** a: Forschungskolloquium Computerlinguistik (Kolloquium) / 5901 | b: Seminar (Seminar) / 5902<br>\n**Belegung:** Forschungskolloquium (a) oder Seminar (b)<br>\n**Empfohlenes Studiensemester:** a: 6. Fachsemester (Sommersemester) | b: 6. Fachsemester (Sommersemester)<br>\n**H\u00e4ufigkeit des Angebots:** a: Jedes Sommersemester | b: Jedes Sommersemester<br>\n**Geplante Gruppengr\u00f6\u00dfe:** a: Ca. 30 Studierende | b: Ca. 3"
        ]
    },
    {
        "user_input": "Muss ich flie\u00dfend Englisch sprechen k\u00f6nnen um Computerlinguistik zu studieren?",
        "reference": "Flie\u00dfendes Englisch wird nicht vorausgesetzt, jedoch ben\u00f6tigst du Englischkenntnisse auf dem Niveau B1. Dies entspricht vergleichsweise einem erfolgreichen vierj\u00e4hrigen Schulunterricht an einer weiterf\u00fchrenden Schule.",
        "response": "Ja, es ist notwendig, Kenntnisse des Englischen (Niveau B1) zu haben, um Computerlinguistik zu studieren.",
        "retrieved_contexts": [
            "# BA Computerlinguistik PO 2025\n**Vorl\u00e4ufige Lesefassung Stand 26.09.2025**\n\n## Studiengang\u00fcbersicht\n\n| Merkmal | Details |\n| :--- | :--- |\n| **Integrierter Studiengang** | Computerlinguistik |\n| **Studienbeginn** | Nur im Wintersemester |\n| **Studienumfang** | 180 ECTS-Leistungspunkte (LP) |\n| **Notwendige Vorkenntnisse** | Kenntnisse des Englischen (Niveau B1, vergleichbar mit erfolgreichem vierj\u00e4hrigem Schulunterricht an einer weiterf\u00fchrenden Schule) |\n| **Prop\u00e4deutikum im Profilbildungsberei",
            " Methoden in der Computerlinguistik<br>\n**Pr\u00fcfungsformen:** Hausarbeit (mit Programmierprojekt) (Pnr. 4110) oder Studienarbeit (mit Programmierprojekt) (Pnr. 4120)<br>\n**Voraussetzungen f\u00fcr die Zulassung zur Modulpr\u00fcfung:** -keine-<br>\n**Voraussetzungen f\u00fcr die Vergabe von ECTS-Leistungspunkten:** Erbrachte Studienleistungen (SL) in allen Lehrveranstaltungen und bestandene Modulpr\u00fcfung.<br>\n**Sonstige Informationen:** -keine-\n\n### Modul: Aufbaumodul - Mathematische Linguistik\n**Englischer Titel:",
            "eninhalte:** Studierende lernen vertiefte Kenntnisse in Spezialgebieten der Computerlinguistik.<br>\n**Teilnahmevoraussetzungen:** Formal: Basismodul - Mathematische und logische Grundlagen, Basismodul - Grundlagen der Computerlinguistik und formale Grammatikbeschreibung, Aufbaumodul - Maschinelles Lernen | Inhaltlich: Je nach Thema<br>\n**Pr\u00fcfungsformen:** -keine-<br>\n**Voraussetzungen f\u00fcr die Zulassung zur Modulpr\u00fcfung:** -keine-<br>\n**Voraussetzungen f\u00fcr die Vergabe von ECTS-Leistungspunkten:**",
            "istik. Dies wird erg\u00e4nzt durch Einf\u00fchrungen in die f\u00fcr die Computerlinguistik zentralen sprachwissenschaftlichen Bereiche Morphologie/Syntax und Semantik/Pragmatik. Desweiteren sieht der Studienplan f\u00fcr das erste Jahr einen Einstieg in computerlinguistische Programmierung mit Python vor, die neben Grundlagen auch aktuelle Methoden der Sprachtechnologie vermittelt.\n**Phase 2 Aufbau von Fachkompetenzen f\u00fcr die Computerlinguistik:** Methodisch lernt man in dieser zweiten Phase die f\u00fcr die datengetr"
        ]
    },
    {
        "user_input": "Muss ich f\u00fcr den Python-Kurs Vorkenntnisse haben?",
        "reference": "Nein, f\u00fcr das Modul \"Python-Programmierung\" werden weder formale noch inhaltliche Vorkenntnisse vorausgesetzt.",
        "response": "Dazu enthalten die bereitgestellten Dokumente keine Informationen.",
        "retrieved_contexts": [
            "ktionale Programmierung). Au\u00dferdem werden Grundkenntnisse des Einsatzes von Python in den Bereichen Data Science und NLP (Natural Language Processing) erworben, sowie die F\u00e4higkeit ein kleines Software-Projekt durchzuf\u00fchren und zu pr\u00e4sentieren.<br>\n**Teilnahmevoraussetzungen:** Formal: Keine | Inhaltlich: Keine<br>\n**Pr\u00fcfungsformen:** Projektarbeit (Pnr. 2310)<br>\n**Voraussetzungen f\u00fcr die Zulassung zur Modulpr\u00fcfung:** -keine-<br>\n**Voraussetzungen f\u00fcr die Vergabe von ECTS-Leistungspunkten:** Er",
            "br>\n**Sonstige Informationen:** -keine-\n\n### Modul: Basismodul - Python-Programmierung\n**Englischer Titel:** Basis module - Python programming<br>\n**Modul-Nummer:** 2300<br>\n**ECTS-Leistungspunkte:** 12 ECTS-Leistungspunkte<br>\n**Workload:** 360 Stunden<br>\n**Dauer:** 2 Semester<br>\n**Lehrveranstaltungen und Lehrformen:** a: Einf\u00fchrung in die Programmierung mit Python (Seminar) / 2301 | b: Einf\u00fchrung in die Programmierung mit Python (\u00dcbung) / 2302 | c: Fortgeschrittene Python-Programmierung mit ",
            "dlagen, Basismodul - Python-Programmierung<br>\n**Pr\u00fcfungsformen:** Klausur (Pnr. 4510)<br>\n**Voraussetzungen f\u00fcr die Zulassung zur Modulpr\u00fcfung:** -keine-<br>\n**Voraussetzungen f\u00fcr die Vergabe von ECTS-Leistungspunkten:** Erbrachte Studienleistungen (SL) in den Lehrveranstaltungen (b) und (c) | Bestandene Modulpr\u00fcfung: 4 ECTS-Leistungspunkte<br>\n**Sonstige Informationen:** -keine-\n\n### Modul: Praktikum & Orientierung\n**Englischer Titel:** Internship & orientation<br>\n**Modul-Nummer:** 3000<br>\n*",
            " nennen und zu erl\u00e4utern; einfache Algorithmen (iterativ und rekursiv) zu verstehen, deren Ablauf zu beschreiben, sowie selbst zu erstellen; eigene Datentypen zu konzipieren und anzuwenden; einfache objektorientierte Programme mit Polymorphie, Vererbung und Schnittstellen zu entwickeln; die behandelten dynamischen Datenstrukturen anzuwenden.<br>\n**Teilnahmevoraussetzungen:** Formal: Keine | Inhaltlich: Basismodul - Mathematische und logische Grundlagen, Basismodul - Python-Programmierung<br>\n**P"
        ]
    },
    {
        "user_input": "Gibt es eine \u00dcbung f\u00fcr Mathematische Grundlagen?",
        "reference": "Nein, f\u00fcr den Kurs \"Mathematische Grundlagen\" gibt es keine begleitende \u00dcbung. Es handelt sich dabei ausschlie\u00dflich um ein Seminar.",
        "response": "Ja, es gibt eine \u00dcbung f\u00fcr Mathematische Grundlagen.",
        "retrieved_contexts": [
            "l - Mathematische und logische Grundlagen** | **1 MP** | **2 SL** | **12 LP** | **8 SWS** |\n| Einf\u00fchrung in die computationelle Logik (Seminar mit \u00dcbung) | | Pnr. 2101 | 4 LP | 4 SWS |\n| Mathematische Grundlagen (Seminar) | | Pnr. 2102 | 4 LP | 4 SWS |\n| Modulpr\u00fcfung (Portfolio) | Pnr. 2110 | | 4 LP | |\n| **Basismodul - Grundlagen der Computerlinguistik und formale Grammatikbeschreibung [1/2]** | | **2 SL** | **4 LP** | **4 SWS** |\n| Einf\u00fchrung in die Computerlinguistik (Seminar) | | Pnr. 2201 |",
            "gical foundations<br>\n**Modul-Nummer:** 2100<br>\n**ECTS-Leistungspunkte:** 12 ECTS-Leistungspunkte<br>\n**Workload:** 360 Stunden<br>\n**Dauer:** 1 Semester<br>\n**Lehrveranstaltungen und Lehrformen:** a: Einf\u00fchrung in die computationelle Logik (Seminar & \u00dcbung) / 2101 | b: Mathematische Grundlagen (Seminar) / 2102<br>\n**Belegung:** Seminar und \u00dcbung (a) und Seminar (b)<br>\n**Empfohlenes Studiensemester:** a: 1. Fachsemester (Wintersemester) | b: 1. Fachsemester (Wintersemester) | Pr\u00fcfung im 1. Fac",
            "a zu erstellen und f\u00fcr Experimente und Analysen durchzuf\u00fchren.<br>\n**Teilnahmevoraussetzungen:** Formal: keine | Inhaltlich: Basismodul Mathematische und logische Grundlagen<br>\n**Pr\u00fcfungsformen:** -keine-<br>\n**Voraussetzungen f\u00fcr die Zulassung zur Modulpr\u00fcfung:** -keine-<br>\n**Voraussetzungen f\u00fcr die Vergabe von ECTS-Leistungspunkten:** Erbrachte Studienleistungen (SL) oder Hausaufgaben in allen Lehrveranstaltungen<br>\n**Sonstige Informationen:** -keine-\n\n### Modul: Aufbaumodul - Maschinelles ",
            "tik besucht wird, wodurch interessante Einblicke in aktuelle Forschungsthemen geboten werden und Anregungen und Inspiration f\u00fcr die Bachelorarbeit gewonnen werden kann. Das 5. Semester kann als Mobilit\u00e4tssemester gew\u00e4hlt werden, da in den Vertiefungsmodulen auch Kurse aus anderen Universit\u00e4ten anerkannt werden k\u00f6nnen.\n\n## Module\n\n### Modul: Basismodul - Mathematische und logische Grundlagen\n**Englischer Titel:** Basis module - mathematical and logical foundations<br>\n**Modul-Nummer:** 2100<br>\n*"
        ]
    },
    {
        "user_input": "Muss ich in Python eine Klausur/Pr\u00fcfung absolvieren?",
        "reference": "Ja, du musst im Modul \"Python-Programmierung\" eine Pr\u00fcfung in Form einer Projektarbeit ablegen. Diese Modulpr\u00fcfung ist jedoch erst im zweiten Fachsemester (Sommersemester) vorgesehen. Im ersten Semester musst du daf\u00fcr lediglich Studienleistungen erbringen.",
        "response": "Nein, es ist nicht notwendig, eine Klausur/Pr\u00fcfung zu absolvieren.",
        "retrieved_contexts": [
            "dlagen, Basismodul - Python-Programmierung<br>\n**Pr\u00fcfungsformen:** Klausur (Pnr. 4510)<br>\n**Voraussetzungen f\u00fcr die Zulassung zur Modulpr\u00fcfung:** -keine-<br>\n**Voraussetzungen f\u00fcr die Vergabe von ECTS-Leistungspunkten:** Erbrachte Studienleistungen (SL) in den Lehrveranstaltungen (b) und (c) | Bestandene Modulpr\u00fcfung: 4 ECTS-Leistungspunkte<br>\n**Sonstige Informationen:** -keine-\n\n### Modul: Praktikum & Orientierung\n**Englischer Titel:** Internship & orientation<br>\n**Modul-Nummer:** 3000<br>\n*",
            "ktionale Programmierung). Au\u00dferdem werden Grundkenntnisse des Einsatzes von Python in den Bereichen Data Science und NLP (Natural Language Processing) erworben, sowie die F\u00e4higkeit ein kleines Software-Projekt durchzuf\u00fchren und zu pr\u00e4sentieren.<br>\n**Teilnahmevoraussetzungen:** Formal: Keine | Inhaltlich: Keine<br>\n**Pr\u00fcfungsformen:** Projektarbeit (Pnr. 2310)<br>\n**Voraussetzungen f\u00fcr die Zulassung zur Modulpr\u00fcfung:** -keine-<br>\n**Voraussetzungen f\u00fcr die Vergabe von ECTS-Leistungspunkten:** Er",
            "2 | c: Fortgeschrittene Python-Programmierung mit NLP-Anwendungen (Seminar) / 2303 | d: Fortgeschrittene Python-Programmierung mit NLP-Anwendungen (\u00dcbung) / 2304<br>\n**Belegung:** Seminar (a) mit \u00dcbung (b) und Seminar (c) mit \u00dcbung (d)<br>\n**Empfohlenes Studiensemester:** a: 1. Fachsemester (Wintersemester) | b: 1. Fachsemester (Wintersemester) | c: 2. Fachsemester (Sommersemester) | d: 2. Fachsemester (Sommersemester) | Pr\u00fcfung im 2. Fachsemester (Sommersemester)<br>\n**H\u00e4ufigkeit des Angebots:*",
            "Schule) |\n| **Prop\u00e4deutikum im Profilbildungsbereich** | keine Angabe |\n| **Anzahl der Modulpr\u00fcfungen** | 9, zuz\u00fcglich Bachelorarbeit |\n| **Art und Inhalt der Module und der Pr\u00fcfungen** | **Module:**<br>- Basismodul - Mathematische und logische Grundlagen (8 SWS, 1 MP, 12 LP)<br>- Basismodul - Grundlagen der Computerlinguistik und formale Grammatikbeschreibung (8 SWS, 1 MP, 12 LP)<br>- Basismodul - Python-Programmierung (8 SWS, 1 MP, 12 LP)<br>- Basiswissen Linguistik - Morphologie und Syntax (6"
        ]
    },
    {
        "user_input": "Wann soll ich das Praktikum machen?",
        "reference": "Es wird empfohlen, das Berufsfeldpraktikum nach dem vierten oder f\u00fcnften Semester zu absolvieren.",
        "response": "Dazu enthalten die bereitgestellten Dokumente keine Informationen.",
        "retrieved_contexts": [
            "ns 6-w\u00f6chiges Berufsfeldpraktikum oder eine Projektarbeit absolviert, jeweils mit einschl\u00e4gig computerlinguistischem Inhalt. Das Praktikum soll einen Einblick in die Berufspraxis vermitteln sowie den sp\u00e4teren \u00dcbergang in die Berufswelt erleichtern. Die Wahl des Praktikumsplatzes erfolgt im Einvernehmen mit dem/der Praktikumsbeauftragten der Abteilung f\u00fcr Computerlinguistik. Der/die Praktikumsbeauftragte ist bei der Vermittlung von Praktikumspl\u00e4tzen behilflich und bietet eine fachliche Praktikums",
            "en behilflich und bietet eine fachliche Praktikumsberatung und -begleitung an. \u00dcber das Praktikum ist ein kurzer Bericht (ca. 3-5 Seiten) zu verfassen und ein Zeugnis der Praktikumsstelle einzureichen. |\n\n---\n\n## Exemplarischer Studienverlaufsplan Bachelor Computerlinguistik\n\nBei dieser Darstellung handelt es sich um einen exemplarischen Studienverlaufsplan, der nicht verpflichtend ist. Dieser Plan strebt eine m\u00f6glichst gleichm\u00e4\u00dfige Arbeitsverteilung in Form von ECTS-Leistungspunkten pro Semeste",
            "g) / 4502 | c: Praktische \u00dcbung zur Vorlesung (Praktische \u00dcbung) / 4503<br>\n**Belegung:** Vorlesung (a) mit \u00dcbung (b) und praktischer \u00dcbung (c)<br>\n**Empfohlenes Studiensemester:** a: 3. Fachsemester (Wintersemester) | b: 3. Fachsemester (Wintersemester) | c: 3. Fachsemester (Wintersemester)<br>\n**H\u00e4ufigkeit des Angebots:** a: Jedes Wintersemester | b: Jedes Wintersemester | c: Jedes Wintersemester<br>\n**Geplante Gruppengr\u00f6\u00dfe:** a: Unbegrenzt | b: Ca. 30 Studierende | c: Ca. 30 Studierende<br>\n*",
            "ch sind. Im Rahmen dieses Moduls muss mindestens eine Veranstaltung aus der Informatik belegt werden. Neben diesen Modulen, die relativ flexibel Spezialisierungen in Computerlinguistik, Linguistik und Informatik erlauben, ist im letzten Jahr ein Praktikum zur Berufsorientierung und die Anfertigung der Bachelorarbeit vorgesehen. Letztere wird in der Regel im letzten Semester durchgef\u00fchrt, wobei parallel das Forschungskolloquium der Computerlinguistik besucht wird, wodurch interessante Einblicke i"
        ]
    },
    {
        "user_input": "Wird im Studiengang KI behandelt?",
        "reference": "Ja, das Thema K\u00fcnstliche Intelligenz (KI) ist ein zentraler und fest verankerter Bestandteil des Studiengangs. Im Pflichtbereich (Deep Learning): Im Aufbaumodul \"Maschinelles Lernen\" lernen die Studierenden den Umgang mit k\u00fcnstlichen neuronalen Netzen (Deep Learning) kennen und implementieren diese zur L\u00f6sung von Aufgaben im Natural Language Processing (NLP). Als Wahlthema in der Informatik: Im \"Vertiefungsmodul - Interdisziplin\u00e4r\" kann aus dem Bereich der Informatik explizit die Veranstaltung \"\u00dcberblick K\u00fcnstliche Intelligenz\" belegt werden. Spezialisierung im 3. Studienjahr: In den Vertiefungsmodulen der Computerlinguistik werden hochaktuelle KI-Architekturen in Seminaren gelehrt, darunter ausdr\u00fccklich \"gro\u00dfe Sprachmodelle\" (Large Language Models) und \"Transformer-Architekturen\".",
        "response": "Ja, im Studiengang KI behandelt.",
        "retrieved_contexts": [
            "nellen Lernens und der k\u00fcnstlichen Intelligenz, und Programmierkenntnisse auf hohem Niveau. Dieses Wissen wird im dritten Jahr weiter ausgebaut und im Rahmen eines Praktikums und der Abschlussarbeit im Kontext konkreter Fragestellungen angewendet. Damit sind die Absolventen des Studiengangs optimal vorbereitet auf eine berufliche T\u00e4tigkeit z.B. in den Bereichen elektronische Informationsverarbeitung, Sprachressourcenmanagement, maschinelle Sprachverarbeitung und Sprachtechnologie. Die Studierend",
            "verarbeitung und Sprachtechnologie. Die Studierenden erwerben au\u00dferdem besonders in den Aufbau- und Vertiefungsmodulen die F\u00e4higkeit, relevante Informationen im Bereich der Computerlinguistik zu sammeln, zu bewerten und zu interpretieren und daraus wissenschaftlich fundierte Urteile abzuleiten, z.B. auch \u00fcber gesellschaftsrelevante Aspekte von Sprachtechnologien wie etwa den Einsatz von Methoden der k\u00fcnstlichen Intelligenz in gro\u00dfen Sprachmodellen. Die Absolventen k\u00f6nnen sich selbst\u00e4ndig in neue",
            "auf einen anschlie\u00dfenden Masterstudiengang. z.B. im Bereich Sprachtechnologie oder K\u00fcnstliche Intelligenz oder im Bereich Linguistik vorbereitet.\n\n## Aufbau des Studiums\nGrob l\u00e4sst sich das Studium in drei Phasen einteilen: Die ersten zwei Semester sind dem Erwerb von Basiswissen gewidmet, Semester 3 und 4 dem Aufbau weiterer Fachkompetenzen und die letzten beiden Semester der weiteren Spezialisierung und dem Studienabschluss.\n**Phase 1 Erwerb von Basiswissen f\u00fcr die Computerlinguistik:** Hierzu",
            "r Informatik sind z.B.: Professionelle Softwareentwicklung, Datenbanksysteme, Nichtkooperative Spieltheorie, Komplexit\u00e4tstheorie, Numerische Optimierung, Dialogsysteme, \u00dcberblick K\u00fcnstliche Intelligenz.<br>\n**Angestrebte Lernergebnisse und Studieninhalte:** Vertiefte Kenntnisse in Spezialgebieten von Linguistik/Computerlinguistik/Informatik<br>\n**Teilnahmevoraussetzungen:** Formal: keine<br>\n**Pr\u00fcfungsformen:** M\u00fcndliche Pr\u00fcfung (Pnr. 5110) oder Klausur (Pnr. 5120) oder Hausarbeit (Pnr. 5130) od"
        ]
    },
    {
        "user_input": "Muss ich Kurse aus der Linguistik f\u00fcr das interdisziplin\u00e4re Vertiefungsmodul belegen?",
        "reference": "Nein, Linguistik-Kurse sind keine Pflicht. Das Modul sieht vor, dass du zwei Vorlesungen oder Seminare aus der Linguistik oder der Informatik w\u00e4hlst, wobei lediglich der Informatik-Anteil von 4 SWS vorgeschrieben ist.",
        "response": "Nein, es ist nicht notwendig, Kurse aus der Linguistik f\u00fcr das interdisziplin\u00e4re Vertiefungsmodul zu belegen.",
        "retrieved_contexts": [
            "ren in computerlinguistischen Anwendungen, Advanced Constituency Parsing, Dependency Parsing, Finite-State Morphology, Semantic Role Labeling, Discourse Representation Theory, Fuzzy Logic usw. Daneben gibt es das interdisziplin\u00e4re Vertiefungsmodul, in dem den Studierenden erm\u00f6glicht wird, neben Veranstaltungen aus der Computerlinguistik auch Veranstaltungen aus Linguistik und Informatik zu belegen, die nicht notwendig dezidiert computerlinguistisch sind. Im Rahmen dieses Moduls muss mindestens e",
            "dul - Mathematische Linguistik\n**Englischer Titel:** Advanced module - mathematical linguistics<br>\n**Modul-Nummer:** 4200<br>\n**ECTS-Leistungspunkte:** 6 ECTS-Leistungspunkte<br>\n**Workload:** 180 Stunden<br>\n**Dauer:** 1 Semester<br>\n**Lehrveranstaltungen und Lehrformen:** a: Automatentheorie & Formale Sprachen (Seminar) / 4201 | b: \u00dcbung zu Automatentheorie & Formale Sprachen (\u00dcbung) / 4202<br>\n**Belegung:** Seminar (a) und \u00dcbung (b)<br>\n**Empfohlenes Studiensemester:** a: 3. Fachsemester (Wi",
            "Klausur (Pnr. 5120) oder Hausarbeit (Pnr. 5130) oder Studienarbeit (Pnr. 5140) oder Projektarbeit (Pnr. 5150)<br>\n**Voraussetzungen f\u00fcr die Zulassung zur Modulpr\u00fcfung:** -keine<br>\n**Voraussetzungen f\u00fcr die Vergabe von ECTS-Leistungspunkten:** Bestandene Modulpr\u00fcfung, aktive und erfolgreiche Mitwirkung in den Seminaren und theoretischen und praktischen \u00dcbungen.<br>\n**Sonstige Informationen:** -keine-\n\n### Modul: Vertiefungsmodul - Computerlinguistik 1\n**Englischer Titel:** Specialization module ",
            "ik\n**Englischer Titel:** Basic expertise in linguistics - semantics and pragmatics<br>\n**Modul-Nummer:** 1400<br>\n**ECTS-Leistungspunkte:** 9 ECTS-Leistungspunkte<br>\n**Workload:** 270 Stunden<br>\n**Dauer:** 1 Semester<br>\n**Lehrveranstaltungen und Lehrformen:** a: Semantik und Pragmatik (Vorlesung) / 1401 | b: Tutorium zu Semantik und Pragmatik (Tutorium) / 1402<br>\n**Belegung:** Vorlesung (a) und Tutorium (b)<br>\n**Empfohlenes Studiensemester:** a: 2. Fachsemester (Sommersemester) | b: 2. Fach"
        ]
    },
    {
        "user_input": "Wie stark z\u00e4hlt die Bachelorarbeit f\u00fcr meine Abschlussnote?",
        "reference": "Die Note der Bachelorarbeit wird bei der Ermittlung der Gesamtnote dreifach gewichtet. Im Vergleich dazu gehen alle anderen Modulpr\u00fcfungen nur einfach in die Gesamtnote ein.",
        "response": "Dazu enthalten die bereitgestellten Dokumente keine Informationen.",
        "retrieved_contexts": [
            "s- und Aufbaumodule<br>\n**Pr\u00fcfungsformen:** Bachelorarbeit (Pnr. 6000)<br>\n**Voraussetzungen f\u00fcr die Zulassung zur Pr\u00fcfung:** -keine-<br>\n**Voraussetzungen f\u00fcr die Vergabe von ECTS-Leistungspunkten:** Aktive und erfolgreiche Mitwirkung im Forschungsseminar, bestandene Bachelorarbeit.<br>\n**Sonstige Informationen:** -keine-",
            "en behilflich und bietet eine fachliche Praktikumsberatung und -begleitung an. \u00dcber das Praktikum ist ein kurzer Bericht (ca. 3-5 Seiten) zu verfassen und ein Zeugnis der Praktikumsstelle einzureichen. |\n\n---\n\n## Exemplarischer Studienverlaufsplan Bachelor Computerlinguistik\n\nBei dieser Darstellung handelt es sich um einen exemplarischen Studienverlaufsplan, der nicht verpflichtend ist. Dieser Plan strebt eine m\u00f6glichst gleichm\u00e4\u00dfige Arbeitsverteilung in Form von ECTS-Leistungspunkten pro Semeste",
            "esonderheiten** | Die zweite Wiederholung einer Modulpr\u00fcfung darf als m\u00fcndliche Pr\u00fcfung erfolgen. |\n| **Gewichtung der Pr\u00fcfungen f\u00fcr die Gesamtnote** | Bachelorarbeit: dreifach<br>Alle Modulpr\u00fcfungen: einfach |\n| **Pr\u00fcfungssprache nach \u00a7 6 (4)** | keine Angabe |\n| **Auslandsaufenthalt** | Optional (Mobilit\u00e4tsfenster: 5. Semester) |\n| **Exkursion** | keine Angabe |\n| **Praktikum** | Nach dem vierten oder f\u00fcnften Semester wird entweder ein mindestens 6-w\u00f6chiges Berufsfeldpraktikum oder eine Projek",
            "\n**Voraussetzungen f\u00fcr die Zulassung zur Modulpr\u00fcfung:** -keine-<br>\n**Voraussetzungen f\u00fcr die Vergabe von ECTS-Leistungspunkten:** Aktive und erfolgreiche Mitwirkung im Forschungsseminar, bestandene Modulpr\u00fcfung<br>\n**Sonstige Informationen:** -keine-\n\n### Modul: Abschlussarbeit und Forschungskolloquium\n**Englischer Titel:** Thesis and research colloquium<br>\n**Modul-Nummer:** 5900<br>\n**ECTS-Leistungspunkte:** 15 ECTS-Leistungspunkte<br>\n**Workload:** 450 Stunden<br>\n**Dauer:** 1 Semester<br>\n"
        ]
    },
    {
        "user_input": "Muss ich alle Module bestanden haben, bevor ich meine Bachelorarbeit schreibe?",
        "reference": "Nein, du musst nicht zwingend das gesamte Studium vorher abgeschlossen haben. Die einzige formale Teilnahmevoraussetzung f\u00fcr das Modul \"Abschlussarbeit und Forschungskolloquium\" ist der erfolgreiche Abschluss aller Basis- und Aufbaumodule.",
        "response": "Dazu enthalten die bereitgestellten Dokumente keine Informationen.",
        "retrieved_contexts": [
            "s- und Aufbaumodule<br>\n**Pr\u00fcfungsformen:** Bachelorarbeit (Pnr. 6000)<br>\n**Voraussetzungen f\u00fcr die Zulassung zur Pr\u00fcfung:** -keine-<br>\n**Voraussetzungen f\u00fcr die Vergabe von ECTS-Leistungspunkten:** Aktive und erfolgreiche Mitwirkung im Forschungsseminar, bestandene Bachelorarbeit.<br>\n**Sonstige Informationen:** -keine-",
            "on-Programmierung<br>\n**Pr\u00fcfungsformen:** -keine-<br>\n**Voraussetzungen f\u00fcr die Zulassung zur Modulpr\u00fcfung:** -keine-<br>\n**Voraussetzungen f\u00fcr die Vergabe von ECTS-Leistungspunkten:** Erbrachte Studienleistungen (SL) in (a) und 6-w\u00f6chiges Praktikum nachgewiesen \u00fcber Praktikumsnachweis und Praktikumsbericht.<br>\n**Sonstige Informationen:** -keine-\n\n### Modul: Vertiefungsmodul - Interdisziplin\u00e4r\n**Englischer Titel:** Specialization module - interdisciplinary<br>\n**Modul-Nummer:** 5100<br>\n**ECTS-",
            "Klausur (Pnr. 5120) oder Hausarbeit (Pnr. 5130) oder Studienarbeit (Pnr. 5140) oder Projektarbeit (Pnr. 5150)<br>\n**Voraussetzungen f\u00fcr die Zulassung zur Modulpr\u00fcfung:** -keine<br>\n**Voraussetzungen f\u00fcr die Vergabe von ECTS-Leistungspunkten:** Bestandene Modulpr\u00fcfung, aktive und erfolgreiche Mitwirkung in den Seminaren und theoretischen und praktischen \u00dcbungen.<br>\n**Sonstige Informationen:** -keine-\n\n### Modul: Vertiefungsmodul - Computerlinguistik 1\n**Englischer Titel:** Specialization module ",
            "cher darstellen, durch das w\u00f6chentliche Einreichen von Hausaufgaben mit Abgabeterminen umgehen und ihre eigenst\u00e4ndige Arbeit dementsprechend strukturieren.<br>\n**Teilnahmevoraussetzungen:** Formal: -keine- | Inhaltlich: -keine-<br>\n**Pr\u00fcfungsformen:** Klausur (Pnr. 1410)<br>\n**Voraussetzungen f\u00fcr die Zulassung zur Modulpr\u00fcfung:** -keine-<br>\n**Voraussetzungen f\u00fcr die Vergabe von ECTS-Leistungspunkten:** Erbrachte Studienleistungen (SL) in allen Lehrveranstaltungen und bestandene Modulpr\u00fcfung.<br"
        ]
    },
    {
        "user_input": "Gibt es eine Klausur in Wahrscheinlichkeitstheorie?",
        "reference": "Nein, im \"Basismodul - Statistische Methoden in der Computerlinguistik\", zu dem die Wahrscheinlichkeitstheorie geh\u00f6rt, gibt es gar keine Modulpr\u00fcfung und somit auch keine Klausur. Es m\u00fcssen lediglich Studienleistungen erbracht werden.",
        "response": "Ja, es gibt eine Klausur in Wahrscheinlichkeitstheorie und Statistik.",
        "retrieved_contexts": [
            "ul - Statistische Methoden in der Computerlinguistik [1/2]** | **0 MP** | **1 SL** | **4 LP** | **4 SWS** |\n| Wahrscheinlichkeitstheorie und Statistik (Seminar und \u00dcbung) | | Pnr. 2401 | 4 LP | 4 SWS |\n| **Profilbildungsbereich** | | | **1 LP** | |\n\n### 3. Semester Bachelor Computerlinguistik\n*Summe: 4 Module, 1 MP, 7 Veranstaltungen, 18 SWS, 30 LP, davon 6 LP im PBB*\n\n| Modul / Veranstaltung | MP | SL | LP | SWS |\n| :--- | :--- | :--- | :--- | :--- |\n| **Basismodul - Statistische Methoden in de",
            "S/60 Stunden / 2 ECTS-Leistungspunkte | b: 2 SWS/30 Stunden / 1 ECTS-Leistungspunkt<br>\n**Selbststudium:** a: 60 Stunden / 2 ECTS-Leistungspunkte | b: 30 Stunden / 1 ECTS-Leistungspunkt<br>\n**ECTS-Leistungspunkte f\u00fcr die Modulpr\u00fcfung:** -keine-<br>\n**Inhalte:** Dieses Modul vermittelt grundlegende Kenntnisse in Wahrscheinlichkeitstheorie und in statistischen Methoden der Computerlinguistik, sowie deren Anwendung mittels Korpora und Datens\u00e4tzen. Unter anderem werden folgende Bereiche abgedeckt: S",
            "nter anderem werden folgende Bereiche abgedeckt: Statistik und statistische Programmierung in einer geeigneten Programmiersprache (z.B. R); Aufbau und Pflege linguistischer Ressourcen (Korpora, Datenbanken, ...).<br>\n**Angestrebte Lernergebnisse und Studieninhalte:** Kenntnisse der Grundlagen der Wahrscheinlichkeitstheorie und Grundbegriffe der Statistik. F\u00e4higkeit, statistische Analysen selbst zu konzipieren und implementieren. F\u00e4higkeit, Korpora zu erstellen und f\u00fcr Experimente und Analysen du",
            "ehrveranstaltungen und bestandene Modulpr\u00fcfung.<br>\n**Sonstige Informationen:** -keine-\n\n### Modul: Basismodul - Statistische Methoden in der Computerlinguistik\n**Englischer Titel:** Basis module - statistical methods in computational linguistics<br>\n**Modul-Nummer:** 2400<br>\n**ECTS-Leistungspunkte:** 6 ECTS-Leistungspunkte<br>\n**Workload:** 180 Stunden<br>\n**Dauer:** 2 Semester<br>\n**Lehrveranstaltungen und Lehrformen:** a: Wahrscheinlichkeitstheorie und Statistik (Seminar und \u00dcbung) / 2401 | "
        ]
    }
]