[
    {
        "user_input": "Welche Kurse sollte ich im ersten Semester belegen?",
        "reference": "Laut dem exemplarischen Studienverlaufsplan solltest du im ersten Semester folgende Kurse belegen: Mathematische Grundlagen, Einf\u00fchrung in die computationelle Logik, Einf\u00fchrung in die Computerlinguistik, Einf\u00fchrung in die Programmierung mit Python, Morphologie und Syntax.",
        "response": "Dazu enthalten die bereitgestellten Dokumente keine Informationen.",
        "retrieved_contexts": [
            "r (a) mit \u00dcbung (b) und Seminar (c) mit \u00dcbung (d)<br>\n**Empfohlenes Studiensemester:** a: 1. Fachsemester (Wintersemester) | b: 1. Fachsemester (Wintersemester) | c: 2. Fachsemester (Sommersemester) |",
            "minar) / 2102<br>\n**Belegung:** Seminar und \u00dcbung (a) und Seminar (b)<br>\n**Empfohlenes Studiensemester:** a: 1. Fachsemester (Wintersemester) | b: 1. Fachsemester (Wintersemester) | Pr\u00fcfung im 1. Fac",
            "\n**Belegung:** Seminar mit \u00dcbung (a) und Seminar (b)<br>\n**Empfohlenes Studiensemester:** a: 3. Fachsemester (Wintersemester) | b: 4. Fachsemester (Sommersemester) | Pr\u00fcfung im 4. Fachsemester (Sommer",
            ">\n**Belegung:** Seminar (a)<br>\n**Empfohlenes Studiensemester:** a: 4. Fachsemester (Sommersemester) | b: 5. Fachsemester (Wintersemester)<br>\n**H\u00e4ufigkeit des Angebots:** a: Jedes Sommersemester | b:",
            "/ 5202<br>\n**Belegung:** Seminar (a) und Seminar (b)<br>\n**Empfohlenes Studiensemester:** a: 5. Fachsemester (Wintersemester) | b: 5. Fachsemester (Wintersemester)<br>\n**H\u00e4ufigkeit des Angebots:** Jed",
            "udienbeginn** | Nur im Wintersemester |\n| **Studienumfang** | 180 ECTS-Leistungspunkte (LP) |\n| **Notwendige Vorkenntnisse** | Kenntnisse des Englischen (Niveau B1, vergleichbar mit erfolgreichem vier",
            "egung:** Nach Vorgabe der gew\u00e4hlten Veranstaltungen<br>\n**Empfohlenes Studiensemester:** 4. Fachsemester (Sommersemester) | 5. Fachsemester (Wintersemester)<br>\n**H\u00e4ufigkeit des Angebots:** Jedes Seme",
            "onnen werden kann. Das 5. Semester kann als Mobilit\u00e4tssemester gew\u00e4hlt werden, da in den Vertiefungsmodulen auch Kurse aus anderen Universit\u00e4ten anerkannt werden k\u00f6nnen.\n\n## Module\n\n### Modul: Basismo",
            "heorie und Statistik (Seminar und \u00dcbung) / 2401 | b: Linguistische Ressourcen (Seminar) / 2402<br>\n**Belegung:** Seminar mit \u00dcbung (a) und Seminar (b)<br>\n**Empfohlenes Studiensemester:** a: 2. Fachse",
            "rsing (\u00dcbung) / 4302<br>\n**Belegung:** Seminar (a) und \u00dcbung (b)<br>\n**Empfohlenes Studiensemester:** a: 4. Fachsemester (Sommersemester) | b: 4. Fachsemester (Sommersemester)<br>\n**H\u00e4ufigkeit des Ang"
        ]
    },
    {
        "user_input": "Kann ich mit dem Studium in Computerlinguistik auch im Sommersemester anfangen?",
        "reference": "Nein, das Studium ist f\u00fcr einen Beginn im Wintersemester ausgelegt.",
        "response": "Ja, mit dem Studium in Computerlinguistik kann man auch im Sommersemester anfangen.",
        "retrieved_contexts": [
            "reich** | | | **1 LP** | |\n\n### 6. Semester Bachelor Computerlinguistik\n*Summe: 3 Module, 1 MP, Bachelorarbeit, 2 Veranstaltungen, 8 SWS, 30 LP, davon 1 LP im PBB*\n\n| Modul / Veranstaltung | MP | SL |",
            " | |\n\n### 5. Semester Bachelor Computerlinguistik\n*Summe: 3 Module, 1 MP, 3 Veranstaltungen, 12 SWS, 30 LP, davon 1 LP im PBB*\n\n| Modul / Veranstaltung | MP | SL | LP | SWS |\n| :--- | :--- | :--- | :-",
            "n dem den Studierenden erm\u00f6glicht wird, neben Veranstaltungen aus der Computerlinguistik auch Veranstaltungen aus Linguistik und Informatik zu belegen, die nicht notwendig dezidiert computerlinguistis",
            "ngskolloquium Computerlinguistik (Kolloquium) / 5901 | b: Seminar (Seminar) / 5902<br>\n**Belegung:** Forschungskolloquium (a) oder Seminar (b)<br>\n**Empfohlenes Studiensemester:** a: 6. Fachsemester (",
            "<br>\n**Workload:** 270 Stunden<br>\n**Dauer:** 1 Semester<br>\n**Lehrveranstaltungen und Lehrformen:** a: thematisches Seminar in der Computerlinguistik (Seminar) / 5301<br>\n**Belegung:** Seminar (a)<br",
            "= PBB\n* Pr\u00fcfungsnummer = Pnr.\n\n### 1. Semester Bachelor Computerlinguistik\n*Summe: 4 Module, 2 MP, 8 Veranstaltungen, 22 SWS, 30 LP, davon 1 LP im PBB*\n\n| Modul / Veranstaltung | MP | SL | LP | SWS |\n",
            " LP | SWS |\n| :--- | :--- | :--- | :--- | :--- |\n| **Vertiefungsmodul - Computerlinguistik 2** | **1 MP** | **1 SL** | **9 LP** | **4 SWS** |\n| Seminar nach Wahl im Bereich Computerlinguistik | | Pnr.",
            "ungspunkte<br>\n**Workload:** 360 Stunden<br>\n**Dauer:** 1 Semester<br>\n**Lehrveranstaltungen und Lehrformen:** a: Seminar Computerlinguistik (Seminar) / 5201 | b: Seminar Computerlinguistik (Seminar) ",
            " Pnr. 4503 | 2 LP | 2 SWS |\n| Modulpr\u00fcfung (Klausur) | Pnr. 4510 | | 4 LP | |\n| **Profilbildungsbereich** | | | **6 LP** | |\n\n### 4. Semester Bachelor Computerlinguistik\n*Summe: 5 Module, 1 MP, 7 Vera",
            "Bachelor Computerlinguistik\n*Summe: 4 Module, 3 MP, 7 Veranstaltungen, 18 SWS, 30 LP, davon 1 LP im PBB*\n\n| Modul / Veranstaltung | MP | SL | LP | SWS |\n| :--- | :--- | :--- | :--- | :--- |\n| **Basism"
        ]
    },
    {
        "user_input": "Muss ich flie\u00dfend Englisch sprechen k\u00f6nnen um Computerlinguistik zu studieren?",
        "reference": "Flie\u00dfendes Englisch wird nicht vorausgesetzt, jedoch ben\u00f6tigst du Englischkenntnisse auf dem Niveau B1. Dies entspricht vergleichsweise einem erfolgreichen vierj\u00e4hrigen Schulunterricht an einer weiterf\u00fchrenden Schule.",
        "response": "Nein, es ist nicht notwendig, flie\u00dfend Englisch zu sprechen, um Computerlinguistik zu studieren. Die Teilnahmevoraussetzungen f\u00fcr die meisten Vertiefungsmodulen (z. B. Modul 5200, 5300) sind formal: Basismodul - Mathematische und logische Grundlagen, Basismodul - Grundlagen der Computerlinguistik und formale Grammatik.",
        "retrieved_contexts": [
            " - Computerlinguistik 2 (4 SWS, 1 MP, 9 LP)<br>- Abschlussarbeit und Forschungskolloquium (2 SWS, 15 LP)<br>- Profilbildungsbereich (18 LP) |\n| **Voraussetzungen f\u00fcr Pr\u00fcfungen** | keine Angabe |\n| **B",
            "ne-\n\n### Modul: Vertiefungsmodul - Computerlinguistik 1\n**Englischer Titel:** Specialization module - computational linguistics 1<br>\n**Modul-Nummer:** 5200<br>\n**ECTS-Leistungspunkte:** 12 ECTS-Leist",
            "n dem den Studierenden erm\u00f6glicht wird, neben Veranstaltungen aus der Computerlinguistik auch Veranstaltungen aus Linguistik und Informatik zu belegen, die nicht notwendig dezidiert computerlinguistis",
            "eninhalte:** Studierende lernen vertiefte Kenntnisse in Spezialgebieten der Computerlinguistik.<br>\n**Teilnahmevoraussetzungen:** Formal: Basismodul - Mathematische und logische Grundlagen, Basismodul",
            " LP | SWS |\n| :--- | :--- | :--- | :--- | :--- |\n| **Vertiefungsmodul - Computerlinguistik 2** | **1 MP** | **1 SL** | **9 LP** | **4 SWS** |\n| Seminar nach Wahl im Bereich Computerlinguistik | | Pnr.",
            "Spezialgebieten der Computerlinguistik.<br>\n**Teilnahmevoraussetzungen:** Formal: Basismodul - Mathematische und logische Grundlagen, Basismodul - Grundlagen der Computerlinguistik und formale Grammat",
            "# Modul: Vertiefungsmodul - Computerlinguistik 2\n**Englischer Titel:** Specialization module computational linguistics 2<br>\n**Modul-Nummer:** 5300<br>\n**ECTS-Leistungspunkte:** 9 ECTS-Leistungspunkte",
            "alte:** Vertiefte Kenntnisse in Spezialgebieten von Linguistik/Computerlinguistik/Informatik<br>\n**Teilnahmevoraussetzungen:** Formal: keine<br>\n**Pr\u00fcfungsformen:** M\u00fcndliche Pr\u00fcfung (Pnr. 5110) oder ",
            " Methoden in der Computerlinguistik<br>\n**Pr\u00fcfungsformen:** Hausarbeit (mit Programmierprojekt) (Pnr. 4110) oder Studienarbeit (mit Programmierprojekt) (Pnr. 4120)<br>\n**Voraussetzungen f\u00fcr die Zulass",
            "# BA Computerlinguistik PO 2025\n**Vorl\u00e4ufige Lesefassung Stand 26.09.2025**\n\n## Studiengang\u00fcbersicht\n\n| Merkmal | Details |\n| :--- | :--- |\n| **Integrierter Studiengang** | Computerlinguistik |\n| **St"
        ]
    },
    {
        "user_input": "Muss ich f\u00fcr den Python-Kurs Vorkenntnisse haben?",
        "reference": "Nein, f\u00fcr das Modul \"Python-Programmierung\" werden weder formale noch inhaltliche Vorkenntnisse vorausgesetzt.",
        "response": "Nein, es ist nicht notwendig, Vorkenntnisse in Python zu haben.",
        "retrieved_contexts": [
            "sowie Kenntnisse \u00fcber fortgeschrittene Konzepte der Python-Programmierung (objektorientierte und funktionale Programmierung). Au\u00dferdem werden Grundkenntnisse des Einsatzes von Python in den Bereichen ",
            " Grundz\u00fcge der Sorftware-Entwicklung.<br>\n**Angestrebte Lernergebnisse und Studieninhalte:** Die Studierenden erwerben grundlegende F\u00e4higkeiten in der Programmierung mit der Programmiersprache Python ",
            "| Bestandene Modulpr\u00fcfung: 4 ECTS-Leistungspunkte<br>\n**Sonstige Informationen:** -keine-\n\n### Modul: Basismodul - Python-Programmierung\n**Englischer Titel:** Basis module - Python programming<br>\n**M",
            " 2 LP | 2 SWS |\n| Einf\u00fchrung in die Programmierung mit Python (\u00dcbung) | | Pnr. 2302 | 2 LP | 2 SWS |\n| **Basiswissen Linguistik - Morphologie und Syntax** | **1 MP** | **2 SL** | **9 LP** | **6 SWS** ",
            "ammierung mit Python (Seminar) / 2301 | b: Einf\u00fchrung in die Programmierung mit Python (\u00dcbung) / 2302 | c: Fortgeschrittene Python-Programmierung mit NLP-Anwendungen (Seminar) / 2303 | d: Fortgeschrit",
            "tene Python-Programmierung mit NLP-Anwendungen (\u00dcbung) / 2304<br>\n**Belegung:** Seminar (a) mit \u00dcbung (b) und Seminar (c) mit \u00dcbung (d)<br>\n**Empfohlenes Studiensemester:** a: 1. Fachsemester (Winters",
            "stellungen und Repr\u00e4sentationen der Computerlinguistik und auf soliden Kenntnissen der Programmiersprache Python (siehe Phase 1). Parallel dazu gewinnen die Studierenden Einblick in linguistische Ress",
            "stik (\u00dcbung) | | Pnr. 2202 | 2 LP | 2 SWS |\n| **Basismodul - Python-Programmierung [1/2]** | | **2 SL** | **4 LP** | **4 SWS** |\n| Einf\u00fchrung in die Programmierung mit Python (Seminar) | | Pnr. 2301 |",
            "schaftlichen Bereiche Morphologie/Syntax und Semantik/Pragmatik. Desweiteren sieht der Studienplan f\u00fcr das erste Jahr einen Einstieg in computerlinguistische Programmierung mit Python vor, die neben G",
            "beschreibung (8 SWS, 1 MP, 12 LP)<br>- Basismodul - Python-Programmierung (8 SWS, 1 MP, 12 LP)<br>- Basiswissen Linguistik - Morphologie und Syntax (6 SWS, 1 MP, 9 LP)<br>- Basiswissen Linguistik - Se"
        ]
    },
    {
        "user_input": "Gibt es eine \u00dcbung f\u00fcr Mathematische Grundlagen?",
        "reference": "Nein, f\u00fcr den Kurs \"Mathematische Grundlagen\" gibt es keine begleitende \u00dcbung. Es handelt sich dabei ausschlie\u00dflich um ein Seminar.",
        "response": "Ja, es gibt eine \u00dcbung f\u00fcr Mathematische Grundlagen.",
        "retrieved_contexts": [
            "halt der Module und der Pr\u00fcfungen** | **Module:**<br>- Basismodul - Mathematische und logische Grundlagen (8 SWS, 1 MP, 12 LP)<br>- Basismodul - Grundlagen der Computerlinguistik und formale Grammatik",
            "| :--- | :--- | :--- | :--- | :--- |\n| **Basismodul - Mathematische und logische Grundlagen** | **1 MP** | **2 SL** | **12 LP** | **8 SWS** |\n| Einf\u00fchrung in die computationelle Logik (Seminar mit \u00dcbu",
            "lich: Basismodul - Mathematische und logische Grundlagen, Basismodul - Grundlagen der Computerlinguistik und formale Grammatikbeschreibung, Basiswissen Linguistik - Morphologie und Syntax<br>\n**Pr\u00fcfun",
            "lich: Basismodul - Mathematische und logische Grundlagen, Basismodul - Python-Programmierung<br>\n**Pr\u00fcfungsformen:** Klausur (Pnr. 4510)<br>\n**Voraussetzungen f\u00fcr die Zulassung zur Modulpr\u00fcfung:** -ke",
            "dul - Mathematische und logische Grundlagen\n**Englischer Titel:** Basis module - mathematical and logical foundations<br>\n**Modul-Nummer:** 2100<br>\n**ECTS-Leistungspunkte:** 12 ECTS-Leistungspunkte<b",
            "matikformalismen (\u00dcbung) | | Pnr. 2204 | 2 LP | 2 SWS |\n| Modulpr\u00fcfung (Klausur) | Pnr. 2210 | | 4 LP | |\n| **Basismodul - Python-Programmierung [2/2]** | **1 MP** | **2 SL** | **8 LP** | **4 SWS** |\n",
            "ng) | | Pnr. 2101 | 4 LP | 4 SWS |\n| Mathematische Grundlagen (Seminar) | | Pnr. 2102 | 4 LP | 4 SWS |\n| Modulpr\u00fcfung (Portfolio) | Pnr. 2110 | | 4 LP | |\n| **Basismodul - Grundlagen der Computerlingu",
            "rchzuf\u00fchren.<br>\n**Teilnahmevoraussetzungen:** Formal: keine | Inhaltlich: Basismodul Mathematische und logische Grundlagen<br>\n**Pr\u00fcfungsformen:** -keine-<br>\n**Voraussetzungen f\u00fcr die Zulassung zur ",
            "asismodul - Mathematische und logische Grundlagen, Basismodul - Grundlagen der Computerlinguistik und formale Grammatikbeschreibung, Basismodul - Python-Programmierung<br>\n**Pr\u00fcfungsformen:** -keine-<",
            "tsprechungen zu konstruieren.<br>\n**Teilnahmevoraussetzungen:** Formal: keine | Inhaltlich: Basismodul - Mathematische und logische Grundlagen, Basismodul - Grundlagen der Computerlinguistik und forma"
        ]
    },
    {
        "user_input": "Muss ich in Python eine Klausur/Pr\u00fcfung absolvieren?",
        "reference": "Ja, du musst im Modul \"Python-Programmierung\" eine Pr\u00fcfung in Form einer Projektarbeit ablegen. Diese Modulpr\u00fcfung ist jedoch erst im zweiten Fachsemester (Sommersemester) vorgesehen. Im ersten Semester musst du daf\u00fcr lediglich Studienleistungen erbringen.",
        "response": "Nein, es ist nicht notwendig, eine Klausur/Pr\u00fcfung zu absolvieren.",
        "retrieved_contexts": [
            "| Bestandene Modulpr\u00fcfung: 4 ECTS-Leistungspunkte<br>\n**Sonstige Informationen:** -keine-\n\n### Modul: Basismodul - Python-Programmierung\n**Englischer Titel:** Basis module - Python programming<br>\n**M",
            "lich: Basismodul - Mathematische und logische Grundlagen, Basismodul - Python-Programmierung<br>\n**Pr\u00fcfungsformen:** Klausur (Pnr. 4510)<br>\n**Voraussetzungen f\u00fcr die Zulassung zur Modulpr\u00fcfung:** -ke",
            "tene Python-Programmierung mit NLP-Anwendungen (\u00dcbung) / 2304<br>\n**Belegung:** Seminar (a) mit \u00dcbung (b) und Seminar (c) mit \u00dcbung (d)<br>\n**Empfohlenes Studiensemester:** a: 1. Fachsemester (Winters",
            " 2 LP | 2 SWS |\n| Einf\u00fchrung in die Programmierung mit Python (\u00dcbung) | | Pnr. 2302 | 2 LP | 2 SWS |\n| **Basiswissen Linguistik - Morphologie und Syntax** | **1 MP** | **2 SL** | **9 LP** | **6 SWS** ",
            "istungspunkt<br>\n**ECTS-Leistungspunkte f\u00fcr die Modulpr\u00fcfung:** 4 ECTS-Leistungspunkte (120 Stunden)<br>\n**Inhalte:** Wintersemester: Grundlagen der Python-Programmierung; Datentypen in Python; g\u00e4ngig",
            " Grundz\u00fcge der Sorftware-Entwicklung.<br>\n**Angestrebte Lernergebnisse und Studieninhalte:** Die Studierenden erwerben grundlegende F\u00e4higkeiten in der Programmierung mit der Programmiersprache Python ",
            "matikformalismen (\u00dcbung) | | Pnr. 2204 | 2 LP | 2 SWS |\n| Modulpr\u00fcfung (Klausur) | Pnr. 2210 | | 4 LP | |\n| **Basismodul - Python-Programmierung [2/2]** | **1 MP** | **2 SL** | **8 LP** | **4 SWS** |\n",
            "Klausur (Pnr. 5120) oder Hausarbeit (Pnr. 5130) oder Studienarbeit (Pnr. 5140) oder Projektarbeit (Pnr. 5150)<br>\n**Voraussetzungen f\u00fcr die Zulassung zur Modulpr\u00fcfung:** -keine<br>\n**Voraussetzungen f",
            " - Computerlinguistik 2 (4 SWS, 1 MP, 9 LP)<br>- Abschlussarbeit und Forschungskolloquium (2 SWS, 15 LP)<br>- Profilbildungsbereich (18 LP) |\n| **Voraussetzungen f\u00fcr Pr\u00fcfungen** | keine Angabe |\n| **B",
            "schaftlichen Bereiche Morphologie/Syntax und Semantik/Pragmatik. Desweiteren sieht der Studienplan f\u00fcr das erste Jahr einen Einstieg in computerlinguistische Programmierung mit Python vor, die neben G"
        ]
    },
    {
        "user_input": "Wann soll ich das Praktikum machen?",
        "reference": "Es wird empfohlen, das Berufsfeldpraktikum nach dem vierten oder f\u00fcnften Semester zu absolvieren.",
        "response": "Dazu enthalten die bereitgestellten Dokumente keine Informationen.",
        "retrieved_contexts": [
            "Einblick in die Berufspraxis vermitteln sowie den sp\u00e4teren \u00dcbergang in die Berufswelt erleichtern. Die Wahl des Praktikumsplatzes erfolgt im Einvernehmen mit dem/der Praktikumsbeauftragten der Abteilu",
            " Informatik erlauben, ist im letzten Jahr ein Praktikum zur Berufsorientierung und die Anfertigung der Bachelorarbeit vorgesehen. Letztere wird in der Regel im letzten Semester durchgef\u00fchrt, wobei par",
            "n oder f\u00fcnften Semester wird entweder ein mindestens 6-w\u00f6chiges Berufsfeldpraktikum oder eine Projektarbeit absolviert, jeweils mit einschl\u00e4gig computerlinguistischem Inhalt. Das Praktikum soll einen ",
            "-- | :--- |\n| **Praktikum & Orientierung [2/2]** | | **1 SL** | **9 LP** | |\n| Praktikum (in der Regel 6 Wochen Vollzeit) | | Pnr. 3010 | 9 LP | |\n| **Vertiefungsmodul - Interdisziplin\u00e4r [2/2]** | **1",
            "urchf\u00fchrung eines Praktikums und (3) \u00fcber das Thema der Abschlussarbeit weiter zu spezialisieren und in Richtung m\u00f6glicher anschlie\u00dfender T\u00e4tigkeitsfelder zu orientieren. Zum einen werden im Rahmen de",
            "g) / 4502 | c: Praktische \u00dcbung zur Vorlesung (Praktische \u00dcbung) / 4503<br>\n**Belegung:** Vorlesung (a) mit \u00dcbung (b) und praktischer \u00dcbung (c)<br>\n**Empfohlenes Studiensemester:** a: 3. Fachsemester ",
            " Rahmen eines Praktikums und der Abschlussarbeit im Kontext konkreter Fragestellungen angewendet. Damit sind die Absolventen des Studiengangs optimal vorbereitet auf eine berufliche T\u00e4tigkeit z.B. in ",
            "ng f\u00fcr Computerlinguistik. Der/die Praktikumsbeauftragte ist bei der Vermittlung von Praktikumspl\u00e4tzen behilflich und bietet eine fachliche Praktikumsberatung und -begleitung an. \u00dcber das Praktikum is",
            "t ein kurzer Bericht (ca. 3-5 Seiten) zu verfassen und ein Zeugnis der Praktikumsstelle einzureichen. |\n\n---\n\n## Exemplarischer Studienverlaufsplan Bachelor Computerlinguistik\n\nBei dieser Darstellung ",
            "tudienphase insbesondere in Bezug auf Studienorganisation (Schwerpunktsetzung, Auslandsaufenthalt, Praktikum, ...); Abschlussarbeit (Themenwahl, wissenschaftliches Arbeiten, ...); Berufsperspektiven ("
        ]
    },
    {
        "user_input": "Wird im Studiengang KI behandelt?",
        "reference": "Ja, das Thema K\u00fcnstliche Intelligenz (KI) ist ein zentraler und fest verankerter Bestandteil des Studiengangs. Im Pflichtbereich (Deep Learning): Im Aufbaumodul \"Maschinelles Lernen\" lernen die Studierenden den Umgang mit k\u00fcnstlichen neuronalen Netzen (Deep Learning) kennen und implementieren diese zur L\u00f6sung von Aufgaben im Natural Language Processing (NLP). Als Wahlthema in der Informatik: Im \"Vertiefungsmodul - Interdisziplin\u00e4r\" kann aus dem Bereich der Informatik explizit die Veranstaltung \"\u00dcberblick K\u00fcnstliche Intelligenz\" belegt werden. Spezialisierung im 3. Studienjahr: In den Vertiefungsmodulen der Computerlinguistik werden hochaktuelle KI-Architekturen in Seminaren gelehrt, darunter ausdr\u00fccklich \"gro\u00dfe Sprachmodelle\" (Large Language Models) und \"Transformer-Architekturen\".",
        "response": "Ja, im Studiengang KI behandelt.",
        "retrieved_contexts": [
            "den Bereichen elektronische Informationsverarbeitung, Sprachressourcenmanagement, maschinelle Sprachverarbeitung und Sprachtechnologie. Die Studierenden erwerben au\u00dferdem besonders in den Aufbau- und ",
            "auf einen anschlie\u00dfenden Masterstudiengang. z.B. im Bereich Sprachtechnologie oder K\u00fcnstliche Intelligenz oder im Bereich Linguistik vorbereitet.\n\n## Aufbau des Studiums\nGrob l\u00e4sst sich das Studium in",
            " Sprachverarbeitung als auch im Bereich des maschinellen Lernens und der k\u00fcnstlichen Intelligenz, und Programmierkenntnisse auf hohem Niveau. Dieses Wissen wird im dritten Jahr weiter ausgebaut und im",
            "Grafik, Dateien)<br>\n**Angestrebte Lernergebnisse und Studieninhalte:** Studierende sollen nach Absolvierung der Lehrveranstaltungen in der Lage sein, Begriffe der Informatik und der Programmierung zu",
            "r>\n**Workload:** 360 Stunden<br>\n**Dauer:** 1 Semester<br>\n**Lehrveranstaltungen und Lehrformen:** a: Einf\u00fchrung in die computationelle Logik (Seminar & \u00dcbung) / 2101 | b: Mathematische Grundlagen (Se",
            "eninhalte:** Studierende lernen vertiefte Kenntnisse in Spezialgebieten der Computerlinguistik.<br>\n**Teilnahmevoraussetzungen:** Formal: Basismodul - Mathematische und logische Grundlagen, Basismodul",
            "gen.<br>\n**Angestrebte Lernergebnisse und Studieninhalte:** Studierende lernen aktuelle Forschungsarbeit der Computerlinguistik kennen, und lernen weiterhin selbst\u00e4ndig wissenschaftlich zu arbeiten.<b",
            " Informatik erlauben, ist im letzten Jahr ein Praktikum zur Berufsorientierung und die Anfertigung der Bachelorarbeit vorgesehen. Letztere wird in der Regel im letzten Semester durchgef\u00fchrt, wobei par",
            "es Faches aufgrund von didaktischen \u00dcberlegungen individuell zu anderen Studienverl\u00e4ufen r\u00e4t. Bitte informieren Sie sich bei der Studienberatung, in welcher Reihenfolge Sie welche Pflichtmodule und Wa",
            "ch sind. Im Rahmen dieses Moduls muss mindestens eine Veranstaltung aus der Informatik belegt werden. Neben diesen Modulen, die relativ flexibel Spezialisierungen in Computerlinguistik, Linguistik und"
        ]
    },
    {
        "user_input": "Muss ich Kurse aus der Linguistik f\u00fcr das interdisziplin\u00e4re Vertiefungsmodul belegen?",
        "reference": "Nein, Linguistik-Kurse sind keine Pflicht. Das Modul sieht vor, dass du zwei Vorlesungen oder Seminare aus der Linguistik oder der Informatik w\u00e4hlst, wobei lediglich der Informatik-Anteil von 4 SWS vorgeschrieben ist.",
        "response": "Nein, es ist nicht notwendig, Kurse aus der Linguistik f\u00fcr das interdisziplin\u00e4re Vertiefungsmodul belegen.",
        "retrieved_contexts": [
            "ch sind. Im Rahmen dieses Moduls muss mindestens eine Veranstaltung aus der Informatik belegt werden. Neben diesen Modulen, die relativ flexibel Spezialisierungen in Computerlinguistik, Linguistik und",
            "ne-\n\n### Modul: Vertiefungsmodul - Computerlinguistik 1\n**Englischer Titel:** Specialization module - computational linguistics 1<br>\n**Modul-Nummer:** 5200<br>\n**ECTS-Leistungspunkte:** 12 ECTS-Leist",
            "P, 12 LP)<br>- Praktikum und Orientierung (2 SWS, 12 LP)<br>- Vertiefungsmodul - interdisziplin\u00e4r (8 SWS, 1 MP, 12 LP)<br>- Vertiefungsmodul - Computerlinguistik 1 (8 SWS, 12 LP)<br>- Vertiefungsmodul",
            " LP | SWS |\n| :--- | :--- | :--- | :--- | :--- |\n| **Vertiefungsmodul - Computerlinguistik 2** | **1 MP** | **1 SL** | **9 LP** | **4 SWS** |\n| Seminar nach Wahl im Bereich Computerlinguistik | | Pnr.",
            "# Modul: Vertiefungsmodul - Computerlinguistik 2\n**Englischer Titel:** Specialization module computational linguistics 2<br>\n**Modul-Nummer:** 5300<br>\n**ECTS-Leistungspunkte:** 9 ECTS-Leistungspunkte",
            "tige Informationen:** -keine-\n\n### Modul: Aufbaumodul - Mathematische Linguistik\n**Englischer Titel:** Advanced module - mathematical linguistics<br>\n**Modul-Nummer:** 4200<br>\n**ECTS-Leistungspunkte:",
            "dul: Basiswissen Linguistik - Semantik und Pragmatik\n**Englischer Titel:** Basic expertise in linguistics - semantics and pragmatics<br>\n**Modul-Nummer:** 1400<br>\n**ECTS-Leistungspunkte:** 9 ECTS-Lei",
            "eninhalte:** Studierende lernen vertiefte Kenntnisse in Spezialgebieten der Computerlinguistik.<br>\n**Teilnahmevoraussetzungen:** Formal: Basismodul - Mathematische und logische Grundlagen, Basismodul",
            "Bachelor Computerlinguistik\n*Summe: 4 Module, 3 MP, 7 Veranstaltungen, 18 SWS, 30 LP, davon 1 LP im PBB*\n\n| Modul / Veranstaltung | MP | SL | LP | SWS |\n| :--- | :--- | :--- | :--- | :--- |\n| **Basism",
            "reich** | | | **1 LP** | |\n\n### 6. Semester Bachelor Computerlinguistik\n*Summe: 3 Module, 1 MP, Bachelorarbeit, 2 Veranstaltungen, 8 SWS, 30 LP, davon 1 LP im PBB*\n\n| Modul / Veranstaltung | MP | SL |"
        ]
    },
    {
        "user_input": "Wie stark z\u00e4hlt die Bachelorarbeit f\u00fcr meine Abschlussnote?",
        "reference": "Die Note der Bachelorarbeit wird bei der Ermittlung der Gesamtnote dreifach gewichtet. Im Vergleich dazu gehen alle anderen Modulpr\u00fcfungen nur einfach in die Gesamtnote ein.",
        "response": "Dazu enthalten die bereitgestellten Dokumente keine Informationen.",
        "retrieved_contexts": [
            "ungen f\u00fcr die Vergabe von ECTS-Leistungspunkten:** Aktive und erfolgreiche Mitwirkung im Forschungsseminar, bestandene Bachelorarbeit.<br>\n**Sonstige Informationen:** -keine-",
            " 3 LP | 2 SWS |\n| Bachelorarbeit | Pnr. 6000 | | 12 LP | |\n| **Profilbildungsbereich** | | | **6 LP** | |\n",
            "t ein kurzer Bericht (ca. 3-5 Seiten) zu verfassen und ein Zeugnis der Praktikumsstelle einzureichen. |\n\n---\n\n## Exemplarischer Studienverlaufsplan Bachelor Computerlinguistik\n\nBei dieser Darstellung ",
            "reich** | | | **1 LP** | |\n\n### 6. Semester Bachelor Computerlinguistik\n*Summe: 3 Module, 1 MP, Bachelorarbeit, 2 Veranstaltungen, 8 SWS, 30 LP, davon 1 LP im PBB*\n\n| Modul / Veranstaltung | MP | SL |",
            "j\u00e4hrigem Schulunterricht an einer weiterf\u00fchrenden Schule) |\n| **Prop\u00e4deutikum im Profilbildungsbereich** | keine Angabe |\n| **Anzahl der Modulpr\u00fcfungen** | 9, zuz\u00fcglich Bachelorarbeit |\n| **Art und In",
            "ungspunkt | b: 2 SWS/30 Stunden/1 ECTS-Leistungspunkt | c: 2 SWS/30 Stunden / 1 ECTS-Leistungspunkt | d: 2 SWS/30 Stunden / 1 ECTS-Leistungspunkt<br>\n**Selbststudium:** a: 30 Stunden / 1 ECTS-Leistung",
            "r>\n**Teilnahmevoraussetzungen:** Formal: Alle Basis- und Aufbaumodule<br>\n**Pr\u00fcfungsformen:** Bachelorarbeit (Pnr. 6000)<br>\n**Voraussetzungen f\u00fcr die Zulassung zur Pr\u00fcfung:** -keine-<br>\n**Voraussetz",
            "nden / 1 ECTS-Leistungspunkt | b: 2 SWS/30 Stunden / 1 ECTS-Leistungspunkt<br>\n**Selbststudium:** a: 60 Stunden / 2 ECTS-Leistungspunkte | b: 60 Stunden/2 ECTS-Leistungspunkte<br>\n**ECTS-Leistungspunk",
            "esonderheiten** | Die zweite Wiederholung einer Modulpr\u00fcfung darf als m\u00fcndliche Pr\u00fcfung erfolgen. |\n| **Gewichtung der Pr\u00fcfungen f\u00fcr die Gesamtnote** | Bachelorarbeit: dreifach<br>Alle Modulpr\u00fcfungen:",
            "en:** Erbrachte Studienleistungen (SL) in den Lehrveranstaltungen (a) und (b): 4 ECTS-Leistungspunkte | Erbrachte Studienleistungen (SL) in den Lehrveranstaltungen (c) und (d): 4 ECTS-Leistungspunkte "
        ]
    },
    {
        "user_input": "Muss ich alle Module bestanden haben, bevor ich meine Bachelorarbeit schreibe?",
        "reference": "Nein, du musst nicht zwingend das gesamte Studium vorher abgeschlossen haben. Die einzige formale Teilnahmevoraussetzung f\u00fcr das Modul \"Abschlussarbeit und Forschungskolloquium\" ist der erfolgreiche Abschluss aller Basis- und Aufbaumodule.",
        "response": "Nein, nicht alle Module m\u00fcssen bestanden haben. Die Zulassung zur Modulpr\u00fcfung erfordert nur, dass man mindestens eine Modulpr\u00fcfung bestandene Studienleistung (SL) in allen Lehrveranstaltungen und bestandene Modulpr\u00fcfung erbracht hat.",
        "retrieved_contexts": [
            "r>\n**Teilnahmevoraussetzungen:** Formal: Alle Basis- und Aufbaumodule<br>\n**Pr\u00fcfungsformen:** Bachelorarbeit (Pnr. 6000)<br>\n**Voraussetzungen f\u00fcr die Zulassung zur Pr\u00fcfung:** -keine-<br>\n**Voraussetz",
            "ung zur Modulpr\u00fcfung:** -keine-<br>\n**Voraussetzungen f\u00fcr die Vergabe von ECTS-Leistungspunkten:** Erbrachte Studienleistungen (SL) in allen Lehrveranstaltungen und bestandene Modulpr\u00fcfung.<br>\n**Sons",
            "br>\n**Voraussetzungen f\u00fcr die Zulassung zur Modulpr\u00fcfung:** -keine-<br>\n**Voraussetzungen f\u00fcr die Vergabe von ECTS-Leistungspunkten:** Erbrachte Studienleistungen (SL) in (a) und 6-w\u00f6chiges Praktikum ",
            "j\u00e4hrigem Schulunterricht an einer weiterf\u00fchrenden Schule) |\n| **Prop\u00e4deutikum im Profilbildungsbereich** | keine Angabe |\n| **Anzahl der Modulpr\u00fcfungen** | 9, zuz\u00fcglich Bachelorarbeit |\n| **Art und In",
            "Modulpr\u00fcfung:** -keine-<br>\n**Voraussetzungen f\u00fcr die Vergabe von ECTS-Leistungspunkten:** Erbrachte Studienleistungen (SL) oder Hausaufgaben in allen Lehrveranstaltungen<br>\n**Sonstige Informationen:",
            "Klausur (Pnr. 5120) oder Hausarbeit (Pnr. 5130) oder Studienarbeit (Pnr. 5140) oder Projektarbeit (Pnr. 5150)<br>\n**Voraussetzungen f\u00fcr die Zulassung zur Modulpr\u00fcfung:** -keine<br>\n**Voraussetzungen f",
            "reich** | | | **1 LP** | |\n\n### 6. Semester Bachelor Computerlinguistik\n*Summe: 3 Module, 1 MP, Bachelorarbeit, 2 Veranstaltungen, 8 SWS, 30 LP, davon 1 LP im PBB*\n\n| Modul / Veranstaltung | MP | SL |",
            "ungen f\u00fcr die Vergabe von ECTS-Leistungspunkten:** Aktive und erfolgreiche Mitwirkung im Forschungsseminar, bestandene Bachelorarbeit.<br>\n**Sonstige Informationen:** -keine-",
            "\u00fcr die Zulassung zur Modulpr\u00fcfung:** -keine-<br>\n**Voraussetzungen f\u00fcr die Vergabe von ECTS-Leistungspunkten:** Erbrachte Studienleistungen (SL) in den Lehrveranstaltungen (a) und (b).<br>\n**Sonstige ",
            "e Zulassung zur Modulpr\u00fcfung:** -keine-<br>\n**Voraussetzungen f\u00fcr die Vergabe von ECTS-Leistungspunkten:** Erbrachte Studienleistungen (SL) in allen Lehrveranstaltungen und bestandene Modulpr\u00fcfung.<br"
        ]
    },
    {
        "user_input": "Gibt es eine Klausur in Wahrscheinlichkeitstheorie?",
        "reference": "Nein, im \"Basismodul - Statistische Methoden in der Computerlinguistik\", zu dem die Wahrscheinlichkeitstheorie geh\u00f6rt, gibt es gar keine Modulpr\u00fcfung und somit auch keine Klausur. Es m\u00fcssen lediglich Studienleistungen erbracht werden.",
        "response": "Ja, es gibt eine Klausur in Wahrscheinlichkeitstheorie.",
        "retrieved_contexts": [
            "SWS** |\n| Wahrscheinlichkeitstheorie und Statistik (Seminar und \u00dcbung) | | Pnr. 2401 | 4 LP | 4 SWS |\n| **Profilbildungsbereich** | | | **1 LP** | |\n\n### 3. Semester Bachelor Computerlinguistik\n*Summe",
            " 30 Stunden / 1 ECTS-Leistungspunkt<br>\n**ECTS-Leistungspunkte f\u00fcr die Modulpr\u00fcfung:** -keine-<br>\n**Inhalte:** Dieses Modul vermittelt grundlegende Kenntnisse in Wahrscheinlichkeitstheorie und in sta",
            "|\n| Modulpr\u00fcfung (Klausur) | Pnr. 2310 | | 4 LP | |\n| **Basiswissen Linguistik - Semantik und Pragmatik** | **1 MP** | **2 SL** | **9 LP** | **6 SWS** |\n| Vorlesung | | Pnr. 1401 | 4 LP | 4 SWS |\n| Tu",
            " d: 2. Fachsemester (Sommersemester) | Pr\u00fcfung im 2. Fachsemester (Sommersemester)<br>\n**H\u00e4ufigkeit des Angebots:** a: Jedes Wintersemester | b: Jedes Wintersemester | c: Jedes Sommersemester | d: Jed",
            "|\n| Vorlesung | | Pnr. 1301 | 2 LP | 4 SWS |\n| Tutorium | | Pnr. 1302 | 2 LP | 2 SWS |\n| Modulpr\u00fcfung (Klausur) | Pnr. 1310 | | 3 LP | |\n| **Profilbilungsbereich** | | | **1 LP** | |\n\n### 2. Semester ",
            "heorie und Statistik (Seminar und \u00dcbung) / 2401 | b: Linguistische Ressourcen (Seminar) / 2402<br>\n**Belegung:** Seminar mit \u00dcbung (a) und Seminar (b)<br>\n**Empfohlenes Studiensemester:** a: 2. Fachse",
            "torium | | Pnr. 1402 | 2 LP | 2 SWS |\n| Modulpr\u00fcfung (Klausur) | Pnr. 1410 | | 3 LP | |\n| **Basismodul - Statistische Methoden in der Computerlinguistik [1/2]** | **0 MP** | **1 SL** | **4 LP** | **4 ",
            "formalen und probabilistischen Methoden der Computerlinguistik. Kenntnisse \u00fcber g\u00e4ngige computerlinguistische Formalismen zur Implementierung von Grammatiken.<br>\n**Teilnahmevoraussetzungen:** Formal:",
            "hrscheinlichkeitstheorie und Grundbegriffe der Statistik. F\u00e4higkeit, statistische Analysen selbst zu konzipieren und implementieren. F\u00e4higkeit, Korpora zu erstellen und f\u00fcr Experimente und Analysen du",
            "g) / 4502 | c: Praktische \u00dcbung zur Vorlesung (Praktische \u00dcbung) / 4503<br>\n**Belegung:** Vorlesung (a) mit \u00dcbung (b) und praktischer \u00dcbung (c)<br>\n**Empfohlenes Studiensemester:** a: 3. Fachsemester "
        ]
    }
]