[
    {
        "user_input": "Welche Kurse sollte ich im ersten Semester belegen?",
        "reference": "Laut dem exemplarischen Studienverlaufsplan solltest du im ersten Semester folgende Kurse belegen: Mathematische Grundlagen, Einf\u00fchrung in die computationelle Logik, Einf\u00fchrung in die Computerlinguistik, Einf\u00fchrung in die Programmierung mit Python, Morphologie und Syntax.",
        "response": "Im ersten Semester sollten folgende Kurse belegt werden:\n\n*   Einf\u00fchrung in die Computerlinguistik\n*   Mathematische und logische Konzepte und Methoden\n*   Grammatikmodellierung\n*   Statistik\n*   Computerlinguistische Programmierung mit Python",
        "retrieved_contexts": [
            "## Aufbau des Studiums\nGrob l\u00e4sst sich das Studium in drei Phasen einteilen: Die ersten zwei Semester sind dem Erwerb von Basiswissen gewidmet, Semester 3 und 4 dem Aufbau weiterer Fachkompetenzen und die letzten beiden Semester der weiteren Spezialisierung und dem Studienabschluss.\n**Phase 1 Erwerb von Basiswissen f\u00fcr die Computerlinguistik:** Hierzu geh\u00f6rt die Vermittlung mathematischer und logischer Konzepte und Methoden, die f\u00fcr die Computerlinguistik wesentlich sind, eine Einf\u00fchrung in die Computerlinguistik, die einen \u00dcberblick \u00fcber zentrale computerlinguistische Fragestellungen und g\u00e4ngige Methoden in diesen Bereichen gibt, der Erwerb von Kenntnissen \u00fcber Formalismen und Methoden der Grammatikmodellierung und eine Einf\u00fchrung in die Statistik. Dies wird erg\u00e4nzt durch Einf\u00fchrungen in die f\u00fcr die Computerlinguistik zentralen sprachwissenschaftlichen Bereiche Morphologie/Syntax und Semantik/Pragmatik. Desweiteren sieht der Studienplan f\u00fcr das erste Jahr einen Einstieg in computerlinguistische Programmierung mit Python vor, die neben Grundlagen auch aktuelle Methoden der Sprachtechnologie vermittelt.\n**Phase 2 Aufbau von Fachkompetenzen f\u00fcr die Computerlinguistik:** Methodisch lernt man in dieser zweiten Phase die f\u00fcr die datengetriebene Computerlinguistik so zentralen Bereiche des Maschinellen Lernens und des Deep Learnings (also maschinelles Lernen mit k\u00fcnstlichen neuronalen Netzen) kennen, aufbauend auf dem Wissen \u00fcber Fragestellungen und Repr\u00e4sentationen der Computerlinguistik und auf soliden Kenntnissen der Programmiersprache Python (siehe Phase 1). Parallel dazu gewinnen die Studierenden Einblick in linguistische Ressourcen. Daneben werden in dieser Phase weitere Paradigma von Programmiersprachen vermittelt, n\u00e4mlich objektorientiertes Programmieren und, im Kontext von Themen der computationellen Semantik, entweder logische oder funktionale Programmierung. Au\u00dferdem werden die Bereiche syntaktische Verarbeitung und Automatentheorie und formale Sprachen in Hinblick auf computerlinguistische Problemstellungen vertieft. Als \u00dcbergang zur Phase 3 ist zudem eine Orientierung in Hinblick auf m\u00f6gliche Spezialisierungen vorgesehen.\n**Phase 3 Spezialisierung und Berufsorientierung:** Im letzten Studienjahr geht es darum, aufbauend auf den vorher erworbenen Grundlagen und Methoden, Fachkompetenzen weiter auszubauen und sich (1) \u00fcber die Wahl der Bereiche, in denen im letzten Jahr APs abgelegt werden, (2) \u00fcber die Durchf\u00fchrung eines Praktikums und (3) \u00fcber das Thema der Abschlussarbeit weiter zu spezialisieren und in Richtung m\u00f6glicher anschlie\u00dfender T\u00e4tigkeitsfelder zu orientieren. Zum einen werden im Rahmen der beiden computerlinguistischen Vertiefungsmodule regelm\u00e4\u00dfig eine Reihe von unterschiedlichen thematischen Seminaren angeboten werden, aus denen die Studierenden frei w\u00e4hlen k\u00f6nnen. In einem der Seminare, im Vertiefungsmodul 2, muss eine MP angelegt werden. Themen dieser Seminare sind z.B. Vektorsemantik, gro\u00dfe Sprachmodelle, Transformer-Architekturen in computerlinguistischen Anwendungen, Advanced Constituency Parsing, Dependency Parsing, Finite-State Morphology, Semantic Role Labeling, Discourse Representation Theory, Fuzzy Logic usw. Daneben gibt es das interdisziplin\u00e4re Vertiefungsmodul, in dem den Studierenden erm\u00f6glicht wird, neben Veranstaltungen aus der Computerlinguistik auch Veranstaltungen aus Linguistik und Informatik zu belegen, die nicht notwendig dezidiert computerlinguistisch sind. Im Rahmen dieses Moduls muss mindestens eine Veranstaltung aus der Informatik belegt werden. Neben diesen Modulen, die relativ flexibel Spezialisierungen in Computerlinguistik, Linguistik und Informatik erlauben, ist im letzten Jahr ein Praktikum zur Berufsorientierung und die Anfertigung der Bachelorarbeit vorgesehen. Letztere wird in der Regel im letzten Semester durchgef\u00fchrt, wobei parallel das Forschungskolloquium der Computerlinguistik besucht wird, wodurch interessante Einblicke in aktuelle Forschungsthemen geboten werden und Anregungen und Inspiration f\u00fcr die Bachelorarbeit gewonnen werden kann. Das 5. Semester kann als Mobilit\u00e4tssemester gew\u00e4hlt werden, da in den Vertiefungsmodulen auch Kurse aus anderen Universit\u00e4ten anerkannt werden k\u00f6nnen."
        ]
    },
    {
        "user_input": "Kann ich auch im Sommersemester anfangen?",
        "reference": "Nein, das Studium ist f\u00fcr einen Beginn im Wintersemester ausgelegt.",
        "response": "Ja, Sie k\u00f6nnen im Sommersemester anfangen.",
        "retrieved_contexts": [
            "### Modul: Abschlussarbeit und Forschungskolloquium\n**Englischer Titel:** Thesis and research colloquium<br>\n**Modul-Nummer:** 5900<br>\n**ECTS-Leistungspunkte:** 15 ECTS-Leistungspunkte<br>\n**Workload:** 450 Stunden<br>\n**Dauer:** 1 Semester<br>\n**Lehrveranstaltungen und Lehrformen:** a: Forschungskolloquium Computerlinguistik (Kolloquium) / 5901 | b: Seminar (Seminar) / 5902<br>\n**Belegung:** Forschungskolloquium (a) oder Seminar (b)<br>\n**Empfohlenes Studiensemester:** a: 6. Fachsemester (Sommersemester) | b: 6. Fachsemester (Sommersemester)<br>\n**H\u00e4ufigkeit des Angebots:** a: Jedes Sommersemester | b: Jedes Sommersemester<br>\n**Geplante Gruppengr\u00f6\u00dfe:** a: Ca. 30 Studierende | b: Ca. 30 Studierende<br>\n**Kontaktzeit:** a: 2 SWS/30 Stunden / 1 ECTS-Leistungspunkt | b: 2 SWS/30 Stunden / 1 ECTS-Leistungspunkt<br>\n**Selbststudium:** Im 6. Fachsemester: 60 Stunden / 2 ECTS-Leistungspunkte<br>\n**ECTS-Leistungspunkte f\u00fcr die Modulpr\u00fcfung:** 12 ECTS-Leistungspunkte<br>\n**Inhalte:** Im Forschungskolloquium tragen jede zweite Woche (meist ausw\u00e4rtige) G\u00e4ste ihre aktuelle Forschungsarbeit vor. Die Woche davor werden die Inhalte der Vortr\u00e4ge anhand von Artikeln besprochen und vorbereitet. Das Thema der Bachelorarbeit darf frei gew\u00e4hlt werden, muss aber im Bereich Computerlinguistik liegen.<br>\n**Angestrebte Lernergebnisse und Studieninhalte:** Studierende lernen aktuelle Forschungsarbeit der Computerlinguistik kennen, und lernen weiterhin selbst\u00e4ndig wissenschaftlich zu arbeiten.<br>\n**Teilnahmevoraussetzungen:** Formal: Alle Basis- und Aufbaumodule<br>\n**Pr\u00fcfungsformen:** Bachelorarbeit (Pnr. 6000)<br>\n**Voraussetzungen f\u00fcr die Zulassung zur Pr\u00fcfung:** -keine-<br>\n**Voraussetzungen f\u00fcr die Vergabe von ECTS-Leistungspunkten:** Aktive und erfolgreiche Mitwirkung im Forschungsseminar, bestandene Bachelorarbeit.<br>\n**Sonstige Informationen:** -keine-"
        ]
    },
    {
        "user_input": "Muss ich flie\u00dfend Englisch sprechen k\u00f6nnen um Computerlinguistik zu studieren?",
        "reference": "Flie\u00dfendes Englisch wird nicht vorausgesetzt, jedoch ben\u00f6tigst du Englischkenntnisse auf dem Niveau B1. Dies entspricht vergleichsweise einem erfolgreichen vierj\u00e4hrigen Schulunterricht an einer weiterf\u00fchrenden Schule.",
        "response": "Ja, Kenntnisse des Englischen (Niveau B1) sind notwendig, um Computerlinguistik zu studieren.",
        "retrieved_contexts": [
            "| Merkmal | Details |\n| :--- | :--- |\n| **Integrierter Studiengang** | Computerlinguistik |\n| **Studienbeginn** | Nur im Wintersemester |\n| **Studienumfang** | 180 ECTS-Leistungspunkte (LP) |\n| **Notwendige Vorkenntnisse** | Kenntnisse des Englischen (Niveau B1, vergleichbar mit erfolgreichem vierj\u00e4hrigem Schulunterricht an einer weiterf\u00fchrenden Schule) |\n| **Prop\u00e4deutikum im Profilbildungsbereich** | keine Angabe |\n| **Anzahl der Modulpr\u00fcfungen** | 9, zuz\u00fcglich Bachelorarbeit |\n| **Art und Inhalt der Module und der Pr\u00fcfungen** | **Module:**<br>- Basismodul - Mathematische und logische Grundlagen (8 SWS, 1 MP, 12 LP)<br>- Basismodul - Grundlagen der Computerlinguistik und formale Grammatikbeschreibung (8 SWS, 1 MP, 12 LP)<br>- Basismodul - Python-Programmierung (8 SWS, 1 MP, 12 LP)<br>- Basiswissen Linguistik - Morphologie und Syntax (6 SWS, 1 MP, 9 LP)<br>- Basiswissen Linguistik - Semantik und Pragmatik (6 SWS, 1 MP, 9 LP)<br>- Basismodul - Statistische Methoden in der Computerlinguistik (6 SWS, 6 LP)<br>- Aufbaumodul - Maschinelles Lernen (8 SWS, 1 MP, 12 LP)<br>- Aufbaumodul - Mathematische Linguistik (4 SWS, 6 LP)<br>- Aufbaumodul - Parsing (4 SWS, 6 LP)<br>- Aufbaumodul - Logische Programmierung (4 SWS, 6 LP)<br>- Aufbaumodul - Objektorientierte Programmierung (8 SWS, 1 MP, 12 LP)<br>- Praktikum und Orientierung (2 SWS, 12 LP)<br>- Vertiefungsmodul - interdisziplin\u00e4r (8 SWS, 1 MP, 12 LP)<br>- Vertiefungsmodul - Computerlinguistik 1 (8 SWS, 12 LP)<br>- Vertiefungsmodul - Computerlinguistik 2 (4 SWS, 1 MP, 9 LP)<br>- Abschlussarbeit und Forschungskolloquium (2 SWS, 15 LP)<br>- Profilbildungsbereich (18 LP) |\n| **Voraussetzungen f\u00fcr Pr\u00fcfungen** | keine Angabe |\n| **Besonderheiten** | Die zweite Wiederholung einer Modulpr\u00fcfung darf als m\u00fcndliche Pr\u00fcfung erfolgen. |\n| **Gewichtung der Pr\u00fcfungen f\u00fcr die Gesamtnote** | Bachelorarbeit: dreifach<br>Alle Modulpr\u00fcfungen: einfach |\n| **Pr\u00fcfungssprache nach \u00a7 6 (4)** | keine Angabe |\n| **Auslandsaufenthalt** | Optional (Mobilit\u00e4tsfenster: 5. Semester) |\n| **Exkursion** | keine Angabe |\n| **Praktikum** | Nach dem vierten oder f\u00fcnften Semester wird entweder ein mindestens 6-w\u00f6chiges Berufsfeldpraktikum oder eine Projektarbeit absolviert, jeweils mit einschl\u00e4gig computerlinguistischem Inhalt. Das Praktikum soll einen Einblick in die Berufspraxis vermitteln sowie den sp\u00e4teren \u00dcbergang in die Berufswelt erleichtern. Die Wahl des Praktikumsplatzes erfolgt im Einvernehmen mit dem/der Praktikumsbeauftragten der Abteilung f\u00fcr Computerlinguistik. Der/die Praktikumsbeauftragte ist bei der Vermittlung von Praktikumspl\u00e4tzen behilflich und bietet eine fachliche Praktikumsberatung und -begleitung an. \u00dcber das Praktikum ist ein kurzer Bericht (ca. 3-5 Seiten) zu verfassen und ein Zeugnis der Praktikumsstelle einzureichen. |"
        ]
    },
    {
        "user_input": "Muss ich f\u00fcr den Python-Kurs Vorkenntnisse haben?",
        "reference": "Nein, f\u00fcr das Modul \"Python-Programmierung\" werden weder formale noch inhaltliche Vorkenntnisse vorausgesetzt.",
        "response": "Dazu enthalten die bereitgestellten Dokumente keine Informationen.",
        "retrieved_contexts": [
            "### Modul: Basismodul - Python-Programmierung\n**Englischer Titel:** Basis module - Python programming<br>\n**Modul-Nummer:** 2300<br>\n**ECTS-Leistungspunkte:** 12 ECTS-Leistungspunkte<br>\n**Workload:** 360 Stunden<br>\n**Dauer:** 2 Semester<br>\n**Lehrveranstaltungen und Lehrformen:** a: Einf\u00fchrung in die Programmierung mit Python (Seminar) / 2301 | b: Einf\u00fchrung in die Programmierung mit Python (\u00dcbung) / 2302 | c: Fortgeschrittene Python-Programmierung mit NLP-Anwendungen (Seminar) / 2303 | d: Fortgeschrittene Python-Programmierung mit NLP-Anwendungen (\u00dcbung) / 2304<br>\n**Belegung:** Seminar (a) mit \u00dcbung (b) und Seminar (c) mit \u00dcbung (d)<br>\n**Empfohlenes Studiensemester:** a: 1. Fachsemester (Wintersemester) | b: 1. Fachsemester (Wintersemester) | c: 2. Fachsemester (Sommersemester) | d: 2. Fachsemester (Sommersemester) | Pr\u00fcfung im 2. Fachsemester (Sommersemester)<br>\n**H\u00e4ufigkeit des Angebots:** a: Jedes Wintersemester | b: Jedes Wintersemester | c: Jedes Sommersemester | d: Jedes Sommersemester<br>\n**Geplante Gruppengr\u00f6\u00dfe:** a: Ca. 60 Studierende | b: Ca. 60 Studierende | c: Ca. 60 Studierende | d: Ca. 60 Studierende<br>\n**Kontaktzeit:** a: 2 SWS / 30 Stunden / 1 ECTS-Leistungspunkt | b: 2 SWS/30 Stunden / 1 ECTS-Leistungspunkt | c: 2 SWS/30 Stunden / 1 ECTS-Leistungspunkt | d: 2 SWS/30 Stunden / 1 ECTS-Leistungspunkt<br>\n**Selbststudium:** a: 30 Stunden / 1 ECTS-Leistungspunkt | b: 30 Stunden / 1 ECTS-Leistungspunkt | c: 30 Stunden / 1 ECTS-Leistungspunkt | d: 30 Stunden/1 ECTS-Leistungspunkt<br>\n**ECTS-Leistungspunkte f\u00fcr die Modulpr\u00fcfung:** 4 ECTS-Leistungspunkte (120 Stunden)<br>\n**Inhalte:** Wintersemester: Grundlagen der Python-Programmierung; Datentypen in Python; g\u00e4ngige Programmkonstrukte; elementare Textverarbeitung. Sommersemester: Objektorientierte und funktionale Programmierung mit Python; Einsatz von Programm-Bibliotheken in den Bereichen Data Science und NLP; Grundz\u00fcge der Sorftware-Entwicklung.<br>\n**Angestrebte Lernergebnisse und Studieninhalte:** Die Studierenden erwerben grundlegende F\u00e4higkeiten in der Programmierung mit der Programmiersprache Python sowie Kenntnisse \u00fcber fortgeschrittene Konzepte der Python-Programmierung (objektorientierte und funktionale Programmierung). Au\u00dferdem werden Grundkenntnisse des Einsatzes von Python in den Bereichen Data Science und NLP (Natural Language Processing) erworben, sowie die F\u00e4higkeit ein kleines Software-Projekt durchzuf\u00fchren und zu pr\u00e4sentieren.<br>\n**Teilnahmevoraussetzungen:** Formal: Keine | Inhaltlich: Keine<br>\n**Pr\u00fcfungsformen:** Projektarbeit (Pnr. 2310)<br>\n**Voraussetzungen f\u00fcr die Zulassung zur Modulpr\u00fcfung:** -keine-<br>\n**Voraussetzungen f\u00fcr die Vergabe von ECTS-Leistungspunkten:** Erbrachte Studienleistungen (SL) in den Lehrveranstaltungen (a) und (b): 4 ECTS-Leistungspunkte | Erbrachte Studienleistungen (SL) in den Lehrveranstaltungen (c) und (d): 4 ECTS-Leistungspunkte | Bestandene Modulpr\u00fcfung: 4 ECTS-Leistungspunkte<br>\n**Sonstige Informationen:** -keine-"
        ]
    },
    {
        "user_input": "Gibt es eine \u00dcbung f\u00fcr den Kurs Mathematische Grundlagen?",
        "reference": "Nein, f\u00fcr den Kurs \"Mathematische Grundlagen\" gibt es keine begleitende \u00dcbung. Es handelt sich dabei ausschlie\u00dflich um ein Seminar.",
        "response": "Ja, es gibt eine \u00dcbung f\u00fcr den Kurs Mathematische Grundlagen. Der Kurs besteht aus zwei Lehrveranstaltungen: \"Einf\u00fchrung in die computationelle Logik (Seminar & \u00dcbung)\" (2101) und \"Mathematische Grundlagen (Seminar)\" (2102).",
        "retrieved_contexts": [
            "### Modul: Basismodul - Mathematische und logische Grundlagen\n**Englischer Titel:** Basis module - mathematical and logical foundations<br>\n**Modul-Nummer:** 2100<br>\n**ECTS-Leistungspunkte:** 12 ECTS-Leistungspunkte<br>\n**Workload:** 360 Stunden<br>\n**Dauer:** 1 Semester<br>\n**Lehrveranstaltungen und Lehrformen:** a: Einf\u00fchrung in die computationelle Logik (Seminar & \u00dcbung) / 2101 | b: Mathematische Grundlagen (Seminar) / 2102<br>\n**Belegung:** Seminar und \u00dcbung (a) und Seminar (b)<br>\n**Empfohlenes Studiensemester:** a: 1. Fachsemester (Wintersemester) | b: 1. Fachsemester (Wintersemester) | Pr\u00fcfung im 1. Fachsemester (Wintersemester)<br>\n**H\u00e4ufigkeit des Angebots:** a: Jedes Wintersemester | b: Jedes Wintersemester<br>\n**Geplante Gruppengr\u00f6\u00dfe:** a: Ca. 60 Studierende | b: Ca. 60 Studierende<br>\n**Kontaktzeit:** a: 4 SWS/60 Stunden / 2 ECTS-Leistungspunkte | b: 4 SWS/60 Stunden / 2 ECTS-Leistungspunkte<br>\n**Selbststudium:** a: 60 Stunden / 2 ECTS-Leistungspunkte | b: 60 Stunden/2 ECTS-Leistungspunkte<br>\n**ECTS-Leistungspunkte f\u00fcr die Modulpr\u00fcfung:** 4 ECTS-Leistungspunkte<br>\n**Inhalte:** Aufbereitung der mathematischen Schulkenntnisse und deren Vertiefung, um formale Methoden der Mathematik einsetzen zu k\u00f6nnen wie z.B. Mengenlehre, Vektorrechnung oder Beweisf\u00fchrung. Bedeutung der Logik; menschliche Sprache und formale Sprache; Einf\u00fchrung in die Aussagenlogik und Pr\u00e4dikatenlogik; Modelle, Wahrheitswerte und formale Beweise.<br>\n**Angestrebte Lernergebnisse und Studieninhalte:** Die Studierenden beherrschen wesentliche logische und mathematische Verfahren und haben Verst\u00e4ndnis von grundlegenden logischen und mathematischen Methoden sowie deren Anwendung in spezifischen F\u00e4llen. Sie haben das formale R\u00fcstzeug, um die wichtigsten Methoden der formalen Linguistik und Computerlinguistik zu verstehen.<br>\n**Teilnahmevoraussetzungen:** Formal: Keine | Inhaltlich: Keine<br>\n**Pr\u00fcfungsformen:** Portfolio (Pnr. 2110)<br>\n**Voraussetzungen f\u00fcr die Zulassung zur Modulpr\u00fcfung:** -keine-<br>\n**Voraussetzungen f\u00fcr die Vergabe von ECTS-Leistungspunkten:** Erbrachte Studienleistungen (SL) in den Lehrveranstaltungen (a) und (b) und bestandene Modulpr\u00fcfung.<br>\n**Sonstige Informationen:** -keine-",
            "| Modul / Veranstaltung | MP | SL | LP | SWS |\n| :--- | :--- | :--- | :--- | :--- |\n| **Basismodul - Mathematische und logische Grundlagen** | **1 MP** | **2 SL** | **12 LP** | **8 SWS** |\n| Einf\u00fchrung in die computationelle Logik (Seminar mit \u00dcbung) | | Pnr. 2101 | 4 LP | 4 SWS |\n| Mathematische Grundlagen (Seminar) | | Pnr. 2102 | 4 LP | 4 SWS |\n| Modulpr\u00fcfung (Portfolio) | Pnr. 2110 | | 4 LP | |\n| **Basismodul - Grundlagen der Computerlinguistik und formale Grammatikbeschreibung [1/2]** | | **2 SL** | **4 LP** | **4 SWS** |\n| Einf\u00fchrung in die Computerlinguistik (Seminar) | | Pnr. 2201 | 2 LP | 2 SWS |\n| Einf\u00fchrung in die Computerlinguistik (\u00dcbung) | | Pnr. 2202 | 2 LP | 2 SWS |\n| **Basismodul - Python-Programmierung [1/2]** | | **2 SL** | **4 LP** | **4 SWS** |\n| Einf\u00fchrung in die Programmierung mit Python (Seminar) | | Pnr. 2301 | 2 LP | 2 SWS |\n| Einf\u00fchrung in die Programmierung mit Python (\u00dcbung) | | Pnr. 2302 | 2 LP | 2 SWS |\n| **Basiswissen Linguistik - Morphologie und Syntax** | **1 MP** | **2 SL** | **9 LP** | **6 SWS** |\n| Vorlesung | | Pnr. 1301 | 2 LP | 4 SWS |\n| Tutorium | | Pnr. 1302 | 2 LP | 2 SWS |\n| Modulpr\u00fcfung (Klausur) | Pnr. 1310 | | 3 LP | |\n| **Profilbilungsbereich** | | | **1 LP** | |"
        ]
    },
    {
        "user_input": "Wann soll ich das Praktikum machen?",
        "reference": "Es wird empfohlen, das Berufsfeldpraktikum nach dem vierten oder f\u00fcnften Semester zu absolvieren.",
        "response": "Dazu enthalten die bereitgestellten Dokumente keine Informationen.",
        "retrieved_contexts": []
    },
    {
        "user_input": "Gibt es eine generelle Anwesenheitspflicht f\u00fcr Vorlesungen?",
        "reference": "Nein, bei Vorlesungen kann keine Anwesenheitspflicht festgelegt werden.",
        "response": "Dazu enthalten die bereitgestellten Dokumente keine Informationen.",
        "retrieved_contexts": [
            "Eine Pflicht zur Anwesenheit in Lehrveranstaltungen kann in allen Modulen oder Modulteilen vorgeschrieben werden, in denen die regelm\u00e4\u00dfige Anwesenheit und die aktive Teilnahme f\u00fcr das Erreichen des Lernziels erforderlich ist. Generell gilt dies f\u00fcr Exkursionen, Forschungsprojekte, Praktika, Sprachkurse und \u00dcbungen. Seminare sind grunds\u00e4tzlich auf die kontinuierliche Beteiligung aller Studierenden am Dialog ausgerichtet und k\u00f6nnen mit einer Anwesenheitspflicht belegt werden, sofern nicht mehr als 25 Personen teilnehmen. Bei Vorlesungen kann keine Anwesenheitspflicht festgelegt werden. F\u00fcr andere Lehrveranstaltungen gilt eine Anwesenheitspflicht nur dann, wenn sie im jeweiligen f\u00e4cherspezifischen Anhang explizit festgelegt ist. Die Anwesenheitspflicht ist erf\u00fcllt, wenn ein/e Studierende/r 80% der Veranstaltungszeit beigewohnt hat."
        ]
    },
    {
        "user_input": "Wann gilt die Anwesenheitspflicht in einer Lehrveranstaltung als erf\u00fcllt?",
        "reference": "Die Anwesenheitspflicht ist erf\u00fcllt, wenn ein Studierender oder eine Studierende 80% der Veranstaltungszeit beigewohnt hat.",
        "response": "Die Anwesenheitspflicht gilt als erf\u00fcllt, wenn ein/e Studierende/r 80% der Veranstaltungszeit beigewohnt hat.",
        "retrieved_contexts": [
            "Eine Pflicht zur Anwesenheit in Lehrveranstaltungen kann in allen Modulen oder Modulteilen vorgeschrieben werden, in denen die regelm\u00e4\u00dfige Anwesenheit und die aktive Teilnahme f\u00fcr das Erreichen des Lernziels erforderlich ist. Generell gilt dies f\u00fcr Exkursionen, Forschungsprojekte, Praktika, Sprachkurse und \u00dcbungen. Seminare sind grunds\u00e4tzlich auf die kontinuierliche Beteiligung aller Studierenden am Dialog ausgerichtet und k\u00f6nnen mit einer Anwesenheitspflicht belegt werden, sofern nicht mehr als 25 Personen teilnehmen. Bei Vorlesungen kann keine Anwesenheitspflicht festgelegt werden. F\u00fcr andere Lehrveranstaltungen gilt eine Anwesenheitspflicht nur dann, wenn sie im jeweiligen f\u00e4cherspezifischen Anhang explizit festgelegt ist. Die Anwesenheitspflicht ist erf\u00fcllt, wenn ein/e Studierende/r 80% der Veranstaltungszeit beigewohnt hat."
        ]
    },
    {
        "user_input": "Gibt es eine Klausur in Wahrscheinlichkeitstheorie?",
        "reference": "Nein, im \"Basismodul - Statistische Methoden in der Computerlinguistik\", zu dem die Wahrscheinlichkeitstheorie geh\u00f6rt, gibt es gar keine Modulpr\u00fcfung und somit auch keine Klausur. Es m\u00fcssen lediglich Studienleistungen erbracht werden.",
        "response": "Nein, es gibt keine Klausur in Wahrscheinlichkeitstheorie im Kontext der bereitgestellten Dokumente.",
        "retrieved_contexts": [
            "| Modul / Veranstaltung | MP | SL | LP | SWS |\n| :--- | :--- | :--- | :--- | :--- |\n| **Basismodul - Grundlagen der Computerlinguistik und formale Grammatikbeschreibung [2/2]** | **1 MP** | **2 SL** | **8 LP** | **4 SWS** |\n| Grammatikformalismen (Seminar) | | Pnr. 2203 | 2 LP | 2 SWS |\n| Grammatikformalismen (\u00dcbung) | | Pnr. 2204 | 2 LP | 2 SWS |\n| Modulpr\u00fcfung (Klausur) | Pnr. 2210 | | 4 LP | |\n| **Basismodul - Python-Programmierung [2/2]** | **1 MP** | **2 SL** | **8 LP** | **4 SWS** |\n| Fortgeschrittene Python-Programmierung mit NLP-Anwendungen (Seminar) | | Pnr. 2303 | 2 LP | 2 SWS |\n| Fortgeschrittene Python-Programmierung mit NLP-Anwendungen (\u00dcbung) | | Pnr. 2304 | 2 LP | 2 SWS |\n| Modulpr\u00fcfung (Klausur) | Pnr. 2310 | | 4 LP | |\n| **Basiswissen Linguistik - Semantik und Pragmatik** | **1 MP** | **2 SL** | **9 LP** | **6 SWS** |\n| Vorlesung | | Pnr. 1401 | 4 LP | 4 SWS |\n| Tutorium | | Pnr. 1402 | 2 LP | 2 SWS |\n| Modulpr\u00fcfung (Klausur) | Pnr. 1410 | | 3 LP | |\n| **Basismodul - Statistische Methoden in der Computerlinguistik [1/2]** | **0 MP** | **1 SL** | **4 LP** | **4 SWS** |\n| Wahrscheinlichkeitstheorie und Statistik (Seminar und \u00dcbung) | | Pnr. 2401 | 4 LP | 4 SWS |\n| **Profilbildungsbereich** | | | **1 LP** | |"
        ]
    },
    {
        "user_input": "Wie lang dauert eine Klausur?",
        "reference": "Die Dauer einer Klausurarbeit betr\u00e4gt in der Regel 90 Minuten.",
        "response": "Die Dauer einer Klausur betr\u00e4gt in der Regel 90 Minuten.",
        "retrieved_contexts": [
            "(3) Die Dauer einer Klausurarbeit betr\u00e4gt in der Regel 90 Minuten. Ausnahmsweise kann die Bearbeitungszeit abh\u00e4ngig vom Workload des Moduls auf h\u00f6chstens 180 Minuten verl\u00e4ngert oder auf mindestens 45 Minuten verk\u00fcrzt werden. Die Bewertung einer Klausur wird durch die Dozentinnen und Dozenten vorgenommen. Die Bewertung ist der Kandidatin oder dem Kandidaten nach sp\u00e4testens acht Wochen bekannt zu machen. N\u00e4heres regelt der f\u00e4cherspezifische Anhang.",
            "(4) Eine Studienarbeit besteht aus der m\u00fcndlichen Pr\u00e4sentation und schriftlichen Ausarbeitung einer Thematik aus dem Stoffgebiet einer oder mehrerer Lehrveranstaltungen. Alternativ kann eine Klausur von 45 Minuten Dauer an die Stelle der schriftlichen Ausarbeitung treten. Die Dauer der m\u00fcndlichen Pr\u00e4sentation betr\u00e4gt mindestens 15 Minuten. Der Umfang der schriftlichen Ausarbeitung soll mindestens 1500 W\u00f6rter (circa 5 Seiten) und h\u00f6chstens 4500 W\u00f6rter (circa 15 Seiten) betragen. Die Bewertung einer Studienarbeit wird durch die Dozentin oder den Dozenten vorgenommen. Die Bewertung ist der Kandidatin oder dem Kandidaten nach sp\u00e4testens acht Wochen nach Abgabe der schriftlichen Ausarbeitung bekannt zu machen."
        ]
    },
    {
        "user_input": "Wie oft darf ich eine nicht bestandene Modulpr\u00fcfung wiederholen?",
        "reference": "Eine nicht bestandene Modulpr\u00fcfung kann insgesamt zweimal wiederholt werden.",
        "response": "Eine nicht bestandene Modulpr\u00fcfung kann zweimal wiederholt werden.",
        "retrieved_contexts": [
            "(5) Eine nicht bestandene Modulpr\u00fcfung, beziehungsweise eine mit weniger als \"ausreichend\" bewertete Pr\u00fcfungsleistung als Teil der Gruppenarbeit, kann zweimal wiederholt werden.",
            "(7) Die Wiederholungspr\u00fcfung soll innerhalb eines Jahres nach Abschluss der nicht bestandenen Pr\u00fcfung abgeschlossen sein.",
            "(9) Die Bachelorpr\u00fcfung ist endg\u00fcltig nicht bestanden, wenn\n\u2022 die Bachelorarbeit nicht bestanden ist und nicht mehr wiederholt werden darf,\n\u2022 eine verpflichtende Modulpr\u00fcfung nicht bestanden ist und nicht mehr wiederholt werden darf oder\n\u2022 eine Modulpr\u00fcfung in einem Wahlpflichtbereich nicht bestanden ist, nicht mehr wiederholt werden darf und es nicht m\u00f6glich ist, die notwendige Bestehensgrenze des Wahlpflichtbereiches durch alternative Modulpr\u00fcfungen zu erreichen."
        ]
    },
    {
        "user_input": "Wie stark z\u00e4hlt die Bachelorarbeit f\u00fcr meine Abschlussnote?",
        "reference": "Die Note der Bachelorarbeit wird bei der Ermittlung der Gesamtnote dreifach gewichtet. Im Vergleich dazu gehen alle anderen Modulpr\u00fcfungen nur einfach in die Gesamtnote ein.",
        "response": "Die Bachelorarbeit z\u00e4hlt bei integrierten Studieng\u00e4ngen dreifach oder vierfach gewichtet, w\u00e4hrend bei Kern- und Erg\u00e4nzungsfachstudieng\u00e4ngen sie zu 20 Prozent der Gesamtnote ausmacht.",
        "retrieved_contexts": [
            "(6) Die Gesamtnote der Bachelorpr\u00fcfung bei Kern- und Erg\u00e4nzungsfachstudieng\u00e4ngen errechnet sich zu 20 Prozent aus der Note der Bachelorarbeit, zu 50 Prozent aus dem gewichteten arithmetischen Mittel aller Modulnoten des Kernfaches, und zu 30 Prozent aus dem gewichteten arithmetischen Mittel aller Modulnoten des Erg\u00e4nzungsfaches. Modulnoten k\u00f6nnen nach Ma\u00dfgabe des f\u00e4cherspezifischen Anhangs doppelt oder dreifach gewichtet werden. Alle Dezimalstellen au\u00dfer der ersten werden ohne Rundung gestrichen.",
            "(5) Die Gesamtnote der Bachelorpr\u00fcfung bei integrierten Studieng\u00e4ngen errechnet sich als gewichtetes arithmetisches Mittel aus den Modulnoten und der Bachelorarbeit. Alle Dezimalstellen au\u00dfer der ersten werden ohne Rundung gestrichen. Die Bachelorarbeit wird nach Ma\u00dfgabe des f\u00e4cherspezifischen Anhangs dreifach oder vierfach gewichtet. Die Gewichtung der Modulnoten ist im f\u00e4cherspezifischen Anhang angegeben.",
            "(3) Die der Bachelorarbeit ergibt sich wie folgt. Wenn die Noten beider Gutachten mindestens \"ausreichend\" (4,0) sind und nicht mehr als 2,0 auseinander liegen, errechnet sich die Endnote als der Durchschnitt der beiden Noten. Wenn beide Noten \"nicht ausreichend\" (5,0) sind, ist die Endnote \"nicht ausreichend\" (5,0). Wenn eine der beiden Noten \"nicht ausreichend\" (5,0) und die andere mindestens \"ausreichend\" (4,0) ist oder wenn die Noten der beiden Gutachten mehr als 2,0 auseinander liegen, bestellt die oder der Vorsitzende des Pr\u00fcfungsausschusses beziehungsweise ihre oder seine Stellvertretung eine dritte Gutachterin oder einen dritten Gutachter. Die Endnote errechnet sich dann als der Durchschnitt der beiden besseren Noten, falls sie mindestens \"ausreichend\" (4,0) sind. Alle Dezimalstellen au\u00dfer der ersten werden ohne Rundung gestrichen. Sind zwei der drei Noten \"nicht ausreichend\" (5,0), ist die Endnote \"nicht ausreichend\" (5,0)."
        ]
    },
    {
        "user_input": "Was passiert, wenn ich in einer Pr\u00e4senzpr\u00fcfung generative K\u00fcnstliche Intelligenz benutze?",
        "reference": "Der Einsatz generativer K\u00fcnstlicher Intelligenz im Rahmen von Pr\u00e4senzpr\u00fcfungen ist unzul\u00e4ssig. Dies gilt als T\u00e4uschungsversuch.",
        "response": "Der Einsatz generativer K\u00fcnstlicher Intelligenz im Rahmen von Pr\u00e4senzpr\u00fcfungen ist unzul\u00e4ssig und gilt als T\u00e4uschungsversuch.",
        "retrieved_contexts": [
            "(5) Versuchen Kandidatinnen oder Kandidaten, das Ergebnis einer Pr\u00fcfungsleistung durch T\u00e4uschung, zum Beispiel Benutzung nicht zugelassener Hilfsmittel, zu beeinflussen, gilt die betreffende Pr\u00fcfungsleistung als mit \"nicht ausreichend\" (5,0) bewertet. Der Einsatz generativer K\u00fcnstlicher Intelligenz im Rahmen von Pr\u00e4senzpr\u00fcfungen ist unzul\u00e4ssig. Als T\u00e4uschungsversuch gelten auch nicht als Solche gekennzeichnete Zitate aus Internetquellen. Wer als Kandidatin oder Kandidat den ordnungsgem\u00e4\u00dfen Ablauf der Pr\u00fcfung st\u00f6rt, kann von den jeweiligen Pr\u00fcfenden oder Aufsichtf\u00fchrenden nach Abmahnung von der Fortsetzung der Pr\u00fcfungsleistung ausgeschlossen werden; in diesem Fall gilt die betreffende Pr\u00fcfungsleistung als mit \"nicht ausreichend\" (5,0) bewertet. Die Gr\u00fcnde f\u00fcr den Ausschluss sind aktenkundig zu machen. Wer von der weiteren Erbringung einer Pr\u00fcfungsleistung ausgeschlossen wird, kann verlangen, dass diese Entscheidung vom Pr\u00fcfungsausschuss \u00fcberpr\u00fcft wird. Dies gilt entsprechend bei der Feststellung einer T\u00e4uschung im Sinne von Satz 1."
        ]
    },
    {
        "user_input": "Muss ich Kurse aus der Linguistik f\u00fcr das interdisziplin\u00e4re Vertiefungsmodul belegen?",
        "reference": "Nein, Linguistik-Kurse sind keine Pflicht. Das Modul sieht vor, dass du zwei Vorlesungen oder Seminare aus der Linguistik oder der Informatik w\u00e4hlst, wobei lediglich der Informatik-Anteil von 4 SWS vorgeschrieben ist.",
        "response": "Nein, Sie m\u00fcssen Kurse aus der Linguistik nicht belegen. Das Modul erfordert mindestens 4 Semesterwochenstunden (SWS) in der Informatik.",
        "retrieved_contexts": [
            "### Modul: Vertiefungsmodul - Interdisziplin\u00e4r\n**Englischer Titel:** Specialization module - interdisciplinary<br>\n**Modul-Nummer:** 5100<br>\n**ECTS-Leistungspunkte:** 12 ECTS-Leistungspunkte<br>\n**Workload:** 360 Stunden<br>\n**Dauer:** 2 Semester<br>\n**Lehrveranstaltungen und Lehrformen:** Zwei Vorlesungen oder Seminare aus Linguistik oder Informatik | Vorlesung Linguistik: 5101, 5105 | Vorlesung Informatik: 5102, 5106 | Seminar Linguistik: 5103, 5107 | Seminar Informatik: 5104, 5108<br>\n**Belegung:** Nach Vorgabe der gew\u00e4hlten Veranstaltungen<br>\n**Empfohlenes Studiensemester:** 4. Fachsemester (Sommersemester) | 5. Fachsemester (Wintersemester)<br>\n**H\u00e4ufigkeit des Angebots:** Jedes Semester<br>\n**Geplante Gruppengr\u00f6\u00dfe:** Nach Vorgabe der gew\u00e4hlten Veranstaltungen<br>\n**Kontaktzeit:** Nach Vorgabe der gew\u00e4hlten Veranstaltungen<br>\n**Selbststudium:** Nach Vorgabe der gew\u00e4hlten Veranstaltungen<br>\n**ECTS-Leistungspunkte f\u00fcr die Modulpr\u00fcfung:** Nach Vorgabe der gew\u00e4hlten Veranstaltungen<br>\n**Inhalte:** M\u00f6gliche Inhalte sind Themen der Linguistik und Informatik. Relevante m\u00f6gliche Themen in der Linguistik sind z.B.: Phonetik und Phonologie, Psycho- und Neurolinguistik, historische Linguistik. Es m\u00fcssen Veranstaltungen im Umfang von mindestens 4 SWS in der Informatik belegt werden. Dabei darf keine Doppelung von Inhalten der Module aus der Computerlinguistik entstehen. F\u00fcr die Computerlinguistik relevante m\u00f6gliche Themen in der Informatik sind z.B.: Professionelle Softwareentwicklung, Datenbanksysteme, Nichtkooperative Spieltheorie, Komplexit\u00e4tstheorie, Numerische Optimierung, Dialogsysteme, \u00dcberblick K\u00fcnstliche Intelligenz.<br>\n**Angestrebte Lernergebnisse und Studieninhalte:** Vertiefte Kenntnisse in Spezialgebieten von Linguistik/Computerlinguistik/Informatik<br>\n**Teilnahmevoraussetzungen:** Formal: keine<br>\n**Pr\u00fcfungsformen:** M\u00fcndliche Pr\u00fcfung (Pnr. 5110) oder Klausur (Pnr. 5120) oder Hausarbeit (Pnr. 5130) oder Studienarbeit (Pnr. 5140) oder Projektarbeit (Pnr. 5150)<br>\n**Voraussetzungen f\u00fcr die Zulassung zur Modulpr\u00fcfung:** -keine<br>\n**Voraussetzungen f\u00fcr die Vergabe von ECTS-Leistungspunkten:** Bestandene Modulpr\u00fcfung, aktive und erfolgreiche Mitwirkung in den Seminaren und theoretischen und praktischen \u00dcbungen.<br>\n**Sonstige Informationen:** -keine-"
        ]
    },
    {
        "user_input": "Wie lang ist die offizielle Bearbeitungszeit f\u00fcr die Bachelorarbeit?",
        "reference": "Die Bearbeitungszeit f\u00fcr die Bachelorarbeit betr\u00e4gt maximal drei Monate.",
        "response": "Die offizielle Bearbeitungszeit f\u00fcr die Bachelorarbeit endet in der Regel zwei Monate nach dem Abschluss der m\u00fcndlichen Leistung.",
        "retrieved_contexts": [
            "(10) Die Bearbeitungszeit f\u00fcr Studienarbeiten endet zwei Monate nach Abschluss der m\u00fcndlichen Leistung, sp\u00e4testens zum Vorlesungsbeginn des darauffolgenden Semesters. Die Bearbeitungszeit f\u00fcr Hausarbeiten betr\u00e4gt in der Regel zwei Monate. Sie kann vom zust\u00e4ndigen Pr\u00fcfungsausschuss um bis zu einen Monat verl\u00e4ngert werden, wenn die Aufgabenstellung dies zwingend erfordert. Die Themen werden im laufenden Semester vergeben. Die Bearbeitungszeit f\u00fcr den schriftlichen Bericht bei Projektarbeiten endet in der Regel zwei Monate nach dem Abschluss der praktischen Projektarbeit. Sie kann vom zust\u00e4ndigen Pr\u00fcfungsausschuss um bis zu einen Monat verl\u00e4ngert werden, wenn die Aufgabenstellung dies zwingend erfordert. Verz\u00f6gert sich die Bearbeitung durch von der Kandidatin oder dem Kandidaten nicht zu vertretende Umst\u00e4nde, kann sowohl f\u00fcr Hausarbeiten als auch f\u00fcr Projektarbeiten eine Nachfrist von bis zu 4 Wochen einger\u00e4umt werden.",
            "(3) Die Dauer einer Klausurarbeit betr\u00e4gt in der Regel 90 Minuten. Ausnahmsweise kann die Bearbeitungszeit abh\u00e4ngig vom Workload des Moduls auf h\u00f6chstens 180 Minuten verl\u00e4ngert oder auf mindestens 45 Minuten verk\u00fcrzt werden. Die Bewertung einer Klausur wird durch die Dozentinnen und Dozenten vorgenommen. Die Bewertung ist der Kandidatin oder dem Kandidaten nach sp\u00e4testens acht Wochen bekannt zu machen. N\u00e4heres regelt der f\u00e4cherspezifische Anhang.",
            "(3) Die Bewertung der Bachelorarbeit ist der Kandidatin oder dem Kandidaten nach sp\u00e4testens acht Wochen mitzuteilen."
        ]
    }
]