[
    {
        "user_input": "Welche Kurse sollte ich im ersten Semester belegen?",
        "reference": "Laut dem exemplarischen Studienverlaufsplan solltest du im ersten Semester folgende Kurse belegen: Mathematische Grundlagen, Einf\u00fchrung in die computationelle Logik, Einf\u00fchrung in die Computerlinguistik, Einf\u00fchrung in die Programmierung mit Python, Morphologie und Syntax.",
        "response": "Im ersten Semester sollten Sie die Kurse mit den folgenden Bezeichnungen belegen:\n*   a: Einf\u00fchrung in die computationelle Logik (Seminar & \u00dcbung) / 2101\n*   b: Mathematische Grundlagen (Seminar) / 2102",
        "retrieved_contexts": [
            "r (a) mit \u00dcbung (b) und Seminar (c) mit \u00dcbung (d)<br>\n**Empfohlenes Studiensemester:** a: 1. Fachsemester (Wintersemester) | b: 1. Fachsemester (Wintersemester) | c: 2. Fachsemester (Sommersemester) | d: 2. Fachsemester (Sommersemester) | Pr\u00fcfung im 2. Fachsemester (Sommersemester)<br>\n**H\u00e4ufigkeit ",
            "\n**Belegung:** Seminar mit \u00dcbung (a) und Seminar (b)<br>\n**Empfohlenes Studiensemester:** a: 3. Fachsemester (Wintersemester) | b: 4. Fachsemester (Sommersemester) | Pr\u00fcfung im 4. Fachsemester (Sommersemester)<br>\n**H\u00e4ufigkeit des Angebots:** a: Jedes Wintersemester | b: Jedes Sommersemester<br>\n**G",
            ": Einf\u00fchrung in die computationelle Logik (Seminar & \u00dcbung) / 2101 | b: Mathematische Grundlagen (Seminar) / 2102<br>\n**Belegung:** Seminar und \u00dcbung (a) und Seminar (b)<br>\n**Empfohlenes Studiensemester:** a: 1. Fachsemester (Wintersemester) | b: 1. Fachsemester (Wintersemester) | Pr\u00fcfung im 1. Fac",
            "altungen und Lehrformen:** a: Wahrscheinlichkeitstheorie und Statistik (Seminar und \u00dcbung) / 2401 | b: Linguistische Ressourcen (Seminar) / 2402<br>\n**Belegung:** Seminar mit \u00dcbung (a) und Seminar (b)<br>\n**Empfohlenes Studiensemester:** a: 2. Fachsemester (Sommersemester) | b: 3. Fachsemester (Wint",
            "atik | Vorlesung Linguistik: 5101, 5105 | Vorlesung Informatik: 5102, 5106 | Seminar Linguistik: 5103, 5107 | Seminar Informatik: 5104, 5108<br>\n**Belegung:** Nach Vorgabe der gew\u00e4hlten Veranstaltungen<br>\n**Empfohlenes Studiensemester:** 4. Fachsemester (Sommersemester) | 5. Fachsemester (Wintersem",
            "eranstaltungen und Lehrformen:** a: Programmierung (Vorlesung) / 4501 | b: \u00dcbung zur Vorlesung (\u00dcbung) / 4502 | c: Praktische \u00dcbung zur Vorlesung (Praktische \u00dcbung) / 4503<br>\n**Belegung:** Vorlesung (a) mit \u00dcbung (b) und praktischer \u00dcbung (c)<br>\n**Empfohlenes Studiensemester:** a: 3. Fachsemester "
        ]
    },
    {
        "user_input": "Kann ich mit dem Studium in Computerlinguistik auch im Sommersemester anfangen?",
        "reference": "Nein, das Studium ist f\u00fcr einen Beginn im Wintersemester ausgelegt.",
        "response": "Dazu enthalten die bereitgestellten Dokumente keine Informationen.",
        "retrieved_contexts": [
            " Seminar nach Wahl im Bereich Computerlinguistik | | Pnr. 5202 | 6 LP | 4 SWS |\n| **Profilbildungsbereich** | | | **1 LP** | |\n\n### 6. Semester Bachelor Computerlinguistik\n*Summe: 3 Module, 1 MP, Bachelorarbeit, 2 Veranstaltungen, 8 SWS, 30 LP, davon 1 LP im PBB*\n\n| Modul / Veranstaltung | MP | SL |",
            "# BA Computerlinguistik PO 2025\n**Vorl\u00e4ufige Lesefassung Stand 26.09.2025**\n\n## Studiengang\u00fcbersicht\n\n| Merkmal | Details |\n| :--- | :--- |\n| **Integrierter Studiengang** | Computerlinguistik |\n| **Studienbeginn** | Nur im Wintersemester |\n| **Studienumfang** | 180 ECTS-Leistungspunkte (LP) |\n| **No",
            " a: thematisches Seminar in der Computerlinguistik (Seminar) / 5301<br>\n**Belegung:** Seminar (a)<br>\n**Empfohlenes Studiensemester:** a: 6. Fachsemester (Sommersemester) | Pr\u00fcfung im 6. Fachsemester (Sommersemester)<br>\n**H\u00e4ufigkeit des Angebots:** a: Jedes Sommersemester<br>\n**Geplante Gruppengr\u00f6\u00df",
            "2 SWS |\n| **Profilbildungsbereich** | | | **3 LP** | |\n\n### 5. Semester Bachelor Computerlinguistik\n*Summe: 3 Module, 1 MP, 3 Veranstaltungen, 12 SWS, 30 LP, davon 1 LP im PBB*\n\n| Modul / Veranstaltung | MP | SL | LP | SWS |\n| :--- | :--- | :--- | :--- | :--- |\n| **Praktikum & Orientierung [2/2]** |",
            "|\n| **Profilbildungsbereich** | | | **1 LP** | |\n\n### 3. Semester Bachelor Computerlinguistik\n*Summe: 4 Module, 1 MP, 7 Veranstaltungen, 18 SWS, 30 LP, davon 6 LP im PBB*\n\n| Modul / Veranstaltung | MP | SL | LP | SWS |\n| :--- | :--- | :--- | :--- | :--- |\n| **Basismodul - Statistische Methoden in de",
            "rformen:** a: Seminar Computerlinguistik (Seminar) / 5201 | b: Seminar Computerlinguistik (Seminar) / 5202<br>\n**Belegung:** Seminar (a) und Seminar (b)<br>\n**Empfohlenes Studiensemester:** a: 5. Fachsemester (Wintersemester) | b: 5. Fachsemester (Wintersemester)<br>\n**H\u00e4ufigkeit des Angebots:** Jed"
        ]
    },
    {
        "user_input": "Muss ich flie\u00dfend Englisch sprechen k\u00f6nnen um Computerlinguistik zu studieren?",
        "reference": "Flie\u00dfendes Englisch wird nicht vorausgesetzt, jedoch ben\u00f6tigst du Englischkenntnisse auf dem Niveau B1. Dies entspricht vergleichsweise einem erfolgreichen vierj\u00e4hrigen Schulunterricht an einer weiterf\u00fchrenden Schule.",
        "response": "Nein, flie\u00dfend Englisch ist nicht eine Teilnahmevoraussetzung f\u00fcr die Computerlinguistik.",
        "retrieved_contexts": [
            "beit der Computerlinguistik kennen, und lernen weiterhin selbst\u00e4ndig wissenschaftlich zu arbeiten.<br>\n**Teilnahmevoraussetzungen:** Formal: Alle Basis- und Aufbaumodule<br>\n**Pr\u00fcfungsformen:** Bachelorarbeit (Pnr. 6000)<br>\n**Voraussetzungen f\u00fcr die Zulassung zur Pr\u00fcfung:** -keine-<br>\n**Voraussetz",
            "nstaltungen aus der Computerlinguistik auch Veranstaltungen aus Linguistik und Informatik zu belegen, die nicht notwendig dezidiert computerlinguistisch sind. Im Rahmen dieses Moduls muss mindestens eine Veranstaltung aus der Informatik belegt werden. Neben diesen Modulen, die relativ flexibel Spezi",
            " f\u00fcr die Computerlinguistik zentralen sprachwissenschaftlichen Bereiche Morphologie/Syntax und Semantik/Pragmatik. Desweiteren sieht der Studienplan f\u00fcr das erste Jahr einen Einstieg in computerlinguistische Programmierung mit Python vor, die neben Grundlagen auch aktuelle Methoden der Sprachtechnol",
            "# BA Computerlinguistik PO 2025\n**Vorl\u00e4ufige Lesefassung Stand 26.09.2025**\n\n## Studiengang\u00fcbersicht\n\n| Merkmal | Details |\n| :--- | :--- |\n| **Integrierter Studiengang** | Computerlinguistik |\n| **Studienbeginn** | Nur im Wintersemester |\n| **Studienumfang** | 180 ECTS-Leistungspunkte (LP) |\n| **No",
            "Studieninhalte:** Wissen \u00fcber Ziele der Computerlinguistik sowie Vertrautheit mit den grundlegenden formalen und probabilistischen Methoden der Computerlinguistik. Kenntnisse \u00fcber g\u00e4ngige computerlinguistische Formalismen zur Implementierung von Grammatiken.<br>\n**Teilnahmevoraussetzungen:** Formal:",
            "tik 1\n**Englischer Titel:** Specialization module - computational linguistics 1<br>\n**Modul-Nummer:** 5200<br>\n**ECTS-Leistungspunkte:** 12 ECTS-Leistungspunkte<br>\n**Workload:** 360 Stunden<br>\n**Dauer:** 1 Semester<br>\n**Lehrveranstaltungen und Lehrformen:** a: Seminar Computerlinguistik (Seminar)"
        ]
    },
    {
        "user_input": "Muss ich f\u00fcr den Python-Kurs Vorkenntnisse haben?",
        "reference": "Nein, f\u00fcr das Modul \"Python-Programmierung\" werden weder formale noch inhaltliche Vorkenntnisse vorausgesetzt.",
        "response": "Nein, es werden keine Vorkenntnisse f\u00fcr den Python-Kurs ben\u00f6tigt.",
        "retrieved_contexts": [
            "ktionale Programmierung). Au\u00dferdem werden Grundkenntnisse des Einsatzes von Python in den Bereichen Data Science und NLP (Natural Language Processing) erworben, sowie die F\u00e4higkeit ein kleines Software-Projekt durchzuf\u00fchren und zu pr\u00e4sentieren.<br>\n**Teilnahmevoraussetzungen:** Formal: Keine | Inhal",
            "d formale Grammatikbeschreibung, Basismodul - Python-Programmierung<br>\n**Pr\u00fcfungsformen:** -keine-<br>\n**Voraussetzungen f\u00fcr die Zulassung zur Modulpr\u00fcfung:** -keine-<br>\n**Voraussetzungen f\u00fcr die Vergabe von ECTS-Leistungspunkten:** Erbrachte Studienleistungen (SL) in (a) und 6-w\u00f6chiges Praktikum ",
            "den<br>\n**Dauer:** 2 Semester<br>\n**Lehrveranstaltungen und Lehrformen:** a: Einf\u00fchrung in die Programmierung mit Python (Seminar) / 2301 | b: Einf\u00fchrung in die Programmierung mit Python (\u00dcbung) / 2302 | c: Fortgeschrittene Python-Programmierung mit NLP-Anwendungen (Seminar) / 2303 | d: Fortgeschrit",
            "rebte Lernergebnisse und Studieninhalte:** Die Studierenden erwerben grundlegende F\u00e4higkeiten in der Programmierung mit der Programmiersprache Python sowie Kenntnisse \u00fcber fortgeschrittene Konzepte der Python-Programmierung (objektorientierte und funktionale Programmierung). Au\u00dferdem werden Grundken",
            "Teilnahmevoraussetzungen:** Formal: Keine | Inhaltlich: Basismodul - Mathematische und logische Grundlagen, Basismodul - Python-Programmierung<br>\n**Pr\u00fcfungsformen:** Klausur (Pnr. 4510)<br>\n**Voraussetzungen f\u00fcr die Zulassung zur Modulpr\u00fcfung:** -keine-<br>\n**Voraussetzungen f\u00fcr die Vergabe von ECT",
            "br>\n**Sonstige Informationen:** -keine-\n\n### Modul: Basismodul - Python-Programmierung\n**Englischer Titel:** Basis module - Python programming<br>\n**Modul-Nummer:** 2300<br>\n**ECTS-Leistungspunkte:** 12 ECTS-Leistungspunkte<br>\n**Workload:** 360 Stunden<br>\n**Dauer:** 2 Semester<br>\n**Lehrveranstalt"
        ]
    },
    {
        "user_input": "Gibt es eine \u00dcbung f\u00fcr Mathematische Grundlagen?",
        "reference": "Nein, f\u00fcr den Kurs \"Mathematische Grundlagen\" gibt es keine begleitende \u00dcbung. Es handelt sich dabei ausschlie\u00dflich um ein Seminar.",
        "response": "Ja, es gibt eine \u00dcbung f\u00fcr Mathematische Grundlagen, die als \u201eEinf\u00fchrung in die computationelle Logik (Seminar mit \u00dcbung)\" bezeichnet wird und die Pnr. 2101 tr\u00e4gt.",
        "retrieved_contexts": [
            "| :--- | :--- | :--- | :--- | :--- |\n| **Basismodul - Mathematische und logische Grundlagen** | **1 MP** | **2 SL** | **12 LP** | **8 SWS** |\n| Einf\u00fchrung in die computationelle Logik (Seminar mit \u00dcbung) | | Pnr. 2101 | 4 LP | 4 SWS |\n| Mathematische Grundlagen (Seminar) | | Pnr. 2102 | 4 LP | 4 SWS",
            "ischer Titel:** Basis module - mathematical and logical foundations<br>\n**Modul-Nummer:** 2100<br>\n**ECTS-Leistungspunkte:** 12 ECTS-Leistungspunkte<br>\n**Workload:** 360 Stunden<br>\n**Dauer:** 1 Semester<br>\n**Lehrveranstaltungen und Lehrformen:** a: Einf\u00fchrung in die computationelle Logik (Seminar",
            "mal: keine | Inhaltlich: Basismodul Mathematische und logische Grundlagen<br>\n**Pr\u00fcfungsformen:** -keine-<br>\n**Voraussetzungen f\u00fcr die Zulassung zur Modulpr\u00fcfung:** -keine-<br>\n**Voraussetzungen f\u00fcr die Vergabe von ECTS-Leistungspunkten:** Erbrachte Studienleistungen (SL) oder Hausaufgaben in allen",
            " Mathematische und logische Grundlagen, Basismodul - Grundlagen der Computerlinguistik und formale Grammatikbeschreibung, Aufbaumodul - Maschinelles Lernen | Inhaltlich: Je nach Thema<br>\n**Pr\u00fcfungsformen:** -keine-<br>\n**Voraussetzungen f\u00fcr die Zulassung zur Modulpr\u00fcfung:** -keine-<br>\n**Voraussetz",
            ": Einf\u00fchrung in die computationelle Logik (Seminar & \u00dcbung) / 2101 | b: Mathematische Grundlagen (Seminar) / 2102<br>\n**Belegung:** Seminar und \u00dcbung (a) und Seminar (b)<br>\n**Empfohlenes Studiensemester:** a: 1. Fachsemester (Wintersemester) | b: 1. Fachsemester (Wintersemester) | Pr\u00fcfung im 1. Fac",
            "ch** | keine Angabe |\n| **Anzahl der Modulpr\u00fcfungen** | 9, zuz\u00fcglich Bachelorarbeit |\n| **Art und Inhalt der Module und der Pr\u00fcfungen** | **Module:**<br>- Basismodul - Mathematische und logische Grundlagen (8 SWS, 1 MP, 12 LP)<br>- Basismodul - Grundlagen der Computerlinguistik und formale Grammatik"
        ]
    },
    {
        "user_input": "Muss ich in Python eine Klausur/Pr\u00fcfung absolvieren?",
        "reference": "Ja, du musst im Modul \"Python-Programmierung\" eine Pr\u00fcfung in Form einer Projektarbeit ablegen. Diese Modulpr\u00fcfung ist jedoch erst im zweiten Fachsemester (Sommersemester) vorgesehen. Im ersten Semester musst du daf\u00fcr lediglich Studienleistungen erbringen.",
        "response": "Nein, du musst in Python eine Klausur/Pr\u00fcfung absolvieren.",
        "retrieved_contexts": [
            "d formale Grammatikbeschreibung, Basismodul - Python-Programmierung<br>\n**Pr\u00fcfungsformen:** -keine-<br>\n**Voraussetzungen f\u00fcr die Zulassung zur Modulpr\u00fcfung:** -keine-<br>\n**Voraussetzungen f\u00fcr die Vergabe von ECTS-Leistungspunkten:** Erbrachte Studienleistungen (SL) in (a) und 6-w\u00f6chiges Praktikum ",
            "Teilnahmevoraussetzungen:** Formal: Keine | Inhaltlich: Basismodul - Mathematische und logische Grundlagen, Basismodul - Python-Programmierung<br>\n**Pr\u00fcfungsformen:** Klausur (Pnr. 4510)<br>\n**Voraussetzungen f\u00fcr die Zulassung zur Modulpr\u00fcfung:** -keine-<br>\n**Voraussetzungen f\u00fcr die Vergabe von ECT",
            "ktionale Programmierung). Au\u00dferdem werden Grundkenntnisse des Einsatzes von Python in den Bereichen Data Science und NLP (Natural Language Processing) erworben, sowie die F\u00e4higkeit ein kleines Software-Projekt durchzuf\u00fchren und zu pr\u00e4sentieren.<br>\n**Teilnahmevoraussetzungen:** Formal: Keine | Inhal",
            "** | **1 MP** | **2 SL** | **8 LP** | **4 SWS** |\n| Fortgeschrittene Python-Programmierung mit NLP-Anwendungen (Seminar) | | Pnr. 2303 | 2 LP | 2 SWS |\n| Fortgeschrittene Python-Programmierung mit NLP-Anwendungen (\u00dcbung) | | Pnr. 2304 | 2 LP | 2 SWS |\n| Modulpr\u00fcfung (Klausur) | Pnr. 2310 | | 4 LP | ",
            "rebte Lernergebnisse und Studieninhalte:** Die Studierenden erwerben grundlegende F\u00e4higkeiten in der Programmierung mit der Programmiersprache Python sowie Kenntnisse \u00fcber fortgeschrittene Konzepte der Python-Programmierung (objektorientierte und funktionale Programmierung). Au\u00dferdem werden Grundken",
            "br>\n**Sonstige Informationen:** -keine-\n\n### Modul: Basismodul - Python-Programmierung\n**Englischer Titel:** Basis module - Python programming<br>\n**Modul-Nummer:** 2300<br>\n**ECTS-Leistungspunkte:** 12 ECTS-Leistungspunkte<br>\n**Workload:** 360 Stunden<br>\n**Dauer:** 2 Semester<br>\n**Lehrveranstalt"
        ]
    },
    {
        "user_input": "Wann soll ich das Praktikum machen?",
        "reference": "Es wird empfohlen, das Berufsfeldpraktikum nach dem vierten oder f\u00fcnften Semester zu absolvieren.",
        "response": "Das Praktikum soll in der Regel im 4. Fachsemester (Sommersemester) oder im 5. Fachsemester (Wintersemester) absolviert werden.",
        "retrieved_contexts": [
            "ns 6-w\u00f6chiges Berufsfeldpraktikum oder eine Projektarbeit absolviert, jeweils mit einschl\u00e4gig computerlinguistischem Inhalt. Das Praktikum soll einen Einblick in die Berufspraxis vermitteln sowie den sp\u00e4teren \u00dcbergang in die Berufswelt erleichtern. Die Wahl des Praktikumsplatzes erfolgt im Einverneh",
            "ie Wahl des Praktikumsplatzes erfolgt im Einvernehmen mit dem/der Praktikumsbeauftragten der Abteilung f\u00fcr Computerlinguistik. Der/die Praktikumsbeauftragte ist bei der Vermittlung von Praktikumspl\u00e4tzen behilflich und bietet eine fachliche Praktikumsberatung und -begleitung an. \u00dcber das Praktikum is",
            ". Neben diesen Modulen, die relativ flexibel Spezialisierungen in Computerlinguistik, Linguistik und Informatik erlauben, ist im letzten Jahr ein Praktikum zur Berufsorientierung und die Anfertigung der Bachelorarbeit vorgesehen. Letztere wird in der Regel im letzten Semester durchgef\u00fchrt, wobei par",
            ": Orientierungsseminar (Seminar) / 3001 | b: Praktikum (in der Regel 6 Wochen in Vollzeit) / 3010<br>\n**Belegung:** Seminar (a)<br>\n**Empfohlenes Studiensemester:** a: 4. Fachsemester (Sommersemester) | b: 5. Fachsemester (Wintersemester)<br>\n**H\u00e4ufigkeit des Angebots:** a: Jedes Sommersemester | b:",
            "beratung und -begleitung an. \u00dcber das Praktikum ist ein kurzer Bericht (ca. 3-5 Seiten) zu verfassen und ein Zeugnis der Praktikumsstelle einzureichen. |\n\n---\n\n## Exemplarischer Studienverlaufsplan Bachelor Computerlinguistik\n\nBei dieser Darstellung handelt es sich um einen exemplarischen Studienver",
            "-- | :--- |\n| **Praktikum & Orientierung [2/2]** | | **1 SL** | **9 LP** | |\n| Praktikum (in der Regel 6 Wochen Vollzeit) | | Pnr. 3010 | 9 LP | |\n| **Vertiefungsmodul - Interdisziplin\u00e4r [2/2]** | **1 MP** | **1 SL** | **8 LP** | **4 SWS** |\n| Seminar nach Wahl | | Pnr. 5103 | 4 LP | 4 SWS |\n| Modul"
        ]
    },
    {
        "user_input": "Wird im Studiengang KI behandelt?",
        "reference": "Ja, das Thema K\u00fcnstliche Intelligenz (KI) ist ein zentraler und fest verankerter Bestandteil des Studiengangs. Im Pflichtbereich (Deep Learning): Im Aufbaumodul \"Maschinelles Lernen\" lernen die Studierenden den Umgang mit k\u00fcnstlichen neuronalen Netzen (Deep Learning) kennen und implementieren diese zur L\u00f6sung von Aufgaben im Natural Language Processing (NLP). Als Wahlthema in der Informatik: Im \"Vertiefungsmodul - Interdisziplin\u00e4r\" kann aus dem Bereich der Informatik explizit die Veranstaltung \"\u00dcberblick K\u00fcnstliche Intelligenz\" belegt werden. Spezialisierung im 3. Studienjahr: In den Vertiefungsmodulen der Computerlinguistik werden hochaktuelle KI-Architekturen in Seminaren gelehrt, darunter ausdr\u00fccklich \"gro\u00dfe Sprachmodelle\" (Large Language Models) und \"Transformer-Architekturen\".",
        "response": "Ja, im Studiengang KI werden Themen wie Dialogsysteme, K\u00fcnstliche Intelligenz, maschinelles Lernen und Deep Learning behandelt.",
        "retrieved_contexts": [
            "vorbereitet auf eine berufliche T\u00e4tigkeit z.B. in den Bereichen elektronische Informationsverarbeitung, Sprachressourcenmanagement, maschinelle Sprachverarbeitung und Sprachtechnologie. Die Studierenden erwerben au\u00dferdem besonders in den Aufbau- und Vertiefungsmodulen die F\u00e4higkeit, relevante Inform",
            "sammenarbeit zu gestalten. Damit sind sie optimal auf einen anschlie\u00dfenden Masterstudiengang. z.B. im Bereich Sprachtechnologie oder K\u00fcnstliche Intelligenz oder im Bereich Linguistik vorbereitet.\n\n## Aufbau des Studiums\nGrob l\u00e4sst sich das Studium in drei Phasen einteilen: Die ersten zwei Semester s",
            "ng, Dialogsysteme, \u00dcberblick K\u00fcnstliche Intelligenz.<br>\n**Angestrebte Lernergebnisse und Studieninhalte:** Vertiefte Kenntnisse in Spezialgebieten von Linguistik/Computerlinguistik/Informatik<br>\n**Teilnahmevoraussetzungen:** Formal: keine<br>\n**Pr\u00fcfungsformen:** M\u00fcndliche Pr\u00fcfung (Pnr. 5110) oder ",
            "chtechnologien wie etwa den Einsatz von Methoden der k\u00fcnstlichen Intelligenz in gro\u00dfen Sprachmodellen. Die Absolventen k\u00f6nnen sich selbst\u00e4ndig in neue Themengebiete einarbeiten und neue F\u00e4higkeiten lernen. Sie k\u00f6nnen sich mit Informatikern, Sprachwissenschaftlern und Laien \u00fcber Informationen, Ideen,",
            "e im Bereich maschinelles Lernen und Deep Learning.<br>\n**Angestrebte Lernergebnisse und Studieninhalte:** Studierende lernen vertiefte Kenntnisse in Spezialgebieten der Computerlinguistik.<br>\n**Teilnahmevoraussetzungen:** Formal: Basismodul - Mathematische und logische Grundlagen, Basismodul - Gru",
            "und Studieninhalte:** Studierende sollen nach Absolvierung der Lehrveranstaltungen in der Lage sein, Begriffe der Informatik und der Programmierung zu nennen und zu erl\u00e4utern; einfache Algorithmen (iterativ und rekursiv) zu verstehen, deren Ablauf zu beschreiben, sowie selbst zu erstellen; eigene Da"
        ]
    },
    {
        "user_input": "Muss ich Kurse aus der Linguistik f\u00fcr das interdisziplin\u00e4re Vertiefungsmodul belegen?",
        "reference": "Nein, Linguistik-Kurse sind keine Pflicht. Das Modul sieht vor, dass du zwei Vorlesungen oder Seminare aus der Linguistik oder der Informatik w\u00e4hlst, wobei lediglich der Informatik-Anteil von 4 SWS vorgeschrieben ist.",
        "response": "Nein, Kurse aus der Linguistik m\u00fcssen nicht belegt werden. Das interdisziplin\u00e4re Vertiefungsmodul erm\u00f6glicht es Ihnen, neben Veranstaltungen aus der Computerlinguistik auch Veranstaltungen aus Linguistik und Informatik zu belegen, die nicht notwendig dezidiert computerlinguistisch sind.",
        "retrieved_contexts": [
            "len Lehrveranstaltungen und bestandene Modulpr\u00fcfung.<br>\n**Sonstige Informationen:** -keine-\n\n### Modul: Basiswissen Linguistik - Semantik und Pragmatik\n**Englischer Titel:** Basic expertise in linguistics - semantics and pragmatics<br>\n**Modul-Nummer:** 1400<br>\n**ECTS-Leistungspunkte:** 9 ECTS-Lei",
            "d Constituency Parsing, Dependency Parsing, Finite-State Morphology, Semantic Role Labeling, Discourse Representation Theory, Fuzzy Logic usw. Daneben gibt es das interdisziplin\u00e4re Vertiefungsmodul, in dem den Studierenden erm\u00f6glicht wird, neben Veranstaltungen aus der Computerlinguistik auch Verans",
            " SWS, 1 MP, 12 LP)<br>- Vertiefungsmodul - Computerlinguistik 1 (8 SWS, 12 LP)<br>- Vertiefungsmodul - Computerlinguistik 2 (4 SWS, 1 MP, 9 LP)<br>- Abschlussarbeit und Forschungskolloquium (2 SWS, 15 LP)<br>- Profilbildungsbereich (18 LP) |\n| **Voraussetzungen f\u00fcr Pr\u00fcfungen** | keine Angabe |\n| **B",
            "nstaltungen aus der Computerlinguistik auch Veranstaltungen aus Linguistik und Informatik zu belegen, die nicht notwendig dezidiert computerlinguistisch sind. Im Rahmen dieses Moduls muss mindestens eine Veranstaltung aus der Informatik belegt werden. Neben diesen Modulen, die relativ flexibel Spezi",
            "linguistik\n**Englischer Titel:** Basis module - statistical methods in computational linguistics<br>\n**Modul-Nummer:** 2400<br>\n**ECTS-Leistungspunkte:** 6 ECTS-Leistungspunkte<br>\n**Workload:** 180 Stunden<br>\n**Dauer:** 2 Semester<br>\n**Lehrveranstaltungen und Lehrformen:** a: Wahrscheinlichkeitst",
            "staltungen und bestandene Modulpr\u00fcfung.<br>\n**Sonstige Informationen:** -keine-\n\n### Modul: Aufbaumodul - Mathematische Linguistik\n**Englischer Titel:** Advanced module - mathematical linguistics<br>\n**Modul-Nummer:** 4200<br>\n**ECTS-Leistungspunkte:** 6 ECTS-Leistungspunkte<br>\n**Workload:** 180 St"
        ]
    },
    {
        "user_input": "Wie stark z\u00e4hlt die Bachelorarbeit f\u00fcr meine Abschlussnote?",
        "reference": "Die Note der Bachelorarbeit wird bei der Ermittlung der Gesamtnote dreifach gewichtet. Im Vergleich dazu gehen alle anderen Modulpr\u00fcfungen nur einfach in die Gesamtnote ein.",
        "response": "Die Bachelorarbeit z\u00e4hlt f\u00fcr 1 SL (Studienleistungspunkt) und 15 LP (Leistungspunkte) in der Modulpr\u00fcfung.",
        "retrieved_contexts": [
            " Zulassung zur Pr\u00fcfung:** -keine-<br>\n**Voraussetzungen f\u00fcr die Vergabe von ECTS-Leistungspunkten:** Aktive und erfolgreiche Mitwirkung im Forschungsseminar, bestandene Bachelorarbeit.<br>\n**Sonstige Informationen:** -keine-",
            " 5301 | 5 LP | 4 SWS |\n| Modulpr\u00fcfung | Pnr. 5310 | | 4 LP | |\n| **Abschlussarbeit und Forschungskolloquium** | | **1 SL** | **15 LP** | **4 SWS** |\n| Forschungskolloquium oder Seminar | | Pnr. 5901 | 3 LP | 2 SWS |\n| Bachelorarbeit | Pnr. 6000 | | 12 LP | |\n| **Profilbildungsbereich** | | | **6 LP*",
            "beratung und -begleitung an. \u00dcber das Praktikum ist ein kurzer Bericht (ca. 3-5 Seiten) zu verfassen und ein Zeugnis der Praktikumsstelle einzureichen. |\n\n---\n\n## Exemplarischer Studienverlaufsplan Bachelor Computerlinguistik\n\nBei dieser Darstellung handelt es sich um einen exemplarischen Studienver",
            "brachte Studienleistungen (SL) in den Lehrveranstaltungen (a) und (b): 4 ECTS-Leistungspunkte | Erbrachte Studienleistungen (SL) in den Lehrveranstaltungen (c) und (d): 4 ECTS-Leistungspunkte | Bestandene Modulpr\u00fcfung: 4 ECTS-Leistungspunkte<br>\n**Sonstige Informationen:** -keine-\n\n### Modul: Basisw",
            "ine-<br>\n**Voraussetzungen f\u00fcr die Vergabe von ECTS-Leistungspunkten:** Erbrachte Studienleistungen (SL) in den Lehrveranstaltungen (b) und (c) | Bestandene Modulpr\u00fcfung: 4 ECTS-Leistungspunkte<br>\n**Sonstige Informationen:** -keine-\n\n### Modul: Praktikum & Orientierung\n**Englischer Titel:** Interns",
            "en:** Erbrachte Studienleistungen (SL) in den Lehrveranstaltungen (a) und (b): 4 ECTS-Leistungspunkte | Erbrachte Studienleistungen (SL) in den Lehrveranstaltungen (c) und (d): 4 ECTS-Leistungspunkte | Bestandene Modulpr\u00fcfung: 4 ECTS-Leistungspunkte<br>\n**Sonstige Informationen:** -keine-\n\n### Modul"
        ]
    },
    {
        "user_input": "Muss ich alle Module bestanden haben, bevor ich meine Bachelorarbeit schreibe?",
        "reference": "Nein, du musst nicht zwingend das gesamte Studium vorher abgeschlossen haben. Die einzige formale Teilnahmevoraussetzung f\u00fcr das Modul \"Abschlussarbeit und Forschungskolloquium\" ist der erfolgreiche Abschluss aller Basis- und Aufbaumodule.",
        "response": "Nein, es ist nicht erforderlich, alle Module bestanden zu haben, bevor die Bachelorarbeit geschrieben werden kann.",
        "retrieved_contexts": [
            ". 4110) oder Studienarbeit (mit Programmierprojekt) (Pnr. 4120)<br>\n**Voraussetzungen f\u00fcr die Zulassung zur Modulpr\u00fcfung:** -keine-<br>\n**Voraussetzungen f\u00fcr die Vergabe von ECTS-Leistungspunkten:** Erbrachte Studienleistungen (SL) in allen Lehrveranstaltungen und bestandene Modulpr\u00fcfung.<br>\n**Sons",
            " 5320) oder Hausarbeit (Pnr. 5330) oder Studienarbeit (Pnr. 5340) oder Projektarbeit (Pnr. 5350)<br>\n**Voraussetzungen f\u00fcr die Zulassung zur Modulpr\u00fcfung:** -keine-<br>\n**Voraussetzungen f\u00fcr die Vergabe von ECTS-Leistungspunkten:** Aktive und erfolgreiche Mitwirkung im Forschungsseminar, bestandene ",
            "\u00fcr die Zulassung zur Modulpr\u00fcfung:** -keine-<br>\n**Voraussetzungen f\u00fcr die Vergabe von ECTS-Leistungspunkten:** Erbrachte Studienleistungen (SL) in den Lehrveranstaltungen (a) und (b).<br>\n**Sonstige Informationen:** -keine-\n\n### Modul: Aufbaumodul - Objektorientierte Programmierung\n**Englischer Tit",
            "gsformen:** -keine-<br>\n**Voraussetzungen f\u00fcr die Zulassung zur Modulpr\u00fcfung:** -keine-<br>\n**Voraussetzungen f\u00fcr die Vergabe von ECTS-Leistungspunkten:** Erbrachte Studienleistungen (SL) in allen Lehrveranstaltungen<br>\n**Sonstige Informationen:** -keine-\n\n### Modul: Aufbaumodul - Logische Programm",
            "*Teilnahmevoraussetzungen:** Formal: Keine | Inhaltlich: Keine<br>\n**Pr\u00fcfungsformen:** Projektarbeit (Pnr. 2310)<br>\n**Voraussetzungen f\u00fcr die Zulassung zur Modulpr\u00fcfung:** -keine-<br>\n**Voraussetzungen f\u00fcr die Vergabe von ECTS-Leistungspunkten:** Erbrachte Studienleistungen (SL) in den Lehrveransta",
            "ch** | keine Angabe |\n| **Anzahl der Modulpr\u00fcfungen** | 9, zuz\u00fcglich Bachelorarbeit |\n| **Art und Inhalt der Module und der Pr\u00fcfungen** | **Module:**<br>- Basismodul - Mathematische und logische Grundlagen (8 SWS, 1 MP, 12 LP)<br>- Basismodul - Grundlagen der Computerlinguistik und formale Grammatik"
        ]
    },
    {
        "user_input": "Gibt es eine Klausur in Wahrscheinlichkeitstheorie?",
        "reference": "Nein, im \"Basismodul - Statistische Methoden in der Computerlinguistik\", zu dem die Wahrscheinlichkeitstheorie geh\u00f6rt, gibt es gar keine Modulpr\u00fcfung und somit auch keine Klausur. Es m\u00fcssen lediglich Studienleistungen erbracht werden.",
        "response": "Nein, es gibt keine Klausur in Wahrscheinlichkeitstheorie.",
        "retrieved_contexts": [
            "ng (Klausur) | Pnr. 1410 | | 3 LP | |\n| **Basismodul - Statistische Methoden in der Computerlinguistik [1/2]** | **0 MP** | **1 SL** | **4 LP** | **4 SWS** |\n| Wahrscheinlichkeitstheorie und Statistik (Seminar und \u00dcbung) | | Pnr. 2401 | 4 LP | 4 SWS |\n| **Profilbildungsbereich** | | | **1 LP** | |\n\n",
            "altungen und Lehrformen:** a: Wahrscheinlichkeitstheorie und Statistik (Seminar und \u00dcbung) / 2401 | b: Linguistische Ressourcen (Seminar) / 2402<br>\n**Belegung:** Seminar mit \u00dcbung (a) und Seminar (b)<br>\n**Empfohlenes Studiensemester:** a: 2. Fachsemester (Sommersemester) | b: 3. Fachsemester (Wint",
            "*Inhalte:** Dieses Modul vermittelt grundlegende Kenntnisse in Wahrscheinlichkeitstheorie und in statistischen Methoden der Computerlinguistik, sowie deren Anwendung mittels Korpora und Datens\u00e4tzen. Unter anderem werden folgende Bereiche abgedeckt: Statistik und statistische Programmierung in einer ",
            "tatistik und statistische Programmierung in einer geeigneten Programmiersprache (z.B. R); Aufbau und Pflege linguistischer Ressourcen (Korpora, Datenbanken, ...).<br>\n**Angestrebte Lernergebnisse und Studieninhalte:** Kenntnisse der Grundlagen der Wahrscheinlichkeitstheorie und Grundbegriffe der Sta",
            "hrscheinlichkeitstheorie und Grundbegriffe der Statistik. F\u00e4higkeit, statistische Analysen selbst zu konzipieren und implementieren. F\u00e4higkeit, Korpora zu erstellen und f\u00fcr Experimente und Analysen durchzuf\u00fchren.<br>\n**Teilnahmevoraussetzungen:** Formal: keine | Inhaltlich: Basismodul Mathematische ",
            "|\n| Modulpr\u00fcfung (Klausur) | Pnr. 2310 | | 4 LP | |\n| **Basiswissen Linguistik - Semantik und Pragmatik** | **1 MP** | **2 SL** | **9 LP** | **6 SWS** |\n| Vorlesung | | Pnr. 1401 | 4 LP | 4 SWS |\n| Tutorium | | Pnr. 1402 | 2 LP | 2 SWS |\n| Modulpr\u00fcfung (Klausur) | Pnr. 1410 | | 3 LP | |\n| **Basismod"
        ]
    }
]