[
    {
        "user_input": "Welche Kurse sollte ich im ersten Semester belegen?",
        "reference": "Laut dem exemplarischen Studienverlaufsplan solltest du im ersten Semester folgende Kurse belegen: Mathematische Grundlagen, Einf\u00fchrung in die computationelle Logik, Einf\u00fchrung in die Computerlinguistik, Einf\u00fchrung in die Programmierung mit Python, Morphologie und Syntax.",
        "response": "Source 1:\nminar) / 2102<br>\n**Belegung:** Seminar und \u00dcbung (a) und Seminar (b)<br>\n**Empfohlenes Studiensemester:** a: 1. Fachsemester (Wintersemester) | b: 1. Fachsemester (Wintersemester) | Pr\u00fcfung im 1. Fac\nSource 2:\nung) / 2304<br>\n**Belegung:** Seminar (a) mit \u00dcbung (b) und Seminar (c) mit \u00dcbung (d)<br>\n**Empfohlenes Studiensemester:** a: 1. Fachsemester (Wintersemester) | b: 1. Fachsemester (Wintersemester) | c\nSource 3:\nr (a) mit \u00dcbung (b) und Seminar (c) mit \u00dcbung (d)<br>\n**Empfohlenes Studiensemester:** a: 1. Fachsemester (Wintersemester) | b: 1. Fachsemester (Wintersemester) | c: 2. Fachsemester (Sommersemester) |\nSource 4:\ng:** Vorlesung (a) und Tutorium (b)<br>\n**Empfohlenes Studiensemester:** a: 1. Fachsemester (Wintersemester) | b: 1. Fachsemester (Wintersemester) | Pr\u00fcfung im 1. Fachsemester (Wintersemester)<br>\n**H\nSource 5:\n 1 Semester<br>\n**Lehrveranstaltungen und Lehrformen:** a: Parsing (Seminar) / 4301 | b: \u00dcbung zu Parsing (\u00dcbung) / 4302<br>\n**Belegung:** Seminar (a) und \u00dcbung (b)<br>\n**Empfohlenes Studiensemester:*\nSource 6:\n>\n**Belegung:** Seminar (a)<br>\n**Empfohlenes Studiensemester:** a: 4. Fachsemester (Sommersemester) | b: 5. Fachsemester (Wintersemester)<br>\n**H\u00e4ufigkeit des Angebots:** a: Jedes Sommersemester | b:\nSource 7:\n<br>\n**Empfohlenes Studiensemester:** a: 2. Fachsemester (Sommersemester) | b: 3. Fachsemester (Wintersemester)<br>\n**H\u00e4ufigkeit des Angebots:** a: Jedes Wintersemester | b: Jedes Sommersemester<br>\n*",
        "retrieved_contexts": [
            "minar) / 2102<br>\n**Belegung:** Seminar und \u00dcbung (a) und Seminar (b)<br>\n**Empfohlenes Studiensemester:** a: 1. Fachsemester (Wintersemester) | b: 1. Fachsemester (Wintersemester) | Pr\u00fcfung im 1. Fac",
            "ung) / 2304<br>\n**Belegung:** Seminar (a) mit \u00dcbung (b) und Seminar (c) mit \u00dcbung (d)<br>\n**Empfohlenes Studiensemester:** a: 1. Fachsemester (Wintersemester) | b: 1. Fachsemester (Wintersemester) | c",
            "r (a) mit \u00dcbung (b) und Seminar (c) mit \u00dcbung (d)<br>\n**Empfohlenes Studiensemester:** a: 1. Fachsemester (Wintersemester) | b: 1. Fachsemester (Wintersemester) | c: 2. Fachsemester (Sommersemester) |",
            "g:** Vorlesung (a) und Tutorium (b)<br>\n**Empfohlenes Studiensemester:** a: 1. Fachsemester (Wintersemester) | b: 1. Fachsemester (Wintersemester) | Pr\u00fcfung im 1. Fachsemester (Wintersemester)<br>\n**H",
            " 1 Semester<br>\n**Lehrveranstaltungen und Lehrformen:** a: Parsing (Seminar) / 4301 | b: \u00dcbung zu Parsing (\u00dcbung) / 4302<br>\n**Belegung:** Seminar (a) und \u00dcbung (b)<br>\n**Empfohlenes Studiensemester:*",
            ">\n**Belegung:** Seminar (a)<br>\n**Empfohlenes Studiensemester:** a: 4. Fachsemester (Sommersemester) | b: 5. Fachsemester (Wintersemester)<br>\n**H\u00e4ufigkeit des Angebots:** a: Jedes Sommersemester | b:",
            "<br>\n**Empfohlenes Studiensemester:** a: 2. Fachsemester (Sommersemester) | b: 3. Fachsemester (Wintersemester)<br>\n**H\u00e4ufigkeit des Angebots:** a: Jedes Wintersemester | b: Jedes Sommersemester<br>\n*"
        ]
    },
    {
        "user_input": "Kann ich auch im Sommersemester anfangen?",
        "reference": "Nein, das Studium ist f\u00fcr einen Beginn im Wintersemester ausgelegt.",
        "response": "Source 1:\n>\n**Belegung:** Seminar (a)<br>\n**Empfohlenes Studiensemester:** a: 4. Fachsemester (Sommersemester) | b: 5. Fachsemester (Wintersemester)<br>\n**H\u00e4ufigkeit des Angebots:** a: Jedes Sommersemester | b:\nSource 2:\n mit \u00dcbung (b)<br>\n**Empfohlenes Studiensemester:** a: 4. Fachsemester (Sommersemester) | b: 4. Fachsemester (Sommersemester)<br>\n**H\u00e4ufigkeit des Angebots:** a: Jedes Sommersemester | b: Jedes Sommer\nSource 3:\n<br>\n**Empfohlenes Studiensemester:** a: 2. Fachsemester (Sommersemester) | b: 3. Fachsemester (Wintersemester)<br>\n**H\u00e4ufigkeit des Angebots:** a: Jedes Wintersemester | b: Jedes Sommersemester<br>\n*\nSource 4:\n und \u00dcbung (b)<br>\n**Empfohlenes Studiensemester:** a: 4. Fachsemester (Sommersemester) | b: 4. Fachsemester (Sommersemester)<br>\n**H\u00e4ufigkeit des Angebots:** a: Jedes Sommersemester | b: Jedes Sommer\nSource 5:\n* a: 2. Fachsemester (Sommersemester) | b: 2. Fachsemester (Sommersemester) | Pr\u00fcfung im 2. Fachsemester (Sommersemester)<br>\n**H\u00e4ufigkeit des Angebots:** a: Jedes Sommersemester | b: Jedes Sommerseme\nSource 6:\nrsemester) | c: 2. Fachsemester (Sommersemester) | d: 2. Fachsemester (Sommersemester) | Pr\u00fcfung im 2. Fachsemester (Sommersemester)<br>\n**H\u00e4ufigkeit des Angebots:** a: Jedes Wintersemester | b: Jedes\nSource 7:\nn<br>\n**Empfohlenes Studiensemester:** 4. Fachsemester (Sommersemester) | 5. Fachsemester (Wintersemester)<br>\n**H\u00e4ufigkeit des Angebots:** Jedes Semester<br>\n**Geplante Gruppengr\u00f6\u00dfe:** Nach Vorgabe d",
        "retrieved_contexts": [
            ">\n**Belegung:** Seminar (a)<br>\n**Empfohlenes Studiensemester:** a: 4. Fachsemester (Sommersemester) | b: 5. Fachsemester (Wintersemester)<br>\n**H\u00e4ufigkeit des Angebots:** a: Jedes Sommersemester | b:",
            " mit \u00dcbung (b)<br>\n**Empfohlenes Studiensemester:** a: 4. Fachsemester (Sommersemester) | b: 4. Fachsemester (Sommersemester)<br>\n**H\u00e4ufigkeit des Angebots:** a: Jedes Sommersemester | b: Jedes Sommer",
            "<br>\n**Empfohlenes Studiensemester:** a: 2. Fachsemester (Sommersemester) | b: 3. Fachsemester (Wintersemester)<br>\n**H\u00e4ufigkeit des Angebots:** a: Jedes Wintersemester | b: Jedes Sommersemester<br>\n*",
            " und \u00dcbung (b)<br>\n**Empfohlenes Studiensemester:** a: 4. Fachsemester (Sommersemester) | b: 4. Fachsemester (Sommersemester)<br>\n**H\u00e4ufigkeit des Angebots:** a: Jedes Sommersemester | b: Jedes Sommer",
            "* a: 2. Fachsemester (Sommersemester) | b: 2. Fachsemester (Sommersemester) | Pr\u00fcfung im 2. Fachsemester (Sommersemester)<br>\n**H\u00e4ufigkeit des Angebots:** a: Jedes Sommersemester | b: Jedes Sommerseme",
            "rsemester) | c: 2. Fachsemester (Sommersemester) | d: 2. Fachsemester (Sommersemester) | Pr\u00fcfung im 2. Fachsemester (Sommersemester)<br>\n**H\u00e4ufigkeit des Angebots:** a: Jedes Wintersemester | b: Jedes",
            "n<br>\n**Empfohlenes Studiensemester:** 4. Fachsemester (Sommersemester) | 5. Fachsemester (Wintersemester)<br>\n**H\u00e4ufigkeit des Angebots:** Jedes Semester<br>\n**Geplante Gruppengr\u00f6\u00dfe:** Nach Vorgabe d"
        ]
    },
    {
        "user_input": "Muss ich flie\u00dfend Englisch sprechen k\u00f6nnen um Computerlinguistik zu studieren?",
        "reference": "Flie\u00dfendes Englisch wird nicht vorausgesetzt, jedoch ben\u00f6tigst du Englischkenntnisse auf dem Niveau B1. Dies entspricht vergleichsweise einem erfolgreichen vierj\u00e4hrigen Schulunterricht an einer weiterf\u00fchrenden Schule.",
        "response": "Source 1:\nierter Studiengang** | Computerlinguistik |\n| **Studienbeginn** | Nur im Wintersemester |\n| **Studienumfang** | 180 ECTS-Leistungspunkte (LP) |\n| **Notwendige Vorkenntnisse** | Kenntnisse des Englisch\nSource 2:\nbeit der Computerlinguistik kennen, und lernen weiterhin selbst\u00e4ndig wissenschaftlich zu arbeiten.<br>\n**Teilnahmevoraussetzungen:** Formal: Alle Basis- und Aufbaumodule<br>\n**Pr\u00fcfungsformen:** Bachel\nSource 3:\nerden, muss aber im Bereich Computerlinguistik liegen.<br>\n**Angestrebte Lernergebnisse und Studieninhalte:** Studierende lernen aktuelle Forschungsarbeit der Computerlinguistik kennen, und lernen wei\nSource 4:\n der formalen Linguistik und Computerlinguistik zu verstehen.<br>\n**Teilnahmevoraussetzungen:** Formal: Keine | Inhaltlich: Keine<br>\n**Pr\u00fcfungsformen:** Portfolio (Pnr. 2110)<br>\n**Voraussetzungen f\u00fc\nSource 5:\nnstaltungen aus der Computerlinguistik auch Veranstaltungen aus Linguistik und Informatik zu belegen, die nicht notwendig dezidiert computerlinguistisch sind. Im Rahmen dieses Moduls muss mindestens e\nSource 6:\n# Modul: Vertiefungsmodul - Computerlinguistik 2\n**Englischer Titel:** Specialization module computational linguistics 2<br>\n**Modul-Nummer:** 5300<br>\n**ECTS-Leistungspunkte:** 9 ECTS-Leistungspunkte\nSource 7:\neninhalte:** Studierende lernen vertiefte Kenntnisse in Spezialgebieten der Computerlinguistik.<br>\n**Teilnahmevoraussetzungen:** Formal: Basismodul - Mathematische und logische Grundlagen, Basismodul",
        "retrieved_contexts": [
            "ierter Studiengang** | Computerlinguistik |\n| **Studienbeginn** | Nur im Wintersemester |\n| **Studienumfang** | 180 ECTS-Leistungspunkte (LP) |\n| **Notwendige Vorkenntnisse** | Kenntnisse des Englisch",
            "beit der Computerlinguistik kennen, und lernen weiterhin selbst\u00e4ndig wissenschaftlich zu arbeiten.<br>\n**Teilnahmevoraussetzungen:** Formal: Alle Basis- und Aufbaumodule<br>\n**Pr\u00fcfungsformen:** Bachel",
            "erden, muss aber im Bereich Computerlinguistik liegen.<br>\n**Angestrebte Lernergebnisse und Studieninhalte:** Studierende lernen aktuelle Forschungsarbeit der Computerlinguistik kennen, und lernen wei",
            " der formalen Linguistik und Computerlinguistik zu verstehen.<br>\n**Teilnahmevoraussetzungen:** Formal: Keine | Inhaltlich: Keine<br>\n**Pr\u00fcfungsformen:** Portfolio (Pnr. 2110)<br>\n**Voraussetzungen f\u00fc",
            "nstaltungen aus der Computerlinguistik auch Veranstaltungen aus Linguistik und Informatik zu belegen, die nicht notwendig dezidiert computerlinguistisch sind. Im Rahmen dieses Moduls muss mindestens e",
            "# Modul: Vertiefungsmodul - Computerlinguistik 2\n**Englischer Titel:** Specialization module computational linguistics 2<br>\n**Modul-Nummer:** 5300<br>\n**ECTS-Leistungspunkte:** 9 ECTS-Leistungspunkte",
            "eninhalte:** Studierende lernen vertiefte Kenntnisse in Spezialgebieten der Computerlinguistik.<br>\n**Teilnahmevoraussetzungen:** Formal: Basismodul - Mathematische und logische Grundlagen, Basismodul"
        ]
    },
    {
        "user_input": "Muss ich f\u00fcr den Python-Kurs Vorkenntnisse haben?",
        "reference": "Nein, f\u00fcr das Modul \"Python-Programmierung\" werden weder formale noch inhaltliche Vorkenntnisse vorausgesetzt.",
        "response": "Source 1:\nktionale Programmierung). Au\u00dferdem werden Grundkenntnisse des Einsatzes von Python in den Bereichen Data Science und NLP (Natural Language Processing) erworben, sowie die F\u00e4higkeit ein kleines Softwar\nSource 2:\ndlagen, Basismodul - Python-Programmierung<br>\n**Pr\u00fcfungsformen:** Klausur (Pnr. 4510)<br>\n**Voraussetzungen f\u00fcr die Zulassung zur Modulpr\u00fcfung:** -keine-<br>\n**Voraussetzungen f\u00fcr die Vergabe von ECT\nSource 3:\nungen und Lehrformen:** a: Einf\u00fchrung in die Programmierung mit Python (Seminar) / 2301 | b: Einf\u00fchrung in die Programmierung mit Python (\u00dcbung) / 2302 | c: Fortgeschrittene Python-Programmierung mit \nSource 4:\n Programmierung mit der Programmiersprache Python sowie Kenntnisse \u00fcber fortgeschrittene Konzepte der Python-Programmierung (objektorientierte und funktionale Programmierung). Au\u00dferdem werden Grundken\nSource 5:\nstik und auf soliden Kenntnissen der Programmiersprache Python (siehe Phase 1). Parallel dazu gewinnen die Studierenden Einblick in linguistische Ressourcen. Daneben werden in dieser Phase weitere Par\nSource 6:\n Grundz\u00fcge der Sorftware-Entwicklung.<br>\n**Angestrebte Lernergebnisse und Studieninhalte:** Die Studierenden erwerben grundlegende F\u00e4higkeiten in der Programmierung mit der Programmiersprache Python \nSource 7:\nP | |\n| **Basismodul - Python-Programmierung [2/2]** | **1 MP** | **2 SL** | **8 LP** | **4 SWS** |\n| Fortgeschrittene Python-Programmierung mit NLP-Anwendungen (Seminar) | | Pnr. 2303 | 2 LP | 2 SWS ",
        "retrieved_contexts": [
            "ktionale Programmierung). Au\u00dferdem werden Grundkenntnisse des Einsatzes von Python in den Bereichen Data Science und NLP (Natural Language Processing) erworben, sowie die F\u00e4higkeit ein kleines Softwar",
            "dlagen, Basismodul - Python-Programmierung<br>\n**Pr\u00fcfungsformen:** Klausur (Pnr. 4510)<br>\n**Voraussetzungen f\u00fcr die Zulassung zur Modulpr\u00fcfung:** -keine-<br>\n**Voraussetzungen f\u00fcr die Vergabe von ECT",
            "ungen und Lehrformen:** a: Einf\u00fchrung in die Programmierung mit Python (Seminar) / 2301 | b: Einf\u00fchrung in die Programmierung mit Python (\u00dcbung) / 2302 | c: Fortgeschrittene Python-Programmierung mit ",
            " Programmierung mit der Programmiersprache Python sowie Kenntnisse \u00fcber fortgeschrittene Konzepte der Python-Programmierung (objektorientierte und funktionale Programmierung). Au\u00dferdem werden Grundken",
            "stik und auf soliden Kenntnissen der Programmiersprache Python (siehe Phase 1). Parallel dazu gewinnen die Studierenden Einblick in linguistische Ressourcen. Daneben werden in dieser Phase weitere Par",
            " Grundz\u00fcge der Sorftware-Entwicklung.<br>\n**Angestrebte Lernergebnisse und Studieninhalte:** Die Studierenden erwerben grundlegende F\u00e4higkeiten in der Programmierung mit der Programmiersprache Python ",
            "P | |\n| **Basismodul - Python-Programmierung [2/2]** | **1 MP** | **2 SL** | **8 LP** | **4 SWS** |\n| Fortgeschrittene Python-Programmierung mit NLP-Anwendungen (Seminar) | | Pnr. 2303 | 2 LP | 2 SWS "
        ]
    },
    {
        "user_input": "Gibt es eine \u00dcbung f\u00fcr Mathematische Grundlagen?",
        "reference": "Nein, f\u00fcr den Kurs \"Mathematische Grundlagen\" gibt es keine begleitende \u00dcbung. Es handelt sich dabei ausschlie\u00dflich um ein Seminar.",
        "response": "Source 1:\nannt werden k\u00f6nnen.\n\n## Module\n\n### Modul: Basismodul - Mathematische und logische Grundlagen\n**Englischer Titel:** Basis module - mathematical and logical foundations<br>\n**Modul-Nummer:** 2100<br>\n*\nSource 2:\n Mathematische und logische Grundlagen, Basismodul - Grundlagen der Computerlinguistik und formale Grammatikbeschreibung, Aufbaumodul - Maschinelles Lernen | Inhaltlich: Je nach Thema<br>\n**Pr\u00fcfungsfo\nSource 3:\nhalt der Module und der Pr\u00fcfungen** | **Module:**<br>- Basismodul - Mathematische und logische Grundlagen (8 SWS, 1 MP, 12 LP)<br>- Basismodul - Grundlagen der Computerlinguistik und formale Grammatik\nSource 4:\nl - Mathematische und logische Grundlagen** | **1 MP** | **2 SL** | **12 LP** | **8 SWS** |\n| Einf\u00fchrung in die computationelle Logik (Seminar mit \u00dcbung) | | Pnr. 2101 | 4 LP | 4 SWS |\n| Mathematische\nSource 5:\naussetzungen:** Formal: keine | Inhaltlich: Basismodul - Mathematische und logische Grundlagen<br>\n**Pr\u00fcfungsformen:** -keine-<br>\n**Voraussetzungen f\u00fcr die Zulassung zur Modulpr\u00fcfung:** -keine-<br>\n*\nSource 6:\nul - Mathematische und logische Grundlagen, Basismodul - Grundlagen der Computerlinguistik und formale Grammatikbeschreibung<br>\n**Pr\u00fcfungsformen:** -keine-<br>\n**Voraussetzungen f\u00fcr die Zulassung zur\nSource 7:\na zu erstellen und f\u00fcr Experimente und Analysen durchzuf\u00fchren.<br>\n**Teilnahmevoraussetzungen:** Formal: keine | Inhaltlich: Basismodul Mathematische und logische Grundlagen<br>\n**Pr\u00fcfungsformen:** -k",
        "retrieved_contexts": [
            "annt werden k\u00f6nnen.\n\n## Module\n\n### Modul: Basismodul - Mathematische und logische Grundlagen\n**Englischer Titel:** Basis module - mathematical and logical foundations<br>\n**Modul-Nummer:** 2100<br>\n*",
            " Mathematische und logische Grundlagen, Basismodul - Grundlagen der Computerlinguistik und formale Grammatikbeschreibung, Aufbaumodul - Maschinelles Lernen | Inhaltlich: Je nach Thema<br>\n**Pr\u00fcfungsfo",
            "halt der Module und der Pr\u00fcfungen** | **Module:**<br>- Basismodul - Mathematische und logische Grundlagen (8 SWS, 1 MP, 12 LP)<br>- Basismodul - Grundlagen der Computerlinguistik und formale Grammatik",
            "l - Mathematische und logische Grundlagen** | **1 MP** | **2 SL** | **12 LP** | **8 SWS** |\n| Einf\u00fchrung in die computationelle Logik (Seminar mit \u00dcbung) | | Pnr. 2101 | 4 LP | 4 SWS |\n| Mathematische",
            "aussetzungen:** Formal: keine | Inhaltlich: Basismodul - Mathematische und logische Grundlagen<br>\n**Pr\u00fcfungsformen:** -keine-<br>\n**Voraussetzungen f\u00fcr die Zulassung zur Modulpr\u00fcfung:** -keine-<br>\n*",
            "ul - Mathematische und logische Grundlagen, Basismodul - Grundlagen der Computerlinguistik und formale Grammatikbeschreibung<br>\n**Pr\u00fcfungsformen:** -keine-<br>\n**Voraussetzungen f\u00fcr die Zulassung zur",
            "a zu erstellen und f\u00fcr Experimente und Analysen durchzuf\u00fchren.<br>\n**Teilnahmevoraussetzungen:** Formal: keine | Inhaltlich: Basismodul Mathematische und logische Grundlagen<br>\n**Pr\u00fcfungsformen:** -k"
        ]
    },
    {
        "user_input": "Wie oft darf ich eine Pr\u00fcfung nicht bestehen?",
        "reference": "Aus den Dokumenten geht keine explizite Gesamtzahl der erlaubten Fehlversuche hervor. Es ist jedoch vermerkt, dass die zweite Wiederholung einer Modulpr\u00fcfung als m\u00fcndliche Pr\u00fcfung erfolgen darf. Das bedeutet, dass du eine Pr\u00fcfung mindestens zweimal wiederholen darfst.",
        "response": "Source 1:\nesonderheiten** | Die zweite Wiederholung einer Modulpr\u00fcfung darf als m\u00fcndliche Pr\u00fcfung erfolgen. |\n| **Gewichtung der Pr\u00fcfungen f\u00fcr die Gesamtnote** | Bachelorarbeit: dreifach<br>Alle Modulpr\u00fcfungen:\nSource 2:\n Fachsemester (Wintersemester) | Pr\u00fcfung im 1. Fachsemester (Wintersemester)<br>\n**H\u00e4ufigkeit des Angebots:** a: Jedes Wintersemester | b: Jedes Wintersemester<br>\n**Geplante Gruppengr\u00f6\u00dfe:** a: Ca. 60\nSource 3:\nter (Sommersemester) | Pr\u00fcfung im 6. Fachsemester (Sommersemester)<br>\n**H\u00e4ufigkeit des Angebots:** a: Jedes Sommersemester<br>\n**Geplante Gruppengr\u00f6\u00dfe:** a: Ca. 30 Studierende<br>\n**Kontaktzeit:** a:\nSource 4:\n* a: 2. Fachsemester (Sommersemester) | b: 2. Fachsemester (Sommersemester) | Pr\u00fcfung im 2. Fachsemester (Sommersemester)<br>\n**H\u00e4ufigkeit des Angebots:** a: Jedes Sommersemester | b: Jedes Sommerseme\nSource 5:\n Keine | Inhaltlich: Keine<br>\n**Pr\u00fcfungsformen:** Klausur (Pnr. 2210)<br>\n**Voraussetzungen f\u00fcr die Zulassung zur Modulpr\u00fcfung:** -keine-<br>\n**Voraussetzungen f\u00fcr die Vergabe von ECTS-Leistungspunkt\nSource 6:\nbschlussarbeit und Forschungskolloquium (2 SWS, 15 LP)<br>- Profilbildungsbereich (18 LP) |\n| **Voraussetzungen f\u00fcr Pr\u00fcfungen** | keine Angabe |\n| **Besonderheiten** | Die zweite Wiederholung einer Mo\nSource 7:\nb)<br>\n**Empfohlenes Studiensemester:** a: 3. Fachsemester (Wintersemester) | b: 4. Fachsemester (Sommersemester) | Pr\u00fcfung im 4. Fachsemester (Sommersemester)<br>\n**H\u00e4ufigkeit des Angebots:** a: Jede",
        "retrieved_contexts": [
            "esonderheiten** | Die zweite Wiederholung einer Modulpr\u00fcfung darf als m\u00fcndliche Pr\u00fcfung erfolgen. |\n| **Gewichtung der Pr\u00fcfungen f\u00fcr die Gesamtnote** | Bachelorarbeit: dreifach<br>Alle Modulpr\u00fcfungen:",
            " Fachsemester (Wintersemester) | Pr\u00fcfung im 1. Fachsemester (Wintersemester)<br>\n**H\u00e4ufigkeit des Angebots:** a: Jedes Wintersemester | b: Jedes Wintersemester<br>\n**Geplante Gruppengr\u00f6\u00dfe:** a: Ca. 60",
            "ter (Sommersemester) | Pr\u00fcfung im 6. Fachsemester (Sommersemester)<br>\n**H\u00e4ufigkeit des Angebots:** a: Jedes Sommersemester<br>\n**Geplante Gruppengr\u00f6\u00dfe:** a: Ca. 30 Studierende<br>\n**Kontaktzeit:** a:",
            "* a: 2. Fachsemester (Sommersemester) | b: 2. Fachsemester (Sommersemester) | Pr\u00fcfung im 2. Fachsemester (Sommersemester)<br>\n**H\u00e4ufigkeit des Angebots:** a: Jedes Sommersemester | b: Jedes Sommerseme",
            " Keine | Inhaltlich: Keine<br>\n**Pr\u00fcfungsformen:** Klausur (Pnr. 2210)<br>\n**Voraussetzungen f\u00fcr die Zulassung zur Modulpr\u00fcfung:** -keine-<br>\n**Voraussetzungen f\u00fcr die Vergabe von ECTS-Leistungspunkt",
            "bschlussarbeit und Forschungskolloquium (2 SWS, 15 LP)<br>- Profilbildungsbereich (18 LP) |\n| **Voraussetzungen f\u00fcr Pr\u00fcfungen** | keine Angabe |\n| **Besonderheiten** | Die zweite Wiederholung einer Mo",
            "b)<br>\n**Empfohlenes Studiensemester:** a: 3. Fachsemester (Wintersemester) | b: 4. Fachsemester (Sommersemester) | Pr\u00fcfung im 4. Fachsemester (Sommersemester)<br>\n**H\u00e4ufigkeit des Angebots:** a: Jede"
        ]
    },
    {
        "user_input": "Muss ich in Python eine Klausur/Pr\u00fcfung absolvieren?",
        "reference": "Ja, du musst im Modul \"Python-Programmierung\" eine Pr\u00fcfung in Form einer Projektarbeit ablegen. Diese Modulpr\u00fcfung ist jedoch erst im zweiten Fachsemester (Sommersemester) vorgesehen. Im ersten Semester musst du daf\u00fcr lediglich Studienleistungen erbringen.",
        "response": "Source 1:\ndlagen, Basismodul - Python-Programmierung<br>\n**Pr\u00fcfungsformen:** Klausur (Pnr. 4510)<br>\n**Voraussetzungen f\u00fcr die Zulassung zur Modulpr\u00fcfung:** -keine-<br>\n**Voraussetzungen f\u00fcr die Vergabe von ECT\nSource 2:\nen (Seminar) | | Pnr. 2203 | 2 LP | 2 SWS |\n| Grammatikformalismen (\u00dcbung) | | Pnr. 2204 | 2 LP | 2 SWS |\n| Modulpr\u00fcfung (Klausur) | Pnr. 2210 | | 4 LP | |\n| **Basismodul - Python-Programmierung [2/2]\nSource 3:\nKlausur (Pnr. 5120) oder Hausarbeit (Pnr. 5130) oder Studienarbeit (Pnr. 5140) oder Projektarbeit (Pnr. 5150)<br>\n**Voraussetzungen f\u00fcr die Zulassung zur Modulpr\u00fcfung:** -keine<br>\n**Voraussetzungen f\nSource 4:\nnwendungen (Seminar) | | Pnr. 2303 | 2 LP | 2 SWS |\n| Fortgeschrittene Python-Programmierung mit NLP-Anwendungen (\u00dcbung) | | Pnr. 2304 | 2 LP | 2 SWS |\n| Modulpr\u00fcfung (Klausur) | Pnr. 2310 | | 4 LP | \nSource 5:\non-Programmierung<br>\n**Pr\u00fcfungsformen:** -keine-<br>\n**Voraussetzungen f\u00fcr die Zulassung zur Modulpr\u00fcfung:** -keine-<br>\n**Voraussetzungen f\u00fcr die Vergabe von ECTS-Leistungspunkten:** Erbrachte Studi\nSource 6:\nn Linguistik/Computerlinguistik/Informatik<br>\n**Teilnahmevoraussetzungen:** Formal: keine<br>\n**Pr\u00fcfungsformen:** M\u00fcndliche Pr\u00fcfung (Pnr. 5110) oder Klausur (Pnr. 5120) oder Hausarbeit (Pnr. 5130) od\nSource 7:\n* M\u00fcndliche Pr\u00fcfung (Pnr. 5310) oder Klausur (Pnr. 5320) oder Hausarbeit (Pnr. 5330) oder Studienarbeit (Pnr. 5340) oder Projektarbeit (Pnr. 5350)<br>\n**Voraussetzungen f\u00fcr die Zulassung zur Modulpr\u00fcf",
        "retrieved_contexts": [
            "dlagen, Basismodul - Python-Programmierung<br>\n**Pr\u00fcfungsformen:** Klausur (Pnr. 4510)<br>\n**Voraussetzungen f\u00fcr die Zulassung zur Modulpr\u00fcfung:** -keine-<br>\n**Voraussetzungen f\u00fcr die Vergabe von ECT",
            "en (Seminar) | | Pnr. 2203 | 2 LP | 2 SWS |\n| Grammatikformalismen (\u00dcbung) | | Pnr. 2204 | 2 LP | 2 SWS |\n| Modulpr\u00fcfung (Klausur) | Pnr. 2210 | | 4 LP | |\n| **Basismodul - Python-Programmierung [2/2]",
            "Klausur (Pnr. 5120) oder Hausarbeit (Pnr. 5130) oder Studienarbeit (Pnr. 5140) oder Projektarbeit (Pnr. 5150)<br>\n**Voraussetzungen f\u00fcr die Zulassung zur Modulpr\u00fcfung:** -keine<br>\n**Voraussetzungen f",
            "nwendungen (Seminar) | | Pnr. 2303 | 2 LP | 2 SWS |\n| Fortgeschrittene Python-Programmierung mit NLP-Anwendungen (\u00dcbung) | | Pnr. 2304 | 2 LP | 2 SWS |\n| Modulpr\u00fcfung (Klausur) | Pnr. 2310 | | 4 LP | ",
            "on-Programmierung<br>\n**Pr\u00fcfungsformen:** -keine-<br>\n**Voraussetzungen f\u00fcr die Zulassung zur Modulpr\u00fcfung:** -keine-<br>\n**Voraussetzungen f\u00fcr die Vergabe von ECTS-Leistungspunkten:** Erbrachte Studi",
            "n Linguistik/Computerlinguistik/Informatik<br>\n**Teilnahmevoraussetzungen:** Formal: keine<br>\n**Pr\u00fcfungsformen:** M\u00fcndliche Pr\u00fcfung (Pnr. 5110) oder Klausur (Pnr. 5120) oder Hausarbeit (Pnr. 5130) od",
            "* M\u00fcndliche Pr\u00fcfung (Pnr. 5310) oder Klausur (Pnr. 5320) oder Hausarbeit (Pnr. 5330) oder Studienarbeit (Pnr. 5340) oder Projektarbeit (Pnr. 5350)<br>\n**Voraussetzungen f\u00fcr die Zulassung zur Modulpr\u00fcf"
        ]
    },
    {
        "user_input": "Wann soll ich das Praktikum machen?",
        "reference": "Es wird empfohlen, das Berufsfeldpraktikum nach dem vierten oder f\u00fcnften Semester zu absolvieren.",
        "response": "Source 1:\nEinblick in die Berufspraxis vermitteln sowie den sp\u00e4teren \u00dcbergang in die Berufswelt erleichtern. Die Wahl des Praktikumsplatzes erfolgt im Einvernehmen mit dem/der Praktikumsbeauftragten der Abteilu\nSource 2:\nMobilit\u00e4tsfenster: 5. Semester) |\n| **Exkursion** | keine Angabe |\n| **Praktikum** | Nach dem vierten oder f\u00fcnften Semester wird entweder ein mindestens 6-w\u00f6chiges Berufsfeldpraktikum oder eine Projek\nSource 3:\ng) / 4502 | c: Praktische \u00dcbung zur Vorlesung (Praktische \u00dcbung) / 4503<br>\n**Belegung:** Vorlesung (a) mit \u00dcbung (b) und praktischer \u00dcbung (c)<br>\n**Empfohlenes Studiensemester:** a: 3. Fachsemester \nSource 4:\nen behilflich und bietet eine fachliche Praktikumsberatung und -begleitung an. \u00dcber das Praktikum ist ein kurzer Bericht (ca. 3-5 Seiten) zu verfassen und ein Zeugnis der Praktikumsstelle einzureichen\nSource 5:\nns 6-w\u00f6chiges Berufsfeldpraktikum oder eine Projektarbeit absolviert, jeweils mit einschl\u00e4gig computerlinguistischem Inhalt. Das Praktikum soll einen Einblick in die Berufspraxis vermitteln sowie den \nSource 6:\n mit \u00dcbung (b)<br>\n**Empfohlenes Studiensemester:** a: 4. Fachsemester (Sommersemester) | b: 4. Fachsemester (Sommersemester)<br>\n**H\u00e4ufigkeit des Angebots:** a: Jedes Sommersemester | b: Jedes Sommer\nSource 7:\n und \u00dcbung (b)<br>\n**Empfohlenes Studiensemester:** a: 4. Fachsemester (Sommersemester) | b: 4. Fachsemester (Sommersemester)<br>\n**H\u00e4ufigkeit des Angebots:** a: Jedes Sommersemester | b: Jedes Sommer",
        "retrieved_contexts": [
            "Einblick in die Berufspraxis vermitteln sowie den sp\u00e4teren \u00dcbergang in die Berufswelt erleichtern. Die Wahl des Praktikumsplatzes erfolgt im Einvernehmen mit dem/der Praktikumsbeauftragten der Abteilu",
            "Mobilit\u00e4tsfenster: 5. Semester) |\n| **Exkursion** | keine Angabe |\n| **Praktikum** | Nach dem vierten oder f\u00fcnften Semester wird entweder ein mindestens 6-w\u00f6chiges Berufsfeldpraktikum oder eine Projek",
            "g) / 4502 | c: Praktische \u00dcbung zur Vorlesung (Praktische \u00dcbung) / 4503<br>\n**Belegung:** Vorlesung (a) mit \u00dcbung (b) und praktischer \u00dcbung (c)<br>\n**Empfohlenes Studiensemester:** a: 3. Fachsemester ",
            "en behilflich und bietet eine fachliche Praktikumsberatung und -begleitung an. \u00dcber das Praktikum ist ein kurzer Bericht (ca. 3-5 Seiten) zu verfassen und ein Zeugnis der Praktikumsstelle einzureichen",
            "ns 6-w\u00f6chiges Berufsfeldpraktikum oder eine Projektarbeit absolviert, jeweils mit einschl\u00e4gig computerlinguistischem Inhalt. Das Praktikum soll einen Einblick in die Berufspraxis vermitteln sowie den ",
            " mit \u00dcbung (b)<br>\n**Empfohlenes Studiensemester:** a: 4. Fachsemester (Sommersemester) | b: 4. Fachsemester (Sommersemester)<br>\n**H\u00e4ufigkeit des Angebots:** a: Jedes Sommersemester | b: Jedes Sommer",
            " und \u00dcbung (b)<br>\n**Empfohlenes Studiensemester:** a: 4. Fachsemester (Sommersemester) | b: 4. Fachsemester (Sommersemester)<br>\n**H\u00e4ufigkeit des Angebots:** a: Jedes Sommersemester | b: Jedes Sommer"
        ]
    },
    {
        "user_input": "Wird im Studiengang KI behandelt?",
        "reference": "Ja, das Thema K\u00fcnstliche Intelligenz (KI) ist ein zentraler und fest verankerter Bestandteil des Studiengangs. Im Pflichtbereich (Deep Learning): Im Aufbaumodul \"Maschinelles Lernen\" lernen die Studierenden den Umgang mit k\u00fcnstlichen neuronalen Netzen (Deep Learning) kennen und implementieren diese zur L\u00f6sung von Aufgaben im Natural Language Processing (NLP). Als Wahlthema in der Informatik: Im \"Vertiefungsmodul - Interdisziplin\u00e4r\" kann aus dem Bereich der Informatik explizit die Veranstaltung \"\u00dcberblick K\u00fcnstliche Intelligenz\" belegt werden. Spezialisierung im 3. Studienjahr: In den Vertiefungsmodulen der Computerlinguistik werden hochaktuelle KI-Architekturen in Seminaren gelehrt, darunter ausdr\u00fccklich \"gro\u00dfe Sprachmodelle\" (Large Language Models) und \"Transformer-Architekturen\".",
        "response": "Source 1:\nauf einen anschlie\u00dfenden Masterstudiengang. z.B. im Bereich Sprachtechnologie oder K\u00fcnstliche Intelligenz oder im Bereich Linguistik vorbereitet.\n\n## Aufbau des Studiums\nGrob l\u00e4sst sich das Studium in\nSource 2:\nndividuell zu anderen Studienverl\u00e4ufen r\u00e4t. Bitte informieren Sie sich bei der Studienberatung, in welcher Reihenfolge Sie welche Pflichtmodule und Wahlpflichtmodule studieren k\u00f6nnen.\n\n**Abk\u00fcrzungen i\nSource 3:\nnellen Lernens und der k\u00fcnstlichen Intelligenz, und Programmierkenntnisse auf hohem Niveau. Dieses Wissen wird im dritten Jahr weiter ausgebaut und im Rahmen eines Praktikums und der Abschlussarbeit i\nSource 4:\nund Studieninhalte:** Studierende sollen nach Absolvierung der Lehrveranstaltungen in der Lage sein, Begriffe der Informatik und der Programmierung zu nennen und zu erl\u00e4utern; einfache Algorithmen (it\nSource 5:\nierter Studiengang** | Computerlinguistik |\n| **Studienbeginn** | Nur im Wintersemester |\n| **Studienumfang** | 180 ECTS-Leistungspunkte (LP) |\n| **Notwendige Vorkenntnisse** | Kenntnisse des Englisch\nSource 6:\nverarbeitung und Sprachtechnologie. Die Studierenden erwerben au\u00dferdem besonders in den Aufbau- und Vertiefungsmodulen die F\u00e4higkeit, relevante Informationen im Bereich der Computerlinguistik zu samme\nSource 7:\nist, wie Studierende ihr Studium strukturieren k\u00f6nnen. Es ist m\u00f6glich, dass die Studienberatung dieses Faches aufgrund von didaktischen \u00dcberlegungen individuell zu anderen Studienverl\u00e4ufen r\u00e4t. Bitte ",
        "retrieved_contexts": [
            "auf einen anschlie\u00dfenden Masterstudiengang. z.B. im Bereich Sprachtechnologie oder K\u00fcnstliche Intelligenz oder im Bereich Linguistik vorbereitet.\n\n## Aufbau des Studiums\nGrob l\u00e4sst sich das Studium in",
            "ndividuell zu anderen Studienverl\u00e4ufen r\u00e4t. Bitte informieren Sie sich bei der Studienberatung, in welcher Reihenfolge Sie welche Pflichtmodule und Wahlpflichtmodule studieren k\u00f6nnen.\n\n**Abk\u00fcrzungen i",
            "nellen Lernens und der k\u00fcnstlichen Intelligenz, und Programmierkenntnisse auf hohem Niveau. Dieses Wissen wird im dritten Jahr weiter ausgebaut und im Rahmen eines Praktikums und der Abschlussarbeit i",
            "und Studieninhalte:** Studierende sollen nach Absolvierung der Lehrveranstaltungen in der Lage sein, Begriffe der Informatik und der Programmierung zu nennen und zu erl\u00e4utern; einfache Algorithmen (it",
            "ierter Studiengang** | Computerlinguistik |\n| **Studienbeginn** | Nur im Wintersemester |\n| **Studienumfang** | 180 ECTS-Leistungspunkte (LP) |\n| **Notwendige Vorkenntnisse** | Kenntnisse des Englisch",
            "verarbeitung und Sprachtechnologie. Die Studierenden erwerben au\u00dferdem besonders in den Aufbau- und Vertiefungsmodulen die F\u00e4higkeit, relevante Informationen im Bereich der Computerlinguistik zu samme",
            "ist, wie Studierende ihr Studium strukturieren k\u00f6nnen. Es ist m\u00f6glich, dass die Studienberatung dieses Faches aufgrund von didaktischen \u00dcberlegungen individuell zu anderen Studienverl\u00e4ufen r\u00e4t. Bitte "
        ]
    },
    {
        "user_input": "Muss ich Kurse aus der Linguistik f\u00fcr das interdisziplin\u00e4re Vertiefungsmodul belegen?",
        "reference": "Nein, Linguistik-Kurse sind keine Pflicht. Das Modul sieht vor, dass du zwei Vorlesungen oder Seminare aus der Linguistik oder der Informatik w\u00e4hlst, wobei lediglich der Informatik-Anteil von 4 SWS vorgeschrieben ist.",
        "response": "Source 1:\nse Representation Theory, Fuzzy Logic usw. Daneben gibt es das interdisziplin\u00e4re Vertiefungsmodul, in dem den Studierenden erm\u00f6glicht wird, neben Veranstaltungen aus der Computerlinguistik auch Verans\nSource 2:\nch sind. Im Rahmen dieses Moduls muss mindestens eine Veranstaltung aus der Informatik belegt werden. Neben diesen Modulen, die relativ flexibel Spezialisierungen in Computerlinguistik, Linguistik und\nSource 3:\nlen Lehrveranstaltungen und bestandene Modulpr\u00fcfung.<br>\n**Sonstige Informationen:** -keine-\n\n### Modul: Basiswissen Linguistik - Semantik und Pragmatik\n**Englischer Titel:** Basic expertise in lingui\nSource 4:\nung in den Seminaren und theoretischen und praktischen \u00dcbungen.<br>\n**Sonstige Informationen:** -keine-\n\n### Modul: Vertiefungsmodul - Computerlinguistik 1\n**Englischer Titel:** Specialization module \nSource 5:\n SWS, 1 MP, 12 LP)<br>- Vertiefungsmodul - Computerlinguistik 1 (8 SWS, 12 LP)<br>- Vertiefungsmodul - Computerlinguistik 2 (4 SWS, 1 MP, 9 LP)<br>- Abschlussarbeit und Forschungskolloquium (2 SWS, 15\nSource 6:\n# Modul: Vertiefungsmodul - Computerlinguistik 2\n**Englischer Titel:** Specialization module computational linguistics 2<br>\n**Modul-Nummer:** 5300<br>\n**ECTS-Leistungspunkte:** 9 ECTS-Leistungspunkte\nSource 7:\nierter Studiengang** | Computerlinguistik |\n| **Studienbeginn** | Nur im Wintersemester |\n| **Studienumfang** | 180 ECTS-Leistungspunkte (LP) |\n| **Notwendige Vorkenntnisse** | Kenntnisse des Englisch",
        "retrieved_contexts": [
            "se Representation Theory, Fuzzy Logic usw. Daneben gibt es das interdisziplin\u00e4re Vertiefungsmodul, in dem den Studierenden erm\u00f6glicht wird, neben Veranstaltungen aus der Computerlinguistik auch Verans",
            "ch sind. Im Rahmen dieses Moduls muss mindestens eine Veranstaltung aus der Informatik belegt werden. Neben diesen Modulen, die relativ flexibel Spezialisierungen in Computerlinguistik, Linguistik und",
            "len Lehrveranstaltungen und bestandene Modulpr\u00fcfung.<br>\n**Sonstige Informationen:** -keine-\n\n### Modul: Basiswissen Linguistik - Semantik und Pragmatik\n**Englischer Titel:** Basic expertise in lingui",
            "ung in den Seminaren und theoretischen und praktischen \u00dcbungen.<br>\n**Sonstige Informationen:** -keine-\n\n### Modul: Vertiefungsmodul - Computerlinguistik 1\n**Englischer Titel:** Specialization module ",
            " SWS, 1 MP, 12 LP)<br>- Vertiefungsmodul - Computerlinguistik 1 (8 SWS, 12 LP)<br>- Vertiefungsmodul - Computerlinguistik 2 (4 SWS, 1 MP, 9 LP)<br>- Abschlussarbeit und Forschungskolloquium (2 SWS, 15",
            "# Modul: Vertiefungsmodul - Computerlinguistik 2\n**Englischer Titel:** Specialization module computational linguistics 2<br>\n**Modul-Nummer:** 5300<br>\n**ECTS-Leistungspunkte:** 9 ECTS-Leistungspunkte",
            "ierter Studiengang** | Computerlinguistik |\n| **Studienbeginn** | Nur im Wintersemester |\n| **Studienumfang** | 180 ECTS-Leistungspunkte (LP) |\n| **Notwendige Vorkenntnisse** | Kenntnisse des Englisch"
        ]
    },
    {
        "user_input": "Wie stark z\u00e4hlt die Bachelorarbeit f\u00fcr meine Abschlussnote?",
        "reference": "Die Note der Bachelorarbeit wird bei der Ermittlung der Gesamtnote dreifach gewichtet. Im Vergleich dazu gehen alle anderen Modulpr\u00fcfungen nur einfach in die Gesamtnote ein.",
        "response": "Source 1:\nungen f\u00fcr die Vergabe von ECTS-Leistungspunkten:** Aktive und erfolgreiche Mitwirkung im Forschungsseminar, bestandene Bachelorarbeit.<br>\n**Sonstige Informationen:** -keine-\nSource 2:\n 3 LP | 2 SWS |\n| Bachelorarbeit | Pnr. 6000 | | 12 LP | |\n| **Profilbildungsbereich** | | | **6 LP** | |\n\nSource 3:\n| | 4 LP | |\n| **Abschlussarbeit und Forschungskolloquium** | | **1 SL** | **15 LP** | **4 SWS** |\n| Forschungskolloquium oder Seminar | | Pnr. 5901 | 3 LP | 2 SWS |\n| Bachelorarbeit | Pnr. 6000 | | 1\nSource 4:\ns- und Aufbaumodule<br>\n**Pr\u00fcfungsformen:** Bachelorarbeit (Pnr. 6000)<br>\n**Voraussetzungen f\u00fcr die Zulassung zur Pr\u00fcfung:** -keine-<br>\n**Voraussetzungen f\u00fcr die Vergabe von ECTS-Leistungspunkten:**\nSource 5:\nreich** | | | **1 LP** | |\n\n### 6. Semester Bachelor Computerlinguistik\n*Summe: 3 Module, 1 MP, Bachelorarbeit, 2 Veranstaltungen, 8 SWS, 30 LP, davon 1 LP im PBB*\n\n| Modul / Veranstaltung | MP | SL |\nSource 6:\ner Bachelorarbeit vorgesehen. Letztere wird in der Regel im letzten Semester durchgef\u00fchrt, wobei parallel das Forschungskolloquium der Computerlinguistik besucht wird, wodurch interessante Einblicke i\nSource 7:\nrgabe von ECTS-Leistungspunkten:** Erbrachte Studienleistungen (SL) in (a) und 6-w\u00f6chiges Praktikum nachgewiesen \u00fcber Praktikumsnachweis und Praktikumsbericht.<br>\n**Sonstige Informationen:** -keine-\n",
        "retrieved_contexts": [
            "ungen f\u00fcr die Vergabe von ECTS-Leistungspunkten:** Aktive und erfolgreiche Mitwirkung im Forschungsseminar, bestandene Bachelorarbeit.<br>\n**Sonstige Informationen:** -keine-",
            " 3 LP | 2 SWS |\n| Bachelorarbeit | Pnr. 6000 | | 12 LP | |\n| **Profilbildungsbereich** | | | **6 LP** | |\n",
            "| | 4 LP | |\n| **Abschlussarbeit und Forschungskolloquium** | | **1 SL** | **15 LP** | **4 SWS** |\n| Forschungskolloquium oder Seminar | | Pnr. 5901 | 3 LP | 2 SWS |\n| Bachelorarbeit | Pnr. 6000 | | 1",
            "s- und Aufbaumodule<br>\n**Pr\u00fcfungsformen:** Bachelorarbeit (Pnr. 6000)<br>\n**Voraussetzungen f\u00fcr die Zulassung zur Pr\u00fcfung:** -keine-<br>\n**Voraussetzungen f\u00fcr die Vergabe von ECTS-Leistungspunkten:**",
            "reich** | | | **1 LP** | |\n\n### 6. Semester Bachelor Computerlinguistik\n*Summe: 3 Module, 1 MP, Bachelorarbeit, 2 Veranstaltungen, 8 SWS, 30 LP, davon 1 LP im PBB*\n\n| Modul / Veranstaltung | MP | SL |",
            "er Bachelorarbeit vorgesehen. Letztere wird in der Regel im letzten Semester durchgef\u00fchrt, wobei parallel das Forschungskolloquium der Computerlinguistik besucht wird, wodurch interessante Einblicke i",
            "rgabe von ECTS-Leistungspunkten:** Erbrachte Studienleistungen (SL) in (a) und 6-w\u00f6chiges Praktikum nachgewiesen \u00fcber Praktikumsnachweis und Praktikumsbericht.<br>\n**Sonstige Informationen:** -keine-\n"
        ]
    },
    {
        "user_input": "Muss ich alle Module bestanden haben, bevor ich meine Bachelorarbeit schreibe?",
        "reference": "Nein, du musst nicht zwingend das gesamte Studium vorher abgeschlossen haben. Die einzige formale Teilnahmevoraussetzung f\u00fcr das Modul \"Abschlussarbeit und Forschungskolloquium\" ist der erfolgreiche Abschluss aller Basis- und Aufbaumodule.",
        "response": "Source 1:\ns- und Aufbaumodule<br>\n**Pr\u00fcfungsformen:** Bachelorarbeit (Pnr. 6000)<br>\n**Voraussetzungen f\u00fcr die Zulassung zur Pr\u00fcfung:** -keine-<br>\n**Voraussetzungen f\u00fcr die Vergabe von ECTS-Leistungspunkten:**\nSource 2:\nKlausur (Pnr. 5120) oder Hausarbeit (Pnr. 5130) oder Studienarbeit (Pnr. 5140) oder Projektarbeit (Pnr. 5150)<br>\n**Voraussetzungen f\u00fcr die Zulassung zur Modulpr\u00fcfung:** -keine<br>\n**Voraussetzungen f\nSource 3:\nSchule) |\n| **Prop\u00e4deutikum im Profilbildungsbereich** | keine Angabe |\n| **Anzahl der Modulpr\u00fcfungen** | 9, zuz\u00fcglich Bachelorarbeit |\n| **Art und Inhalt der Module und der Pr\u00fcfungen** | **Module:**<\nSource 4:\n* M\u00fcndliche Pr\u00fcfung (Pnr. 5310) oder Klausur (Pnr. 5320) oder Hausarbeit (Pnr. 5330) oder Studienarbeit (Pnr. 5340) oder Projektarbeit (Pnr. 5350)<br>\n**Voraussetzungen f\u00fcr die Zulassung zur Modulpr\u00fcf\nSource 5:\n| Bachelorarbeit: dreifach<br>Alle Modulpr\u00fcfungen: einfach |\n| **Pr\u00fcfungssprache nach \u00a7 6 (4)** | keine Angabe |\n| **Auslandsaufenthalt** | Optional (Mobilit\u00e4tsfenster: 5. Semester) |\n| **Exkursion** \nSource 6:\nkeine-<br>\n**Voraussetzungen f\u00fcr die Zulassung zur Modulpr\u00fcfung:** -keine-<br>\n**Voraussetzungen f\u00fcr die Vergabe von ECTS-Leistungspunkten:** Erbrachte Studienleistungen (SL) in allen Lehrveranstaltun\nSource 7:\n) (Pnr. 4120)<br>\n**Voraussetzungen f\u00fcr die Zulassung zur Modulpr\u00fcfung:** -keine-<br>\n**Voraussetzungen f\u00fcr die Vergabe von ECTS-Leistungspunkten:** Erbrachte Studienleistungen (SL) in allen Lehrveran",
        "retrieved_contexts": [
            "s- und Aufbaumodule<br>\n**Pr\u00fcfungsformen:** Bachelorarbeit (Pnr. 6000)<br>\n**Voraussetzungen f\u00fcr die Zulassung zur Pr\u00fcfung:** -keine-<br>\n**Voraussetzungen f\u00fcr die Vergabe von ECTS-Leistungspunkten:**",
            "Klausur (Pnr. 5120) oder Hausarbeit (Pnr. 5130) oder Studienarbeit (Pnr. 5140) oder Projektarbeit (Pnr. 5150)<br>\n**Voraussetzungen f\u00fcr die Zulassung zur Modulpr\u00fcfung:** -keine<br>\n**Voraussetzungen f",
            "Schule) |\n| **Prop\u00e4deutikum im Profilbildungsbereich** | keine Angabe |\n| **Anzahl der Modulpr\u00fcfungen** | 9, zuz\u00fcglich Bachelorarbeit |\n| **Art und Inhalt der Module und der Pr\u00fcfungen** | **Module:**<",
            "* M\u00fcndliche Pr\u00fcfung (Pnr. 5310) oder Klausur (Pnr. 5320) oder Hausarbeit (Pnr. 5330) oder Studienarbeit (Pnr. 5340) oder Projektarbeit (Pnr. 5350)<br>\n**Voraussetzungen f\u00fcr die Zulassung zur Modulpr\u00fcf",
            "| Bachelorarbeit: dreifach<br>Alle Modulpr\u00fcfungen: einfach |\n| **Pr\u00fcfungssprache nach \u00a7 6 (4)** | keine Angabe |\n| **Auslandsaufenthalt** | Optional (Mobilit\u00e4tsfenster: 5. Semester) |\n| **Exkursion** ",
            "keine-<br>\n**Voraussetzungen f\u00fcr die Zulassung zur Modulpr\u00fcfung:** -keine-<br>\n**Voraussetzungen f\u00fcr die Vergabe von ECTS-Leistungspunkten:** Erbrachte Studienleistungen (SL) in allen Lehrveranstaltun",
            ") (Pnr. 4120)<br>\n**Voraussetzungen f\u00fcr die Zulassung zur Modulpr\u00fcfung:** -keine-<br>\n**Voraussetzungen f\u00fcr die Vergabe von ECTS-Leistungspunkten:** Erbrachte Studienleistungen (SL) in allen Lehrveran"
        ]
    }
]