[
    {
        "user_input": "Welche Kurse sollte ich im ersten Semester belegen?",
        "reference": "Laut dem exemplarischen Studienverlaufsplan solltest du im ersten Semester folgende Kurse belegen: Mathematische Grundlagen, Einf\u00fchrung in die computationelle Logik, Einf\u00fchrung in die Computerlinguistik, Einf\u00fchrung in die Programmierung mit Python, Morphologie und Syntax.",
        "response": "Dazu enthalten die bereitgestellten Dokumente keine Informationen.",
        "retrieved_contexts": [
            "### 1. Semester Bachelor Computerlinguistik\n*Summe: 4 Module, 2 MP, 8 Veranstaltungen, 22 SWS, 30 LP, davon 1 LP im PBB*"
        ]
    },
    {
        "user_input": "Kann ich mit dem Studium in Computerlinguistik auch im Sommersemester anfangen?",
        "reference": "Nein, das Studium ist f\u00fcr einen Beginn im Wintersemester ausgelegt.",
        "response": "Ja, mit dem Studium in Computerlinguistik kann man im Sommersemester anfangen.",
        "retrieved_contexts": [
            "| Merkmal | Details |\n| :--- | :--- |\n| **Integrierter Studiengang** | Computerlinguistik |\n| **Studienbeginn** | Nur im Wintersemester |\n| **Studienumfang** | 180 ECTS-Leistungspunkte (LP) |\n| **Notwendige Vorkenntnisse** | Kenntnisse des Englischen (Niveau B1, vergleichbar mit erfolgreichem vierj\u00e4hrigem Schulunterricht an einer weiterf\u00fchrenden Schule) |\n| **Prop\u00e4deutikum im Profilbildungsbereich** | keine Angabe |\n| **Anzahl der Modulpr\u00fcfungen** | 9, zuz\u00fcglich Bachelorarbeit |\n| **Art und Inhalt der Module und der Pr\u00fcfungen** | **Module:**<br>- Basismodul - Mathematische und logische Grundlagen (8 SWS, 1 MP, 12 LP)<br>- Basismodul - Grundlagen der Computerlinguistik und formale Grammatikbeschreibung (8 SWS, 1 MP, 12 LP)<br>- Basismodul - Python-Programmierung (8 SWS, 1 MP, 12 LP)<br>- Basiswissen Linguistik - Morphologie und Syntax (6 SWS, 1 MP, 9 LP)<br>- Basiswissen Linguistik - Semantik und Pragmatik (6 SWS, 1 MP, 9 LP)<br>- Basismodul - Statistische Methoden in der Computerlinguistik (6 SWS, 6 LP)<br>- Aufbaumodul - Maschinelles Lernen (8 SWS, 1 MP, 12 LP)<br>- Aufbaumodul - Mathematische Linguistik (4 SWS, 6 LP)<br>- Aufbaumodul - Parsing (4 SWS, 6 LP)<br>- Aufbaumodul - Logische Programmierung (4 SWS, 6 LP)<br>- Aufbaumodul - Objektorientierte Programmierung (8 SWS, 1 MP, 12 LP)<br>- Praktikum und Orientierung (2 SWS, 12 LP)<br>- Vertiefungsmodul - interdisziplin\u00e4r (8 SWS, 1 MP, 12 LP)<br>- Vertiefungsmodul - Computerlinguistik 1 (8 SWS, 12 LP)<br>- Vertiefungsmodul - Computerlinguistik 2 (4 SWS, 1 MP, 9 LP)<br>- Abschlussarbeit und Forschungskolloquium (2 SWS, 15 LP)<br>- Profilbildungsbereich (18 LP) |\n| **Voraussetzungen f\u00fcr Pr\u00fcfungen** | keine Angabe |\n| **Besonderheiten** | Die zweite Wiederholung einer Modulpr\u00fcfung darf als m\u00fcndliche Pr\u00fcfung erfolgen. |\n| **Gewichtung der Pr\u00fcfungen f\u00fcr die Gesamtnote** | Bachelorarbeit: dreifach<br>Alle Modulpr\u00fcfungen: einfach |\n| **Pr\u00fcfungssprache nach \u00a7 6 (4)** | keine Angabe |\n| **Auslandsaufenthalt** | Optional (Mobilit\u00e4tsfenster: 5. Semester) |\n| **Exkursion** | keine Angabe |\n| **Praktikum** | Nach dem vierten oder f\u00fcnften Semester wird entweder ein mindestens 6-w\u00f6chiges Berufsfeldpraktikum oder eine Projektarbeit absolviert, jeweils mit einschl\u00e4gig computerlinguistischem Inhalt. Das Praktikum soll einen Einblick in die Berufspraxis vermitteln sowie den sp\u00e4teren \u00dcbergang in die Berufswelt erleichtern. Die Wahl des Praktikumsplatzes erfolgt im Einvernehmen mit dem/der Praktikumsbeauftragten der Abteilung f\u00fcr Computerlinguistik. Der/die Praktikumsbeauftragte ist bei der Vermittlung von Praktikumspl\u00e4tzen behilflich und bietet eine fachliche Praktikumsberatung und -begleitung an. \u00dcber das Praktikum ist ein kurzer Bericht (ca. 3-5 Seiten) zu verfassen und ein Zeugnis der Praktikumsstelle einzureichen. |"
        ]
    },
    {
        "user_input": "Muss ich flie\u00dfend Englisch sprechen k\u00f6nnen um Computerlinguistik zu studieren?",
        "reference": "Flie\u00dfendes Englisch wird nicht vorausgesetzt, jedoch ben\u00f6tigst du Englischkenntnisse auf dem Niveau B1. Dies entspricht vergleichsweise einem erfolgreichen vierj\u00e4hrigen Schulunterricht an einer weiterf\u00fchrenden Schule.",
        "response": "Ja, es ist notwendig, Kenntnisse des Englischen (Niveau B1) zu haben, um Computerlinguistik zu studieren.",
        "retrieved_contexts": [
            "| Merkmal | Details |\n| :--- | :--- |\n| **Integrierter Studiengang** | Computerlinguistik |\n| **Studienbeginn** | Nur im Wintersemester |\n| **Studienumfang** | 180 ECTS-Leistungspunkte (LP) |\n| **Notwendige Vorkenntnisse** | Kenntnisse des Englischen (Niveau B1, vergleichbar mit erfolgreichem vierj\u00e4hrigem Schulunterricht an einer weiterf\u00fchrenden Schule) |\n| **Prop\u00e4deutikum im Profilbildungsbereich** | keine Angabe |\n| **Anzahl der Modulpr\u00fcfungen** | 9, zuz\u00fcglich Bachelorarbeit |\n| **Art und Inhalt der Module und der Pr\u00fcfungen** | **Module:**<br>- Basismodul - Mathematische und logische Grundlagen (8 SWS, 1 MP, 12 LP)<br>- Basismodul - Grundlagen der Computerlinguistik und formale Grammatikbeschreibung (8 SWS, 1 MP, 12 LP)<br>- Basismodul - Python-Programmierung (8 SWS, 1 MP, 12 LP)<br>- Basiswissen Linguistik - Morphologie und Syntax (6 SWS, 1 MP, 9 LP)<br>- Basiswissen Linguistik - Semantik und Pragmatik (6 SWS, 1 MP, 9 LP)<br>- Basismodul - Statistische Methoden in der Computerlinguistik (6 SWS, 6 LP)<br>- Aufbaumodul - Maschinelles Lernen (8 SWS, 1 MP, 12 LP)<br>- Aufbaumodul - Mathematische Linguistik (4 SWS, 6 LP)<br>- Aufbaumodul - Parsing (4 SWS, 6 LP)<br>- Aufbaumodul - Logische Programmierung (4 SWS, 6 LP)<br>- Aufbaumodul - Objektorientierte Programmierung (8 SWS, 1 MP, 12 LP)<br>- Praktikum und Orientierung (2 SWS, 12 LP)<br>- Vertiefungsmodul - interdisziplin\u00e4r (8 SWS, 1 MP, 12 LP)<br>- Vertiefungsmodul - Computerlinguistik 1 (8 SWS, 12 LP)<br>- Vertiefungsmodul - Computerlinguistik 2 (4 SWS, 1 MP, 9 LP)<br>- Abschlussarbeit und Forschungskolloquium (2 SWS, 15 LP)<br>- Profilbildungsbereich (18 LP) |\n| **Voraussetzungen f\u00fcr Pr\u00fcfungen** | keine Angabe |\n| **Besonderheiten** | Die zweite Wiederholung einer Modulpr\u00fcfung darf als m\u00fcndliche Pr\u00fcfung erfolgen. |\n| **Gewichtung der Pr\u00fcfungen f\u00fcr die Gesamtnote** | Bachelorarbeit: dreifach<br>Alle Modulpr\u00fcfungen: einfach |\n| **Pr\u00fcfungssprache nach \u00a7 6 (4)** | keine Angabe |\n| **Auslandsaufenthalt** | Optional (Mobilit\u00e4tsfenster: 5. Semester) |\n| **Exkursion** | keine Angabe |\n| **Praktikum** | Nach dem vierten oder f\u00fcnften Semester wird entweder ein mindestens 6-w\u00f6chiges Berufsfeldpraktikum oder eine Projektarbeit absolviert, jeweils mit einschl\u00e4gig computerlinguistischem Inhalt. Das Praktikum soll einen Einblick in die Berufspraxis vermitteln sowie den sp\u00e4teren \u00dcbergang in die Berufswelt erleichtern. Die Wahl des Praktikumsplatzes erfolgt im Einvernehmen mit dem/der Praktikumsbeauftragten der Abteilung f\u00fcr Computerlinguistik. Der/die Praktikumsbeauftragte ist bei der Vermittlung von Praktikumspl\u00e4tzen behilflich und bietet eine fachliche Praktikumsberatung und -begleitung an. \u00dcber das Praktikum ist ein kurzer Bericht (ca. 3-5 Seiten) zu verfassen und ein Zeugnis der Praktikumsstelle einzureichen. |"
        ]
    },
    {
        "user_input": "Muss ich f\u00fcr den Python-Kurs Vorkenntnisse haben?",
        "reference": "Nein, f\u00fcr das Modul \"Python-Programmierung\" werden weder formale noch inhaltliche Vorkenntnisse vorausgesetzt.",
        "response": "Dazu enthalten die bereitgestellten Dokumente keine Informationen.",
        "retrieved_contexts": [
            "### Modul: Basismodul - Python-Programmierung\n**Englischer Titel:** Basis module - Python programming<br>\n**Modul-Nummer:** 2300<br>\n**ECTS-Leistungspunkte:** 12 ECTS-Leistungspunkte<br>\n**Workload:** 360 Stunden<br>\n**Dauer:** 2 Semester<br>\n**Lehrveranstaltungen und Lehrformen:** a: Einf\u00fchrung in die Programmierung mit Python (Seminar) / 2301 | b: Einf\u00fchrung in die Programmierung mit Python (\u00dcbung) / 2302 | c: Fortgeschrittene Python-Programmierung mit NLP-Anwendungen (Seminar) / 2303 | d: Fortgeschrittene Python-Programmierung mit NLP-Anwendungen (\u00dcbung) / 2304<br>\n**Belegung:** Seminar (a) mit \u00dcbung (b) und Seminar (c) mit \u00dcbung (d)<br>\n**Empfohlenes Studiensemester:** a: 1. Fachsemester (Wintersemester) | b: 1. Fachsemester (Wintersemester) | c: 2. Fachsemester (Sommersemester) | d: 2. Fachsemester (Sommersemester) | Pr\u00fcfung im 2. Fachsemester (Sommersemester)<br>\n**H\u00e4ufigkeit des Angebots:** a: Jedes Wintersemester | b: Jedes Wintersemester | c: Jedes Sommersemester | d: Jedes Sommersemester<br>\n**Geplante Gruppengr\u00f6\u00dfe:** a: Ca. 60 Studierende | b: Ca. 60 Studierende | c: Ca. 60 Studierende | d: Ca. 60 Studierende<br>\n**Kontaktzeit:** a: 2 SWS / 30 Stunden / 1 ECTS-Leistungspunkt | b: 2 SWS/30 Stunden / 1 ECTS-Leistungspunkt | c: 2 SWS/30 Stunden / 1 ECTS-Leistungspunkt | d: 2 SWS/30 Stunden / 1 ECTS-Leistungspunkt<br>\n**Selbststudium:** a: 30 Stunden / 1 ECTS-Leistungspunkt | b: 30 Stunden / 1 ECTS-Leistungspunkt | c: 30 Stunden / 1 ECTS-Leistungspunkt | d: 30 Stunden/1 ECTS-Leistungspunkt<br>\n**ECTS-Leistungspunkte f\u00fcr die Modulpr\u00fcfung:** 4 ECTS-Leistungspunkte (120 Stunden)<br>\n**Inhalte:** Wintersemester: Grundlagen der Python-Programmierung; Datentypen in Python; g\u00e4ngige Programmkonstrukte; elementare Textverarbeitung. Sommersemester: Objektorientierte und funktionale Programmierung mit Python; Einsatz von Programm-Bibliotheken in den Bereichen Data Science und NLP; Grundz\u00fcge der Sorftware-Entwicklung.<br>\n**Angestrebte Lernergebnisse und Studieninhalte:** Die Studierenden erwerben grundlegende F\u00e4higkeiten in der Programmierung mit der Programmiersprache Python sowie Kenntnisse \u00fcber fortgeschrittene Konzepte der Python-Programmierung (objektorientierte und funktionale Programmierung). Au\u00dferdem werden Grundkenntnisse des Einsatzes von Python in den Bereichen Data Science und NLP (Natural Language Processing) erworben, sowie die F\u00e4higkeit ein kleines Software-Projekt durchzuf\u00fchren und zu pr\u00e4sentieren.<br>\n**Teilnahmevoraussetzungen:** Formal: Keine | Inhaltlich: Keine<br>\n**Pr\u00fcfungsformen:** Projektarbeit (Pnr. 2310)<br>\n**Voraussetzungen f\u00fcr die Zulassung zur Modulpr\u00fcfung:** -keine-<br>\n**Voraussetzungen f\u00fcr die Vergabe von ECTS-Leistungspunkten:** Erbrachte Studienleistungen (SL) in den Lehrveranstaltungen (a) und (b): 4 ECTS-Leistungspunkte | Erbrachte Studienleistungen (SL) in den Lehrveranstaltungen (c) und (d): 4 ECTS-Leistungspunkte | Bestandene Modulpr\u00fcfung: 4 ECTS-Leistungspunkte<br>\n**Sonstige Informationen:** -keine-"
        ]
    },
    {
        "user_input": "Gibt es eine \u00dcbung f\u00fcr Mathematische Grundlagen?",
        "reference": "Nein, f\u00fcr den Kurs \"Mathematische Grundlagen\" gibt es keine begleitende \u00dcbung. Es handelt sich dabei ausschlie\u00dflich um ein Seminar.",
        "response": "Nein, es gibt keine \u00dcbung f\u00fcr Mathematische Grundlagen in der bereitgestellten Quelle.",
        "retrieved_contexts": [
            "### Modul: Basismodul - Mathematische und logische Grundlagen\n**Englischer Titel:** Basis module - mathematical and logical foundations<br>\n**Modul-Nummer:** 2100<br>\n**ECTS-Leistungspunkte:** 12 ECTS-Leistungspunkte<br>\n**Workload:** 360 Stunden<br>\n**Dauer:** 1 Semester<br>\n**Lehrveranstaltungen und Lehrformen:** a: Einf\u00fchrung in die computationelle Logik (Seminar & \u00dcbung) / 2101 | b: Mathematische Grundlagen (Seminar) / 2102<br>\n**Belegung:** Seminar und \u00dcbung (a) und Seminar (b)<br>\n**Empfohlenes Studiensemester:** a: 1. Fachsemester (Wintersemester) | b: 1. Fachsemester (Wintersemester) | Pr\u00fcfung im 1. Fachsemester (Wintersemester)<br>\n**H\u00e4ufigkeit des Angebots:** a: Jedes Wintersemester | b: Jedes Wintersemester<br>\n**Geplante Gruppengr\u00f6\u00dfe:** a: Ca. 60 Studierende | b: Ca. 60 Studierende<br>\n**Kontaktzeit:** a: 4 SWS/60 Stunden / 2 ECTS-Leistungspunkte | b: 4 SWS/60 Stunden / 2 ECTS-Leistungspunkte<br>\n**Selbststudium:** a: 60 Stunden / 2 ECTS-Leistungspunkte | b: 60 Stunden/2 ECTS-Leistungspunkte<br>\n**ECTS-Leistungspunkte f\u00fcr die Modulpr\u00fcfung:** 4 ECTS-Leistungspunkte<br>\n**Inhalte:** Aufbereitung der mathematischen Schulkenntnisse und deren Vertiefung, um formale Methoden der Mathematik einsetzen zu k\u00f6nnen wie z.B. Mengenlehre, Vektorrechnung oder Beweisf\u00fchrung. Bedeutung der Logik; menschliche Sprache und formale Sprache; Einf\u00fchrung in die Aussagenlogik und Pr\u00e4dikatenlogik; Modelle, Wahrheitswerte und formale Beweise.<br>\n**Angestrebte Lernergebnisse und Studieninhalte:** Die Studierenden beherrschen wesentliche logische und mathematische Verfahren und haben Verst\u00e4ndnis von grundlegenden logischen und mathematischen Methoden sowie deren Anwendung in spezifischen F\u00e4llen. Sie haben das formale R\u00fcstzeug, um die wichtigsten Methoden der formalen Linguistik und Computerlinguistik zu verstehen.<br>\n**Teilnahmevoraussetzungen:** Formal: Keine | Inhaltlich: Keine<br>\n**Pr\u00fcfungsformen:** Portfolio (Pnr. 2110)<br>\n**Voraussetzungen f\u00fcr die Zulassung zur Modulpr\u00fcfung:** -keine-<br>\n**Voraussetzungen f\u00fcr die Vergabe von ECTS-Leistungspunkten:** Erbrachte Studienleistungen (SL) in den Lehrveranstaltungen (a) und (b) und bestandene Modulpr\u00fcfung.<br>\n**Sonstige Informationen:** -keine-"
        ]
    },
    {
        "user_input": "Muss ich in Python eine Klausur/Pr\u00fcfung absolvieren?",
        "reference": "Ja, du musst im Modul \"Python-Programmierung\" eine Pr\u00fcfung in Form einer Projektarbeit ablegen. Diese Modulpr\u00fcfung ist jedoch erst im zweiten Fachsemester (Sommersemester) vorgesehen. Im ersten Semester musst du daf\u00fcr lediglich Studienleistungen erbringen.",
        "response": "Nein, es ist nicht notwendig, eine Klausur/Pr\u00fcfung zu absolvieren.",
        "retrieved_contexts": [
            "### Modul: Basismodul - Python-Programmierung\n**Englischer Titel:** Basis module - Python programming<br>\n**Modul-Nummer:** 2300<br>\n**ECTS-Leistungspunkte:** 12 ECTS-Leistungspunkte<br>\n**Workload:** 360 Stunden<br>\n**Dauer:** 2 Semester<br>\n**Lehrveranstaltungen und Lehrformen:** a: Einf\u00fchrung in die Programmierung mit Python (Seminar) / 2301 | b: Einf\u00fchrung in die Programmierung mit Python (\u00dcbung) / 2302 | c: Fortgeschrittene Python-Programmierung mit NLP-Anwendungen (Seminar) / 2303 | d: Fortgeschrittene Python-Programmierung mit NLP-Anwendungen (\u00dcbung) / 2304<br>\n**Belegung:** Seminar (a) mit \u00dcbung (b) und Seminar (c) mit \u00dcbung (d)<br>\n**Empfohlenes Studiensemester:** a: 1. Fachsemester (Wintersemester) | b: 1. Fachsemester (Wintersemester) | c: 2. Fachsemester (Sommersemester) | d: 2. Fachsemester (Sommersemester) | Pr\u00fcfung im 2. Fachsemester (Sommersemester)<br>\n**H\u00e4ufigkeit des Angebots:** a: Jedes Wintersemester | b: Jedes Wintersemester | c: Jedes Sommersemester | d: Jedes Sommersemester<br>\n**Geplante Gruppengr\u00f6\u00dfe:** a: Ca. 60 Studierende | b: Ca. 60 Studierende | c: Ca. 60 Studierende | d: Ca. 60 Studierende<br>\n**Kontaktzeit:** a: 2 SWS / 30 Stunden / 1 ECTS-Leistungspunkt | b: 2 SWS/30 Stunden / 1 ECTS-Leistungspunkt | c: 2 SWS/30 Stunden / 1 ECTS-Leistungspunkt | d: 2 SWS/30 Stunden / 1 ECTS-Leistungspunkt<br>\n**Selbststudium:** a: 30 Stunden / 1 ECTS-Leistungspunkt | b: 30 Stunden / 1 ECTS-Leistungspunkt | c: 30 Stunden / 1 ECTS-Leistungspunkt | d: 30 Stunden/1 ECTS-Leistungspunkt<br>\n**ECTS-Leistungspunkte f\u00fcr die Modulpr\u00fcfung:** 4 ECTS-Leistungspunkte (120 Stunden)<br>\n**Inhalte:** Wintersemester: Grundlagen der Python-Programmierung; Datentypen in Python; g\u00e4ngige Programmkonstrukte; elementare Textverarbeitung. Sommersemester: Objektorientierte und funktionale Programmierung mit Python; Einsatz von Programm-Bibliotheken in den Bereichen Data Science und NLP; Grundz\u00fcge der Sorftware-Entwicklung.<br>\n**Angestrebte Lernergebnisse und Studieninhalte:** Die Studierenden erwerben grundlegende F\u00e4higkeiten in der Programmierung mit der Programmiersprache Python sowie Kenntnisse \u00fcber fortgeschrittene Konzepte der Python-Programmierung (objektorientierte und funktionale Programmierung). Au\u00dferdem werden Grundkenntnisse des Einsatzes von Python in den Bereichen Data Science und NLP (Natural Language Processing) erworben, sowie die F\u00e4higkeit ein kleines Software-Projekt durchzuf\u00fchren und zu pr\u00e4sentieren.<br>\n**Teilnahmevoraussetzungen:** Formal: Keine | Inhaltlich: Keine<br>\n**Pr\u00fcfungsformen:** Projektarbeit (Pnr. 2310)<br>\n**Voraussetzungen f\u00fcr die Zulassung zur Modulpr\u00fcfung:** -keine-<br>\n**Voraussetzungen f\u00fcr die Vergabe von ECTS-Leistungspunkten:** Erbrachte Studienleistungen (SL) in den Lehrveranstaltungen (a) und (b): 4 ECTS-Leistungspunkte | Erbrachte Studienleistungen (SL) in den Lehrveranstaltungen (c) und (d): 4 ECTS-Leistungspunkte | Bestandene Modulpr\u00fcfung: 4 ECTS-Leistungspunkte<br>\n**Sonstige Informationen:** -keine-"
        ]
    },
    {
        "user_input": "Wann soll ich das Praktikum machen?",
        "reference": "Es wird empfohlen, das Berufsfeldpraktikum nach dem vierten oder f\u00fcnften Semester zu absolvieren.",
        "response": "Dazu enthalten die bereitgestellten Dokumente keine Informationen.",
        "retrieved_contexts": [
            "### Modul: Praktikum & Orientierung\n**Englischer Titel:** Internship & orientation<br>\n**Modul-Nummer:** 3000<br>\n**ECTS-Leistungspunkte:** 12 ECTS-Leistungspunkte<br>\n**Workload:** 360 Stunden<br>\n**Dauer:** 2 Semester<br>\n**Lehrveranstaltungen und Lehrformen:** a: Orientierungsseminar (Seminar) / 3001 | b: Praktikum (in der Regel 6 Wochen in Vollzeit) / 3010<br>\n**Belegung:** Seminar (a)<br>\n**Empfohlenes Studiensemester:** a: 4. Fachsemester (Sommersemester) | b: 5. Fachsemester (Wintersemester)<br>\n**H\u00e4ufigkeit des Angebots:** a: Jedes Sommersemester | b: Jedes Semester<br>\n**Geplante Gruppengr\u00f6\u00dfe:** a: Ca. 60 Studierende | b: Ca. 60 Studierende<br>\n**Kontaktzeit:** a: 2 SWS / 30 Stunden / 1 ECTS-Leistungspunkt | b: keine<br>\n**Selbststudium:** a: 60 Stunden / 2 ECTS-Leistungspunkte | b: 270 Stunden/9 ECTS-Leistungspunkte<br>\n**ECTS-Leistungspunkte f\u00fcr die Modulpr\u00fcfung:** -keine-<br>\n**Inhalte:** a: Das Seminar bietet Orientierung f\u00fcr die zweite Studienphase insbesondere in Bezug auf Studienorganisation (Schwerpunktsetzung, Auslandsaufenthalt, Praktikum, ...); Abschlussarbeit (Themenwahl, wissenschaftliches Arbeiten, ...); Berufsperspektiven (Bewerbungsverfahren, Berufsfeldorientierung, ...); Anschlussstudieng\u00e4nge (wissenschaftliche Karriere, ...). | b: Berufsorientierte Anwendung der im Studium vermittelten Qualifikationen<br>\n**Angestrebte Lernergebnisse und Studieninhalte:** Die Studierenden entwickeln Entwicklungsziele f\u00fcr ihre Zukunft und lernen, welche Schritte sie zur Realisierung ergreifen k\u00f6nnen. Sie erlangen Orientierung sowohl f\u00fcr den weiteren Studienaufbau als auch f\u00fcr ihren beruflichen Werdegang. Berufliche W\u00fcnsche und M\u00f6glichkeiten k\u00f6nnen sie realistischer beurteilen. Sie erwerben erweiterte Methodenkenntnis aus der beruflichen Praxis und gewinnen ein verst\u00e4rktes Selbstvertrauen durch Praxiserprobung des bisher erworbenen Wissens. Sie vertiefen ihre Kenntnisse zum wissenschaftlichen Arbeiten, k\u00f6nnen eigene Forschungsfragen formulieren, diese angemessen einengen und die zur Beantwortung notwendigen Schritte planen und umsetzen.<br>\n**Teilnahmevoraussetzungen:** Formal: 4. Fachsemester oder h\u00f6her | Inhaltlich: Basismodul - Mathematische und logische Grundlagen, Basismodul - Grundlagen der Computerlinguistik und formale Grammatikbeschreibung, Basismodul - Python-Programmierung<br>\n**Pr\u00fcfungsformen:** -keine-<br>\n**Voraussetzungen f\u00fcr die Zulassung zur Modulpr\u00fcfung:** -keine-<br>\n**Voraussetzungen f\u00fcr die Vergabe von ECTS-Leistungspunkten:** Erbrachte Studienleistungen (SL) in (a) und 6-w\u00f6chiges Praktikum nachgewiesen \u00fcber Praktikumsnachweis und Praktikumsbericht.<br>\n**Sonstige Informationen:** -keine-"
        ]
    },
    {
        "user_input": "Wird im Studiengang KI behandelt?",
        "reference": "Ja, das Thema K\u00fcnstliche Intelligenz (KI) ist ein zentraler und fest verankerter Bestandteil des Studiengangs. Im Pflichtbereich (Deep Learning): Im Aufbaumodul \"Maschinelles Lernen\" lernen die Studierenden den Umgang mit k\u00fcnstlichen neuronalen Netzen (Deep Learning) kennen und implementieren diese zur L\u00f6sung von Aufgaben im Natural Language Processing (NLP). Als Wahlthema in der Informatik: Im \"Vertiefungsmodul - Interdisziplin\u00e4r\" kann aus dem Bereich der Informatik explizit die Veranstaltung \"\u00dcberblick K\u00fcnstliche Intelligenz\" belegt werden. Spezialisierung im 3. Studienjahr: In den Vertiefungsmodulen der Computerlinguistik werden hochaktuelle KI-Architekturen in Seminaren gelehrt, darunter ausdr\u00fccklich \"gro\u00dfe Sprachmodelle\" (Large Language Models) und \"Transformer-Architekturen\".",
        "response": "Ja, der Studiengang Computerlinguistik behandelt KI.",
        "retrieved_contexts": [
            "## Ziele des Studiums\nDer integrative Bachelorstudiengang Computerlinguistik leistet eine breite computerlinguistische Ausbildung. Die Studierenden erwerben im Rahmen der ersten beiden Jahre Wissen \u00fcber die Komplexit\u00e4t sprachlicher Erscheinungen, Methodenkenntnisse und -fertigkeiten sowohl im Bereich der symbolischen Sprachverarbeitung als auch im Bereich des maschinellen Lernens und der k\u00fcnstlichen Intelligenz, und Programmierkenntnisse auf hohem Niveau. Dieses Wissen wird im dritten Jahr weiter ausgebaut und im Rahmen eines Praktikums und der Abschlussarbeit im Kontext konkreter Fragestellungen angewendet. Damit sind die Absolventen des Studiengangs optimal vorbereitet auf eine berufliche T\u00e4tigkeit z.B. in den Bereichen elektronische Informationsverarbeitung, Sprachressourcenmanagement, maschinelle Sprachverarbeitung und Sprachtechnologie. Die Studierenden erwerben au\u00dferdem besonders in den Aufbau- und Vertiefungsmodulen die F\u00e4higkeit, relevante Informationen im Bereich der Computerlinguistik zu sammeln, zu bewerten und zu interpretieren und daraus wissenschaftlich fundierte Urteile abzuleiten, z.B. auch \u00fcber gesellschaftsrelevante Aspekte von Sprachtechnologien wie etwa den Einsatz von Methoden der k\u00fcnstlichen Intelligenz in gro\u00dfen Sprachmodellen. Die Absolventen k\u00f6nnen sich selbst\u00e4ndig in neue Themengebiete einarbeiten und neue F\u00e4higkeiten lernen. Sie k\u00f6nnen sich mit Informatikern, Sprachwissenschaftlern und Laien \u00fcber Informationen, Ideen, Probleme und L\u00f6sungen austauschen. Dank der Interdisziplinarit\u00e4t des Faches lernen sie au\u00dferdem, \u00fcber Fachgrenzen hinweg zwischen unterschiedlichen Standpunkten zu vermitteln und multidisziplin\u00e4re Zusammenarbeit zu gestalten. Damit sind sie optimal auf einen anschlie\u00dfenden Masterstudiengang. z.B. im Bereich Sprachtechnologie oder K\u00fcnstliche Intelligenz oder im Bereich Linguistik vorbereitet."
        ]
    },
    {
        "user_input": "Muss ich Kurse aus der Linguistik f\u00fcr das interdisziplin\u00e4re Vertiefungsmodul belegen?",
        "reference": "Nein, Linguistik-Kurse sind keine Pflicht. Das Modul sieht vor, dass du zwei Vorlesungen oder Seminare aus der Linguistik oder der Informatik w\u00e4hlst, wobei lediglich der Informatik-Anteil von 4 SWS vorgeschrieben ist.",
        "response": "Nein, es ist nicht notwendig, Kurse aus der Linguistik f\u00fcr das Modul zu belegen. Die Modulpr\u00fcfung kann durch M\u00fcndliche Pr\u00fcfung, Klausur, Hausarbeit oder Studienarbeit ersetzt werden.",
        "retrieved_contexts": [
            "### Modul: Vertiefungsmodul - Interdisziplin\u00e4r\n**Englischer Titel:** Specialization module - interdisciplinary<br>\n**Modul-Nummer:** 5100<br>\n**ECTS-Leistungspunkte:** 12 ECTS-Leistungspunkte<br>\n**Workload:** 360 Stunden<br>\n**Dauer:** 2 Semester<br>\n**Lehrveranstaltungen und Lehrformen:** Zwei Vorlesungen oder Seminare aus Linguistik oder Informatik | Vorlesung Linguistik: 5101, 5105 | Vorlesung Informatik: 5102, 5106 | Seminar Linguistik: 5103, 5107 | Seminar Informatik: 5104, 5108<br>\n**Belegung:** Nach Vorgabe der gew\u00e4hlten Veranstaltungen<br>\n**Empfohlenes Studiensemester:** 4. Fachsemester (Sommersemester) | 5. Fachsemester (Wintersemester)<br>\n**H\u00e4ufigkeit des Angebots:** Jedes Semester<br>\n**Geplante Gruppengr\u00f6\u00dfe:** Nach Vorgabe der gew\u00e4hlten Veranstaltungen<br>\n**Kontaktzeit:** Nach Vorgabe der gew\u00e4hlten Veranstaltungen<br>\n**Selbststudium:** Nach Vorgabe der gew\u00e4hlten Veranstaltungen<br>\n**ECTS-Leistungspunkte f\u00fcr die Modulpr\u00fcfung:** Nach Vorgabe der gew\u00e4hlten Veranstaltungen<br>\n**Inhalte:** M\u00f6gliche Inhalte sind Themen der Linguistik und Informatik. Relevante m\u00f6gliche Themen in der Linguistik sind z.B.: Phonetik und Phonologie, Psycho- und Neurolinguistik, historische Linguistik. Es m\u00fcssen Veranstaltungen im Umfang von mindestens 4 SWS in der Informatik belegt werden. Dabei darf keine Doppelung von Inhalten der Module aus der Computerlinguistik entstehen. F\u00fcr die Computerlinguistik relevante m\u00f6gliche Themen in der Informatik sind z.B.: Professionelle Softwareentwicklung, Datenbanksysteme, Nichtkooperative Spieltheorie, Komplexit\u00e4tstheorie, Numerische Optimierung, Dialogsysteme, \u00dcberblick K\u00fcnstliche Intelligenz.<br>\n**Angestrebte Lernergebnisse und Studieninhalte:** Vertiefte Kenntnisse in Spezialgebieten von Linguistik/Computerlinguistik/Informatik<br>\n**Teilnahmevoraussetzungen:** Formal: keine<br>\n**Pr\u00fcfungsformen:** M\u00fcndliche Pr\u00fcfung (Pnr. 5110) oder Klausur (Pnr. 5120) oder Hausarbeit (Pnr. 5130) oder Studienarbeit (Pnr. 5140) oder Projektarbeit (Pnr. 5150)<br>\n**Voraussetzungen f\u00fcr die Zulassung zur Modulpr\u00fcfung:** -keine<br>\n**Voraussetzungen f\u00fcr die Vergabe von ECTS-Leistungspunkten:** Bestandene Modulpr\u00fcfung, aktive und erfolgreiche Mitwirkung in den Seminaren und theoretischen und praktischen \u00dcbungen.<br>\n**Sonstige Informationen:** -keine-"
        ]
    },
    {
        "user_input": "Wie stark z\u00e4hlt die Bachelorarbeit f\u00fcr meine Abschlussnote?",
        "reference": "Die Note der Bachelorarbeit wird bei der Ermittlung der Gesamtnote dreifach gewichtet. Im Vergleich dazu gehen alle anderen Modulpr\u00fcfungen nur einfach in die Gesamtnote ein.",
        "response": "Dazu enthalten die bereitgestellten Dokumente keine Informationen.",
        "retrieved_contexts": [
            "### Modul: Abschlussarbeit und Forschungskolloquium\n**Englischer Titel:** Thesis and research colloquium<br>\n**Modul-Nummer:** 5900<br>\n**ECTS-Leistungspunkte:** 15 ECTS-Leistungspunkte<br>\n**Workload:** 450 Stunden<br>\n**Dauer:** 1 Semester<br>\n**Lehrveranstaltungen und Lehrformen:** a: Forschungskolloquium Computerlinguistik (Kolloquium) / 5901 | b: Seminar (Seminar) / 5902<br>\n**Belegung:** Forschungskolloquium (a) oder Seminar (b)<br>\n**Empfohlenes Studiensemester:** a: 6. Fachsemester (Sommersemester) | b: 6. Fachsemester (Sommersemester)<br>\n**H\u00e4ufigkeit des Angebots:** a: Jedes Sommersemester | b: Jedes Sommersemester<br>\n**Geplante Gruppengr\u00f6\u00dfe:** a: Ca. 30 Studierende | b: Ca. 30 Studierende<br>\n**Kontaktzeit:** a: 2 SWS/30 Stunden / 1 ECTS-Leistungspunkt | b: 2 SWS/30 Stunden / 1 ECTS-Leistungspunkt<br>\n**Selbststudium:** Im 6. Fachsemester: 60 Stunden / 2 ECTS-Leistungspunkte<br>\n**ECTS-Leistungspunkte f\u00fcr die Modulpr\u00fcfung:** 12 ECTS-Leistungspunkte<br>\n**Inhalte:** Im Forschungskolloquium tragen jede zweite Woche (meist ausw\u00e4rtige) G\u00e4ste ihre aktuelle Forschungsarbeit vor. Die Woche davor werden die Inhalte der Vortr\u00e4ge anhand von Artikeln besprochen und vorbereitet. Das Thema der Bachelorarbeit darf frei gew\u00e4hlt werden, muss aber im Bereich Computerlinguistik liegen.<br>\n**Angestrebte Lernergebnisse und Studieninhalte:** Studierende lernen aktuelle Forschungsarbeit der Computerlinguistik kennen, und lernen weiterhin selbst\u00e4ndig wissenschaftlich zu arbeiten.<br>\n**Teilnahmevoraussetzungen:** Formal: Alle Basis- und Aufbaumodule<br>\n**Pr\u00fcfungsformen:** Bachelorarbeit (Pnr. 6000)<br>\n**Voraussetzungen f\u00fcr die Zulassung zur Pr\u00fcfung:** -keine-<br>\n**Voraussetzungen f\u00fcr die Vergabe von ECTS-Leistungspunkten:** Aktive und erfolgreiche Mitwirkung im Forschungsseminar, bestandene Bachelorarbeit.<br>\n**Sonstige Informationen:** -keine-"
        ]
    },
    {
        "user_input": "Muss ich alle Module bestanden haben, bevor ich meine Bachelorarbeit schreibe?",
        "reference": "Nein, du musst nicht zwingend das gesamte Studium vorher abgeschlossen haben. Die einzige formale Teilnahmevoraussetzung f\u00fcr das Modul \"Abschlussarbeit und Forschungskolloquium\" ist der erfolgreiche Abschluss aller Basis- und Aufbaumodule.",
        "response": "Nein, nicht alle Module m\u00fcssen bestanden werden.",
        "retrieved_contexts": [
            "### 6. Semester Bachelor Computerlinguistik\n*Summe: 3 Module, 1 MP, Bachelorarbeit, 2 Veranstaltungen, 8 SWS, 30 LP, davon 1 LP im PBB*"
        ]
    },
    {
        "user_input": "Gibt es eine Klausur in Wahrscheinlichkeitstheorie?",
        "reference": "Nein, im \"Basismodul - Statistische Methoden in der Computerlinguistik\", zu dem die Wahrscheinlichkeitstheorie geh\u00f6rt, gibt es gar keine Modulpr\u00fcfung und somit auch keine Klausur. Es m\u00fcssen lediglich Studienleistungen erbracht werden.",
        "response": "Nein, es gibt keine Klausur in Wahrscheinlichkeitstheorie.",
        "retrieved_contexts": [
            "### Modul: Basismodul - Statistische Methoden in der Computerlinguistik\n**Englischer Titel:** Basis module - statistical methods in computational linguistics<br>\n**Modul-Nummer:** 2400<br>\n**ECTS-Leistungspunkte:** 6 ECTS-Leistungspunkte<br>\n**Workload:** 180 Stunden<br>\n**Dauer:** 2 Semester<br>\n**Lehrveranstaltungen und Lehrformen:** a: Wahrscheinlichkeitstheorie und Statistik (Seminar und \u00dcbung) / 2401 | b: Linguistische Ressourcen (Seminar) / 2402<br>\n**Belegung:** Seminar mit \u00dcbung (a) und Seminar (b)<br>\n**Empfohlenes Studiensemester:** a: 2. Fachsemester (Sommersemester) | b: 3. Fachsemester (Wintersemester)<br>\n**H\u00e4ufigkeit des Angebots:** a: Jedes Wintersemester | b: Jedes Sommersemester<br>\n**Geplante Gruppengr\u00f6\u00dfe:** a: Ca. 60 Studierende | b: Ca. 60 Studierende<br>\n**Kontaktzeit:** a: 4 SWS/60 Stunden / 2 ECTS-Leistungspunkte | b: 2 SWS/30 Stunden / 1 ECTS-Leistungspunkt<br>\n**Selbststudium:** a: 60 Stunden / 2 ECTS-Leistungspunkte | b: 30 Stunden / 1 ECTS-Leistungspunkt<br>\n**ECTS-Leistungspunkte f\u00fcr die Modulpr\u00fcfung:** -keine-<br>\n**Inhalte:** Dieses Modul vermittelt grundlegende Kenntnisse in Wahrscheinlichkeitstheorie und in statistischen Methoden der Computerlinguistik, sowie deren Anwendung mittels Korpora und Datens\u00e4tzen. Unter anderem werden folgende Bereiche abgedeckt: Statistik und statistische Programmierung in einer geeigneten Programmiersprache (z.B. R); Aufbau und Pflege linguistischer Ressourcen (Korpora, Datenbanken, ...).<br>\n**Angestrebte Lernergebnisse und Studieninhalte:** Kenntnisse der Grundlagen der Wahrscheinlichkeitstheorie und Grundbegriffe der Statistik. F\u00e4higkeit, statistische Analysen selbst zu konzipieren und implementieren. F\u00e4higkeit, Korpora zu erstellen und f\u00fcr Experimente und Analysen durchzuf\u00fchren.<br>\n**Teilnahmevoraussetzungen:** Formal: keine | Inhaltlich: Basismodul Mathematische und logische Grundlagen<br>\n**Pr\u00fcfungsformen:** -keine-<br>\n**Voraussetzungen f\u00fcr die Zulassung zur Modulpr\u00fcfung:** -keine-<br>\n**Voraussetzungen f\u00fcr die Vergabe von ECTS-Leistungspunkten:** Erbrachte Studienleistungen (SL) oder Hausaufgaben in allen Lehrveranstaltungen<br>\n**Sonstige Informationen:** -keine-"
        ]
    }
]