[
    {
        "user_input": "Welche Kurse sollte ich im ersten Semester belegen?",
        "reference": "Laut dem exemplarischen Studienverlaufsplan solltest du im ersten Semester folgende Kurse belegen: Mathematische Grundlagen, Einf\u00fchrung in die computationelle Logik, Einf\u00fchrung in die Computerlinguistik, Einf\u00fchrung in die Programmierung mit Python, Morphologie und Syntax.",
        "response": "Source 1:\ninformieren Sie sich bei der Studienberatung, in welcher Reihenfolge Sie welche Pflichtmodule und Wahlpflichtmodule studieren k\u00f6nnen.\n\n**Abk\u00fcrzungen im Studienverlaufsplan:**\n* Modulpr\u00fcfung = MP\n* Studienleistung = SL\n* ECTS-Leistungspunkte = LP\n* Semesterwochenstunden = SWS\n* Profilbildungsbereich = PBB\n* Pr\u00fcfungsnummer = Pnr.\n\n### 1. Semester Bachelor Computerlinguistik\n*Summe: 4 Module, 2 MP, 8 Veranstaltungen, 22 SWS, 30 LP, davon 1 LP im PBB*\n\n| Modul / Veranstaltung | MP | SL | LP | SWS |\n\nSource 2:\neranstaltungen und Lehrformen:** a: Programmierung (Vorlesung) / 4501 | b: \u00dcbung zur Vorlesung (\u00dcbung) / 4502 | c: Praktische \u00dcbung zur Vorlesung (Praktische \u00dcbung) / 4503<br>\n**Belegung:** Vorlesung (a) mit \u00dcbung (b) und praktischer \u00dcbung (c)<br>\n**Empfohlenes Studiensemester:** a: 3. Fachsemester (Wintersemester) | b: 3. Fachsemester (Wintersemester) | c: 3. Fachsemester (Wintersemester)<br>\n**H\u00e4ufigkeit des Angebots:** a: Jedes Wintersemester | b: Jedes Wintersemester | c: Jedes Wintersemeste\nSource 3:\nster (Sommersemester) | 5. Fachsemester (Wintersemester)<br>\n**H\u00e4ufigkeit des Angebots:** Jedes Semester<br>\n**Geplante Gruppengr\u00f6\u00dfe:** Nach Vorgabe der gew\u00e4hlten Veranstaltungen<br>\n**Kontaktzeit:** Nach Vorgabe der gew\u00e4hlten Veranstaltungen<br>\n**Selbststudium:** Nach Vorgabe der gew\u00e4hlten Veranstaltungen<br>\n**ECTS-Leistungspunkte f\u00fcr die Modulpr\u00fcfung:** Nach Vorgabe der gew\u00e4hlten Veranstaltungen<br>\n**Inhalte:** M\u00f6gliche Inhalte sind Themen der Linguistik und Informatik. Relevante m\u00f6gliche T",
        "retrieved_contexts": [
            "informieren Sie sich bei der Studienberatung, in welcher Reihenfolge Sie welche Pflichtmodule und Wahlpflichtmodule studieren k\u00f6nnen.\n\n**Abk\u00fcrzungen im Studienverlaufsplan:**\n* Modulpr\u00fcfung = MP\n* Studienleistung = SL\n* ECTS-Leistungspunkte = LP\n* Semesterwochenstunden = SWS\n* Profilbildungsbereich = PBB\n* Pr\u00fcfungsnummer = Pnr.\n\n### 1. Semester Bachelor Computerlinguistik\n*Summe: 4 Module, 2 MP, 8 Veranstaltungen, 22 SWS, 30 LP, davon 1 LP im PBB*\n\n| Modul / Veranstaltung | MP | SL | LP | SWS |\n",
            "eranstaltungen und Lehrformen:** a: Programmierung (Vorlesung) / 4501 | b: \u00dcbung zur Vorlesung (\u00dcbung) / 4502 | c: Praktische \u00dcbung zur Vorlesung (Praktische \u00dcbung) / 4503<br>\n**Belegung:** Vorlesung (a) mit \u00dcbung (b) und praktischer \u00dcbung (c)<br>\n**Empfohlenes Studiensemester:** a: 3. Fachsemester (Wintersemester) | b: 3. Fachsemester (Wintersemester) | c: 3. Fachsemester (Wintersemester)<br>\n**H\u00e4ufigkeit des Angebots:** a: Jedes Wintersemester | b: Jedes Wintersemester | c: Jedes Wintersemeste",
            "ster (Sommersemester) | 5. Fachsemester (Wintersemester)<br>\n**H\u00e4ufigkeit des Angebots:** Jedes Semester<br>\n**Geplante Gruppengr\u00f6\u00dfe:** Nach Vorgabe der gew\u00e4hlten Veranstaltungen<br>\n**Kontaktzeit:** Nach Vorgabe der gew\u00e4hlten Veranstaltungen<br>\n**Selbststudium:** Nach Vorgabe der gew\u00e4hlten Veranstaltungen<br>\n**ECTS-Leistungspunkte f\u00fcr die Modulpr\u00fcfung:** Nach Vorgabe der gew\u00e4hlten Veranstaltungen<br>\n**Inhalte:** M\u00f6gliche Inhalte sind Themen der Linguistik und Informatik. Relevante m\u00f6gliche T"
        ]
    },
    {
        "user_input": "Kann ich auch im Sommersemester anfangen?",
        "reference": "Nein, das Studium ist f\u00fcr einen Beginn im Wintersemester ausgelegt.",
        "response": "Source 1:\nemester) | b: 1. Fachsemester (Wintersemester) | c: 2. Fachsemester (Sommersemester) | d: 2. Fachsemester (Sommersemester) | Pr\u00fcfung im 2. Fachsemester (Sommersemester)<br>\n**H\u00e4ufigkeit des Angebots:** a: Jedes Wintersemester | b: Jedes Wintersemester | c: Jedes Sommersemester | d: Jedes Sommersemester<br>\n**Geplante Gruppengr\u00f6\u00dfe:** a: Ca. 60 Studierende | b: Ca. 60 Studierende | c: Ca. 60 Studierende | d: Ca. 60 Studierende<br>\n**Kontaktzeit:** a: 2 SWS / 30 Stunden / 1 ECTS-Leistungspunkt | b:\nSource 2:\nr (a) mit \u00dcbung (b) und Seminar (c) mit \u00dcbung (d)<br>\n**Empfohlenes Studiensemester:** a: 1. Fachsemester (Wintersemester) | b: 1. Fachsemester (Wintersemester) | c: 2. Fachsemester (Sommersemester) | d: 2. Fachsemester (Sommersemester) | Pr\u00fcfung im 2. Fachsemester (Sommersemester)<br>\n**H\u00e4ufigkeit des Angebots:** a: Jedes Wintersemester | b: Jedes Wintersemester | c: Jedes Sommersemester | d: Jedes Sommersemester<br>\n**Geplante Gruppengr\u00f6\u00dfe:** a: Ca. 60 Studierende | b: Ca. 60 Studierende | c: \nSource 3:\nster (Sommersemester) | 5. Fachsemester (Wintersemester)<br>\n**H\u00e4ufigkeit des Angebots:** Jedes Semester<br>\n**Geplante Gruppengr\u00f6\u00dfe:** Nach Vorgabe der gew\u00e4hlten Veranstaltungen<br>\n**Kontaktzeit:** Nach Vorgabe der gew\u00e4hlten Veranstaltungen<br>\n**Selbststudium:** Nach Vorgabe der gew\u00e4hlten Veranstaltungen<br>\n**ECTS-Leistungspunkte f\u00fcr die Modulpr\u00fcfung:** Nach Vorgabe der gew\u00e4hlten Veranstaltungen<br>\n**Inhalte:** M\u00f6gliche Inhalte sind Themen der Linguistik und Informatik. Relevante m\u00f6gliche T",
        "retrieved_contexts": [
            "emester) | b: 1. Fachsemester (Wintersemester) | c: 2. Fachsemester (Sommersemester) | d: 2. Fachsemester (Sommersemester) | Pr\u00fcfung im 2. Fachsemester (Sommersemester)<br>\n**H\u00e4ufigkeit des Angebots:** a: Jedes Wintersemester | b: Jedes Wintersemester | c: Jedes Sommersemester | d: Jedes Sommersemester<br>\n**Geplante Gruppengr\u00f6\u00dfe:** a: Ca. 60 Studierende | b: Ca. 60 Studierende | c: Ca. 60 Studierende | d: Ca. 60 Studierende<br>\n**Kontaktzeit:** a: 2 SWS / 30 Stunden / 1 ECTS-Leistungspunkt | b:",
            "r (a) mit \u00dcbung (b) und Seminar (c) mit \u00dcbung (d)<br>\n**Empfohlenes Studiensemester:** a: 1. Fachsemester (Wintersemester) | b: 1. Fachsemester (Wintersemester) | c: 2. Fachsemester (Sommersemester) | d: 2. Fachsemester (Sommersemester) | Pr\u00fcfung im 2. Fachsemester (Sommersemester)<br>\n**H\u00e4ufigkeit des Angebots:** a: Jedes Wintersemester | b: Jedes Wintersemester | c: Jedes Sommersemester | d: Jedes Sommersemester<br>\n**Geplante Gruppengr\u00f6\u00dfe:** a: Ca. 60 Studierende | b: Ca. 60 Studierende | c: ",
            "ster (Sommersemester) | 5. Fachsemester (Wintersemester)<br>\n**H\u00e4ufigkeit des Angebots:** Jedes Semester<br>\n**Geplante Gruppengr\u00f6\u00dfe:** Nach Vorgabe der gew\u00e4hlten Veranstaltungen<br>\n**Kontaktzeit:** Nach Vorgabe der gew\u00e4hlten Veranstaltungen<br>\n**Selbststudium:** Nach Vorgabe der gew\u00e4hlten Veranstaltungen<br>\n**ECTS-Leistungspunkte f\u00fcr die Modulpr\u00fcfung:** Nach Vorgabe der gew\u00e4hlten Veranstaltungen<br>\n**Inhalte:** M\u00f6gliche Inhalte sind Themen der Linguistik und Informatik. Relevante m\u00f6gliche T"
        ]
    },
    {
        "user_input": "Muss ich flie\u00dfend Englisch sprechen k\u00f6nnen um Computerlinguistik zu studieren?",
        "reference": "Flie\u00dfendes Englisch wird nicht vorausgesetzt, jedoch ben\u00f6tigst du Englischkenntnisse auf dem Niveau B1. Dies entspricht vergleichsweise einem erfolgreichen vierj\u00e4hrigen Schulunterricht an einer weiterf\u00fchrenden Schule.",
        "response": "Source 1:\n# BA Computerlinguistik PO 2025\n**Vorl\u00e4ufige Lesefassung Stand 26.09.2025**\n\n## Studiengang\u00fcbersicht\n\n| Merkmal | Details |\n| :--- | :--- |\n| **Integrierter Studiengang** | Computerlinguistik |\n| **Studienbeginn** | Nur im Wintersemester |\n| **Studienumfang** | 180 ECTS-Leistungspunkte (LP) |\n| **Notwendige Vorkenntnisse** | Kenntnisse des Englischen (Niveau B1, vergleichbar mit erfolgreichem vierj\u00e4hrigem Schulunterricht an einer weiterf\u00fchrenden Schule) |\n| **Prop\u00e4deutikum im Profilbildungsberei\nSource 2:\nStudieninhalte:** Wissen \u00fcber Ziele der Computerlinguistik sowie Vertrautheit mit den grundlegenden formalen und probabilistischen Methoden der Computerlinguistik. Kenntnisse \u00fcber g\u00e4ngige computerlinguistische Formalismen zur Implementierung von Grammatiken.<br>\n**Teilnahmevoraussetzungen:** Formal: Keine | Inhaltlich: Keine<br>\n**Pr\u00fcfungsformen:** Klausur (Pnr. 2210)<br>\n**Voraussetzungen f\u00fcr die Zulassung zur Modulpr\u00fcfung:** -keine-<br>\n**Voraussetzungen f\u00fcr die Vergabe von ECTS-Leistungspunkt\nSource 3:\nng:** 4 ECTS-Leistungspunkte<br>\n**Inhalte:** M\u00f6gliche Inhalte sind Themen der Computerlinguistik. Das k\u00f6nnen sein: Nichtklassische (modale, fuzzy oder substrukturelle) Logiken; besondere Grammatikformalismen (Kategorialgrammatik); Vertiefungsseminare im Bereich maschinelles Lernen und Deep Learning.<br>\n**Angestrebte Lernergebnisse und Studieninhalte:** Studierende lernen vertiefte Kenntnisse in Spezialgebieten der Computerlinguistik.<br>\n**Teilnahmevoraussetzungen:** Formal: Basismodul - Mathe",
        "retrieved_contexts": [
            "# BA Computerlinguistik PO 2025\n**Vorl\u00e4ufige Lesefassung Stand 26.09.2025**\n\n## Studiengang\u00fcbersicht\n\n| Merkmal | Details |\n| :--- | :--- |\n| **Integrierter Studiengang** | Computerlinguistik |\n| **Studienbeginn** | Nur im Wintersemester |\n| **Studienumfang** | 180 ECTS-Leistungspunkte (LP) |\n| **Notwendige Vorkenntnisse** | Kenntnisse des Englischen (Niveau B1, vergleichbar mit erfolgreichem vierj\u00e4hrigem Schulunterricht an einer weiterf\u00fchrenden Schule) |\n| **Prop\u00e4deutikum im Profilbildungsberei",
            "Studieninhalte:** Wissen \u00fcber Ziele der Computerlinguistik sowie Vertrautheit mit den grundlegenden formalen und probabilistischen Methoden der Computerlinguistik. Kenntnisse \u00fcber g\u00e4ngige computerlinguistische Formalismen zur Implementierung von Grammatiken.<br>\n**Teilnahmevoraussetzungen:** Formal: Keine | Inhaltlich: Keine<br>\n**Pr\u00fcfungsformen:** Klausur (Pnr. 2210)<br>\n**Voraussetzungen f\u00fcr die Zulassung zur Modulpr\u00fcfung:** -keine-<br>\n**Voraussetzungen f\u00fcr die Vergabe von ECTS-Leistungspunkt",
            "ng:** 4 ECTS-Leistungspunkte<br>\n**Inhalte:** M\u00f6gliche Inhalte sind Themen der Computerlinguistik. Das k\u00f6nnen sein: Nichtklassische (modale, fuzzy oder substrukturelle) Logiken; besondere Grammatikformalismen (Kategorialgrammatik); Vertiefungsseminare im Bereich maschinelles Lernen und Deep Learning.<br>\n**Angestrebte Lernergebnisse und Studieninhalte:** Studierende lernen vertiefte Kenntnisse in Spezialgebieten der Computerlinguistik.<br>\n**Teilnahmevoraussetzungen:** Formal: Basismodul - Mathe"
        ]
    },
    {
        "user_input": "Muss ich f\u00fcr den Python-Kurs Vorkenntnisse haben?",
        "reference": "Nein, f\u00fcr das Modul \"Python-Programmierung\" werden weder formale noch inhaltliche Vorkenntnisse vorausgesetzt.",
        "response": "Source 1:\nktionale Programmierung). Au\u00dferdem werden Grundkenntnisse des Einsatzes von Python in den Bereichen Data Science und NLP (Natural Language Processing) erworben, sowie die F\u00e4higkeit ein kleines Software-Projekt durchzuf\u00fchren und zu pr\u00e4sentieren.<br>\n**Teilnahmevoraussetzungen:** Formal: Keine | Inhaltlich: Keine<br>\n**Pr\u00fcfungsformen:** Projektarbeit (Pnr. 2310)<br>\n**Voraussetzungen f\u00fcr die Zulassung zur Modulpr\u00fcfung:** -keine-<br>\n**Voraussetzungen f\u00fcr die Vergabe von ECTS-Leistungspunkten:** Er\nSource 2:\nden<br>\n**Dauer:** 2 Semester<br>\n**Lehrveranstaltungen und Lehrformen:** a: Einf\u00fchrung in die Programmierung mit Python (Seminar) / 2301 | b: Einf\u00fchrung in die Programmierung mit Python (\u00dcbung) / 2302 | c: Fortgeschrittene Python-Programmierung mit NLP-Anwendungen (Seminar) / 2303 | d: Fortgeschrittene Python-Programmierung mit NLP-Anwendungen (\u00dcbung) / 2304<br>\n**Belegung:** Seminar (a) mit \u00dcbung (b) und Seminar (c) mit \u00dcbung (d)<br>\n**Empfohlenes Studiensemester:** a: 1. Fachsemester (Winters\nSource 3:\n beschreiben, sowie selbst zu erstellen; eigene Datentypen zu konzipieren und anzuwenden; einfache objektorientierte Programme mit Polymorphie, Vererbung und Schnittstellen zu entwickeln; die behandelten dynamischen Datenstrukturen anzuwenden.<br>\n**Teilnahmevoraussetzungen:** Formal: Keine | Inhaltlich: Basismodul - Mathematische und logische Grundlagen, Basismodul - Python-Programmierung<br>\n**Pr\u00fcfungsformen:** Klausur (Pnr. 4510)<br>\n**Voraussetzungen f\u00fcr die Zulassung zur Modulpr\u00fcfung:** -ke",
        "retrieved_contexts": [
            "ktionale Programmierung). Au\u00dferdem werden Grundkenntnisse des Einsatzes von Python in den Bereichen Data Science und NLP (Natural Language Processing) erworben, sowie die F\u00e4higkeit ein kleines Software-Projekt durchzuf\u00fchren und zu pr\u00e4sentieren.<br>\n**Teilnahmevoraussetzungen:** Formal: Keine | Inhaltlich: Keine<br>\n**Pr\u00fcfungsformen:** Projektarbeit (Pnr. 2310)<br>\n**Voraussetzungen f\u00fcr die Zulassung zur Modulpr\u00fcfung:** -keine-<br>\n**Voraussetzungen f\u00fcr die Vergabe von ECTS-Leistungspunkten:** Er",
            "den<br>\n**Dauer:** 2 Semester<br>\n**Lehrveranstaltungen und Lehrformen:** a: Einf\u00fchrung in die Programmierung mit Python (Seminar) / 2301 | b: Einf\u00fchrung in die Programmierung mit Python (\u00dcbung) / 2302 | c: Fortgeschrittene Python-Programmierung mit NLP-Anwendungen (Seminar) / 2303 | d: Fortgeschrittene Python-Programmierung mit NLP-Anwendungen (\u00dcbung) / 2304<br>\n**Belegung:** Seminar (a) mit \u00dcbung (b) und Seminar (c) mit \u00dcbung (d)<br>\n**Empfohlenes Studiensemester:** a: 1. Fachsemester (Winters",
            " beschreiben, sowie selbst zu erstellen; eigene Datentypen zu konzipieren und anzuwenden; einfache objektorientierte Programme mit Polymorphie, Vererbung und Schnittstellen zu entwickeln; die behandelten dynamischen Datenstrukturen anzuwenden.<br>\n**Teilnahmevoraussetzungen:** Formal: Keine | Inhaltlich: Basismodul - Mathematische und logische Grundlagen, Basismodul - Python-Programmierung<br>\n**Pr\u00fcfungsformen:** Klausur (Pnr. 4510)<br>\n**Voraussetzungen f\u00fcr die Zulassung zur Modulpr\u00fcfung:** -ke"
        ]
    },
    {
        "user_input": "Gibt es eine \u00dcbung f\u00fcr Mathematische Grundlagen?",
        "reference": "Nein, f\u00fcr den Kurs \"Mathematische Grundlagen\" gibt es keine begleitende \u00dcbung. Es handelt sich dabei ausschlie\u00dflich um ein Seminar.",
        "response": "Source 1:\n| :--- | :--- | :--- | :--- | :--- |\n| **Basismodul - Mathematische und logische Grundlagen** | **1 MP** | **2 SL** | **12 LP** | **8 SWS** |\n| Einf\u00fchrung in die computationelle Logik (Seminar mit \u00dcbung) | | Pnr. 2101 | 4 LP | 4 SWS |\n| Mathematische Grundlagen (Seminar) | | Pnr. 2102 | 4 LP | 4 SWS |\n| Modulpr\u00fcfung (Portfolio) | Pnr. 2110 | | 4 LP | |\n| **Basismodul - Grundlagen der Computerlinguistik und formale Grammatikbeschreibung [1/2]** | | **2 SL** | **4 LP** | **4 SWS** |\n| Einf\u00fchrung i\nSource 2:\neruflichen Praxis und gewinnen ein verst\u00e4rktes Selbstvertrauen durch Praxiserprobung des bisher erworbenen Wissens. Sie vertiefen ihre Kenntnisse zum wissenschaftlichen Arbeiten, k\u00f6nnen eigene Forschungsfragen formulieren, diese angemessen einengen und die zur Beantwortung notwendigen Schritte planen und umsetzen.<br>\n**Teilnahmevoraussetzungen:** Formal: 4. Fachsemester oder h\u00f6her | Inhaltlich: Basismodul - Mathematische und logische Grundlagen, Basismodul - Grundlagen der Computerlinguistik un\nSource 3:\nul - Mathematische und logische Grundlagen, Basismodul - Grundlagen der Computerlinguistik und formale Grammatikbeschreibung<br>\n**Pr\u00fcfungsformen:** -keine-<br>\n**Voraussetzungen f\u00fcr die Zulassung zur Modulpr\u00fcfung:** -keine-<br>\n**Voraussetzungen f\u00fcr die Vergabe von ECTS-Leistungspunkten:** Erbrachte Studienleistungen (SL) in allen Lehrveranstaltungen<br>\n**Sonstige Informationen:** -keine-\n\n### Modul: Aufbaumodul - Parsing\n**Englischer Titel:** Advanced module - parsing<br>\n**Modul-Nummer:** 43",
        "retrieved_contexts": [
            "| :--- | :--- | :--- | :--- | :--- |\n| **Basismodul - Mathematische und logische Grundlagen** | **1 MP** | **2 SL** | **12 LP** | **8 SWS** |\n| Einf\u00fchrung in die computationelle Logik (Seminar mit \u00dcbung) | | Pnr. 2101 | 4 LP | 4 SWS |\n| Mathematische Grundlagen (Seminar) | | Pnr. 2102 | 4 LP | 4 SWS |\n| Modulpr\u00fcfung (Portfolio) | Pnr. 2110 | | 4 LP | |\n| **Basismodul - Grundlagen der Computerlinguistik und formale Grammatikbeschreibung [1/2]** | | **2 SL** | **4 LP** | **4 SWS** |\n| Einf\u00fchrung i",
            "eruflichen Praxis und gewinnen ein verst\u00e4rktes Selbstvertrauen durch Praxiserprobung des bisher erworbenen Wissens. Sie vertiefen ihre Kenntnisse zum wissenschaftlichen Arbeiten, k\u00f6nnen eigene Forschungsfragen formulieren, diese angemessen einengen und die zur Beantwortung notwendigen Schritte planen und umsetzen.<br>\n**Teilnahmevoraussetzungen:** Formal: 4. Fachsemester oder h\u00f6her | Inhaltlich: Basismodul - Mathematische und logische Grundlagen, Basismodul - Grundlagen der Computerlinguistik un",
            "ul - Mathematische und logische Grundlagen, Basismodul - Grundlagen der Computerlinguistik und formale Grammatikbeschreibung<br>\n**Pr\u00fcfungsformen:** -keine-<br>\n**Voraussetzungen f\u00fcr die Zulassung zur Modulpr\u00fcfung:** -keine-<br>\n**Voraussetzungen f\u00fcr die Vergabe von ECTS-Leistungspunkten:** Erbrachte Studienleistungen (SL) in allen Lehrveranstaltungen<br>\n**Sonstige Informationen:** -keine-\n\n### Modul: Aufbaumodul - Parsing\n**Englischer Titel:** Advanced module - parsing<br>\n**Modul-Nummer:** 43"
        ]
    },
    {
        "user_input": "Wie oft darf ich eine Pr\u00fcfung nicht bestehen?",
        "reference": "Aus den Dokumenten geht keine explizite Gesamtzahl der erlaubten Fehlversuche hervor. Es ist jedoch vermerkt, dass die zweite Wiederholung einer Modulpr\u00fcfung als m\u00fcndliche Pr\u00fcfung erfolgen darf. Das bedeutet, dass du eine Pr\u00fcfung mindestens zweimal wiederholen darfst.",
        "response": "Source 1:\n SWS, 1 MP, 12 LP)<br>- Vertiefungsmodul - Computerlinguistik 1 (8 SWS, 12 LP)<br>- Vertiefungsmodul - Computerlinguistik 2 (4 SWS, 1 MP, 9 LP)<br>- Abschlussarbeit und Forschungskolloquium (2 SWS, 15 LP)<br>- Profilbildungsbereich (18 LP) |\n| **Voraussetzungen f\u00fcr Pr\u00fcfungen** | keine Angabe |\n| **Besonderheiten** | Die zweite Wiederholung einer Modulpr\u00fcfung darf als m\u00fcndliche Pr\u00fcfung erfolgen. |\n| **Gewichtung der Pr\u00fcfungen f\u00fcr die Gesamtnote** | Bachelorarbeit: dreifach<br>Alle Modulpr\u00fcfungen:\nSource 2:\nhrscheinlichkeitstheorie und Grundbegriffe der Statistik. F\u00e4higkeit, statistische Analysen selbst zu konzipieren und implementieren. F\u00e4higkeit, Korpora zu erstellen und f\u00fcr Experimente und Analysen durchzuf\u00fchren.<br>\n**Teilnahmevoraussetzungen:** Formal: keine | Inhaltlich: Basismodul Mathematische und logische Grundlagen<br>\n**Pr\u00fcfungsformen:** -keine-<br>\n**Voraussetzungen f\u00fcr die Zulassung zur Modulpr\u00fcfung:** -keine-<br>\n**Voraussetzungen f\u00fcr die Vergabe von ECTS-Leistungspunkten:** Erbrachte\nSource 3:\nhre eigenst\u00e4ndige Arbeit dementsprechend strukturieren.<br>\n**Teilnahmevoraussetzungen:** Formal: -keine- | Inhaltlich: -keine-<br>\n**Pr\u00fcfungsformen:** Klausur (Pnr. 1410)<br>\n**Voraussetzungen f\u00fcr die Zulassung zur Modulpr\u00fcfung:** -keine-<br>\n**Voraussetzungen f\u00fcr die Vergabe von ECTS-Leistungspunkten:** Erbrachte Studienleistungen (SL) in allen Lehrveranstaltungen und bestandene Modulpr\u00fcfung.<br>\n**Sonstige Informationen:** -keine-\n\n### Modul: Basismodul - Statistische Methoden in der Computer",
        "retrieved_contexts": [
            " SWS, 1 MP, 12 LP)<br>- Vertiefungsmodul - Computerlinguistik 1 (8 SWS, 12 LP)<br>- Vertiefungsmodul - Computerlinguistik 2 (4 SWS, 1 MP, 9 LP)<br>- Abschlussarbeit und Forschungskolloquium (2 SWS, 15 LP)<br>- Profilbildungsbereich (18 LP) |\n| **Voraussetzungen f\u00fcr Pr\u00fcfungen** | keine Angabe |\n| **Besonderheiten** | Die zweite Wiederholung einer Modulpr\u00fcfung darf als m\u00fcndliche Pr\u00fcfung erfolgen. |\n| **Gewichtung der Pr\u00fcfungen f\u00fcr die Gesamtnote** | Bachelorarbeit: dreifach<br>Alle Modulpr\u00fcfungen:",
            "hrscheinlichkeitstheorie und Grundbegriffe der Statistik. F\u00e4higkeit, statistische Analysen selbst zu konzipieren und implementieren. F\u00e4higkeit, Korpora zu erstellen und f\u00fcr Experimente und Analysen durchzuf\u00fchren.<br>\n**Teilnahmevoraussetzungen:** Formal: keine | Inhaltlich: Basismodul Mathematische und logische Grundlagen<br>\n**Pr\u00fcfungsformen:** -keine-<br>\n**Voraussetzungen f\u00fcr die Zulassung zur Modulpr\u00fcfung:** -keine-<br>\n**Voraussetzungen f\u00fcr die Vergabe von ECTS-Leistungspunkten:** Erbrachte",
            "hre eigenst\u00e4ndige Arbeit dementsprechend strukturieren.<br>\n**Teilnahmevoraussetzungen:** Formal: -keine- | Inhaltlich: -keine-<br>\n**Pr\u00fcfungsformen:** Klausur (Pnr. 1410)<br>\n**Voraussetzungen f\u00fcr die Zulassung zur Modulpr\u00fcfung:** -keine-<br>\n**Voraussetzungen f\u00fcr die Vergabe von ECTS-Leistungspunkten:** Erbrachte Studienleistungen (SL) in allen Lehrveranstaltungen und bestandene Modulpr\u00fcfung.<br>\n**Sonstige Informationen:** -keine-\n\n### Modul: Basismodul - Statistische Methoden in der Computer"
        ]
    },
    {
        "user_input": "Muss ich in Python eine Klausur/Pr\u00fcfung absolvieren?",
        "reference": "Ja, du musst im Modul \"Python-Programmierung\" eine Pr\u00fcfung in Form einer Projektarbeit ablegen. Diese Modulpr\u00fcfung ist jedoch erst im zweiten Fachsemester (Sommersemester) vorgesehen. Im ersten Semester musst du daf\u00fcr lediglich Studienleistungen erbringen.",
        "response": "Source 1:\nktionale Programmierung). Au\u00dferdem werden Grundkenntnisse des Einsatzes von Python in den Bereichen Data Science und NLP (Natural Language Processing) erworben, sowie die F\u00e4higkeit ein kleines Software-Projekt durchzuf\u00fchren und zu pr\u00e4sentieren.<br>\n**Teilnahmevoraussetzungen:** Formal: Keine | Inhaltlich: Keine<br>\n**Pr\u00fcfungsformen:** Projektarbeit (Pnr. 2310)<br>\n**Voraussetzungen f\u00fcr die Zulassung zur Modulpr\u00fcfung:** -keine-<br>\n**Voraussetzungen f\u00fcr die Vergabe von ECTS-Leistungspunkten:** Er\nSource 2:\nd formale Grammatikbeschreibung, Basismodul - Python-Programmierung<br>\n**Pr\u00fcfungsformen:** -keine-<br>\n**Voraussetzungen f\u00fcr die Zulassung zur Modulpr\u00fcfung:** -keine-<br>\n**Voraussetzungen f\u00fcr die Vergabe von ECTS-Leistungspunkten:** Erbrachte Studienleistungen (SL) in (a) und 6-w\u00f6chiges Praktikum nachgewiesen \u00fcber Praktikumsnachweis und Praktikumsbericht.<br>\n**Sonstige Informationen:** -keine-\n\n### Modul: Vertiefungsmodul - Interdisziplin\u00e4r\n**Englischer Titel:** Specialization module - interd\nSource 3:\n beschreiben, sowie selbst zu erstellen; eigene Datentypen zu konzipieren und anzuwenden; einfache objektorientierte Programme mit Polymorphie, Vererbung und Schnittstellen zu entwickeln; die behandelten dynamischen Datenstrukturen anzuwenden.<br>\n**Teilnahmevoraussetzungen:** Formal: Keine | Inhaltlich: Basismodul - Mathematische und logische Grundlagen, Basismodul - Python-Programmierung<br>\n**Pr\u00fcfungsformen:** Klausur (Pnr. 4510)<br>\n**Voraussetzungen f\u00fcr die Zulassung zur Modulpr\u00fcfung:** -ke",
        "retrieved_contexts": [
            "ktionale Programmierung). Au\u00dferdem werden Grundkenntnisse des Einsatzes von Python in den Bereichen Data Science und NLP (Natural Language Processing) erworben, sowie die F\u00e4higkeit ein kleines Software-Projekt durchzuf\u00fchren und zu pr\u00e4sentieren.<br>\n**Teilnahmevoraussetzungen:** Formal: Keine | Inhaltlich: Keine<br>\n**Pr\u00fcfungsformen:** Projektarbeit (Pnr. 2310)<br>\n**Voraussetzungen f\u00fcr die Zulassung zur Modulpr\u00fcfung:** -keine-<br>\n**Voraussetzungen f\u00fcr die Vergabe von ECTS-Leistungspunkten:** Er",
            "d formale Grammatikbeschreibung, Basismodul - Python-Programmierung<br>\n**Pr\u00fcfungsformen:** -keine-<br>\n**Voraussetzungen f\u00fcr die Zulassung zur Modulpr\u00fcfung:** -keine-<br>\n**Voraussetzungen f\u00fcr die Vergabe von ECTS-Leistungspunkten:** Erbrachte Studienleistungen (SL) in (a) und 6-w\u00f6chiges Praktikum nachgewiesen \u00fcber Praktikumsnachweis und Praktikumsbericht.<br>\n**Sonstige Informationen:** -keine-\n\n### Modul: Vertiefungsmodul - Interdisziplin\u00e4r\n**Englischer Titel:** Specialization module - interd",
            " beschreiben, sowie selbst zu erstellen; eigene Datentypen zu konzipieren und anzuwenden; einfache objektorientierte Programme mit Polymorphie, Vererbung und Schnittstellen zu entwickeln; die behandelten dynamischen Datenstrukturen anzuwenden.<br>\n**Teilnahmevoraussetzungen:** Formal: Keine | Inhaltlich: Basismodul - Mathematische und logische Grundlagen, Basismodul - Python-Programmierung<br>\n**Pr\u00fcfungsformen:** Klausur (Pnr. 4510)<br>\n**Voraussetzungen f\u00fcr die Zulassung zur Modulpr\u00fcfung:** -ke"
        ]
    },
    {
        "user_input": "Wann soll ich das Praktikum machen?",
        "reference": "Es wird empfohlen, das Berufsfeldpraktikum nach dem vierten oder f\u00fcnften Semester zu absolvieren.",
        "response": "Source 1:\nie Wahl des Praktikumsplatzes erfolgt im Einvernehmen mit dem/der Praktikumsbeauftragten der Abteilung f\u00fcr Computerlinguistik. Der/die Praktikumsbeauftragte ist bei der Vermittlung von Praktikumspl\u00e4tzen behilflich und bietet eine fachliche Praktikumsberatung und -begleitung an. \u00dcber das Praktikum ist ein kurzer Bericht (ca. 3-5 Seiten) zu verfassen und ein Zeugnis der Praktikumsstelle einzureichen. |\n\n---\n\n## Exemplarischer Studienverlaufsplan Bachelor Computerlinguistik\n\nBei dieser Darstellung \nSource 2:\n einfach |\n| **Pr\u00fcfungssprache nach \u00a7 6 (4)** | keine Angabe |\n| **Auslandsaufenthalt** | Optional (Mobilit\u00e4tsfenster: 5. Semester) |\n| **Exkursion** | keine Angabe |\n| **Praktikum** | Nach dem vierten oder f\u00fcnften Semester wird entweder ein mindestens 6-w\u00f6chiges Berufsfeldpraktikum oder eine Projektarbeit absolviert, jeweils mit einschl\u00e4gig computerlinguistischem Inhalt. Das Praktikum soll einen Einblick in die Berufspraxis vermitteln sowie den sp\u00e4teren \u00dcbergang in die Berufswelt erleichtern. D\nSource 3:\n: Orientierungsseminar (Seminar) / 3001 | b: Praktikum (in der Regel 6 Wochen in Vollzeit) / 3010<br>\n**Belegung:** Seminar (a)<br>\n**Empfohlenes Studiensemester:** a: 4. Fachsemester (Sommersemester) | b: 5. Fachsemester (Wintersemester)<br>\n**H\u00e4ufigkeit des Angebots:** a: Jedes Sommersemester | b: Jedes Semester<br>\n**Geplante Gruppengr\u00f6\u00dfe:** a: Ca. 60 Studierende | b: Ca. 60 Studierende<br>\n**Kontaktzeit:** a: 2 SWS / 30 Stunden / 1 ECTS-Leistungspunkt | b: keine<br>\n**Selbststudium:** a: 60 ",
        "retrieved_contexts": [
            "ie Wahl des Praktikumsplatzes erfolgt im Einvernehmen mit dem/der Praktikumsbeauftragten der Abteilung f\u00fcr Computerlinguistik. Der/die Praktikumsbeauftragte ist bei der Vermittlung von Praktikumspl\u00e4tzen behilflich und bietet eine fachliche Praktikumsberatung und -begleitung an. \u00dcber das Praktikum ist ein kurzer Bericht (ca. 3-5 Seiten) zu verfassen und ein Zeugnis der Praktikumsstelle einzureichen. |\n\n---\n\n## Exemplarischer Studienverlaufsplan Bachelor Computerlinguistik\n\nBei dieser Darstellung ",
            " einfach |\n| **Pr\u00fcfungssprache nach \u00a7 6 (4)** | keine Angabe |\n| **Auslandsaufenthalt** | Optional (Mobilit\u00e4tsfenster: 5. Semester) |\n| **Exkursion** | keine Angabe |\n| **Praktikum** | Nach dem vierten oder f\u00fcnften Semester wird entweder ein mindestens 6-w\u00f6chiges Berufsfeldpraktikum oder eine Projektarbeit absolviert, jeweils mit einschl\u00e4gig computerlinguistischem Inhalt. Das Praktikum soll einen Einblick in die Berufspraxis vermitteln sowie den sp\u00e4teren \u00dcbergang in die Berufswelt erleichtern. D",
            ": Orientierungsseminar (Seminar) / 3001 | b: Praktikum (in der Regel 6 Wochen in Vollzeit) / 3010<br>\n**Belegung:** Seminar (a)<br>\n**Empfohlenes Studiensemester:** a: 4. Fachsemester (Sommersemester) | b: 5. Fachsemester (Wintersemester)<br>\n**H\u00e4ufigkeit des Angebots:** a: Jedes Sommersemester | b: Jedes Semester<br>\n**Geplante Gruppengr\u00f6\u00dfe:** a: Ca. 60 Studierende | b: Ca. 60 Studierende<br>\n**Kontaktzeit:** a: 2 SWS / 30 Stunden / 1 ECTS-Leistungspunkt | b: keine<br>\n**Selbststudium:** a: 60 "
        ]
    },
    {
        "user_input": "Wird im Studiengang KI behandelt?",
        "reference": "Ja, das Thema K\u00fcnstliche Intelligenz (KI) ist ein zentraler und fest verankerter Bestandteil des Studiengangs. Im Pflichtbereich (Deep Learning): Im Aufbaumodul \"Maschinelles Lernen\" lernen die Studierenden den Umgang mit k\u00fcnstlichen neuronalen Netzen (Deep Learning) kennen und implementieren diese zur L\u00f6sung von Aufgaben im Natural Language Processing (NLP). Als Wahlthema in der Informatik: Im \"Vertiefungsmodul - Interdisziplin\u00e4r\" kann aus dem Bereich der Informatik explizit die Veranstaltung \"\u00dcberblick K\u00fcnstliche Intelligenz\" belegt werden. Spezialisierung im 3. Studienjahr: In den Vertiefungsmodulen der Computerlinguistik werden hochaktuelle KI-Architekturen in Seminaren gelehrt, darunter ausdr\u00fccklich \"gro\u00dfe Sprachmodelle\" (Large Language Models) und \"Transformer-Architekturen\".",
        "response": "Source 1:\nsenschaftlern und Laien \u00fcber Informationen, Ideen, Probleme und L\u00f6sungen austauschen. Dank der Interdisziplinarit\u00e4t des Faches lernen sie au\u00dferdem, \u00fcber Fachgrenzen hinweg zwischen unterschiedlichen Standpunkten zu vermitteln und multidisziplin\u00e4re Zusammenarbeit zu gestalten. Damit sind sie optimal auf einen anschlie\u00dfenden Masterstudiengang. z.B. im Bereich Sprachtechnologie oder K\u00fcnstliche Intelligenz oder im Bereich Linguistik vorbereitet.\n\n## Aufbau des Studiums\nGrob l\u00e4sst sich das Studium in\nSource 2:\nd Programmierkenntnisse auf hohem Niveau. Dieses Wissen wird im dritten Jahr weiter ausgebaut und im Rahmen eines Praktikums und der Abschlussarbeit im Kontext konkreter Fragestellungen angewendet. Damit sind die Absolventen des Studiengangs optimal vorbereitet auf eine berufliche T\u00e4tigkeit z.B. in den Bereichen elektronische Informationsverarbeitung, Sprachressourcenmanagement, maschinelle Sprachverarbeitung und Sprachtechnologie. Die Studierenden erwerben au\u00dferdem besonders in den Aufbau- und \nSource 3:\nng, Dialogsysteme, \u00dcberblick K\u00fcnstliche Intelligenz.<br>\n**Angestrebte Lernergebnisse und Studieninhalte:** Vertiefte Kenntnisse in Spezialgebieten von Linguistik/Computerlinguistik/Informatik<br>\n**Teilnahmevoraussetzungen:** Formal: keine<br>\n**Pr\u00fcfungsformen:** M\u00fcndliche Pr\u00fcfung (Pnr. 5110) oder Klausur (Pnr. 5120) oder Hausarbeit (Pnr. 5130) oder Studienarbeit (Pnr. 5140) oder Projektarbeit (Pnr. 5150)<br>\n**Voraussetzungen f\u00fcr die Zulassung zur Modulpr\u00fcfung:** -keine<br>\n**Voraussetzungen f",
        "retrieved_contexts": [
            "senschaftlern und Laien \u00fcber Informationen, Ideen, Probleme und L\u00f6sungen austauschen. Dank der Interdisziplinarit\u00e4t des Faches lernen sie au\u00dferdem, \u00fcber Fachgrenzen hinweg zwischen unterschiedlichen Standpunkten zu vermitteln und multidisziplin\u00e4re Zusammenarbeit zu gestalten. Damit sind sie optimal auf einen anschlie\u00dfenden Masterstudiengang. z.B. im Bereich Sprachtechnologie oder K\u00fcnstliche Intelligenz oder im Bereich Linguistik vorbereitet.\n\n## Aufbau des Studiums\nGrob l\u00e4sst sich das Studium in",
            "d Programmierkenntnisse auf hohem Niveau. Dieses Wissen wird im dritten Jahr weiter ausgebaut und im Rahmen eines Praktikums und der Abschlussarbeit im Kontext konkreter Fragestellungen angewendet. Damit sind die Absolventen des Studiengangs optimal vorbereitet auf eine berufliche T\u00e4tigkeit z.B. in den Bereichen elektronische Informationsverarbeitung, Sprachressourcenmanagement, maschinelle Sprachverarbeitung und Sprachtechnologie. Die Studierenden erwerben au\u00dferdem besonders in den Aufbau- und ",
            "ng, Dialogsysteme, \u00dcberblick K\u00fcnstliche Intelligenz.<br>\n**Angestrebte Lernergebnisse und Studieninhalte:** Vertiefte Kenntnisse in Spezialgebieten von Linguistik/Computerlinguistik/Informatik<br>\n**Teilnahmevoraussetzungen:** Formal: keine<br>\n**Pr\u00fcfungsformen:** M\u00fcndliche Pr\u00fcfung (Pnr. 5110) oder Klausur (Pnr. 5120) oder Hausarbeit (Pnr. 5130) oder Studienarbeit (Pnr. 5140) oder Projektarbeit (Pnr. 5150)<br>\n**Voraussetzungen f\u00fcr die Zulassung zur Modulpr\u00fcfung:** -keine<br>\n**Voraussetzungen f"
        ]
    },
    {
        "user_input": "Muss ich Kurse aus der Linguistik f\u00fcr das interdisziplin\u00e4re Vertiefungsmodul belegen?",
        "reference": "Nein, Linguistik-Kurse sind keine Pflicht. Das Modul sieht vor, dass du zwei Vorlesungen oder Seminare aus der Linguistik oder der Informatik w\u00e4hlst, wobei lediglich der Informatik-Anteil von 4 SWS vorgeschrieben ist.",
        "response": "Source 1:\nd Constituency Parsing, Dependency Parsing, Finite-State Morphology, Semantic Role Labeling, Discourse Representation Theory, Fuzzy Logic usw. Daneben gibt es das interdisziplin\u00e4re Vertiefungsmodul, in dem den Studierenden erm\u00f6glicht wird, neben Veranstaltungen aus der Computerlinguistik auch Veranstaltungen aus Linguistik und Informatik zu belegen, die nicht notwendig dezidiert computerlinguistisch sind. Im Rahmen dieses Moduls muss mindestens eine Veranstaltung aus der Informatik belegt werden\nSource 2:\nlinguistik\n**Englischer Titel:** Basis module - statistical methods in computational linguistics<br>\n**Modul-Nummer:** 2400<br>\n**ECTS-Leistungspunkte:** 6 ECTS-Leistungspunkte<br>\n**Workload:** 180 Stunden<br>\n**Dauer:** 2 Semester<br>\n**Lehrveranstaltungen und Lehrformen:** a: Wahrscheinlichkeitstheorie und Statistik (Seminar und \u00dcbung) / 2401 | b: Linguistische Ressourcen (Seminar) / 2402<br>\n**Belegung:** Seminar mit \u00dcbung (a) und Seminar (b)<br>\n**Empfohlenes Studiensemester:** a: 2. Fachse\nSource 3:\nlen Lehrveranstaltungen und bestandene Modulpr\u00fcfung.<br>\n**Sonstige Informationen:** -keine-\n\n### Modul: Basiswissen Linguistik - Semantik und Pragmatik\n**Englischer Titel:** Basic expertise in linguistics - semantics and pragmatics<br>\n**Modul-Nummer:** 1400<br>\n**ECTS-Leistungspunkte:** 9 ECTS-Leistungspunkte<br>\n**Workload:** 270 Stunden<br>\n**Dauer:** 1 Semester<br>\n**Lehrveranstaltungen und Lehrformen:** a: Semantik und Pragmatik (Vorlesung) / 1401 | b: Tutorium zu Semantik und Pragmatik (T",
        "retrieved_contexts": [
            "d Constituency Parsing, Dependency Parsing, Finite-State Morphology, Semantic Role Labeling, Discourse Representation Theory, Fuzzy Logic usw. Daneben gibt es das interdisziplin\u00e4re Vertiefungsmodul, in dem den Studierenden erm\u00f6glicht wird, neben Veranstaltungen aus der Computerlinguistik auch Veranstaltungen aus Linguistik und Informatik zu belegen, die nicht notwendig dezidiert computerlinguistisch sind. Im Rahmen dieses Moduls muss mindestens eine Veranstaltung aus der Informatik belegt werden",
            "linguistik\n**Englischer Titel:** Basis module - statistical methods in computational linguistics<br>\n**Modul-Nummer:** 2400<br>\n**ECTS-Leistungspunkte:** 6 ECTS-Leistungspunkte<br>\n**Workload:** 180 Stunden<br>\n**Dauer:** 2 Semester<br>\n**Lehrveranstaltungen und Lehrformen:** a: Wahrscheinlichkeitstheorie und Statistik (Seminar und \u00dcbung) / 2401 | b: Linguistische Ressourcen (Seminar) / 2402<br>\n**Belegung:** Seminar mit \u00dcbung (a) und Seminar (b)<br>\n**Empfohlenes Studiensemester:** a: 2. Fachse",
            "len Lehrveranstaltungen und bestandene Modulpr\u00fcfung.<br>\n**Sonstige Informationen:** -keine-\n\n### Modul: Basiswissen Linguistik - Semantik und Pragmatik\n**Englischer Titel:** Basic expertise in linguistics - semantics and pragmatics<br>\n**Modul-Nummer:** 1400<br>\n**ECTS-Leistungspunkte:** 9 ECTS-Leistungspunkte<br>\n**Workload:** 270 Stunden<br>\n**Dauer:** 1 Semester<br>\n**Lehrveranstaltungen und Lehrformen:** a: Semantik und Pragmatik (Vorlesung) / 1401 | b: Tutorium zu Semantik und Pragmatik (T"
        ]
    },
    {
        "user_input": "Wie stark z\u00e4hlt die Bachelorarbeit f\u00fcr meine Abschlussnote?",
        "reference": "Die Note der Bachelorarbeit wird bei der Ermittlung der Gesamtnote dreifach gewichtet. Im Vergleich dazu gehen alle anderen Modulpr\u00fcfungen nur einfach in die Gesamtnote ein.",
        "response": "Source 1:\n 5301 | 5 LP | 4 SWS |\n| Modulpr\u00fcfung | Pnr. 5310 | | 4 LP | |\n| **Abschlussarbeit und Forschungskolloquium** | | **1 SL** | **15 LP** | **4 SWS** |\n| Forschungskolloquium oder Seminar | | Pnr. 5901 | 3 LP | 2 SWS |\n| Bachelorarbeit | Pnr. 6000 | | 12 LP | |\n| **Profilbildungsbereich** | | | **6 LP** | |\n\nSource 2:\nen:** Erbrachte Studienleistungen (SL) in den Lehrveranstaltungen (a) und (b): 4 ECTS-Leistungspunkte | Erbrachte Studienleistungen (SL) in den Lehrveranstaltungen (c) und (d): 4 ECTS-Leistungspunkte | Bestandene Modulpr\u00fcfung: 4 ECTS-Leistungspunkte<br>\n**Sonstige Informationen:** -keine-\n\n### Modul: Basismodul - Python-Programmierung\n**Englischer Titel:** Basis module - Python programming<br>\n**Modul-Nummer:** 2300<br>\n**ECTS-Leistungspunkte:** 12 ECTS-Leistungspunkte<br>\n**Workload:** 360 Stun\nSource 3:\neiche Mitwirkung im Forschungsseminar, bestandene Modulpr\u00fcfung<br>\n**Sonstige Informationen:** -keine-\n\n### Modul: Abschlussarbeit und Forschungskolloquium\n**Englischer Titel:** Thesis and research colloquium<br>\n**Modul-Nummer:** 5900<br>\n**ECTS-Leistungspunkte:** 15 ECTS-Leistungspunkte<br>\n**Workload:** 450 Stunden<br>\n**Dauer:** 1 Semester<br>\n**Lehrveranstaltungen und Lehrformen:** a: Forschungskolloquium Computerlinguistik (Kolloquium) / 5901 | b: Seminar (Seminar) / 5902<br>\n**Belegung:**",
        "retrieved_contexts": [
            " 5301 | 5 LP | 4 SWS |\n| Modulpr\u00fcfung | Pnr. 5310 | | 4 LP | |\n| **Abschlussarbeit und Forschungskolloquium** | | **1 SL** | **15 LP** | **4 SWS** |\n| Forschungskolloquium oder Seminar | | Pnr. 5901 | 3 LP | 2 SWS |\n| Bachelorarbeit | Pnr. 6000 | | 12 LP | |\n| **Profilbildungsbereich** | | | **6 LP** | |\n",
            "en:** Erbrachte Studienleistungen (SL) in den Lehrveranstaltungen (a) und (b): 4 ECTS-Leistungspunkte | Erbrachte Studienleistungen (SL) in den Lehrveranstaltungen (c) und (d): 4 ECTS-Leistungspunkte | Bestandene Modulpr\u00fcfung: 4 ECTS-Leistungspunkte<br>\n**Sonstige Informationen:** -keine-\n\n### Modul: Basismodul - Python-Programmierung\n**Englischer Titel:** Basis module - Python programming<br>\n**Modul-Nummer:** 2300<br>\n**ECTS-Leistungspunkte:** 12 ECTS-Leistungspunkte<br>\n**Workload:** 360 Stun",
            "eiche Mitwirkung im Forschungsseminar, bestandene Modulpr\u00fcfung<br>\n**Sonstige Informationen:** -keine-\n\n### Modul: Abschlussarbeit und Forschungskolloquium\n**Englischer Titel:** Thesis and research colloquium<br>\n**Modul-Nummer:** 5900<br>\n**ECTS-Leistungspunkte:** 15 ECTS-Leistungspunkte<br>\n**Workload:** 450 Stunden<br>\n**Dauer:** 1 Semester<br>\n**Lehrveranstaltungen und Lehrformen:** a: Forschungskolloquium Computerlinguistik (Kolloquium) / 5901 | b: Seminar (Seminar) / 5902<br>\n**Belegung:**"
        ]
    },
    {
        "user_input": "Muss ich alle Module bestanden haben, bevor ich meine Bachelorarbeit schreibe?",
        "reference": "Nein, du musst nicht zwingend das gesamte Studium vorher abgeschlossen haben. Die einzige formale Teilnahmevoraussetzung f\u00fcr das Modul \"Abschlussarbeit und Forschungskolloquium\" ist der erfolgreiche Abschluss aller Basis- und Aufbaumodule.",
        "response": "Source 1:\nhre eigenst\u00e4ndige Arbeit dementsprechend strukturieren.<br>\n**Teilnahmevoraussetzungen:** Formal: -keine- | Inhaltlich: -keine-<br>\n**Pr\u00fcfungsformen:** Klausur (Pnr. 1410)<br>\n**Voraussetzungen f\u00fcr die Zulassung zur Modulpr\u00fcfung:** -keine-<br>\n**Voraussetzungen f\u00fcr die Vergabe von ECTS-Leistungspunkten:** Erbrachte Studienleistungen (SL) in allen Lehrveranstaltungen und bestandene Modulpr\u00fcfung.<br>\n**Sonstige Informationen:** -keine-\n\n### Modul: Basismodul - Statistische Methoden in der Computer\nSource 2:\n. 4110) oder Studienarbeit (mit Programmierprojekt) (Pnr. 4120)<br>\n**Voraussetzungen f\u00fcr die Zulassung zur Modulpr\u00fcfung:** -keine-<br>\n**Voraussetzungen f\u00fcr die Vergabe von ECTS-Leistungspunkten:** Erbrachte Studienleistungen (SL) in allen Lehrveranstaltungen und bestandene Modulpr\u00fcfung.<br>\n**Sonstige Informationen:** -keine-\n\n### Modul: Aufbaumodul - Mathematische Linguistik\n**Englischer Titel:** Advanced module - mathematical linguistics<br>\n**Modul-Nummer:** 4200<br>\n**ECTS-Leistungspunkte:\nSource 3:\ninformieren Sie sich bei der Studienberatung, in welcher Reihenfolge Sie welche Pflichtmodule und Wahlpflichtmodule studieren k\u00f6nnen.\n\n**Abk\u00fcrzungen im Studienverlaufsplan:**\n* Modulpr\u00fcfung = MP\n* Studienleistung = SL\n* ECTS-Leistungspunkte = LP\n* Semesterwochenstunden = SWS\n* Profilbildungsbereich = PBB\n* Pr\u00fcfungsnummer = Pnr.\n\n### 1. Semester Bachelor Computerlinguistik\n*Summe: 4 Module, 2 MP, 8 Veranstaltungen, 22 SWS, 30 LP, davon 1 LP im PBB*\n\n| Modul / Veranstaltung | MP | SL | LP | SWS |\n",
        "retrieved_contexts": [
            "hre eigenst\u00e4ndige Arbeit dementsprechend strukturieren.<br>\n**Teilnahmevoraussetzungen:** Formal: -keine- | Inhaltlich: -keine-<br>\n**Pr\u00fcfungsformen:** Klausur (Pnr. 1410)<br>\n**Voraussetzungen f\u00fcr die Zulassung zur Modulpr\u00fcfung:** -keine-<br>\n**Voraussetzungen f\u00fcr die Vergabe von ECTS-Leistungspunkten:** Erbrachte Studienleistungen (SL) in allen Lehrveranstaltungen und bestandene Modulpr\u00fcfung.<br>\n**Sonstige Informationen:** -keine-\n\n### Modul: Basismodul - Statistische Methoden in der Computer",
            ". 4110) oder Studienarbeit (mit Programmierprojekt) (Pnr. 4120)<br>\n**Voraussetzungen f\u00fcr die Zulassung zur Modulpr\u00fcfung:** -keine-<br>\n**Voraussetzungen f\u00fcr die Vergabe von ECTS-Leistungspunkten:** Erbrachte Studienleistungen (SL) in allen Lehrveranstaltungen und bestandene Modulpr\u00fcfung.<br>\n**Sonstige Informationen:** -keine-\n\n### Modul: Aufbaumodul - Mathematische Linguistik\n**Englischer Titel:** Advanced module - mathematical linguistics<br>\n**Modul-Nummer:** 4200<br>\n**ECTS-Leistungspunkte:",
            "informieren Sie sich bei der Studienberatung, in welcher Reihenfolge Sie welche Pflichtmodule und Wahlpflichtmodule studieren k\u00f6nnen.\n\n**Abk\u00fcrzungen im Studienverlaufsplan:**\n* Modulpr\u00fcfung = MP\n* Studienleistung = SL\n* ECTS-Leistungspunkte = LP\n* Semesterwochenstunden = SWS\n* Profilbildungsbereich = PBB\n* Pr\u00fcfungsnummer = Pnr.\n\n### 1. Semester Bachelor Computerlinguistik\n*Summe: 4 Module, 2 MP, 8 Veranstaltungen, 22 SWS, 30 LP, davon 1 LP im PBB*\n\n| Modul / Veranstaltung | MP | SL | LP | SWS |\n"
        ]
    }
]