[
    {
        "user_input": "Welche Kurse sollte ich im ersten Semester belegen?",
        "reference": "Laut dem exemplarischen Studienverlaufsplan solltest du im ersten Semester folgende Kurse belegen: Mathematische Grundlagen, Einf\u00fchrung in die computationelle Logik, Einf\u00fchrung in die Computerlinguistik, Einf\u00fchrung in die Programmierung mit Python, Morphologie und Syntax.",
        "response": "Im ersten Semester sollten folgende Kurse belegt werden:\n\n*   Basismodul - Mathematische und logische Grundlagen\n*   Basismodul - Grundlagen der Computerlinguistik und formale Grammatikbeschreibung\n*   Basismodul - Python-Programmierung\n*   Basiswissen Linguistik - Morphologie und Syntax",
        "retrieved_contexts": [
            "| Modul / Veranstaltung | MP | SL | LP | SWS |\n| :--- | :--- | :--- | :--- | :--- |\n| **Basismodul - Mathematische und logische Grundlagen** | **1 MP** | **2 SL** | **12 LP** | **8 SWS** |\n| Einf\u00fchrung in die computationelle Logik (Seminar mit \u00dcbung) | | Pnr. 2101 | 4 LP | 4 SWS |\n| Mathematische Grundlagen (Seminar) | | Pnr. 2102 | 4 LP | 4 SWS |\n| Modulpr\u00fcfung (Portfolio) | Pnr. 2110 | | 4 LP | |\n| **Basismodul - Grundlagen der Computerlinguistik und formale Grammatikbeschreibung [1/2]** | | **2 SL** | **4 LP** | **4 SWS** |\n| Einf\u00fchrung in die Computerlinguistik (Seminar) | | Pnr. 2201 | 2 LP | 2 SWS |\n| Einf\u00fchrung in die Computerlinguistik (\u00dcbung) | | Pnr. 2202 | 2 LP | 2 SWS |\n| **Basismodul - Python-Programmierung [1/2]** | | **2 SL** | **4 LP** | **4 SWS** |\n| Einf\u00fchrung in die Programmierung mit Python (Seminar) | | Pnr. 2301 | 2 LP | 2 SWS |\n| Einf\u00fchrung in die Programmierung mit Python (\u00dcbung) | | Pnr. 2302 | 2 LP | 2 SWS |\n| **Basiswissen Linguistik - Morphologie und Syntax** | **1 MP** | **2 SL** | **9 LP** | **6 SWS** |\n| Vorlesung | | Pnr. 1301 | 2 LP | 4 SWS |\n| Tutorium | | Pnr. 1302 | 2 LP | 2 SWS |\n| Modulpr\u00fcfung (Klausur) | Pnr. 1310 | | 3 LP | |\n| **Profilbilungsbereich** | | | **1 LP** | |",
            "## Aufbau des Studiums\nGrob l\u00e4sst sich das Studium in drei Phasen einteilen: Die ersten zwei Semester sind dem Erwerb von Basiswissen gewidmet, Semester 3 und 4 dem Aufbau weiterer Fachkompetenzen und die letzten beiden Semester der weiteren Spezialisierung und dem Studienabschluss.\n**Phase 1 Erwerb von Basiswissen f\u00fcr die Computerlinguistik:** Hierzu geh\u00f6rt die Vermittlung mathematischer und logischer Konzepte und Methoden, die f\u00fcr die Computerlinguistik wesentlich sind, eine Einf\u00fchrung in die Computerlinguistik, die einen \u00dcberblick \u00fcber zentrale computerlinguistische Fragestellungen und g\u00e4ngige Methoden in diesen Bereichen gibt, der Erwerb von Kenntnissen \u00fcber Formalismen und Methoden der Grammatikmodellierung und eine Einf\u00fchrung in die Statistik. Dies wird erg\u00e4nzt durch Einf\u00fchrungen in die f\u00fcr die Computerlinguistik zentralen sprachwissenschaftlichen Bereiche Morphologie/Syntax und Semantik/Pragmatik. Desweiteren sieht der Studienplan f\u00fcr das erste Jahr einen Einstieg in computerlinguistische Programmierung mit Python vor, die neben Grundlagen auch aktuelle Methoden der Sprachtechnologie vermittelt.\n**Phase 2 Aufbau von Fachkompetenzen f\u00fcr die Computerlinguistik:** Methodisch lernt man in dieser zweiten Phase die f\u00fcr die datengetriebene Computerlinguistik so zentralen Bereiche des Maschinellen Lernens und des Deep Learnings (also maschinelles Lernen mit k\u00fcnstlichen neuronalen Netzen) kennen, aufbauend auf dem Wissen \u00fcber Fragestellungen und Repr\u00e4sentationen der Computerlinguistik und auf soliden Kenntnissen der Programmiersprache Python (siehe Phase 1). Parallel dazu gewinnen die Studierenden Einblick in linguistische Ressourcen. Daneben werden in dieser Phase weitere Paradigma von Programmiersprachen vermittelt, n\u00e4mlich objektorientiertes Programmieren und, im Kontext von Themen der computationellen Semantik, entweder logische oder funktionale Programmierung. Au\u00dferdem werden die Bereiche syntaktische Verarbeitung und Automatentheorie und formale Sprachen in Hinblick auf computerlinguistische Problemstellungen vertieft. Als \u00dcbergang zur Phase 3 ist zudem eine Orientierung in Hinblick auf m\u00f6gliche Spezialisierungen vorgesehen.\n**Phase 3 Spezialisierung und Berufsorientierung:** Im letzten Studienjahr geht es darum, aufbauend auf den vorher erworbenen Grundlagen und Methoden, Fachkompetenzen weiter auszubauen und sich (1) \u00fcber die Wahl der Bereiche, in denen im letzten Jahr APs abgelegt werden, (2) \u00fcber die Durchf\u00fchrung eines Praktikums und (3) \u00fcber das Thema der Abschlussarbeit weiter zu spezialisieren und in Richtung m\u00f6glicher anschlie\u00dfender T\u00e4tigkeitsfelder zu orientieren. Zum einen werden im Rahmen der beiden computerlinguistischen Vertiefungsmodule regelm\u00e4\u00dfig eine Reihe von unterschiedlichen thematischen Seminaren angeboten werden, aus denen die Studierenden frei w\u00e4hlen k\u00f6nnen. In einem der Seminare, im Vertiefungsmodul 2, muss eine MP angelegt werden. Themen dieser Seminare sind z.B. Vektorsemantik, gro\u00dfe Sprachmodelle, Transformer-Architekturen in computerlinguistischen Anwendungen, Advanced Constituency Parsing, Dependency Parsing, Finite-State Morphology, Semantic Role Labeling, Discourse Representation Theory, Fuzzy Logic usw. Daneben gibt es das interdisziplin\u00e4re Vertiefungsmodul, in dem den Studierenden erm\u00f6glicht wird, neben Veranstaltungen aus der Computerlinguistik auch Veranstaltungen aus Linguistik und Informatik zu belegen, die nicht notwendig dezidiert computerlinguistisch sind. Im Rahmen dieses Moduls muss mindestens eine Veranstaltung aus der Informatik belegt werden. Neben diesen Modulen, die relativ flexibel Spezialisierungen in Computerlinguistik, Linguistik und Informatik erlauben, ist im letzten Jahr ein Praktikum zur Berufsorientierung und die Anfertigung der Bachelorarbeit vorgesehen. Letztere wird in der Regel im letzten Semester durchgef\u00fchrt, wobei parallel das Forschungskolloquium der Computerlinguistik besucht wird, wodurch interessante Einblicke in aktuelle Forschungsthemen geboten werden und Anregungen und Inspiration f\u00fcr die Bachelorarbeit gewonnen werden kann. Das 5. Semester kann als Mobilit\u00e4tssemester gew\u00e4hlt werden, da in den Vertiefungsmodulen auch Kurse aus anderen Universit\u00e4ten anerkannt werden k\u00f6nnen.",
            "| Modul / Veranstaltung | MP | SL | LP | SWS |\n| :--- | :--- | :--- | :--- | :--- |\n| **Aufbaumodul - Maschinelles Lernen [2/2]** | **1 MP** | **1 SL** | **8 LP** | **4 SWS** |\n| Deep Learning (Seminar) | | Pnr. 4102 | 4 LP | 4 SWS |\n| Modulpr\u00fcfung | Pnr. 4110 | | 4 LP | |\n| **Aufbaumodul - Parsing** | | **2 SL** | **6 LP** | **4 SWS** |\n| Parsing (Seminar) | | Pnr. 4301 | 3 LP | 2 SWS |\n| Parsing (\u00dcbung) | | Pnr. 4302 | 3 LP | 2 SWS |\n| **Aufbaumodul - Logische Programmierung** | | **2 SL** | **6 LP** | **4 SWS** |\n| Einf\u00fchrung in Prolog (Seminar) | | Pnr. 4401 | 3 LP | 2 SWS |\n| Prolog (\u00dcbung) | | Pnr. 4402 | 3 LP | 2 SWS |\n| **Vertiefungsmodul - Interdisziplin\u00e4r [1/2]** | | **1 SL** | **4 LP** | **4 SWS** |\n| Seminar nach Wahl | | Pnr. 5101 | 4 LP | 4 SWS |\n| **Praktikum & Orientierung [1/2]** | | **1 SL** | **3 LP** | **2 SWS** |\n| Orientierungsseminar (Seminar) | | Pnr. 3001 | 3 LP | 2 SWS |\n| **Profilbildungsbereich** | | | **3 LP** | |",
            "### 1. Semester Bachelor Computerlinguistik\n*Summe: 4 Module, 2 MP, 8 Veranstaltungen, 22 SWS, 30 LP, davon 1 LP im PBB*",
            "(4) Als Kern- oder Erg\u00e4nzungsfach k\u00f6nnen die folgenden F\u00e4cher gew\u00e4hlt werden:\n\u2022 Anglistik und Amerikanistik,\n\u2022 Germanistik. Sprache - Literatur - Kultur,\n\u2022 Geschichte,\n\u2022 J\u00fcdische Studien,\n\u2022 Kunstgeschichte,\n\u2022 Modernes Japan,\n\u2022 Philosophie."
        ],
        "reranking_scores": [
            0.16857106983661652,
            0.12307233363389969,
            0.08528714627027512,
            0.01649368554353714,
            0.010737712495028973
        ]
    },
    {
        "user_input": "Kann ich auch im Sommersemester anfangen?",
        "reference": "Nein, das Studium ist f\u00fcr einen Beginn im Wintersemester ausgelegt.",
        "response": "Ja, das Modul \"Basismodul - Python-Programmierung\" kann im Sommersemester beginnen.",
        "retrieved_contexts": [
            "### Modul: Basismodul - Python-Programmierung\n**Englischer Titel:** Basis module - Python programming<br>\n**Modul-Nummer:** 2300<br>\n**ECTS-Leistungspunkte:** 12 ECTS-Leistungspunkte<br>\n**Workload:** 360 Stunden<br>\n**Dauer:** 2 Semester<br>\n**Lehrveranstaltungen und Lehrformen:** a: Einf\u00fchrung in die Programmierung mit Python (Seminar) / 2301 | b: Einf\u00fchrung in die Programmierung mit Python (\u00dcbung) / 2302 | c: Fortgeschrittene Python-Programmierung mit NLP-Anwendungen (Seminar) / 2303 | d: Fortgeschrittene Python-Programmierung mit NLP-Anwendungen (\u00dcbung) / 2304<br>\n**Belegung:** Seminar (a) mit \u00dcbung (b) und Seminar (c) mit \u00dcbung (d)<br>\n**Empfohlenes Studiensemester:** a: 1. Fachsemester (Wintersemester) | b: 1. Fachsemester (Wintersemester) | c: 2. Fachsemester (Sommersemester) | d: 2. Fachsemester (Sommersemester) | Pr\u00fcfung im 2. Fachsemester (Sommersemester)<br>\n**H\u00e4ufigkeit des Angebots:** a: Jedes Wintersemester | b: Jedes Wintersemester | c: Jedes Sommersemester | d: Jedes Sommersemester<br>\n**Geplante Gruppengr\u00f6\u00dfe:** a: Ca. 60 Studierende | b: Ca. 60 Studierende | c: Ca. 60 Studierende | d: Ca. 60 Studierende<br>\n**Kontaktzeit:** a: 2 SWS / 30 Stunden / 1 ECTS-Leistungspunkt | b: 2 SWS/30 Stunden / 1 ECTS-Leistungspunkt | c: 2 SWS/30 Stunden / 1 ECTS-Leistungspunkt | d: 2 SWS/30 Stunden / 1 ECTS-Leistungspunkt<br>\n**Selbststudium:** a: 30 Stunden / 1 ECTS-Leistungspunkt | b: 30 Stunden / 1 ECTS-Leistungspunkt | c: 30 Stunden / 1 ECTS-Leistungspunkt | d: 30 Stunden/1 ECTS-Leistungspunkt<br>\n**ECTS-Leistungspunkte f\u00fcr die Modulpr\u00fcfung:** 4 ECTS-Leistungspunkte (120 Stunden)<br>\n**Inhalte:** Wintersemester: Grundlagen der Python-Programmierung; Datentypen in Python; g\u00e4ngige Programmkonstrukte; elementare Textverarbeitung. Sommersemester: Objektorientierte und funktionale Programmierung mit Python; Einsatz von Programm-Bibliotheken in den Bereichen Data Science und NLP; Grundz\u00fcge der Sorftware-Entwicklung.<br>\n**Angestrebte Lernergebnisse und Studieninhalte:** Die Studierenden erwerben grundlegende F\u00e4higkeiten in der Programmierung mit der Programmiersprache Python sowie Kenntnisse \u00fcber fortgeschrittene Konzepte der Python-Programmierung (objektorientierte und funktionale Programmierung). Au\u00dferdem werden Grundkenntnisse des Einsatzes von Python in den Bereichen Data Science und NLP (Natural Language Processing) erworben, sowie die F\u00e4higkeit ein kleines Software-Projekt durchzuf\u00fchren und zu pr\u00e4sentieren.<br>\n**Teilnahmevoraussetzungen:** Formal: Keine | Inhaltlich: Keine<br>\n**Pr\u00fcfungsformen:** Projektarbeit (Pnr. 2310)<br>\n**Voraussetzungen f\u00fcr die Zulassung zur Modulpr\u00fcfung:** -keine-<br>\n**Voraussetzungen f\u00fcr die Vergabe von ECTS-Leistungspunkten:** Erbrachte Studienleistungen (SL) in den Lehrveranstaltungen (a) und (b): 4 ECTS-Leistungspunkte | Erbrachte Studienleistungen (SL) in den Lehrveranstaltungen (c) und (d): 4 ECTS-Leistungspunkte | Bestandene Modulpr\u00fcfung: 4 ECTS-Leistungspunkte<br>\n**Sonstige Informationen:** -keine-",
            "### Modul: Abschlussarbeit und Forschungskolloquium\n**Englischer Titel:** Thesis and research colloquium<br>\n**Modul-Nummer:** 5900<br>\n**ECTS-Leistungspunkte:** 15 ECTS-Leistungspunkte<br>\n**Workload:** 450 Stunden<br>\n**Dauer:** 1 Semester<br>\n**Lehrveranstaltungen und Lehrformen:** a: Forschungskolloquium Computerlinguistik (Kolloquium) / 5901 | b: Seminar (Seminar) / 5902<br>\n**Belegung:** Forschungskolloquium (a) oder Seminar (b)<br>\n**Empfohlenes Studiensemester:** a: 6. Fachsemester (Sommersemester) | b: 6. Fachsemester (Sommersemester)<br>\n**H\u00e4ufigkeit des Angebots:** a: Jedes Sommersemester | b: Jedes Sommersemester<br>\n**Geplante Gruppengr\u00f6\u00dfe:** a: Ca. 30 Studierende | b: Ca. 30 Studierende<br>\n**Kontaktzeit:** a: 2 SWS/30 Stunden / 1 ECTS-Leistungspunkt | b: 2 SWS/30 Stunden / 1 ECTS-Leistungspunkt<br>\n**Selbststudium:** Im 6. Fachsemester: 60 Stunden / 2 ECTS-Leistungspunkte<br>\n**ECTS-Leistungspunkte f\u00fcr die Modulpr\u00fcfung:** 12 ECTS-Leistungspunkte<br>\n**Inhalte:** Im Forschungskolloquium tragen jede zweite Woche (meist ausw\u00e4rtige) G\u00e4ste ihre aktuelle Forschungsarbeit vor. Die Woche davor werden die Inhalte der Vortr\u00e4ge anhand von Artikeln besprochen und vorbereitet. Das Thema der Bachelorarbeit darf frei gew\u00e4hlt werden, muss aber im Bereich Computerlinguistik liegen.<br>\n**Angestrebte Lernergebnisse und Studieninhalte:** Studierende lernen aktuelle Forschungsarbeit der Computerlinguistik kennen, und lernen weiterhin selbst\u00e4ndig wissenschaftlich zu arbeiten.<br>\n**Teilnahmevoraussetzungen:** Formal: Alle Basis- und Aufbaumodule<br>\n**Pr\u00fcfungsformen:** Bachelorarbeit (Pnr. 6000)<br>\n**Voraussetzungen f\u00fcr die Zulassung zur Pr\u00fcfung:** -keine-<br>\n**Voraussetzungen f\u00fcr die Vergabe von ECTS-Leistungspunkten:** Aktive und erfolgreiche Mitwirkung im Forschungsseminar, bestandene Bachelorarbeit.<br>\n**Sonstige Informationen:** -keine-",
            "### Modul: Praktikum & Orientierung\n**Englischer Titel:** Internship & orientation<br>\n**Modul-Nummer:** 3000<br>\n**ECTS-Leistungspunkte:** 12 ECTS-Leistungspunkte<br>\n**Workload:** 360 Stunden<br>\n**Dauer:** 2 Semester<br>\n**Lehrveranstaltungen und Lehrformen:** a: Orientierungsseminar (Seminar) / 3001 | b: Praktikum (in der Regel 6 Wochen in Vollzeit) / 3010<br>\n**Belegung:** Seminar (a)<br>\n**Empfohlenes Studiensemester:** a: 4. Fachsemester (Sommersemester) | b: 5. Fachsemester (Wintersemester)<br>\n**H\u00e4ufigkeit des Angebots:** a: Jedes Sommersemester | b: Jedes Semester<br>\n**Geplante Gruppengr\u00f6\u00dfe:** a: Ca. 60 Studierende | b: Ca. 60 Studierende<br>\n**Kontaktzeit:** a: 2 SWS / 30 Stunden / 1 ECTS-Leistungspunkt | b: keine<br>\n**Selbststudium:** a: 60 Stunden / 2 ECTS-Leistungspunkte | b: 270 Stunden/9 ECTS-Leistungspunkte<br>\n**ECTS-Leistungspunkte f\u00fcr die Modulpr\u00fcfung:** -keine-<br>\n**Inhalte:** a: Das Seminar bietet Orientierung f\u00fcr die zweite Studienphase insbesondere in Bezug auf Studienorganisation (Schwerpunktsetzung, Auslandsaufenthalt, Praktikum, ...); Abschlussarbeit (Themenwahl, wissenschaftliches Arbeiten, ...); Berufsperspektiven (Bewerbungsverfahren, Berufsfeldorientierung, ...); Anschlussstudieng\u00e4nge (wissenschaftliche Karriere, ...). | b: Berufsorientierte Anwendung der im Studium vermittelten Qualifikationen<br>\n**Angestrebte Lernergebnisse und Studieninhalte:** Die Studierenden entwickeln Entwicklungsziele f\u00fcr ihre Zukunft und lernen, welche Schritte sie zur Realisierung ergreifen k\u00f6nnen. Sie erlangen Orientierung sowohl f\u00fcr den weiteren Studienaufbau als auch f\u00fcr ihren beruflichen Werdegang. Berufliche W\u00fcnsche und M\u00f6glichkeiten k\u00f6nnen sie realistischer beurteilen. Sie erwerben erweiterte Methodenkenntnis aus der beruflichen Praxis und gewinnen ein verst\u00e4rktes Selbstvertrauen durch Praxiserprobung des bisher erworbenen Wissens. Sie vertiefen ihre Kenntnisse zum wissenschaftlichen Arbeiten, k\u00f6nnen eigene Forschungsfragen formulieren, diese angemessen einengen und die zur Beantwortung notwendigen Schritte planen und umsetzen.<br>\n**Teilnahmevoraussetzungen:** Formal: 4. Fachsemester oder h\u00f6her | Inhaltlich: Basismodul - Mathematische und logische Grundlagen, Basismodul - Grundlagen der Computerlinguistik und formale Grammatikbeschreibung, Basismodul - Python-Programmierung<br>\n**Pr\u00fcfungsformen:** -keine-<br>\n**Voraussetzungen f\u00fcr die Zulassung zur Modulpr\u00fcfung:** -keine-<br>\n**Voraussetzungen f\u00fcr die Vergabe von ECTS-Leistungspunkten:** Erbrachte Studienleistungen (SL) in (a) und 6-w\u00f6chiges Praktikum nachgewiesen \u00fcber Praktikumsnachweis und Praktikumsbericht.<br>\n**Sonstige Informationen:** -keine-",
            "| Merkmal | Details |\n| :--- | :--- |\n| **Integrierter Studiengang** | Computerlinguistik |\n| **Studienbeginn** | Nur im Wintersemester |\n| **Studienumfang** | 180 ECTS-Leistungspunkte (LP) |\n| **Notwendige Vorkenntnisse** | Kenntnisse des Englischen (Niveau B1, vergleichbar mit erfolgreichem vierj\u00e4hrigem Schulunterricht an einer weiterf\u00fchrenden Schule) |\n| **Prop\u00e4deutikum im Profilbildungsbereich** | keine Angabe |\n| **Anzahl der Modulpr\u00fcfungen** | 9, zuz\u00fcglich Bachelorarbeit |\n| **Art und Inhalt der Module und der Pr\u00fcfungen** | **Module:**<br>- Basismodul - Mathematische und logische Grundlagen (8 SWS, 1 MP, 12 LP)<br>- Basismodul - Grundlagen der Computerlinguistik und formale Grammatikbeschreibung (8 SWS, 1 MP, 12 LP)<br>- Basismodul - Python-Programmierung (8 SWS, 1 MP, 12 LP)<br>- Basiswissen Linguistik - Morphologie und Syntax (6 SWS, 1 MP, 9 LP)<br>- Basiswissen Linguistik - Semantik und Pragmatik (6 SWS, 1 MP, 9 LP)<br>- Basismodul - Statistische Methoden in der Computerlinguistik (6 SWS, 6 LP)<br>- Aufbaumodul - Maschinelles Lernen (8 SWS, 1 MP, 12 LP)<br>- Aufbaumodul - Mathematische Linguistik (4 SWS, 6 LP)<br>- Aufbaumodul - Parsing (4 SWS, 6 LP)<br>- Aufbaumodul - Logische Programmierung (4 SWS, 6 LP)<br>- Aufbaumodul - Objektorientierte Programmierung (8 SWS, 1 MP, 12 LP)<br>- Praktikum und Orientierung (2 SWS, 12 LP)<br>- Vertiefungsmodul - interdisziplin\u00e4r (8 SWS, 1 MP, 12 LP)<br>- Vertiefungsmodul - Computerlinguistik 1 (8 SWS, 12 LP)<br>- Vertiefungsmodul - Computerlinguistik 2 (4 SWS, 1 MP, 9 LP)<br>- Abschlussarbeit und Forschungskolloquium (2 SWS, 15 LP)<br>- Profilbildungsbereich (18 LP) |\n| **Voraussetzungen f\u00fcr Pr\u00fcfungen** | keine Angabe |\n| **Besonderheiten** | Die zweite Wiederholung einer Modulpr\u00fcfung darf als m\u00fcndliche Pr\u00fcfung erfolgen. |\n| **Gewichtung der Pr\u00fcfungen f\u00fcr die Gesamtnote** | Bachelorarbeit: dreifach<br>Alle Modulpr\u00fcfungen: einfach |\n| **Pr\u00fcfungssprache nach \u00a7 6 (4)** | keine Angabe |\n| **Auslandsaufenthalt** | Optional (Mobilit\u00e4tsfenster: 5. Semester) |\n| **Exkursion** | keine Angabe |\n| **Praktikum** | Nach dem vierten oder f\u00fcnften Semester wird entweder ein mindestens 6-w\u00f6chiges Berufsfeldpraktikum oder eine Projektarbeit absolviert, jeweils mit einschl\u00e4gig computerlinguistischem Inhalt. Das Praktikum soll einen Einblick in die Berufspraxis vermitteln sowie den sp\u00e4teren \u00dcbergang in die Berufswelt erleichtern. Die Wahl des Praktikumsplatzes erfolgt im Einvernehmen mit dem/der Praktikumsbeauftragten der Abteilung f\u00fcr Computerlinguistik. Der/die Praktikumsbeauftragte ist bei der Vermittlung von Praktikumspl\u00e4tzen behilflich und bietet eine fachliche Praktikumsberatung und -begleitung an. \u00dcber das Praktikum ist ein kurzer Bericht (ca. 3-5 Seiten) zu verfassen und ein Zeugnis der Praktikumsstelle einzureichen. |",
            "### Modul: Aufbaumodul - Maschinelles Lernen\n**Englischer Titel:** Advanced module - machine learning<br>\n**Modul-Nummer:** 4100<br>\n**ECTS-Leistungspunkte:** 12 ECTS-Leistungspunkte<br>\n**Workload:** 360 Stunden<br>\n**Dauer:** 2 Semester<br>\n**Lehrveranstaltungen und Lehrformen:** a: Grundlagen des maschinellen Lernens (Seminar und \u00dcbung) / 4101 | b: Deep Learning (Seminar) / 4102<br>\n**Belegung:** Seminar mit \u00dcbung (a) und Seminar (b)<br>\n**Empfohlenes Studiensemester:** a: 3. Fachsemester (Wintersemester) | b: 4. Fachsemester (Sommersemester) | Pr\u00fcfung im 4. Fachsemester (Sommersemester)<br>\n**H\u00e4ufigkeit des Angebots:** a: Jedes Wintersemester | b: Jedes Sommersemester<br>\n**Geplante Gruppengr\u00f6\u00dfe:** a: Ca. 60 Studierende | b: Ca. 60 Studierende<br>\n**Kontaktzeit:** a: 4 SWS/60 Stunden / 2 ECTS-Leistungspunkte | b: 4 SWS/60 Stunden / 2 ECTS-Leistungspunkte<br>\n**Selbststudium:** a: 60 Stunden/2 ECTS-Leistungspunkte | b: 60 Stunden/2 ECTS-Leistungspunkte<br>\n**ECTS-Leistungspunkte f\u00fcr die Modulpr\u00fcfung:** 4 ECTS-Leistungspunkte<br>\n**Inhalte:** Methoden des modernen maschinellen Lernens, die auf Vektorrepr\u00e4sentationen basieren. In a werden die grundlegenden, meist linearen Methoden wie lineare/logistische Regression, Support Vector Machines etc. theoretisch besprochen und implementiert. In b werden neuronale Netze und deren Anwendung im Natural Language Processing (NLP) erkl\u00e4rt und implementiert.<br>\n**Angestrebte Lernergebnisse und Studieninhalte:** Die Teilnehmer k\u00f6nnen selbst\u00e4ndig lineare Modelle und neuronale Netze implementieren, um Aufgaben im NLP zu l\u00f6sen. Sie sind vertraut mit Methoden der Evaluation von Modellen und Problemen wie Overfitting und Replizierbarkeit.<br>\n**Teilnahmevoraussetzungen:** Formal: Keine | Inhaltlich: Basismodul - Statistische Methoden in der Computerlinguistik<br>\n**Pr\u00fcfungsformen:** Hausarbeit (mit Programmierprojekt) (Pnr. 4110) oder Studienarbeit (mit Programmierprojekt) (Pnr. 4120)<br>\n**Voraussetzungen f\u00fcr die Zulassung zur Modulpr\u00fcfung:** -keine-<br>\n**Voraussetzungen f\u00fcr die Vergabe von ECTS-Leistungspunkten:** Erbrachte Studienleistungen (SL) in allen Lehrveranstaltungen und bestandene Modulpr\u00fcfung.<br>\n**Sonstige Informationen:** -keine-"
        ],
        "reranking_scores": [
            0.16085563600063324,
            0.0953933522105217,
            0.07643719762563705,
            0.07217609137296677,
            0.01864701695740223
        ]
    },
    {
        "user_input": "Muss ich flie\u00dfend Englisch sprechen k\u00f6nnen um Computerlinguistik zu studieren?",
        "reference": "Flie\u00dfendes Englisch wird nicht vorausgesetzt, jedoch ben\u00f6tigst du Englischkenntnisse auf dem Niveau B1. Dies entspricht vergleichsweise einem erfolgreichen vierj\u00e4hrigen Schulunterricht an einer weiterf\u00fchrenden Schule.",
        "response": "Nein, flie\u00dfend Englisch zu sprechen ist nicht eine Voraussetzung f\u00fcr das Studium der Computerlinguistik. Die notwendigen Vorkenntnisse betreffen lediglich Kenntnisse des Englischen auf Niveau B1.",
        "retrieved_contexts": [
            "| Merkmal | Details |\n| :--- | :--- |\n| **Integrierter Studiengang** | Computerlinguistik |\n| **Studienbeginn** | Nur im Wintersemester |\n| **Studienumfang** | 180 ECTS-Leistungspunkte (LP) |\n| **Notwendige Vorkenntnisse** | Kenntnisse des Englischen (Niveau B1, vergleichbar mit erfolgreichem vierj\u00e4hrigem Schulunterricht an einer weiterf\u00fchrenden Schule) |\n| **Prop\u00e4deutikum im Profilbildungsbereich** | keine Angabe |\n| **Anzahl der Modulpr\u00fcfungen** | 9, zuz\u00fcglich Bachelorarbeit |\n| **Art und Inhalt der Module und der Pr\u00fcfungen** | **Module:**<br>- Basismodul - Mathematische und logische Grundlagen (8 SWS, 1 MP, 12 LP)<br>- Basismodul - Grundlagen der Computerlinguistik und formale Grammatikbeschreibung (8 SWS, 1 MP, 12 LP)<br>- Basismodul - Python-Programmierung (8 SWS, 1 MP, 12 LP)<br>- Basiswissen Linguistik - Morphologie und Syntax (6 SWS, 1 MP, 9 LP)<br>- Basiswissen Linguistik - Semantik und Pragmatik (6 SWS, 1 MP, 9 LP)<br>- Basismodul - Statistische Methoden in der Computerlinguistik (6 SWS, 6 LP)<br>- Aufbaumodul - Maschinelles Lernen (8 SWS, 1 MP, 12 LP)<br>- Aufbaumodul - Mathematische Linguistik (4 SWS, 6 LP)<br>- Aufbaumodul - Parsing (4 SWS, 6 LP)<br>- Aufbaumodul - Logische Programmierung (4 SWS, 6 LP)<br>- Aufbaumodul - Objektorientierte Programmierung (8 SWS, 1 MP, 12 LP)<br>- Praktikum und Orientierung (2 SWS, 12 LP)<br>- Vertiefungsmodul - interdisziplin\u00e4r (8 SWS, 1 MP, 12 LP)<br>- Vertiefungsmodul - Computerlinguistik 1 (8 SWS, 12 LP)<br>- Vertiefungsmodul - Computerlinguistik 2 (4 SWS, 1 MP, 9 LP)<br>- Abschlussarbeit und Forschungskolloquium (2 SWS, 15 LP)<br>- Profilbildungsbereich (18 LP) |\n| **Voraussetzungen f\u00fcr Pr\u00fcfungen** | keine Angabe |\n| **Besonderheiten** | Die zweite Wiederholung einer Modulpr\u00fcfung darf als m\u00fcndliche Pr\u00fcfung erfolgen. |\n| **Gewichtung der Pr\u00fcfungen f\u00fcr die Gesamtnote** | Bachelorarbeit: dreifach<br>Alle Modulpr\u00fcfungen: einfach |\n| **Pr\u00fcfungssprache nach \u00a7 6 (4)** | keine Angabe |\n| **Auslandsaufenthalt** | Optional (Mobilit\u00e4tsfenster: 5. Semester) |\n| **Exkursion** | keine Angabe |\n| **Praktikum** | Nach dem vierten oder f\u00fcnften Semester wird entweder ein mindestens 6-w\u00f6chiges Berufsfeldpraktikum oder eine Projektarbeit absolviert, jeweils mit einschl\u00e4gig computerlinguistischem Inhalt. Das Praktikum soll einen Einblick in die Berufspraxis vermitteln sowie den sp\u00e4teren \u00dcbergang in die Berufswelt erleichtern. Die Wahl des Praktikumsplatzes erfolgt im Einvernehmen mit dem/der Praktikumsbeauftragten der Abteilung f\u00fcr Computerlinguistik. Der/die Praktikumsbeauftragte ist bei der Vermittlung von Praktikumspl\u00e4tzen behilflich und bietet eine fachliche Praktikumsberatung und -begleitung an. \u00dcber das Praktikum ist ein kurzer Bericht (ca. 3-5 Seiten) zu verfassen und ein Zeugnis der Praktikumsstelle einzureichen. |",
            "## Ziele des Studiums\nDer integrative Bachelorstudiengang Computerlinguistik leistet eine breite computerlinguistische Ausbildung. Die Studierenden erwerben im Rahmen der ersten beiden Jahre Wissen \u00fcber die Komplexit\u00e4t sprachlicher Erscheinungen, Methodenkenntnisse und -fertigkeiten sowohl im Bereich der symbolischen Sprachverarbeitung als auch im Bereich des maschinellen Lernens und der k\u00fcnstlichen Intelligenz, und Programmierkenntnisse auf hohem Niveau. Dieses Wissen wird im dritten Jahr weiter ausgebaut und im Rahmen eines Praktikums und der Abschlussarbeit im Kontext konkreter Fragestellungen angewendet. Damit sind die Absolventen des Studiengangs optimal vorbereitet auf eine berufliche T\u00e4tigkeit z.B. in den Bereichen elektronische Informationsverarbeitung, Sprachressourcenmanagement, maschinelle Sprachverarbeitung und Sprachtechnologie. Die Studierenden erwerben au\u00dferdem besonders in den Aufbau- und Vertiefungsmodulen die F\u00e4higkeit, relevante Informationen im Bereich der Computerlinguistik zu sammeln, zu bewerten und zu interpretieren und daraus wissenschaftlich fundierte Urteile abzuleiten, z.B. auch \u00fcber gesellschaftsrelevante Aspekte von Sprachtechnologien wie etwa den Einsatz von Methoden der k\u00fcnstlichen Intelligenz in gro\u00dfen Sprachmodellen. Die Absolventen k\u00f6nnen sich selbst\u00e4ndig in neue Themengebiete einarbeiten und neue F\u00e4higkeiten lernen. Sie k\u00f6nnen sich mit Informatikern, Sprachwissenschaftlern und Laien \u00fcber Informationen, Ideen, Probleme und L\u00f6sungen austauschen. Dank der Interdisziplinarit\u00e4t des Faches lernen sie au\u00dferdem, \u00fcber Fachgrenzen hinweg zwischen unterschiedlichen Standpunkten zu vermitteln und multidisziplin\u00e4re Zusammenarbeit zu gestalten. Damit sind sie optimal auf einen anschlie\u00dfenden Masterstudiengang. z.B. im Bereich Sprachtechnologie oder K\u00fcnstliche Intelligenz oder im Bereich Linguistik vorbereitet.",
            "### Modul: Basismodul - Grundlagen der Computerlinguistik und formale Grammatikbeschreibung\n**Englischer Titel:** Basis module - introduction to computational linguistics and grammar formalisms<br>\n**Modul-Nummer:** 2200<br>\n**ECTS-Leistungspunkte:** 12 ECTS-Leistungspunkte<br>\n**Workload:** 360 Stunden<br>\n**Dauer:** 2 Semester<br>\n**Lehrveranstaltungen und Lehrformen:** a: Einf\u00fchrung in die Computerlinguistik (Seminar) / 2201 | b: Einf\u00fchrung in die Computerlinguistik (\u00dcbung) / 2202 | c: Grammatikformalismen (Seminar) / 2203 | d: Grammatikformalismen (\u00dcbung) / 2204<br>\n**Belegung:** Seminar (a) mit \u00dcbung (b) und Seminar (c) mit \u00dcbung (d)<br>\n**Empfohlenes Studiensemester:** a: 1. Fachsemester (Wintersemester) | b: 1. Fachsemester (Wintersemester) | c: 2. Fachsemester (Sommersemester) | d: 2. Fachsemester (Sommersemester) | Pr\u00fcfung im 2. Fachsemester (Sommersemester)<br>\n**H\u00e4ufigkeit des Angebots:** a: Jedes Wintersemester | b: Jedes Wintersemester | c: Jedes Sommersemester | d: Jedes Sommersemester<br>\n**Geplante Gruppengr\u00f6\u00dfe:** a: Ca. 60 Studierende | b: Ca. 60 Studierende | c: Ca. 60 Studierende | d: Ca. 60 Studierende<br>\n**Kontaktzeit:** a: 2 SWS / 30 Stunden / 1 ECTS-Leistungspunkt | b: 2 SWS/30 Stunden/1 ECTS-Leistungspunkt | c: 2 SWS/30 Stunden / 1 ECTS-Leistungspunkt | d: 2 SWS/30 Stunden / 1 ECTS-Leistungspunkt<br>\n**Selbststudium:** a: 30 Stunden / 1 ECTS-Leistungspunkt | b: 30 Stunden / 1 ECTS-Leistungspunkt | c: 30 Stunden / 1 ECTS-Leistungspunkt | d: 30 Stunden/1 ECTS-Leistungspunkt<br>\n**ECTS-Leistungspunkte f\u00fcr die Modulpr\u00fcfung:** 4 ECTS-Leistungspunkte<br>\n**Inhalte:** Das Seminar \"Einf\u00fchrung in die Computerlinguistik\" gibt einen \u00dcberblick \u00fcber Ziele, Methoden und theoretische Ans\u00e4tze der Computerlinguistik, erg\u00e4nzt durch Beispiele aus relevanten Anwendungsgebieten. Es werden sowohl symbolische Repr\u00e4sentationen als auch datengetrieben Methoden behandelt. Das Seminar \"Grammatikformalismen\" f\u00fchrt in Methoden und Probleme der syntaktischen Modellierung mithilfe von Formalismen wie z.B. HPSG, TAG, CCG usw. ein.<br>\n**Angestrebte Lernergebnisse und Studieninhalte:** Wissen \u00fcber Ziele der Computerlinguistik sowie Vertrautheit mit den grundlegenden formalen und probabilistischen Methoden der Computerlinguistik. Kenntnisse \u00fcber g\u00e4ngige computerlinguistische Formalismen zur Implementierung von Grammatiken.<br>\n**Teilnahmevoraussetzungen:** Formal: Keine | Inhaltlich: Keine<br>\n**Pr\u00fcfungsformen:** Klausur (Pnr. 2210)<br>\n**Voraussetzungen f\u00fcr die Zulassung zur Modulpr\u00fcfung:** -keine-<br>\n**Voraussetzungen f\u00fcr die Vergabe von ECTS-Leistungspunkten:** Erbrachte Studienleistungen (SL) in den Lehrveranstaltungen (a) und (b): 4 ECTS-Leistungspunkte | Erbrachte Studienleistungen (SL) in den Lehrveranstaltungen (c) und (d): 4 ECTS-Leistungspunkte | Bestandene Modulpr\u00fcfung: 4 ECTS-Leistungspunkte<br>\n**Sonstige Informationen:** -keine-",
            "| Modul / Veranstaltung | MP | SL | LP | SWS |\n| :--- | :--- | :--- | :--- | :--- |\n| **Vertiefungsmodul - Computerlinguistik 2** | **1 MP** | **1 SL** | **9 LP** | **4 SWS** |\n| Seminar nach Wahl im Bereich Computerlinguistik | | Pnr. 5301 | 5 LP | 4 SWS |\n| Modulpr\u00fcfung | Pnr. 5310 | | 4 LP | |\n| **Abschlussarbeit und Forschungskolloquium** | | **1 SL** | **15 LP** | **4 SWS** |\n| Forschungskolloquium oder Seminar | | Pnr. 5901 | 3 LP | 2 SWS |\n| Bachelorarbeit | Pnr. 6000 | | 12 LP | |\n| **Profilbildungsbereich** | | | **6 LP** | |",
            "## Exemplarischer Studienverlaufsplan Bachelor Computerlinguistik"
        ],
        "reranking_scores": [
            0.43564707040786743,
            0.05182681977748871,
            0.01428750529885292,
            0.004267587326467037,
            -0.010595554485917091
        ]
    },
    {
        "user_input": "Muss ich f\u00fcr den Python-Kurs Vorkenntnisse haben?",
        "reference": "Nein, f\u00fcr das Modul \"Python-Programmierung\" werden weder formale noch inhaltliche Vorkenntnisse vorausgesetzt.",
        "response": "Dazu enthalten die bereitgestellten Dokumente keine Informationen.",
        "retrieved_contexts": [
            "### Modul: Basismodul - Python-Programmierung\n**Englischer Titel:** Basis module - Python programming<br>\n**Modul-Nummer:** 2300<br>\n**ECTS-Leistungspunkte:** 12 ECTS-Leistungspunkte<br>\n**Workload:** 360 Stunden<br>\n**Dauer:** 2 Semester<br>\n**Lehrveranstaltungen und Lehrformen:** a: Einf\u00fchrung in die Programmierung mit Python (Seminar) / 2301 | b: Einf\u00fchrung in die Programmierung mit Python (\u00dcbung) / 2302 | c: Fortgeschrittene Python-Programmierung mit NLP-Anwendungen (Seminar) / 2303 | d: Fortgeschrittene Python-Programmierung mit NLP-Anwendungen (\u00dcbung) / 2304<br>\n**Belegung:** Seminar (a) mit \u00dcbung (b) und Seminar (c) mit \u00dcbung (d)<br>\n**Empfohlenes Studiensemester:** a: 1. Fachsemester (Wintersemester) | b: 1. Fachsemester (Wintersemester) | c: 2. Fachsemester (Sommersemester) | d: 2. Fachsemester (Sommersemester) | Pr\u00fcfung im 2. Fachsemester (Sommersemester)<br>\n**H\u00e4ufigkeit des Angebots:** a: Jedes Wintersemester | b: Jedes Wintersemester | c: Jedes Sommersemester | d: Jedes Sommersemester<br>\n**Geplante Gruppengr\u00f6\u00dfe:** a: Ca. 60 Studierende | b: Ca. 60 Studierende | c: Ca. 60 Studierende | d: Ca. 60 Studierende<br>\n**Kontaktzeit:** a: 2 SWS / 30 Stunden / 1 ECTS-Leistungspunkt | b: 2 SWS/30 Stunden / 1 ECTS-Leistungspunkt | c: 2 SWS/30 Stunden / 1 ECTS-Leistungspunkt | d: 2 SWS/30 Stunden / 1 ECTS-Leistungspunkt<br>\n**Selbststudium:** a: 30 Stunden / 1 ECTS-Leistungspunkt | b: 30 Stunden / 1 ECTS-Leistungspunkt | c: 30 Stunden / 1 ECTS-Leistungspunkt | d: 30 Stunden/1 ECTS-Leistungspunkt<br>\n**ECTS-Leistungspunkte f\u00fcr die Modulpr\u00fcfung:** 4 ECTS-Leistungspunkte (120 Stunden)<br>\n**Inhalte:** Wintersemester: Grundlagen der Python-Programmierung; Datentypen in Python; g\u00e4ngige Programmkonstrukte; elementare Textverarbeitung. Sommersemester: Objektorientierte und funktionale Programmierung mit Python; Einsatz von Programm-Bibliotheken in den Bereichen Data Science und NLP; Grundz\u00fcge der Sorftware-Entwicklung.<br>\n**Angestrebte Lernergebnisse und Studieninhalte:** Die Studierenden erwerben grundlegende F\u00e4higkeiten in der Programmierung mit der Programmiersprache Python sowie Kenntnisse \u00fcber fortgeschrittene Konzepte der Python-Programmierung (objektorientierte und funktionale Programmierung). Au\u00dferdem werden Grundkenntnisse des Einsatzes von Python in den Bereichen Data Science und NLP (Natural Language Processing) erworben, sowie die F\u00e4higkeit ein kleines Software-Projekt durchzuf\u00fchren und zu pr\u00e4sentieren.<br>\n**Teilnahmevoraussetzungen:** Formal: Keine | Inhaltlich: Keine<br>\n**Pr\u00fcfungsformen:** Projektarbeit (Pnr. 2310)<br>\n**Voraussetzungen f\u00fcr die Zulassung zur Modulpr\u00fcfung:** -keine-<br>\n**Voraussetzungen f\u00fcr die Vergabe von ECTS-Leistungspunkten:** Erbrachte Studienleistungen (SL) in den Lehrveranstaltungen (a) und (b): 4 ECTS-Leistungspunkte | Erbrachte Studienleistungen (SL) in den Lehrveranstaltungen (c) und (d): 4 ECTS-Leistungspunkte | Bestandene Modulpr\u00fcfung: 4 ECTS-Leistungspunkte<br>\n**Sonstige Informationen:** -keine-",
            "| Merkmal | Details |\n| :--- | :--- |\n| **Integrierter Studiengang** | Computerlinguistik |\n| **Studienbeginn** | Nur im Wintersemester |\n| **Studienumfang** | 180 ECTS-Leistungspunkte (LP) |\n| **Notwendige Vorkenntnisse** | Kenntnisse des Englischen (Niveau B1, vergleichbar mit erfolgreichem vierj\u00e4hrigem Schulunterricht an einer weiterf\u00fchrenden Schule) |\n| **Prop\u00e4deutikum im Profilbildungsbereich** | keine Angabe |\n| **Anzahl der Modulpr\u00fcfungen** | 9, zuz\u00fcglich Bachelorarbeit |\n| **Art und Inhalt der Module und der Pr\u00fcfungen** | **Module:**<br>- Basismodul - Mathematische und logische Grundlagen (8 SWS, 1 MP, 12 LP)<br>- Basismodul - Grundlagen der Computerlinguistik und formale Grammatikbeschreibung (8 SWS, 1 MP, 12 LP)<br>- Basismodul - Python-Programmierung (8 SWS, 1 MP, 12 LP)<br>- Basiswissen Linguistik - Morphologie und Syntax (6 SWS, 1 MP, 9 LP)<br>- Basiswissen Linguistik - Semantik und Pragmatik (6 SWS, 1 MP, 9 LP)<br>- Basismodul - Statistische Methoden in der Computerlinguistik (6 SWS, 6 LP)<br>- Aufbaumodul - Maschinelles Lernen (8 SWS, 1 MP, 12 LP)<br>- Aufbaumodul - Mathematische Linguistik (4 SWS, 6 LP)<br>- Aufbaumodul - Parsing (4 SWS, 6 LP)<br>- Aufbaumodul - Logische Programmierung (4 SWS, 6 LP)<br>- Aufbaumodul - Objektorientierte Programmierung (8 SWS, 1 MP, 12 LP)<br>- Praktikum und Orientierung (2 SWS, 12 LP)<br>- Vertiefungsmodul - interdisziplin\u00e4r (8 SWS, 1 MP, 12 LP)<br>- Vertiefungsmodul - Computerlinguistik 1 (8 SWS, 12 LP)<br>- Vertiefungsmodul - Computerlinguistik 2 (4 SWS, 1 MP, 9 LP)<br>- Abschlussarbeit und Forschungskolloquium (2 SWS, 15 LP)<br>- Profilbildungsbereich (18 LP) |\n| **Voraussetzungen f\u00fcr Pr\u00fcfungen** | keine Angabe |\n| **Besonderheiten** | Die zweite Wiederholung einer Modulpr\u00fcfung darf als m\u00fcndliche Pr\u00fcfung erfolgen. |\n| **Gewichtung der Pr\u00fcfungen f\u00fcr die Gesamtnote** | Bachelorarbeit: dreifach<br>Alle Modulpr\u00fcfungen: einfach |\n| **Pr\u00fcfungssprache nach \u00a7 6 (4)** | keine Angabe |\n| **Auslandsaufenthalt** | Optional (Mobilit\u00e4tsfenster: 5. Semester) |\n| **Exkursion** | keine Angabe |\n| **Praktikum** | Nach dem vierten oder f\u00fcnften Semester wird entweder ein mindestens 6-w\u00f6chiges Berufsfeldpraktikum oder eine Projektarbeit absolviert, jeweils mit einschl\u00e4gig computerlinguistischem Inhalt. Das Praktikum soll einen Einblick in die Berufspraxis vermitteln sowie den sp\u00e4teren \u00dcbergang in die Berufswelt erleichtern. Die Wahl des Praktikumsplatzes erfolgt im Einvernehmen mit dem/der Praktikumsbeauftragten der Abteilung f\u00fcr Computerlinguistik. Der/die Praktikumsbeauftragte ist bei der Vermittlung von Praktikumspl\u00e4tzen behilflich und bietet eine fachliche Praktikumsberatung und -begleitung an. \u00dcber das Praktikum ist ein kurzer Bericht (ca. 3-5 Seiten) zu verfassen und ein Zeugnis der Praktikumsstelle einzureichen. |",
            "| Modul / Veranstaltung | MP | SL | LP | SWS |\n| :--- | :--- | :--- | :--- | :--- |\n| **Basismodul - Grundlagen der Computerlinguistik und formale Grammatikbeschreibung [2/2]** | **1 MP** | **2 SL** | **8 LP** | **4 SWS** |\n| Grammatikformalismen (Seminar) | | Pnr. 2203 | 2 LP | 2 SWS |\n| Grammatikformalismen (\u00dcbung) | | Pnr. 2204 | 2 LP | 2 SWS |\n| Modulpr\u00fcfung (Klausur) | Pnr. 2210 | | 4 LP | |\n| **Basismodul - Python-Programmierung [2/2]** | **1 MP** | **2 SL** | **8 LP** | **4 SWS** |\n| Fortgeschrittene Python-Programmierung mit NLP-Anwendungen (Seminar) | | Pnr. 2303 | 2 LP | 2 SWS |\n| Fortgeschrittene Python-Programmierung mit NLP-Anwendungen (\u00dcbung) | | Pnr. 2304 | 2 LP | 2 SWS |\n| Modulpr\u00fcfung (Klausur) | Pnr. 2310 | | 4 LP | |\n| **Basiswissen Linguistik - Semantik und Pragmatik** | **1 MP** | **2 SL** | **9 LP** | **6 SWS** |\n| Vorlesung | | Pnr. 1401 | 4 LP | 4 SWS |\n| Tutorium | | Pnr. 1402 | 2 LP | 2 SWS |\n| Modulpr\u00fcfung (Klausur) | Pnr. 1410 | | 3 LP | |\n| **Basismodul - Statistische Methoden in der Computerlinguistik [1/2]** | **0 MP** | **1 SL** | **4 LP** | **4 SWS** |\n| Wahrscheinlichkeitstheorie und Statistik (Seminar und \u00dcbung) | | Pnr. 2401 | 4 LP | 4 SWS |\n| **Profilbildungsbereich** | | | **1 LP** | |",
            "Die Lehre ist als Pr\u00e4senzstudium organisiert. Im Studium m\u00fcssen die Studierenden nach den Bestimmungen dieser Pr\u00fcfungsordnung Pflicht- und Wahlpflichtveranstaltungen einschlie\u00dflich des Profilbildungsbereiches belegen.",
            "| Modul / Veranstaltung | MP | SL | LP | SWS |\n| :--- | :--- | :--- | :--- | :--- |\n| **Basismodul - Mathematische und logische Grundlagen** | **1 MP** | **2 SL** | **12 LP** | **8 SWS** |\n| Einf\u00fchrung in die computationelle Logik (Seminar mit \u00dcbung) | | Pnr. 2101 | 4 LP | 4 SWS |\n| Mathematische Grundlagen (Seminar) | | Pnr. 2102 | 4 LP | 4 SWS |\n| Modulpr\u00fcfung (Portfolio) | Pnr. 2110 | | 4 LP | |\n| **Basismodul - Grundlagen der Computerlinguistik und formale Grammatikbeschreibung [1/2]** | | **2 SL** | **4 LP** | **4 SWS** |\n| Einf\u00fchrung in die Computerlinguistik (Seminar) | | Pnr. 2201 | 2 LP | 2 SWS |\n| Einf\u00fchrung in die Computerlinguistik (\u00dcbung) | | Pnr. 2202 | 2 LP | 2 SWS |\n| **Basismodul - Python-Programmierung [1/2]** | | **2 SL** | **4 LP** | **4 SWS** |\n| Einf\u00fchrung in die Programmierung mit Python (Seminar) | | Pnr. 2301 | 2 LP | 2 SWS |\n| Einf\u00fchrung in die Programmierung mit Python (\u00dcbung) | | Pnr. 2302 | 2 LP | 2 SWS |\n| **Basiswissen Linguistik - Morphologie und Syntax** | **1 MP** | **2 SL** | **9 LP** | **6 SWS** |\n| Vorlesung | | Pnr. 1301 | 2 LP | 4 SWS |\n| Tutorium | | Pnr. 1302 | 2 LP | 2 SWS |\n| Modulpr\u00fcfung (Klausur) | Pnr. 1310 | | 3 LP | |\n| **Profilbilungsbereich** | | | **1 LP** | |"
        ],
        "reranking_scores": [
            0.2696573734283447,
            0.04806686192750931,
            -0.006788009312003851,
            -0.0318186916410923,
            -0.03648035228252411
        ]
    },
    {
        "user_input": "Gibt es eine \u00dcbung f\u00fcr den Kurs Mathematische Grundlagen?",
        "reference": "Nein, f\u00fcr den Kurs \"Mathematische Grundlagen\" gibt es keine begleitende \u00dcbung. Es handelt sich dabei ausschlie\u00dflich um ein Seminar.",
        "response": "Ja, es gibt eine \u00dcbung f\u00fcr den Kurs Mathematische Grundlagen. Diese \u00dcbung ist Teil der Veranstaltung \"Einf\u00fchrung in die computationelle Logik (Seminar mit \u00dcbung)\" (Modul-Nummer 2101).",
        "retrieved_contexts": [
            "### Modul: Basismodul - Mathematische und logische Grundlagen\n**Englischer Titel:** Basis module - mathematical and logical foundations<br>\n**Modul-Nummer:** 2100<br>\n**ECTS-Leistungspunkte:** 12 ECTS-Leistungspunkte<br>\n**Workload:** 360 Stunden<br>\n**Dauer:** 1 Semester<br>\n**Lehrveranstaltungen und Lehrformen:** a: Einf\u00fchrung in die computationelle Logik (Seminar & \u00dcbung) / 2101 | b: Mathematische Grundlagen (Seminar) / 2102<br>\n**Belegung:** Seminar und \u00dcbung (a) und Seminar (b)<br>\n**Empfohlenes Studiensemester:** a: 1. Fachsemester (Wintersemester) | b: 1. Fachsemester (Wintersemester) | Pr\u00fcfung im 1. Fachsemester (Wintersemester)<br>\n**H\u00e4ufigkeit des Angebots:** a: Jedes Wintersemester | b: Jedes Wintersemester<br>\n**Geplante Gruppengr\u00f6\u00dfe:** a: Ca. 60 Studierende | b: Ca. 60 Studierende<br>\n**Kontaktzeit:** a: 4 SWS/60 Stunden / 2 ECTS-Leistungspunkte | b: 4 SWS/60 Stunden / 2 ECTS-Leistungspunkte<br>\n**Selbststudium:** a: 60 Stunden / 2 ECTS-Leistungspunkte | b: 60 Stunden/2 ECTS-Leistungspunkte<br>\n**ECTS-Leistungspunkte f\u00fcr die Modulpr\u00fcfung:** 4 ECTS-Leistungspunkte<br>\n**Inhalte:** Aufbereitung der mathematischen Schulkenntnisse und deren Vertiefung, um formale Methoden der Mathematik einsetzen zu k\u00f6nnen wie z.B. Mengenlehre, Vektorrechnung oder Beweisf\u00fchrung. Bedeutung der Logik; menschliche Sprache und formale Sprache; Einf\u00fchrung in die Aussagenlogik und Pr\u00e4dikatenlogik; Modelle, Wahrheitswerte und formale Beweise.<br>\n**Angestrebte Lernergebnisse und Studieninhalte:** Die Studierenden beherrschen wesentliche logische und mathematische Verfahren und haben Verst\u00e4ndnis von grundlegenden logischen und mathematischen Methoden sowie deren Anwendung in spezifischen F\u00e4llen. Sie haben das formale R\u00fcstzeug, um die wichtigsten Methoden der formalen Linguistik und Computerlinguistik zu verstehen.<br>\n**Teilnahmevoraussetzungen:** Formal: Keine | Inhaltlich: Keine<br>\n**Pr\u00fcfungsformen:** Portfolio (Pnr. 2110)<br>\n**Voraussetzungen f\u00fcr die Zulassung zur Modulpr\u00fcfung:** -keine-<br>\n**Voraussetzungen f\u00fcr die Vergabe von ECTS-Leistungspunkten:** Erbrachte Studienleistungen (SL) in den Lehrveranstaltungen (a) und (b) und bestandene Modulpr\u00fcfung.<br>\n**Sonstige Informationen:** -keine-",
            "| Modul / Veranstaltung | MP | SL | LP | SWS |\n| :--- | :--- | :--- | :--- | :--- |\n| **Basismodul - Mathematische und logische Grundlagen** | **1 MP** | **2 SL** | **12 LP** | **8 SWS** |\n| Einf\u00fchrung in die computationelle Logik (Seminar mit \u00dcbung) | | Pnr. 2101 | 4 LP | 4 SWS |\n| Mathematische Grundlagen (Seminar) | | Pnr. 2102 | 4 LP | 4 SWS |\n| Modulpr\u00fcfung (Portfolio) | Pnr. 2110 | | 4 LP | |\n| **Basismodul - Grundlagen der Computerlinguistik und formale Grammatikbeschreibung [1/2]** | | **2 SL** | **4 LP** | **4 SWS** |\n| Einf\u00fchrung in die Computerlinguistik (Seminar) | | Pnr. 2201 | 2 LP | 2 SWS |\n| Einf\u00fchrung in die Computerlinguistik (\u00dcbung) | | Pnr. 2202 | 2 LP | 2 SWS |\n| **Basismodul - Python-Programmierung [1/2]** | | **2 SL** | **4 LP** | **4 SWS** |\n| Einf\u00fchrung in die Programmierung mit Python (Seminar) | | Pnr. 2301 | 2 LP | 2 SWS |\n| Einf\u00fchrung in die Programmierung mit Python (\u00dcbung) | | Pnr. 2302 | 2 LP | 2 SWS |\n| **Basiswissen Linguistik - Morphologie und Syntax** | **1 MP** | **2 SL** | **9 LP** | **6 SWS** |\n| Vorlesung | | Pnr. 1301 | 2 LP | 4 SWS |\n| Tutorium | | Pnr. 1302 | 2 LP | 2 SWS |\n| Modulpr\u00fcfung (Klausur) | Pnr. 1310 | | 3 LP | |\n| **Profilbilungsbereich** | | | **1 LP** | |",
            "(3) Die Vermittlung der Lehrinhalte und Kompetenzen findet in Studienmodulen statt. In Modulen werden thematisch, methodisch oder systematisch zusammenh\u00e4ngende Lehrveranstaltungen geb\u00fcndelt. Ein Modul umfasst mindestens 5 LP.",
            "(1) In allen Lehrveranstaltungen sind Studienleistungen obligatorisch. Studienleistungen im Sinne dieser Pr\u00fcfungsordnung werden durch die aktive Teilnahme an Lehrveranstaltungen erbracht. Studienleistungen sind auf die in der Modulbeschreibung definierten Inhalte und Kompetenzen ausgerichtet. Der Workload von Studienleistungen ist durch die Modulbeschreibung begrenzt. Studienleistungen sind unbenotet und k\u00f6nnen als Pr\u00fcfungsvoraussetzung bestimmt werden. N\u00e4heres regelt der f\u00e4cherspezifische Anhang.",
            "| Modul / Veranstaltung | MP | SL | LP | SWS |\n| :--- | :--- | :--- | :--- | :--- |\n| **Basismodul - Statistische Methoden in der Computerlinguistik [2/2]** | | **1 SL** | **2 LP** | **2 SWS** |\n| Linguistische Ressourcen (Seminar) | | Pnr. 2402 | 2 LP | 2 SWS |\n| **Aufbaumodul - Maschinelles Lernen [1/2]** | | **1 SL** | **4 LP** | **4 SWS** |\n| Grundlagen des maschinellen Lernens (Seminar und \u00dcbung) | | Pnr. 4101 | 4 LP | 4 SWS |\n| **Aufbaumodul - Mathematische Linguistik** | | **2 SL** | **6 LP** | **4 SWS** |\n| Automatentheorie & Formale Sprachen (Seminar) | | Pnr. 4201 | 3 LP | 2 SWS |\n| Automatentheorie & Formale Sprachen (\u00dcbung) | | Pnr. 4202 | 3 LP | 2 SWS |\n| **Aufbaumodul - Objektorientierte Programmierung** | **1 MP** | **3 SL** | **12 LP** | **8 SWS** |\n| Programmierung (Vorlesung) | | Pnr. 4501 | 4 LP | 4 SWS |\n| Programmierung (\u00dcbung) | | Pnr. 4502 | 2 LP | 2 SWS |\n| Praktische \u00dcbung zur Vorlesung | | Pnr. 4503 | 2 LP | 2 SWS |\n| Modulpr\u00fcfung (Klausur) | Pnr. 4510 | | 4 LP | |\n| **Profilbildungsbereich** | | | **6 LP** | |"
        ],
        "reranking_scores": [
            0.23781190812587738,
            0.16885842382907867,
            -0.00016566389240324497,
            -0.06969330459833145,
            -0.08035891503095627
        ]
    },
    {
        "user_input": "Wann soll ich das Praktikum machen?",
        "reference": "Es wird empfohlen, das Berufsfeldpraktikum nach dem vierten oder f\u00fcnften Semester zu absolvieren.",
        "response": "Das Praktikum soll nach dem vierten oder f\u00fcnften Semester absolviert werden.",
        "retrieved_contexts": [
            "| Merkmal | Details |\n| :--- | :--- |\n| **Integrierter Studiengang** | Computerlinguistik |\n| **Studienbeginn** | Nur im Wintersemester |\n| **Studienumfang** | 180 ECTS-Leistungspunkte (LP) |\n| **Notwendige Vorkenntnisse** | Kenntnisse des Englischen (Niveau B1, vergleichbar mit erfolgreichem vierj\u00e4hrigem Schulunterricht an einer weiterf\u00fchrenden Schule) |\n| **Prop\u00e4deutikum im Profilbildungsbereich** | keine Angabe |\n| **Anzahl der Modulpr\u00fcfungen** | 9, zuz\u00fcglich Bachelorarbeit |\n| **Art und Inhalt der Module und der Pr\u00fcfungen** | **Module:**<br>- Basismodul - Mathematische und logische Grundlagen (8 SWS, 1 MP, 12 LP)<br>- Basismodul - Grundlagen der Computerlinguistik und formale Grammatikbeschreibung (8 SWS, 1 MP, 12 LP)<br>- Basismodul - Python-Programmierung (8 SWS, 1 MP, 12 LP)<br>- Basiswissen Linguistik - Morphologie und Syntax (6 SWS, 1 MP, 9 LP)<br>- Basiswissen Linguistik - Semantik und Pragmatik (6 SWS, 1 MP, 9 LP)<br>- Basismodul - Statistische Methoden in der Computerlinguistik (6 SWS, 6 LP)<br>- Aufbaumodul - Maschinelles Lernen (8 SWS, 1 MP, 12 LP)<br>- Aufbaumodul - Mathematische Linguistik (4 SWS, 6 LP)<br>- Aufbaumodul - Parsing (4 SWS, 6 LP)<br>- Aufbaumodul - Logische Programmierung (4 SWS, 6 LP)<br>- Aufbaumodul - Objektorientierte Programmierung (8 SWS, 1 MP, 12 LP)<br>- Praktikum und Orientierung (2 SWS, 12 LP)<br>- Vertiefungsmodul - interdisziplin\u00e4r (8 SWS, 1 MP, 12 LP)<br>- Vertiefungsmodul - Computerlinguistik 1 (8 SWS, 12 LP)<br>- Vertiefungsmodul - Computerlinguistik 2 (4 SWS, 1 MP, 9 LP)<br>- Abschlussarbeit und Forschungskolloquium (2 SWS, 15 LP)<br>- Profilbildungsbereich (18 LP) |\n| **Voraussetzungen f\u00fcr Pr\u00fcfungen** | keine Angabe |\n| **Besonderheiten** | Die zweite Wiederholung einer Modulpr\u00fcfung darf als m\u00fcndliche Pr\u00fcfung erfolgen. |\n| **Gewichtung der Pr\u00fcfungen f\u00fcr die Gesamtnote** | Bachelorarbeit: dreifach<br>Alle Modulpr\u00fcfungen: einfach |\n| **Pr\u00fcfungssprache nach \u00a7 6 (4)** | keine Angabe |\n| **Auslandsaufenthalt** | Optional (Mobilit\u00e4tsfenster: 5. Semester) |\n| **Exkursion** | keine Angabe |\n| **Praktikum** | Nach dem vierten oder f\u00fcnften Semester wird entweder ein mindestens 6-w\u00f6chiges Berufsfeldpraktikum oder eine Projektarbeit absolviert, jeweils mit einschl\u00e4gig computerlinguistischem Inhalt. Das Praktikum soll einen Einblick in die Berufspraxis vermitteln sowie den sp\u00e4teren \u00dcbergang in die Berufswelt erleichtern. Die Wahl des Praktikumsplatzes erfolgt im Einvernehmen mit dem/der Praktikumsbeauftragten der Abteilung f\u00fcr Computerlinguistik. Der/die Praktikumsbeauftragte ist bei der Vermittlung von Praktikumspl\u00e4tzen behilflich und bietet eine fachliche Praktikumsberatung und -begleitung an. \u00dcber das Praktikum ist ein kurzer Bericht (ca. 3-5 Seiten) zu verfassen und ein Zeugnis der Praktikumsstelle einzureichen. |",
            "(5) N\u00e4heres regeln die Praktikumsordnungen der einzelnen Studieng\u00e4nge.",
            "(2) Das Berufsfeldpraktikum gibt einen Einblick in einschl\u00e4gige Berufsfelder und die Berufspraxis und erm\u00f6glicht eine Erprobung von Fachkenntnissen in der Praxis. Auf diese Weise sollen den Studierenden konkrete berufsqualifizierende F\u00e4higkeiten und Handlungskompetenzen vermittelt und der \u00dcbergang in die Berufswelt erleichtert werden.",
            "(1) In einigen Studieng\u00e4ngen ist ein obligatorisches Berufsfeldpraktikum zu absolvieren, das von vier Wochen bis zu drei Monaten dauern kann. Das Berufsfeldpraktikum kann auch in Abschnitten absolviert werden. Einschl\u00e4gige Berufst\u00e4tigkeiten und Praxiserfahrungen k\u00f6nnen im Einzelfall auf das Berufsfeldpraktikum angerechnet werden. F\u00fcr je vier Wochen Berufsfeldpraktikum werden mindestens 5 LP angerechnet.",
            "(1) Die Anfertigung der Bachelorarbeit erfolgt in der Regel im sechsten Studiensemester."
        ],
        "reranking_scores": [
            0.22722898423671722,
            0.04543299973011017,
            0.043051645159721375,
            0.03320591524243355,
            -0.009337196126580238
        ]
    },
    {
        "user_input": "Gibt es eine generelle Anwesenheitspflicht f\u00fcr Vorlesungen?",
        "reference": "Nein, bei Vorlesungen kann keine Anwesenheitspflicht festgelegt werden.",
        "response": "Dazu enthalten die bereitgestellten Dokumente keine Informationen.",
        "retrieved_contexts": [
            "Eine Pflicht zur Anwesenheit in Lehrveranstaltungen kann in allen Modulen oder Modulteilen vorgeschrieben werden, in denen die regelm\u00e4\u00dfige Anwesenheit und die aktive Teilnahme f\u00fcr das Erreichen des Lernziels erforderlich ist. Generell gilt dies f\u00fcr Exkursionen, Forschungsprojekte, Praktika, Sprachkurse und \u00dcbungen. Seminare sind grunds\u00e4tzlich auf die kontinuierliche Beteiligung aller Studierenden am Dialog ausgerichtet und k\u00f6nnen mit einer Anwesenheitspflicht belegt werden, sofern nicht mehr als 25 Personen teilnehmen. Bei Vorlesungen kann keine Anwesenheitspflicht festgelegt werden. F\u00fcr andere Lehrveranstaltungen gilt eine Anwesenheitspflicht nur dann, wenn sie im jeweiligen f\u00e4cherspezifischen Anhang explizit festgelegt ist. Die Anwesenheitspflicht ist erf\u00fcllt, wenn ein/e Studierende/r 80% der Veranstaltungszeit beigewohnt hat.",
            "### \u00a7 8 Anwesenheitspflicht",
            "Die Lehre ist als Pr\u00e4senzstudium organisiert. Im Studium m\u00fcssen die Studierenden nach den Bestimmungen dieser Pr\u00fcfungsordnung Pflicht- und Wahlpflichtveranstaltungen einschlie\u00dflich des Profilbildungsbereiches belegen.",
            "\u00a7 8 Anwesenheitspflicht",
            "(1) In allen Lehrveranstaltungen sind Studienleistungen obligatorisch. Studienleistungen im Sinne dieser Pr\u00fcfungsordnung werden durch die aktive Teilnahme an Lehrveranstaltungen erbracht. Studienleistungen sind auf die in der Modulbeschreibung definierten Inhalte und Kompetenzen ausgerichtet. Der Workload von Studienleistungen ist durch die Modulbeschreibung begrenzt. Studienleistungen sind unbenotet und k\u00f6nnen als Pr\u00fcfungsvoraussetzung bestimmt werden. N\u00e4heres regelt der f\u00e4cherspezifische Anhang."
        ],
        "reranking_scores": [
            0.49595290422439575,
            0.043292902410030365,
            0.027119699865579605,
            0.024545812979340553,
            -0.002734373789280653
        ]
    },
    {
        "user_input": "Wann gilt die Anwesenheitspflicht in einer Lehrveranstaltung als erf\u00fcllt?",
        "reference": "Die Anwesenheitspflicht ist erf\u00fcllt, wenn ein Studierender oder eine Studierende 80% der Veranstaltungszeit beigewohnt hat.",
        "response": "Die Anwesenheitspflicht gilt als erf\u00fcllt, wenn ein/e Studierende/r 80% der Veranstaltungszeit beigewohnt hat.",
        "retrieved_contexts": [
            "Eine Pflicht zur Anwesenheit in Lehrveranstaltungen kann in allen Modulen oder Modulteilen vorgeschrieben werden, in denen die regelm\u00e4\u00dfige Anwesenheit und die aktive Teilnahme f\u00fcr das Erreichen des Lernziels erforderlich ist. Generell gilt dies f\u00fcr Exkursionen, Forschungsprojekte, Praktika, Sprachkurse und \u00dcbungen. Seminare sind grunds\u00e4tzlich auf die kontinuierliche Beteiligung aller Studierenden am Dialog ausgerichtet und k\u00f6nnen mit einer Anwesenheitspflicht belegt werden, sofern nicht mehr als 25 Personen teilnehmen. Bei Vorlesungen kann keine Anwesenheitspflicht festgelegt werden. F\u00fcr andere Lehrveranstaltungen gilt eine Anwesenheitspflicht nur dann, wenn sie im jeweiligen f\u00e4cherspezifischen Anhang explizit festgelegt ist. Die Anwesenheitspflicht ist erf\u00fcllt, wenn ein/e Studierende/r 80% der Veranstaltungszeit beigewohnt hat.",
            "Die Lehre ist als Pr\u00e4senzstudium organisiert. Im Studium m\u00fcssen die Studierenden nach den Bestimmungen dieser Pr\u00fcfungsordnung Pflicht- und Wahlpflichtveranstaltungen einschlie\u00dflich des Profilbildungsbereiches belegen.",
            "(1) In allen Lehrveranstaltungen sind Studienleistungen obligatorisch. Studienleistungen im Sinne dieser Pr\u00fcfungsordnung werden durch die aktive Teilnahme an Lehrveranstaltungen erbracht. Studienleistungen sind auf die in der Modulbeschreibung definierten Inhalte und Kompetenzen ausgerichtet. Der Workload von Studienleistungen ist durch die Modulbeschreibung begrenzt. Studienleistungen sind unbenotet und k\u00f6nnen als Pr\u00fcfungsvoraussetzung bestimmt werden. N\u00e4heres regelt der f\u00e4cherspezifische Anhang.",
            "### \u00a7 8 Anwesenheitspflicht",
            "\u00a7 8 Anwesenheitspflicht"
        ],
        "reranking_scores": [
            0.5761180520057678,
            -0.006096647586673498,
            -0.01732325553894043,
            -0.018081169575452805,
            -0.031073564663529396
        ]
    },
    {
        "user_input": "Gibt es eine Klausur in Wahrscheinlichkeitstheorie?",
        "reference": "Nein, im \"Basismodul - Statistische Methoden in der Computerlinguistik\", zu dem die Wahrscheinlichkeitstheorie geh\u00f6rt, gibt es gar keine Modulpr\u00fcfung und somit auch keine Klausur. Es m\u00fcssen lediglich Studienleistungen erbracht werden.",
        "response": "Nein, es gibt keine Klausur in Wahrscheinlichkeitstheorie.",
        "retrieved_contexts": [
            "(1) Schriftliche Modulpr\u00fcfungen k\u00f6nnen als Klausuren oder dokumentierte Einzelberichte ausgestaltet werden. Klausuren k\u00f6nnen Aufgaben enthalten, bei denen mehrere Antworten zur Wahl stehen (Antwort-Wahl beziehungsweise Multiple-Choice-Aufgaben).",
            "| Modul / Veranstaltung | MP | SL | LP | SWS |\n| :--- | :--- | :--- | :--- | :--- |\n| **Basismodul - Grundlagen der Computerlinguistik und formale Grammatikbeschreibung [2/2]** | **1 MP** | **2 SL** | **8 LP** | **4 SWS** |\n| Grammatikformalismen (Seminar) | | Pnr. 2203 | 2 LP | 2 SWS |\n| Grammatikformalismen (\u00dcbung) | | Pnr. 2204 | 2 LP | 2 SWS |\n| Modulpr\u00fcfung (Klausur) | Pnr. 2210 | | 4 LP | |\n| **Basismodul - Python-Programmierung [2/2]** | **1 MP** | **2 SL** | **8 LP** | **4 SWS** |\n| Fortgeschrittene Python-Programmierung mit NLP-Anwendungen (Seminar) | | Pnr. 2303 | 2 LP | 2 SWS |\n| Fortgeschrittene Python-Programmierung mit NLP-Anwendungen (\u00dcbung) | | Pnr. 2304 | 2 LP | 2 SWS |\n| Modulpr\u00fcfung (Klausur) | Pnr. 2310 | | 4 LP | |\n| **Basiswissen Linguistik - Semantik und Pragmatik** | **1 MP** | **2 SL** | **9 LP** | **6 SWS** |\n| Vorlesung | | Pnr. 1401 | 4 LP | 4 SWS |\n| Tutorium | | Pnr. 1402 | 2 LP | 2 SWS |\n| Modulpr\u00fcfung (Klausur) | Pnr. 1410 | | 3 LP | |\n| **Basismodul - Statistische Methoden in der Computerlinguistik [1/2]** | **0 MP** | **1 SL** | **4 LP** | **4 SWS** |\n| Wahrscheinlichkeitstheorie und Statistik (Seminar und \u00dcbung) | | Pnr. 2401 | 4 LP | 4 SWS |\n| **Profilbildungsbereich** | | | **1 LP** | |",
            "(5) Modulpr\u00fcfungen erfolgen als Klausur, auch in elektronischer Form, in Form einer m\u00fcndlichen Pr\u00fcfung, Studienarbeit, Hausarbeit, Portfolio oder Projektarbeit mit individuell zurechenbarer Pr\u00fcfungsleistung. Hierbei soll die Kandidatin oder der Kandidat nachweisen, dass sie oder er in begrenzter Zeit und mit begrenzten Hilfsmitteln ein Problem aus dem Stoffgebiet einer oder mehrerer Lehrveranstaltungen mit den in diesem Gebiet gel\u00e4ufigen Methoden erkennen und Wege zu seiner L\u00f6sung finden kann, die aus der Modulbeschreibung ersichtlichen Lernergebnisse und Kompetenzen also erreicht hat.",
            "### Modul: Basismodul - Statistische Methoden in der Computerlinguistik\n**Englischer Titel:** Basis module - statistical methods in computational linguistics<br>\n**Modul-Nummer:** 2400<br>\n**ECTS-Leistungspunkte:** 6 ECTS-Leistungspunkte<br>\n**Workload:** 180 Stunden<br>\n**Dauer:** 2 Semester<br>\n**Lehrveranstaltungen und Lehrformen:** a: Wahrscheinlichkeitstheorie und Statistik (Seminar und \u00dcbung) / 2401 | b: Linguistische Ressourcen (Seminar) / 2402<br>\n**Belegung:** Seminar mit \u00dcbung (a) und Seminar (b)<br>\n**Empfohlenes Studiensemester:** a: 2. Fachsemester (Sommersemester) | b: 3. Fachsemester (Wintersemester)<br>\n**H\u00e4ufigkeit des Angebots:** a: Jedes Wintersemester | b: Jedes Sommersemester<br>\n**Geplante Gruppengr\u00f6\u00dfe:** a: Ca. 60 Studierende | b: Ca. 60 Studierende<br>\n**Kontaktzeit:** a: 4 SWS/60 Stunden / 2 ECTS-Leistungspunkte | b: 2 SWS/30 Stunden / 1 ECTS-Leistungspunkt<br>\n**Selbststudium:** a: 60 Stunden / 2 ECTS-Leistungspunkte | b: 30 Stunden / 1 ECTS-Leistungspunkt<br>\n**ECTS-Leistungspunkte f\u00fcr die Modulpr\u00fcfung:** -keine-<br>\n**Inhalte:** Dieses Modul vermittelt grundlegende Kenntnisse in Wahrscheinlichkeitstheorie und in statistischen Methoden der Computerlinguistik, sowie deren Anwendung mittels Korpora und Datens\u00e4tzen. Unter anderem werden folgende Bereiche abgedeckt: Statistik und statistische Programmierung in einer geeigneten Programmiersprache (z.B. R); Aufbau und Pflege linguistischer Ressourcen (Korpora, Datenbanken, ...).<br>\n**Angestrebte Lernergebnisse und Studieninhalte:** Kenntnisse der Grundlagen der Wahrscheinlichkeitstheorie und Grundbegriffe der Statistik. F\u00e4higkeit, statistische Analysen selbst zu konzipieren und implementieren. F\u00e4higkeit, Korpora zu erstellen und f\u00fcr Experimente und Analysen durchzuf\u00fchren.<br>\n**Teilnahmevoraussetzungen:** Formal: keine | Inhaltlich: Basismodul Mathematische und logische Grundlagen<br>\n**Pr\u00fcfungsformen:** -keine-<br>\n**Voraussetzungen f\u00fcr die Zulassung zur Modulpr\u00fcfung:** -keine-<br>\n**Voraussetzungen f\u00fcr die Vergabe von ECTS-Leistungspunkten:** Erbrachte Studienleistungen (SL) oder Hausaufgaben in allen Lehrveranstaltungen<br>\n**Sonstige Informationen:** -keine-",
            "| Modul / Veranstaltung | MP | SL | LP | SWS |\n| :--- | :--- | :--- | :--- | :--- |\n| **Basismodul - Statistische Methoden in der Computerlinguistik [2/2]** | | **1 SL** | **2 LP** | **2 SWS** |\n| Linguistische Ressourcen (Seminar) | | Pnr. 2402 | 2 LP | 2 SWS |\n| **Aufbaumodul - Maschinelles Lernen [1/2]** | | **1 SL** | **4 LP** | **4 SWS** |\n| Grundlagen des maschinellen Lernens (Seminar und \u00dcbung) | | Pnr. 4101 | 4 LP | 4 SWS |\n| **Aufbaumodul - Mathematische Linguistik** | | **2 SL** | **6 LP** | **4 SWS** |\n| Automatentheorie & Formale Sprachen (Seminar) | | Pnr. 4201 | 3 LP | 2 SWS |\n| Automatentheorie & Formale Sprachen (\u00dcbung) | | Pnr. 4202 | 3 LP | 2 SWS |\n| **Aufbaumodul - Objektorientierte Programmierung** | **1 MP** | **3 SL** | **12 LP** | **8 SWS** |\n| Programmierung (Vorlesung) | | Pnr. 4501 | 4 LP | 4 SWS |\n| Programmierung (\u00dcbung) | | Pnr. 4502 | 2 LP | 2 SWS |\n| Praktische \u00dcbung zur Vorlesung | | Pnr. 4503 | 2 LP | 2 SWS |\n| Modulpr\u00fcfung (Klausur) | Pnr. 4510 | | 4 LP | |\n| **Profilbildungsbereich** | | | **6 LP** | |"
        ],
        "reranking_scores": [
            0.11388085782527924,
            0.1091684028506279,
            0.09216801822185516,
            0.05823441594839096,
            -0.0834517553448677
        ]
    },
    {
        "user_input": "Wie lang dauert eine Klausur?",
        "reference": "Die Dauer einer Klausurarbeit betr\u00e4gt in der Regel 90 Minuten.",
        "response": "Dazu enthalten die bereitgestellten Dokumente keine Informationen.",
        "retrieved_contexts": [
            "(3) Die Dauer einer Klausurarbeit betr\u00e4gt in der Regel 90 Minuten. Ausnahmsweise kann die Bearbeitungszeit abh\u00e4ngig vom Workload des Moduls auf h\u00f6chstens 180 Minuten verl\u00e4ngert oder auf mindestens 45 Minuten verk\u00fcrzt werden. Die Bewertung einer Klausur wird durch die Dozentinnen und Dozenten vorgenommen. Die Bewertung ist der Kandidatin oder dem Kandidaten nach sp\u00e4testens acht Wochen bekannt zu machen. N\u00e4heres regelt der f\u00e4cherspezifische Anhang.",
            "(4) Eine Studienarbeit besteht aus der m\u00fcndlichen Pr\u00e4sentation und schriftlichen Ausarbeitung einer Thematik aus dem Stoffgebiet einer oder mehrerer Lehrveranstaltungen. Alternativ kann eine Klausur von 45 Minuten Dauer an die Stelle der schriftlichen Ausarbeitung treten. Die Dauer der m\u00fcndlichen Pr\u00e4sentation betr\u00e4gt mindestens 15 Minuten. Der Umfang der schriftlichen Ausarbeitung soll mindestens 1500 W\u00f6rter (circa 5 Seiten) und h\u00f6chstens 4500 W\u00f6rter (circa 15 Seiten) betragen. Die Bewertung einer Studienarbeit wird durch die Dozentin oder den Dozenten vorgenommen. Die Bewertung ist der Kandidatin oder dem Kandidaten nach sp\u00e4testens acht Wochen nach Abgabe der schriftlichen Ausarbeitung bekannt zu machen.",
            "(1) Die Dauer einer m\u00fcndlichen Pr\u00fcfung betr\u00e4gt mindestens 15 und h\u00f6chstens 30 Minuten. M\u00fcndliche Pr\u00fcfungen werden als Einzelpr\u00fcfung vor einer Pr\u00fcferin oder einem Pr\u00fcfer in Gegenwart einer sachkundigen Beisitzerin oder eines sachkundigen Beisitzers gem\u00e4\u00df \u00a7 25 Absatz 5 abgelegt. In der Regel f\u00fchrt die Beisitzerin oder der Beisitzer das Protokoll. In dem Protokoll werden die wesentlichen Gegenst\u00e4nde und Ergebnisse der Pr\u00fcfung festgehalten. Vor der Festsetzung der Note h\u00f6rt die Pr\u00fcferin oder der Pr\u00fcfer die Beisitzerin oder den Beisitzer. Die Bewertung ist der Kandidatin oder dem Kandidaten unmittelbar nach Ende der Pr\u00fcfung bekannt zu machen.",
            "(2) Zu Modulpr\u00fcfungen wird ebenfalls zugelassen, wer eine Zugangspr\u00fcfung f\u00fcr beruflich Qualifizierte gem\u00e4\u00df \u00a7 49 Absatz 6 HG in Verbindung mit der Ordnung zur Weitergeltung von Vorschriften \u00fcber den Hochschulzugang in Studieng\u00e4ngen der Philosophischen Fakult\u00e4t der Heinrich-Heine-Universit\u00e4t D\u00fcsseldorf vom 12.05.2010 (Weitergeltungsordnung) erfolgreich bestanden hat. Pr\u00fcfung im Sinne von \u00a7 2 der Weitergeltungsordnung sind eine Klausurarbeit von zwei Zeitstunden und eine m\u00fcndliche Pr\u00fcfung von 20 bis 30 Minuten Dauer, in denen die Kandidatin oder der Kandidat ihre oder seine fachlichen und methodischen Voraussetzungen f\u00fcr ein Bachelorstudium nachweist. Die Anforderungen an die Durchf\u00fchrung und Bewertung der Klausurarbeit und der m\u00fcndlichen Pr\u00fcfung entsprechen den Anforderungen an Klausuren und m\u00fcndliche Pr\u00fcfungen im Sinne von \u00a7 13 Absatz 1 und \u00a7 14 Absatz 3 dieser Ordnung. Die Note errechnet sich als arithmetisches Mittel der einzelnen Pr\u00fcfungsteilleistungen, wobei jede Teilleistung mindestens als bestanden gewertet sein muss. Nach der Berechnung des arithmetischen Mittels werden alle Dezimalstellen au\u00dfer der ersten ohne Rundung gestrichen. Ein Probestudium gem\u00e4\u00df \u00a7 5 Berufsbildungshochschulzugangsverordnung dauert in allen Studieng\u00e4ngen zwei Semester. Ein Test im Sinne von \u00a7 10 Absatz 5 Satz 2 Berufsbildungshochschulzugangsverordnung ist der m\u00fcndliche Pr\u00fcfungsteil gem\u00e4\u00df Absatz 2 dieser Ordnung. Der Antrag ist \u00fcber die Studierenden- und Pr\u00fcfungsverwaltung an den Pr\u00fcfungsausschuss zu stellen.",
            "(9) Die Bewertung von Pr\u00fcfungen ist den Studierenden jeweils nach sp\u00e4testens acht Wochen bekanntzugeben."
        ],
        "reranking_scores": [
            0.3538009822368622,
            0.128009632229805,
            0.07184842973947525,
            0.047145772725343704,
            -0.04201425611972809
        ]
    },
    {
        "user_input": "Wie oft darf ich eine nicht bestandene Modulpr\u00fcfung wiederholen?",
        "reference": "Eine nicht bestandene Modulpr\u00fcfung kann insgesamt zweimal wiederholt werden.",
        "response": "Eine nicht bestandene Modulpr\u00fcfung kann zweimal wiederholt werden.",
        "retrieved_contexts": [
            "(5) Eine nicht bestandene Modulpr\u00fcfung, beziehungsweise eine mit weniger als \"ausreichend\" bewertete Pr\u00fcfungsleistung als Teil der Gruppenarbeit, kann zweimal wiederholt werden.",
            "(7) Die Wiederholungspr\u00fcfung soll innerhalb eines Jahres nach Abschluss der nicht bestandenen Pr\u00fcfung abgeschlossen sein.",
            "(9) Die Bachelorpr\u00fcfung ist endg\u00fcltig nicht bestanden, wenn\n\u2022 die Bachelorarbeit nicht bestanden ist und nicht mehr wiederholt werden darf,\n\u2022 eine verpflichtende Modulpr\u00fcfung nicht bestanden ist und nicht mehr wiederholt werden darf oder\n\u2022 eine Modulpr\u00fcfung in einem Wahlpflichtbereich nicht bestanden ist, nicht mehr wiederholt werden darf und es nicht m\u00f6glich ist, die notwendige Bestehensgrenze des Wahlpflichtbereiches durch alternative Modulpr\u00fcfungen zu erreichen.",
            "(4) Ist eine Pr\u00fcfung nicht bestanden, oder gilt sie im Sinne von \u00a7 17 Absatz 2 oder 4 beziehungsweise \u00a7 16 Absatz 1 als nicht bestanden, erteilt die oder der Vorsitzende des Pr\u00fcfungsausschusses beziehungsweise ihre oder seine Stellvertretung der Kandidatin oder dem Kandidaten hier\u00fcber einen schriftlichen Bescheid, der auch dar\u00fcber Auskunft gibt, ob die Pr\u00fcfung wiederholt werden kann. Der Bescheid \u00fcber die nicht bestandene Pr\u00fcfung ist mit einer Rechtsbehelfsbelehrung zu versehen.",
            "(3) Eine bestandene Pr\u00fcfung kann nicht wiederholt werden."
        ],
        "reranking_scores": [
            0.5334993004798889,
            0.3542185425758362,
            0.19953715801239014,
            0.14408569037914276,
            0.06774108856916428
        ]
    },
    {
        "user_input": "Wie stark z\u00e4hlt die Bachelorarbeit f\u00fcr meine Abschlussnote?",
        "reference": "Die Note der Bachelorarbeit wird bei der Ermittlung der Gesamtnote dreifach gewichtet. Im Vergleich dazu gehen alle anderen Modulpr\u00fcfungen nur einfach in die Gesamtnote ein.",
        "response": "Die Bachelorarbeit z\u00e4hlt bei integrierten Studieng\u00e4ngen dreifach oder vierfach gewichtet, w\u00e4hrend bei Kern- und Erg\u00e4nzungsfachstudieng\u00e4ngen sie zu 20 Prozent der Gesamtnote ausmacht.",
        "retrieved_contexts": [
            "(6) Die Gesamtnote der Bachelorpr\u00fcfung bei Kern- und Erg\u00e4nzungsfachstudieng\u00e4ngen errechnet sich zu 20 Prozent aus der Note der Bachelorarbeit, zu 50 Prozent aus dem gewichteten arithmetischen Mittel aller Modulnoten des Kernfaches, und zu 30 Prozent aus dem gewichteten arithmetischen Mittel aller Modulnoten des Erg\u00e4nzungsfaches. Modulnoten k\u00f6nnen nach Ma\u00dfgabe des f\u00e4cherspezifischen Anhangs doppelt oder dreifach gewichtet werden. Alle Dezimalstellen au\u00dfer der ersten werden ohne Rundung gestrichen.",
            "(5) Die Gesamtnote der Bachelorpr\u00fcfung bei integrierten Studieng\u00e4ngen errechnet sich als gewichtetes arithmetisches Mittel aus den Modulnoten und der Bachelorarbeit. Alle Dezimalstellen au\u00dfer der ersten werden ohne Rundung gestrichen. Die Bachelorarbeit wird nach Ma\u00dfgabe des f\u00e4cherspezifischen Anhangs dreifach oder vierfach gewichtet. Die Gewichtung der Modulnoten ist im f\u00e4cherspezifischen Anhang angegeben.",
            "(3) Die der Bachelorarbeit ergibt sich wie folgt. Wenn die Noten beider Gutachten mindestens \"ausreichend\" (4,0) sind und nicht mehr als 2,0 auseinander liegen, errechnet sich die Endnote als der Durchschnitt der beiden Noten. Wenn beide Noten \"nicht ausreichend\" (5,0) sind, ist die Endnote \"nicht ausreichend\" (5,0). Wenn eine der beiden Noten \"nicht ausreichend\" (5,0) und die andere mindestens \"ausreichend\" (4,0) ist oder wenn die Noten der beiden Gutachten mehr als 2,0 auseinander liegen, bestellt die oder der Vorsitzende des Pr\u00fcfungsausschusses beziehungsweise ihre oder seine Stellvertretung eine dritte Gutachterin oder einen dritten Gutachter. Die Endnote errechnet sich dann als der Durchschnitt der beiden besseren Noten, falls sie mindestens \"ausreichend\" (4,0) sind. Alle Dezimalstellen au\u00dfer der ersten werden ohne Rundung gestrichen. Sind zwei der drei Noten \"nicht ausreichend\" (5,0), ist die Endnote \"nicht ausreichend\" (5,0).",
            "(5) Die Bachelorarbeit wird mit 12 ECTS-Leistungspunkten gewertet.",
            "(7) Im Bachelorpr\u00fcfungszeugnis und auf den Leistungs\u00fcbersichten werden alle Noten (auch ggf. die von Modulen und Bereichen) sowie die Gesamtnote angegeben. Alle Dezimalstellen au\u00dfer der ersten werden ohne Rundung gestrichen. Die Endnote lautet dann bei einem Wert:\nbis 1,5: sehr gut\nvon 1,6 bis 2,5: gut\nvon 2,6 bis 3,5: befriedigend\nvon 3,6 bis 4,0: ausreichend"
        ],
        "reranking_scores": [
            0.33863306045532227,
            0.1875290721654892,
            0.157377228140831,
            0.09878776222467422,
            0.0778772383928299
        ]
    },
    {
        "user_input": "Was passiert, wenn ich in einer Pr\u00e4senzpr\u00fcfung generative K\u00fcnstliche Intelligenz benutze?",
        "reference": "Der Einsatz generativer K\u00fcnstlicher Intelligenz im Rahmen von Pr\u00e4senzpr\u00fcfungen ist unzul\u00e4ssig. Dies gilt als T\u00e4uschungsversuch.",
        "response": "Wenn du in einer Pr\u00e4senzpr\u00fcfung generative K\u00fcnstliche Intelligenz (KI) nutzt, gilt dies als T\u00e4uschungsversuch und die Pr\u00fcfungsleistung wird mit \"nicht ausreichend\" bewertet.",
        "retrieved_contexts": [
            "(5) Versuchen Kandidatinnen oder Kandidaten, das Ergebnis einer Pr\u00fcfungsleistung durch T\u00e4uschung, zum Beispiel Benutzung nicht zugelassener Hilfsmittel, zu beeinflussen, gilt die betreffende Pr\u00fcfungsleistung als mit \"nicht ausreichend\" (5,0) bewertet. Der Einsatz generativer K\u00fcnstlicher Intelligenz im Rahmen von Pr\u00e4senzpr\u00fcfungen ist unzul\u00e4ssig. Als T\u00e4uschungsversuch gelten auch nicht als Solche gekennzeichnete Zitate aus Internetquellen. Wer als Kandidatin oder Kandidat den ordnungsgem\u00e4\u00dfen Ablauf der Pr\u00fcfung st\u00f6rt, kann von den jeweiligen Pr\u00fcfenden oder Aufsichtf\u00fchrenden nach Abmahnung von der Fortsetzung der Pr\u00fcfungsleistung ausgeschlossen werden; in diesem Fall gilt die betreffende Pr\u00fcfungsleistung als mit \"nicht ausreichend\" (5,0) bewertet. Die Gr\u00fcnde f\u00fcr den Ausschluss sind aktenkundig zu machen. Wer von der weiteren Erbringung einer Pr\u00fcfungsleistung ausgeschlossen wird, kann verlangen, dass diese Entscheidung vom Pr\u00fcfungsausschuss \u00fcberpr\u00fcft wird. Dies gilt entsprechend bei der Feststellung einer T\u00e4uschung im Sinne von Satz 1.",
            "(1) Hat die Kandidatin oder der Kandidat bei einer Pr\u00fcfung get\u00e4uscht und wird diese Tatsache erst nach der Aush\u00e4ndigung des Zeugnisses bekannt, kann der Pr\u00fcfungsausschuss nachtr\u00e4glich die Noten f\u00fcr diejenigen Pr\u00fcfungsleistungen, bei deren Erbringung die Kandidatin oder der Kandidat get\u00e4uscht hat, entsprechend berichtigen und die Pr\u00fcfung ganz oder teilweise f\u00fcr nicht bestanden erkl\u00e4ren.",
            "(2) Pr\u00fcfungen werden bescheinigt.",
            "Die Lehre ist als Pr\u00e4senzstudium organisiert. Im Studium m\u00fcssen die Studierenden nach den Bestimmungen dieser Pr\u00fcfungsordnung Pflicht- und Wahlpflichtveranstaltungen einschlie\u00dflich des Profilbildungsbereiches belegen.",
            "(9) Studienarbeiten, Hausarbeiten, Projektarbeiten und Portfolios ist eine Versicherung der Kandidatinnen und Kandidaten beizuf\u00fcgen, dass sie die Arbeit - bei einer Gruppenarbeit den entsprechend gekennzeichneten Anteil an der Arbeit - selbstst\u00e4ndig verfasst und keine anderen als die angegebenen Quellen benutzt haben. Die Stellen der Arbeit, die anderen Werken dem Wortlaut oder dem Sinn nach entnommen sind, m\u00fcssen unter Angabe der Quelle als Entlehnung kenntlich gemacht werden. Sofern generative K\u00fcnstliche Intelligenz im Rahmen der Arbeit genutzt wurde, ist die Verwendung in einem entsprechenden Absatz methodisch zu reflektieren und in einer Form zu dokumentieren, die den Pr\u00fcfenden die wissenschaftliche Eigenleistung nachvollziehbar macht. Die Versicherung selbst\u00e4ndiger Abfassung ist auch f\u00fcr gelieferte Zeichnungen, Skizzen, Ton- und Videoaufnahmen oder graphische Darstellungen abzugeben. Die Arbeiten sind in digitaler Form in einem g\u00e4ngigen Textverarbeitungsformat einzureichen. Es wird empfohlen f\u00fcr die elektronische \u00dcbermittlung die HHU-Mailadressen und nach M\u00f6glichkeit eine Verschl\u00fcsselung zu verwenden. Bei begr\u00fcndetem Verdacht kann eine \u00dcberpr\u00fcfung mittels einer Plagiatssoftware erfolgen. Das Urheberrecht der Verfasserin oder des Verfassers bleibt dabei gewahrt."
        ],
        "reranking_scores": [
            0.532149076461792,
            -0.0022995115723460913,
            -0.018499979749321938,
            -0.047096580266952515,
            -0.06196276471018791
        ]
    },
    {
        "user_input": "Muss ich Kurse aus der Linguistik f\u00fcr das interdisziplin\u00e4re Vertiefungsmodul belegen?",
        "reference": "Nein, Linguistik-Kurse sind keine Pflicht. Das Modul sieht vor, dass du zwei Vorlesungen oder Seminare aus der Linguistik oder der Informatik w\u00e4hlst, wobei lediglich der Informatik-Anteil von 4 SWS vorgeschrieben ist.",
        "response": "Nein, du musst Kurse aus der Linguistik f\u00fcr das interdisziplin\u00e4re Vertiefungsmodul nicht belegen.\n\nDas Modul erfordert nur Veranstaltungen aus der Informatik (mindestens 4 SWS) und kann Veranstaltungen aus Linguistik belegen, die nicht notwendig dezidiert computerlinguistisch sind.",
        "retrieved_contexts": [
            "### Modul: Vertiefungsmodul - Interdisziplin\u00e4r\n**Englischer Titel:** Specialization module - interdisciplinary<br>\n**Modul-Nummer:** 5100<br>\n**ECTS-Leistungspunkte:** 12 ECTS-Leistungspunkte<br>\n**Workload:** 360 Stunden<br>\n**Dauer:** 2 Semester<br>\n**Lehrveranstaltungen und Lehrformen:** Zwei Vorlesungen oder Seminare aus Linguistik oder Informatik | Vorlesung Linguistik: 5101, 5105 | Vorlesung Informatik: 5102, 5106 | Seminar Linguistik: 5103, 5107 | Seminar Informatik: 5104, 5108<br>\n**Belegung:** Nach Vorgabe der gew\u00e4hlten Veranstaltungen<br>\n**Empfohlenes Studiensemester:** 4. Fachsemester (Sommersemester) | 5. Fachsemester (Wintersemester)<br>\n**H\u00e4ufigkeit des Angebots:** Jedes Semester<br>\n**Geplante Gruppengr\u00f6\u00dfe:** Nach Vorgabe der gew\u00e4hlten Veranstaltungen<br>\n**Kontaktzeit:** Nach Vorgabe der gew\u00e4hlten Veranstaltungen<br>\n**Selbststudium:** Nach Vorgabe der gew\u00e4hlten Veranstaltungen<br>\n**ECTS-Leistungspunkte f\u00fcr die Modulpr\u00fcfung:** Nach Vorgabe der gew\u00e4hlten Veranstaltungen<br>\n**Inhalte:** M\u00f6gliche Inhalte sind Themen der Linguistik und Informatik. Relevante m\u00f6gliche Themen in der Linguistik sind z.B.: Phonetik und Phonologie, Psycho- und Neurolinguistik, historische Linguistik. Es m\u00fcssen Veranstaltungen im Umfang von mindestens 4 SWS in der Informatik belegt werden. Dabei darf keine Doppelung von Inhalten der Module aus der Computerlinguistik entstehen. F\u00fcr die Computerlinguistik relevante m\u00f6gliche Themen in der Informatik sind z.B.: Professionelle Softwareentwicklung, Datenbanksysteme, Nichtkooperative Spieltheorie, Komplexit\u00e4tstheorie, Numerische Optimierung, Dialogsysteme, \u00dcberblick K\u00fcnstliche Intelligenz.<br>\n**Angestrebte Lernergebnisse und Studieninhalte:** Vertiefte Kenntnisse in Spezialgebieten von Linguistik/Computerlinguistik/Informatik<br>\n**Teilnahmevoraussetzungen:** Formal: keine<br>\n**Pr\u00fcfungsformen:** M\u00fcndliche Pr\u00fcfung (Pnr. 5110) oder Klausur (Pnr. 5120) oder Hausarbeit (Pnr. 5130) oder Studienarbeit (Pnr. 5140) oder Projektarbeit (Pnr. 5150)<br>\n**Voraussetzungen f\u00fcr die Zulassung zur Modulpr\u00fcfung:** -keine<br>\n**Voraussetzungen f\u00fcr die Vergabe von ECTS-Leistungspunkten:** Bestandene Modulpr\u00fcfung, aktive und erfolgreiche Mitwirkung in den Seminaren und theoretischen und praktischen \u00dcbungen.<br>\n**Sonstige Informationen:** -keine-",
            "## Aufbau des Studiums\nGrob l\u00e4sst sich das Studium in drei Phasen einteilen: Die ersten zwei Semester sind dem Erwerb von Basiswissen gewidmet, Semester 3 und 4 dem Aufbau weiterer Fachkompetenzen und die letzten beiden Semester der weiteren Spezialisierung und dem Studienabschluss.\n**Phase 1 Erwerb von Basiswissen f\u00fcr die Computerlinguistik:** Hierzu geh\u00f6rt die Vermittlung mathematischer und logischer Konzepte und Methoden, die f\u00fcr die Computerlinguistik wesentlich sind, eine Einf\u00fchrung in die Computerlinguistik, die einen \u00dcberblick \u00fcber zentrale computerlinguistische Fragestellungen und g\u00e4ngige Methoden in diesen Bereichen gibt, der Erwerb von Kenntnissen \u00fcber Formalismen und Methoden der Grammatikmodellierung und eine Einf\u00fchrung in die Statistik. Dies wird erg\u00e4nzt durch Einf\u00fchrungen in die f\u00fcr die Computerlinguistik zentralen sprachwissenschaftlichen Bereiche Morphologie/Syntax und Semantik/Pragmatik. Desweiteren sieht der Studienplan f\u00fcr das erste Jahr einen Einstieg in computerlinguistische Programmierung mit Python vor, die neben Grundlagen auch aktuelle Methoden der Sprachtechnologie vermittelt.\n**Phase 2 Aufbau von Fachkompetenzen f\u00fcr die Computerlinguistik:** Methodisch lernt man in dieser zweiten Phase die f\u00fcr die datengetriebene Computerlinguistik so zentralen Bereiche des Maschinellen Lernens und des Deep Learnings (also maschinelles Lernen mit k\u00fcnstlichen neuronalen Netzen) kennen, aufbauend auf dem Wissen \u00fcber Fragestellungen und Repr\u00e4sentationen der Computerlinguistik und auf soliden Kenntnissen der Programmiersprache Python (siehe Phase 1). Parallel dazu gewinnen die Studierenden Einblick in linguistische Ressourcen. Daneben werden in dieser Phase weitere Paradigma von Programmiersprachen vermittelt, n\u00e4mlich objektorientiertes Programmieren und, im Kontext von Themen der computationellen Semantik, entweder logische oder funktionale Programmierung. Au\u00dferdem werden die Bereiche syntaktische Verarbeitung und Automatentheorie und formale Sprachen in Hinblick auf computerlinguistische Problemstellungen vertieft. Als \u00dcbergang zur Phase 3 ist zudem eine Orientierung in Hinblick auf m\u00f6gliche Spezialisierungen vorgesehen.\n**Phase 3 Spezialisierung und Berufsorientierung:** Im letzten Studienjahr geht es darum, aufbauend auf den vorher erworbenen Grundlagen und Methoden, Fachkompetenzen weiter auszubauen und sich (1) \u00fcber die Wahl der Bereiche, in denen im letzten Jahr APs abgelegt werden, (2) \u00fcber die Durchf\u00fchrung eines Praktikums und (3) \u00fcber das Thema der Abschlussarbeit weiter zu spezialisieren und in Richtung m\u00f6glicher anschlie\u00dfender T\u00e4tigkeitsfelder zu orientieren. Zum einen werden im Rahmen der beiden computerlinguistischen Vertiefungsmodule regelm\u00e4\u00dfig eine Reihe von unterschiedlichen thematischen Seminaren angeboten werden, aus denen die Studierenden frei w\u00e4hlen k\u00f6nnen. In einem der Seminare, im Vertiefungsmodul 2, muss eine MP angelegt werden. Themen dieser Seminare sind z.B. Vektorsemantik, gro\u00dfe Sprachmodelle, Transformer-Architekturen in computerlinguistischen Anwendungen, Advanced Constituency Parsing, Dependency Parsing, Finite-State Morphology, Semantic Role Labeling, Discourse Representation Theory, Fuzzy Logic usw. Daneben gibt es das interdisziplin\u00e4re Vertiefungsmodul, in dem den Studierenden erm\u00f6glicht wird, neben Veranstaltungen aus der Computerlinguistik auch Veranstaltungen aus Linguistik und Informatik zu belegen, die nicht notwendig dezidiert computerlinguistisch sind. Im Rahmen dieses Moduls muss mindestens eine Veranstaltung aus der Informatik belegt werden. Neben diesen Modulen, die relativ flexibel Spezialisierungen in Computerlinguistik, Linguistik und Informatik erlauben, ist im letzten Jahr ein Praktikum zur Berufsorientierung und die Anfertigung der Bachelorarbeit vorgesehen. Letztere wird in der Regel im letzten Semester durchgef\u00fchrt, wobei parallel das Forschungskolloquium der Computerlinguistik besucht wird, wodurch interessante Einblicke in aktuelle Forschungsthemen geboten werden und Anregungen und Inspiration f\u00fcr die Bachelorarbeit gewonnen werden kann. Das 5. Semester kann als Mobilit\u00e4tssemester gew\u00e4hlt werden, da in den Vertiefungsmodulen auch Kurse aus anderen Universit\u00e4ten anerkannt werden k\u00f6nnen.",
            "| Modul / Veranstaltung | MP | SL | LP | SWS |\n| :--- | :--- | :--- | :--- | :--- |\n| **Praktikum & Orientierung [2/2]** | | **1 SL** | **9 LP** | |\n| Praktikum (in der Regel 6 Wochen Vollzeit) | | Pnr. 3010 | 9 LP | |\n| **Vertiefungsmodul - Interdisziplin\u00e4r [2/2]** | **1 MP** | **1 SL** | **8 LP** | **4 SWS** |\n| Seminar nach Wahl | | Pnr. 5103 | 4 LP | 4 SWS |\n| Modulpr\u00fcfung | Pnr. 5110 | | 4 LP | |\n| **Vertiefungsmodul - Computerlinguistik 1** | | **2 SL** | **12 LP** | **8 SWS** |\n| Seminar nach Wahl im Bereich Computerlinguistik | | Pnr. 5201 | 6 LP | 4 SWS |\n| Seminar nach Wahl im Bereich Computerlinguistik | | Pnr. 5202 | 6 LP | 4 SWS |\n| **Profilbildungsbereich** | | | **1 LP** | |",
            "| Modul / Veranstaltung | MP | SL | LP | SWS |\n| :--- | :--- | :--- | :--- | :--- |\n| **Basismodul - Grundlagen der Computerlinguistik und formale Grammatikbeschreibung [2/2]** | **1 MP** | **2 SL** | **8 LP** | **4 SWS** |\n| Grammatikformalismen (Seminar) | | Pnr. 2203 | 2 LP | 2 SWS |\n| Grammatikformalismen (\u00dcbung) | | Pnr. 2204 | 2 LP | 2 SWS |\n| Modulpr\u00fcfung (Klausur) | Pnr. 2210 | | 4 LP | |\n| **Basismodul - Python-Programmierung [2/2]** | **1 MP** | **2 SL** | **8 LP** | **4 SWS** |\n| Fortgeschrittene Python-Programmierung mit NLP-Anwendungen (Seminar) | | Pnr. 2303 | 2 LP | 2 SWS |\n| Fortgeschrittene Python-Programmierung mit NLP-Anwendungen (\u00dcbung) | | Pnr. 2304 | 2 LP | 2 SWS |\n| Modulpr\u00fcfung (Klausur) | Pnr. 2310 | | 4 LP | |\n| **Basiswissen Linguistik - Semantik und Pragmatik** | **1 MP** | **2 SL** | **9 LP** | **6 SWS** |\n| Vorlesung | | Pnr. 1401 | 4 LP | 4 SWS |\n| Tutorium | | Pnr. 1402 | 2 LP | 2 SWS |\n| Modulpr\u00fcfung (Klausur) | Pnr. 1410 | | 3 LP | |\n| **Basismodul - Statistische Methoden in der Computerlinguistik [1/2]** | **0 MP** | **1 SL** | **4 LP** | **4 SWS** |\n| Wahrscheinlichkeitstheorie und Statistik (Seminar und \u00dcbung) | | Pnr. 2401 | 4 LP | 4 SWS |\n| **Profilbildungsbereich** | | | **1 LP** | |",
            "(3) Zu den integrierten Studieng\u00e4ngen, an denen mehrere F\u00e4cher beteiligt sind, geh\u00f6ren die Bachelorstudieng\u00e4nge:\n\u2022 Computerlinguistik,\n\u2022 Linguistik (integrativ),\n\u2022 Philosophie (integrativ),\n\u2022 Sozialwissenschaften - Medien, Politik, Gesellschaft,"
        ],
        "reranking_scores": [
            0.5697890520095825,
            0.3563862144947052,
            0.11938377469778061,
            0.005511618219316006,
            0.0032450321596115828
        ]
    },
    {
        "user_input": "Wie lang ist die offizielle Bearbeitungszeit f\u00fcr die Bachelorarbeit?",
        "reference": "Die Bearbeitungszeit f\u00fcr die Bachelorarbeit betr\u00e4gt maximal drei Monate.",
        "response": "Die offizielle Bearbeitungszeit f\u00fcr die Bachelorarbeit betr\u00e4gt maximal drei Monate.",
        "retrieved_contexts": [
            "(4) Die Bearbeitungszeit betr\u00e4gt maximal drei Monate. Auf begr\u00fcndeten Antrag der Kandidatin oder des Kandidaten kann ausnahmsweise eine Nachfrist von bis zu vier Wochen gew\u00e4hrt werden. Verz\u00f6gert sich die Bearbeitung innerhalb der Nachfrist durch Erkrankung des Kandidaten beziehungsweise der Kandidatin, kann nach Vorlage eines Attestes eine weitere Nachfrist von bis zu zwei Wochen gew\u00e4hrt werden.",
            "(10) Die Bearbeitungszeit f\u00fcr Studienarbeiten endet zwei Monate nach Abschluss der m\u00fcndlichen Leistung, sp\u00e4testens zum Vorlesungsbeginn des darauffolgenden Semesters. Die Bearbeitungszeit f\u00fcr Hausarbeiten betr\u00e4gt in der Regel zwei Monate. Sie kann vom zust\u00e4ndigen Pr\u00fcfungsausschuss um bis zu einen Monat verl\u00e4ngert werden, wenn die Aufgabenstellung dies zwingend erfordert. Die Themen werden im laufenden Semester vergeben. Die Bearbeitungszeit f\u00fcr den schriftlichen Bericht bei Projektarbeiten endet in der Regel zwei Monate nach dem Abschluss der praktischen Projektarbeit. Sie kann vom zust\u00e4ndigen Pr\u00fcfungsausschuss um bis zu einen Monat verl\u00e4ngert werden, wenn die Aufgabenstellung dies zwingend erfordert. Verz\u00f6gert sich die Bearbeitung durch von der Kandidatin oder dem Kandidaten nicht zu vertretende Umst\u00e4nde, kann sowohl f\u00fcr Hausarbeiten als auch f\u00fcr Projektarbeiten eine Nachfrist von bis zu 4 Wochen einger\u00e4umt werden.",
            "(3) Die Dauer einer Klausurarbeit betr\u00e4gt in der Regel 90 Minuten. Ausnahmsweise kann die Bearbeitungszeit abh\u00e4ngig vom Workload des Moduls auf h\u00f6chstens 180 Minuten verl\u00e4ngert oder auf mindestens 45 Minuten verk\u00fcrzt werden. Die Bewertung einer Klausur wird durch die Dozentinnen und Dozenten vorgenommen. Die Bewertung ist der Kandidatin oder dem Kandidaten nach sp\u00e4testens acht Wochen bekannt zu machen. N\u00e4heres regelt der f\u00e4cherspezifische Anhang.",
            "(3) Die Bewertung der Bachelorarbeit ist der Kandidatin oder dem Kandidaten nach sp\u00e4testens acht Wochen mitzuteilen.",
            "(2) Das Bachelorzeugnis ist unverz\u00fcglich, m\u00f6glichst innerhalb von vier Wochen, auszustellen und enth\u00e4lt die Noten der Pr\u00fcfungen, das Thema und die Note der Bachelorarbeit sowie die Gesamtnote. Die Noten werden in Ziffern genannt. Neben dem Zeugnis wird ein Diploma Supplement ausgeh\u00e4ndigt, das eine allgemeine Beschreibung des Studiengangs enth\u00e4lt, sowie ein Transcript of Records, in dem die Module und zugeordneten Lehrveranstaltungen aufgef\u00fchrt sind, in denen Pr\u00fcfungen oder Studienleistungen erbracht worden sind. F\u00fcr das Diploma Supplement ist grunds\u00e4tzlich die aktuelle Fassung zu verwenden. Das Zeugnis wird von der Studierenden- und Pr\u00fcfungsverwaltung im Auftrag der oder des Vorsitzenden des Pr\u00fcfungsausschusses beziehungsweise ihrer oder seiner Stellvertretung unterzeichnet. Es tr\u00e4gt das Ausstellungsdatum sowie das Datum des Tages, an dem die letzte Studien- oder Pr\u00fcfungsleistung erbracht worden ist."
        ],
        "reranking_scores": [
            0.22000648081302643,
            0.17515134811401367,
            0.10273725539445877,
            0.10230964422225952,
            0.06179354712367058
        ]
    }
]