[
    {
        "user_input": "Welche Kurse sollte ich im ersten Semester belegen?",
        "reference": "Laut dem exemplarischen Studienverlaufsplan solltest du im ersten Semester folgende Kurse belegen: Mathematische Grundlagen, Einführung in die computationelle Logik, Einführung in die Computerlinguistik, Einführung in die Programmierung mit Python, Morphologie und Syntax.",
        "response": "Im ersten Semester sollten Sie die folgenden Kurse belegen:\n\n*   **Basismodul - Mathematische und logische Grundlagen** (Modul-Nummer 2100)\n*   **Praktikum & Orientierung** (Modul-Nummer 3000)",
        "retrieved_contexts": [
            "### Modul: Praktikum & Orientierung\n**Englischer Titel:** Internship & orientation<br>\n**Modul-Nummer:** 3000<br>\n**ECTS-Leistungspunkte:** 12 ECTS-Leistungspunkte<br>\n**Workload:** 360 Stunden<br>\n**Dauer:** 2 Semester<br>\n**Lehrveranstaltungen und Lehrformen:** a: Orientierungsseminar (Seminar) / 3001 | b: Praktikum (in der Regel 6 Wochen in Vollzeit) / 3010<br>\n**Belegung:** Seminar (a)<br>\n**Empfohlenes Studiensemester:** a: 4. Fachsemester (Sommersemester) | b: 5. Fachsemester (Wintersemester)<br>\n**Häufigkeit des Angebots:** a: Jedes Sommersemester | b: Jedes Semester<br>\n**Geplante Gruppengröße:** a: Ca. 60 Studierende | b: Ca. 60 Studierende<br>\n**Kontaktzeit:** a: 2 SWS / 30 Stunden / 1 ECTS-Leistungspunkt | b: keine<br>\n**Selbststudium:** a: 60 Stunden / 2 ECTS-Leistungspunkte | b: 270 Stunden/9 ECTS-Leistungspunkte<br>\n**ECTS-Leistungspunkte für die Modulprüfung:** -keine-<br>\n**Inhalte:** a: Das Seminar bietet Orientierung für die zweite Studienphase insbesondere in Bezug auf Studienorganisation (Schwerpunktsetzung, Auslandsaufenthalt, Praktikum, ...); Abschlussarbeit (Themenwahl, wissenschaftliches Arbeiten, ...); Berufsperspektiven (Bewerbungsverfahren, Berufsfeldorientierung, ...); Anschlussstudiengänge (wissenschaftliche Karriere, ...). | b: Berufsorientierte Anwendung der im Studium vermittelten Qualifikationen<br>\n**Angestrebte Lernergebnisse und Studieninhalte:** Die Studierenden entwickeln Entwicklungsziele für ihre Zukunft und lernen, welche Schritte sie zur Realisierung ergreifen können. Sie erlangen Orientierung sowohl für den weiteren Studienaufbau als auch für ihren beruflichen Werdegang. Berufliche Wünsche und Möglichkeiten können sie realistischer beurteilen. Sie erwerben erweiterte Methodenkenntnis aus der beruflichen Praxis und gewinnen ein verstärktes Selbstvertrauen durch Praxiserprobung des bisher erworbenen Wissens. Sie vertiefen ihre Kenntnisse zum wissenschaftlichen Arbeiten, können eigene Forschungsfragen formulieren, diese angemessen einengen und die zur Beantwortung notwendigen Schritte planen und umsetzen.<br>\n**Teilnahmevoraussetzungen:** Formal: 4. Fachsemester oder höher | Inhaltlich: Basismodul - Mathematische und logische Grundlagen, Basismodul - Grundlagen der Computerlinguistik und formale Grammatikbeschreibung, Basismodul - Python-Programmierung<br>\n**Prüfungsformen:** -keine-<br>\n**Voraussetzungen für die Zulassung zur Modulprüfung:** -keine-<br>\n**Voraussetzungen für die Vergabe von ECTS-Leistungspunkten:** Erbrachte Studienleistungen (SL) in (a) und 6-wöchiges Praktikum nachgewiesen über Praktikumsnachweis und Praktikumsbericht.<br>\n**Sonstige Informationen:** -keine-",
            "## Aufbau des Studiums\nGrob lässt sich das Studium in drei Phasen einteilen: Die ersten zwei Semester sind dem Erwerb von Basiswissen gewidmet, Semester 3 und 4 dem Aufbau weiterer Fachkompetenzen und die letzten beiden Semester der weiteren Spezialisierung und dem Studienabschluss.\n**Phase 1 Erwerb von Basiswissen für die Computerlinguistik:** Hierzu gehört die Vermittlung mathematischer und logischer Konzepte und Methoden, die für die Computerlinguistik wesentlich sind, eine Einführung in die Computerlinguistik, die einen Überblick über zentrale computerlinguistische Fragestellungen und gängige Methoden in diesen Bereichen gibt, der Erwerb von Kenntnissen über Formalismen und Methoden der Grammatikmodellierung und eine Einführung in die Statistik. Dies wird ergänzt durch Einführungen in die für die Computerlinguistik zentralen sprachwissenschaftlichen Bereiche Morphologie/Syntax und Semantik/Pragmatik. Desweiteren sieht der Studienplan für das erste Jahr einen Einstieg in computerlinguistische Programmierung mit Python vor, die neben Grundlagen auch aktuelle Methoden der Sprachtechnologie vermittelt.\n**Phase 2 Aufbau von Fachkompetenzen für die Computerlinguistik:** Methodisch lernt man in dieser zweiten Phase die für die datengetriebene Computerlinguistik so zentralen Bereiche des Maschinellen Lernens und des Deep Learnings (also maschinelles Lernen mit künstlichen neuronalen Netzen) kennen, aufbauend auf dem Wissen über Fragestellungen und Repräsentationen der Computerlinguistik und auf soliden Kenntnissen der Programmiersprache Python (siehe Phase 1). Parallel dazu gewinnen die Studierenden Einblick in linguistische Ressourcen. Daneben werden in dieser Phase weitere Paradigma von Programmiersprachen vermittelt, nämlich objektorientiertes Programmieren und, im Kontext von Themen der computationellen Semantik, entweder logische oder funktionale Programmierung. Außerdem werden die Bereiche syntaktische Verarbeitung und Automatentheorie und formale Sprachen in Hinblick auf computerlinguistische Problemstellungen vertieft. Als Übergang zur Phase 3 ist zudem eine Orientierung in Hinblick auf mögliche Spezialisierungen vorgesehen.\n**Phase 3 Spezialisierung und Berufsorientierung:** Im letzten Studienjahr geht es darum, aufbauend auf den vorher erworbenen Grundlagen und Methoden, Fachkompetenzen weiter auszubauen und sich (1) über die Wahl der Bereiche, in denen im letzten Jahr APs abgelegt werden, (2) über die Durchführung eines Praktikums und (3) über das Thema der Abschlussarbeit weiter zu spezialisieren und in Richtung möglicher anschließender Tätigkeitsfelder zu orientieren. Zum einen werden im Rahmen der beiden computerlinguistischen Vertiefungsmodule regelmäßig eine Reihe von unterschiedlichen thematischen Seminaren angeboten werden, aus denen die Studierenden frei wählen können. In einem der Seminare, im Vertiefungsmodul 2, muss eine MP angelegt werden. Themen dieser Seminare sind z.B. Vektorsemantik, große Sprachmodelle, Transformer-Architekturen in computerlinguistischen Anwendungen, Advanced Constituency Parsing, Dependency Parsing, Finite-State Morphology, Semantic Role Labeling, Discourse Representation Theory, Fuzzy Logic usw. Daneben gibt es das interdisziplinäre Vertiefungsmodul, in dem den Studierenden ermöglicht wird, neben Veranstaltungen aus der Computerlinguistik auch Veranstaltungen aus Linguistik und Informatik zu belegen, die nicht notwendig dezidiert computerlinguistisch sind. Im Rahmen dieses Moduls muss mindestens eine Veranstaltung aus der Informatik belegt werden. Neben diesen Modulen, die relativ flexibel Spezialisierungen in Computerlinguistik, Linguistik und Informatik erlauben, ist im letzten Jahr ein Praktikum zur Berufsorientierung und die Anfertigung der Bachelorarbeit vorgesehen. Letztere wird in der Regel im letzten Semester durchgeführt, wobei parallel das Forschungskolloquium der Computerlinguistik besucht wird, wodurch interessante Einblicke in aktuelle Forschungsthemen geboten werden und Anregungen und Inspiration für die Bachelorarbeit gewonnen werden kann. Das 5. Semester kann als Mobilitätssemester gewählt werden, da in den Vertiefungsmodulen auch Kurse aus anderen Universitäten anerkannt werden können.",
            "### Modul: Basismodul - Mathematische und logische Grundlagen\n**Englischer Titel:** Basis module - mathematical and logical foundations<br>\n**Modul-Nummer:** 2100<br>\n**ECTS-Leistungspunkte:** 12 ECTS-Leistungspunkte<br>\n**Workload:** 360 Stunden<br>\n**Dauer:** 1 Semester<br>\n**Lehrveranstaltungen und Lehrformen:** a: Einführung in die computationelle Logik (Seminar & Übung) / 2101 | b: Mathematische Grundlagen (Seminar) / 2102<br>\n**Belegung:** Seminar und Übung (a) und Seminar (b)<br>\n**Empfohlenes Studiensemester:** a: 1. Fachsemester (Wintersemester) | b: 1. Fachsemester (Wintersemester) | Prüfung im 1. Fachsemester (Wintersemester)<br>\n**Häufigkeit des Angebots:** a: Jedes Wintersemester | b: Jedes Wintersemester<br>\n**Geplante Gruppengröße:** a: Ca. 60 Studierende | b: Ca. 60 Studierende<br>\n**Kontaktzeit:** a: 4 SWS/60 Stunden / 2 ECTS-Leistungspunkte | b: 4 SWS/60 Stunden / 2 ECTS-Leistungspunkte<br>\n**Selbststudium:** a: 60 Stunden / 2 ECTS-Leistungspunkte | b: 60 Stunden/2 ECTS-Leistungspunkte<br>\n**ECTS-Leistungspunkte für die Modulprüfung:** 4 ECTS-Leistungspunkte<br>\n**Inhalte:** Aufbereitung der mathematischen Schulkenntnisse und deren Vertiefung, um formale Methoden der Mathematik einsetzen zu können wie z.B. Mengenlehre, Vektorrechnung oder Beweisführung. Bedeutung der Logik; menschliche Sprache und formale Sprache; Einführung in die Aussagenlogik und Prädikatenlogik; Modelle, Wahrheitswerte und formale Beweise.<br>\n**Angestrebte Lernergebnisse und Studieninhalte:** Die Studierenden beherrschen wesentliche logische und mathematische Verfahren und haben Verständnis von grundlegenden logischen und mathematischen Methoden sowie deren Anwendung in spezifischen Fällen. Sie haben das formale Rüstzeug, um die wichtigsten Methoden der formalen Linguistik und Computerlinguistik zu verstehen.<br>\n**Teilnahmevoraussetzungen:** Formal: Keine | Inhaltlich: Keine<br>\n**Prüfungsformen:** Portfolio (Pnr. 2110)<br>\n**Voraussetzungen für die Zulassung zur Modulprüfung:** -keine-<br>\n**Voraussetzungen für die Vergabe von ECTS-Leistungspunkten:** Erbrachte Studienleistungen (SL) in den Lehrveranstaltungen (a) und (b) und bestandene Modulprüfung.<br>\n**Sonstige Informationen:** -keine-"
        ]
    },
    {
        "user_input": "Kann ich auch im Sommersemester anfangen?",
        "reference": "Nein, das Studium ist für einen Beginn im Wintersemester ausgelegt.",
        "response": "Dazu enthalten die bereitgestellten Dokumente keine Informationen.",
        "retrieved_contexts": [
            "(3) Mit der Anmeldung zu Lehrveranstaltungen und Studienleistungen legen die Studierenden eine verbindliche Modul- bzw. Bereichszuordnung in ihrem Studiengang fest. Eine nachträgliche Umbuchung ist nicht möglich. Die Verbindlichkeit gilt unabhängig davon, ob die Leistung bestanden oder nicht bestanden wurde oder ob sie im weiteren Studienverlauf angerechnet wird. Ausnahmen zu dieser Regelung können im fächerspezifischen Anhang getroffen werden.",
            "(1) Die Anfertigung der Bachelorarbeit erfolgt in der Regel im sechsten Studiensemester.",
            "(4) Ist ein Modul oder Bereich des Studiums erfolgreich abgeschlossen, können dort keine weiteren Lehrveranstaltungen oder Studienleistungen mehr angemeldet werden."
        ]
    },
    {
        "user_input": "Muss ich fließend Englisch sprechen können um Computerlinguistik zu studieren?",
        "reference": "Fließendes Englisch wird nicht vorausgesetzt, jedoch benötigst du Englischkenntnisse auf dem Niveau B1. Dies entspricht vergleichsweise einem erfolgreichen vierjährigen Schulunterricht an einer weiterführenden Schule.",
        "response": "Nein, es ist nicht notwendig, fließend Englisch zu sprechen, da die Vorkenntnisse nur ein Niveau B1 (vergleichbar mit erfolgreichem vierjährigem Schulunterricht) erfordern.",
        "retrieved_contexts": [
            "| Merkmal | Details |\n| :--- | :--- |\n| **Integrierter Studiengang** | Computerlinguistik |\n| **Studienbeginn** | Nur im Wintersemester |\n| **Studienumfang** | 180 ECTS-Leistungspunkte (LP) |\n| **Notwendige Vorkenntnisse** | Kenntnisse des Englischen (Niveau B1, vergleichbar mit erfolgreichem vierjährigem Schulunterricht an einer weiterführenden Schule) |\n| **Propädeutikum im Profilbildungsbereich** | keine Angabe |\n| **Anzahl der Modulprüfungen** | 9, zuzüglich Bachelorarbeit |\n| **Art und Inhalt der Module und der Prüfungen** | **Module:**<br>- Basismodul - Mathematische und logische Grundlagen (8 SWS, 1 MP, 12 LP)<br>- Basismodul - Grundlagen der Computerlinguistik und formale Grammatikbeschreibung (8 SWS, 1 MP, 12 LP)<br>- Basismodul - Python-Programmierung (8 SWS, 1 MP, 12 LP)<br>- Basiswissen Linguistik - Morphologie und Syntax (6 SWS, 1 MP, 9 LP)<br>- Basiswissen Linguistik - Semantik und Pragmatik (6 SWS, 1 MP, 9 LP)<br>- Basismodul - Statistische Methoden in der Computerlinguistik (6 SWS, 6 LP)<br>- Aufbaumodul - Maschinelles Lernen (8 SWS, 1 MP, 12 LP)<br>- Aufbaumodul - Mathematische Linguistik (4 SWS, 6 LP)<br>- Aufbaumodul - Parsing (4 SWS, 6 LP)<br>- Aufbaumodul - Logische Programmierung (4 SWS, 6 LP)<br>- Aufbaumodul - Objektorientierte Programmierung (8 SWS, 1 MP, 12 LP)<br>- Praktikum und Orientierung (2 SWS, 12 LP)<br>- Vertiefungsmodul - interdisziplinär (8 SWS, 1 MP, 12 LP)<br>- Vertiefungsmodul - Computerlinguistik 1 (8 SWS, 12 LP)<br>- Vertiefungsmodul - Computerlinguistik 2 (4 SWS, 1 MP, 9 LP)<br>- Abschlussarbeit und Forschungskolloquium (2 SWS, 15 LP)<br>- Profilbildungsbereich (18 LP) |\n| **Voraussetzungen für Prüfungen** | keine Angabe |\n| **Besonderheiten** | Die zweite Wiederholung einer Modulprüfung darf als mündliche Prüfung erfolgen. |\n| **Gewichtung der Prüfungen für die Gesamtnote** | Bachelorarbeit: dreifach<br>Alle Modulprüfungen: einfach |\n| **Prüfungssprache nach § 6 (4)** | keine Angabe |\n| **Auslandsaufenthalt** | Optional (Mobilitätsfenster: 5. Semester) |\n| **Exkursion** | keine Angabe |\n| **Praktikum** | Nach dem vierten oder fünften Semester wird entweder ein mindestens 6-wöchiges Berufsfeldpraktikum oder eine Projektarbeit absolviert, jeweils mit einschlägig computerlinguistischem Inhalt. Das Praktikum soll einen Einblick in die Berufspraxis vermitteln sowie den späteren Übergang in die Berufswelt erleichtern. Die Wahl des Praktikumsplatzes erfolgt im Einvernehmen mit dem/der Praktikumsbeauftragten der Abteilung für Computerlinguistik. Der/die Praktikumsbeauftragte ist bei der Vermittlung von Praktikumsplätzen behilflich und bietet eine fachliche Praktikumsberatung und -begleitung an. Über das Praktikum ist ein kurzer Bericht (ca. 3-5 Seiten) zu verfassen und ein Zeugnis der Praktikumsstelle einzureichen. |",
            "## Ziele des Studiums\nDer integrative Bachelorstudiengang Computerlinguistik leistet eine breite computerlinguistische Ausbildung. Die Studierenden erwerben im Rahmen der ersten beiden Jahre Wissen über die Komplexität sprachlicher Erscheinungen, Methodenkenntnisse und -fertigkeiten sowohl im Bereich der symbolischen Sprachverarbeitung als auch im Bereich des maschinellen Lernens und der künstlichen Intelligenz, und Programmierkenntnisse auf hohem Niveau. Dieses Wissen wird im dritten Jahr weiter ausgebaut und im Rahmen eines Praktikums und der Abschlussarbeit im Kontext konkreter Fragestellungen angewendet. Damit sind die Absolventen des Studiengangs optimal vorbereitet auf eine berufliche Tätigkeit z.B. in den Bereichen elektronische Informationsverarbeitung, Sprachressourcenmanagement, maschinelle Sprachverarbeitung und Sprachtechnologie. Die Studierenden erwerben außerdem besonders in den Aufbau- und Vertiefungsmodulen die Fähigkeit, relevante Informationen im Bereich der Computerlinguistik zu sammeln, zu bewerten und zu interpretieren und daraus wissenschaftlich fundierte Urteile abzuleiten, z.B. auch über gesellschaftsrelevante Aspekte von Sprachtechnologien wie etwa den Einsatz von Methoden der künstlichen Intelligenz in großen Sprachmodellen. Die Absolventen können sich selbständig in neue Themengebiete einarbeiten und neue Fähigkeiten lernen. Sie können sich mit Informatikern, Sprachwissenschaftlern und Laien über Informationen, Ideen, Probleme und Lösungen austauschen. Dank der Interdisziplinarität des Faches lernen sie außerdem, über Fachgrenzen hinweg zwischen unterschiedlichen Standpunkten zu vermitteln und multidisziplinäre Zusammenarbeit zu gestalten. Damit sind sie optimal auf einen anschließenden Masterstudiengang. z.B. im Bereich Sprachtechnologie oder Künstliche Intelligenz oder im Bereich Linguistik vorbereitet.",
            "### Modul: Vertiefungsmodul - Computerlinguistik 2\n**Englischer Titel:** Specialization module computational linguistics 2<br>\n**Modul-Nummer:** 5300<br>\n**ECTS-Leistungspunkte:** 9 ECTS-Leistungspunkte<br>\n**Workload:** 270 Stunden<br>\n**Dauer:** 1 Semester<br>\n**Lehrveranstaltungen und Lehrformen:** a: thematisches Seminar in der Computerlinguistik (Seminar) / 5301<br>\n**Belegung:** Seminar (a)<br>\n**Empfohlenes Studiensemester:** a: 6. Fachsemester (Sommersemester) | Prüfung im 6. Fachsemester (Sommersemester)<br>\n**Häufigkeit des Angebots:** a: Jedes Sommersemester<br>\n**Geplante Gruppengröße:** a: Ca. 30 Studierende<br>\n**Kontaktzeit:** a: 4 SWS/60 Stunden / 2 ECTS-Leistungspunkte<br>\n**Selbststudium:** a: 90 Stunden / 3 ECTS-Leistungspunkte<br>\n**ECTS-Leistungspunkte für die Modulprüfung:** 4 ECTS-Leistungspunkte<br>\n**Inhalte:** Mögliche Inhalte sind Themen der Computerlinguistik. Das können sein: Nichtklassische (modale, fuzzy oder substrukturelle) Logiken; besondere Grammatikformalismen (Kategorialgrammatik); Vertiefungsseminare im Bereich maschinelles Lernen und Deep Learning.<br>\n**Angestrebte Lernergebnisse und Studieninhalte:** Studierende lernen vertiefte Kenntnisse in Spezialgebieten der Computerlinguistik.<br>\n**Teilnahmevoraussetzungen:** Formal: Basismodul - Mathematische und logische Grundlagen, Basismodul - Grundlagen der Computerlinguistik und formale Grammatikbeschreibung, Aufbaumodul - Maschinelles Lernen | Inhaltlich: Je nach Thema<br>\n**Prüfungsformen:** Mündliche Prüfung (Pnr. 5310) oder Klausur (Pnr. 5320) oder Hausarbeit (Pnr. 5330) oder Studienarbeit (Pnr. 5340) oder Projektarbeit (Pnr. 5350)<br>\n**Voraussetzungen für die Zulassung zur Modulprüfung:** -keine-<br>\n**Voraussetzungen für die Vergabe von ECTS-Leistungspunkten:** Aktive und erfolgreiche Mitwirkung im Forschungsseminar, bestandene Modulprüfung<br>\n**Sonstige Informationen:** -keine-"
        ]
    },
    {
        "user_input": "Muss ich für den Python-Kurs Vorkenntnisse haben?",
        "reference": "Nein, für das Modul \"Python-Programmierung\" werden weder formale noch inhaltliche Vorkenntnisse vorausgesetzt.",
        "response": "Dazu enthalten die bereitgestellten Dokumente keine Informationen.",
        "retrieved_contexts": [
            "### Modul: Basismodul - Python-Programmierung\n**Englischer Titel:** Basis module - Python programming<br>\n**Modul-Nummer:** 2300<br>\n**ECTS-Leistungspunkte:** 12 ECTS-Leistungspunkte<br>\n**Workload:** 360 Stunden<br>\n**Dauer:** 2 Semester<br>\n**Lehrveranstaltungen und Lehrformen:** a: Einführung in die Programmierung mit Python (Seminar) / 2301 | b: Einführung in die Programmierung mit Python (Übung) / 2302 | c: Fortgeschrittene Python-Programmierung mit NLP-Anwendungen (Seminar) / 2303 | d: Fortgeschrittene Python-Programmierung mit NLP-Anwendungen (Übung) / 2304<br>\n**Belegung:** Seminar (a) mit Übung (b) und Seminar (c) mit Übung (d)<br>\n**Empfohlenes Studiensemester:** a: 1. Fachsemester (Wintersemester) | b: 1. Fachsemester (Wintersemester) | c: 2. Fachsemester (Sommersemester) | d: 2. Fachsemester (Sommersemester) | Prüfung im 2. Fachsemester (Sommersemester)<br>\n**Häufigkeit des Angebots:** a: Jedes Wintersemester | b: Jedes Wintersemester | c: Jedes Sommersemester | d: Jedes Sommersemester<br>\n**Geplante Gruppengröße:** a: Ca. 60 Studierende | b: Ca. 60 Studierende | c: Ca. 60 Studierende | d: Ca. 60 Studierende<br>\n**Kontaktzeit:** a: 2 SWS / 30 Stunden / 1 ECTS-Leistungspunkt | b: 2 SWS/30 Stunden / 1 ECTS-Leistungspunkt | c: 2 SWS/30 Stunden / 1 ECTS-Leistungspunkt | d: 2 SWS/30 Stunden / 1 ECTS-Leistungspunkt<br>\n**Selbststudium:** a: 30 Stunden / 1 ECTS-Leistungspunkt | b: 30 Stunden / 1 ECTS-Leistungspunkt | c: 30 Stunden / 1 ECTS-Leistungspunkt | d: 30 Stunden/1 ECTS-Leistungspunkt<br>\n**ECTS-Leistungspunkte für die Modulprüfung:** 4 ECTS-Leistungspunkte (120 Stunden)<br>\n**Inhalte:** Wintersemester: Grundlagen der Python-Programmierung; Datentypen in Python; gängige Programmkonstrukte; elementare Textverarbeitung. Sommersemester: Objektorientierte und funktionale Programmierung mit Python; Einsatz von Programm-Bibliotheken in den Bereichen Data Science und NLP; Grundzüge der Sorftware-Entwicklung.<br>\n**Angestrebte Lernergebnisse und Studieninhalte:** Die Studierenden erwerben grundlegende Fähigkeiten in der Programmierung mit der Programmiersprache Python sowie Kenntnisse über fortgeschrittene Konzepte der Python-Programmierung (objektorientierte und funktionale Programmierung). Außerdem werden Grundkenntnisse des Einsatzes von Python in den Bereichen Data Science und NLP (Natural Language Processing) erworben, sowie die Fähigkeit ein kleines Software-Projekt durchzuführen und zu präsentieren.<br>\n**Teilnahmevoraussetzungen:** Formal: Keine | Inhaltlich: Keine<br>\n**Prüfungsformen:** Projektarbeit (Pnr. 2310)<br>\n**Voraussetzungen für die Zulassung zur Modulprüfung:** -keine-<br>\n**Voraussetzungen für die Vergabe von ECTS-Leistungspunkten:** Erbrachte Studienleistungen (SL) in den Lehrveranstaltungen (a) und (b): 4 ECTS-Leistungspunkte | Erbrachte Studienleistungen (SL) in den Lehrveranstaltungen (c) und (d): 4 ECTS-Leistungspunkte | Bestandene Modulprüfung: 4 ECTS-Leistungspunkte<br>\n**Sonstige Informationen:** -keine-",
            "### Modul: Aufbaumodul - Objektorientierte Programmierung\n**Englischer Titel:** Advanced module - object-oriented programming<br>\n**Modul-Nummer:** 4500<br>\n**ECTS-Leistungspunkte:** 12 ECTS-Leistungspunkte<br>\n**Workload:** 360 Stunden<br>\n**Dauer:** 1 Semester<br>\n**Lehrveranstaltungen und Lehrformen:** a: Programmierung (Vorlesung) / 4501 | b: Übung zur Vorlesung (Übung) / 4502 | c: Praktische Übung zur Vorlesung (Praktische Übung) / 4503<br>\n**Belegung:** Vorlesung (a) mit Übung (b) und praktischer Übung (c)<br>\n**Empfohlenes Studiensemester:** a: 3. Fachsemester (Wintersemester) | b: 3. Fachsemester (Wintersemester) | c: 3. Fachsemester (Wintersemester)<br>\n**Häufigkeit des Angebots:** a: Jedes Wintersemester | b: Jedes Wintersemester | c: Jedes Wintersemester<br>\n**Geplante Gruppengröße:** a: Unbegrenzt | b: Ca. 30 Studierende | c: Ca. 30 Studierende<br>\n**Kontaktzeit:** a: 4 SWS/60 Stunden/2 ECTS-Leistungspunkte | b: 2 SWS/30 Stunden/1 ECTS-Leistungspunkt | c: 2 SWS / 30 Stunden/1 ECTS-Leistungspunkt<br>\n**Selbststudium:** a: 60 Stunden / 2 ECTS-Leistungspunkte | b: 30 Stunden/1 ECTS-Leistungspunkt | c: 30 Stunden / 1 ECTS-Leistungspunk<br>\n**ECTS-Leistungspunkte für die Modulprüfung:** 4 ECTS-Leistungspunkte<br>\n**Inhalte:** Dieses Modul vermittelt grundlegende Programmierkenntnisse in einer objektorientierten Programmiersprache. Darüber hinaus werden einführend Aspekte von Algorithmen und Datenstrukturen behandelt. Es wird keine Programmiererfahrung vorausgesetzt. Grundlegende Begriffe der Informatik; Primitive Datentypen und Variablen; Kontrollstrukturen; Eigene Datentypen (Klassen) und Arrays; Programmstrukturen im Speicher (Heap, Stack); Konzepte der Objektorientierung (Polymorphie, Schnittstellen); Rekursion; Fehlerbehandlung; Dynamische Datenstrukturen (Listen, Binärbäume, Hashing); Suchen und Sortieren (ausgewählte Algorithmen, u.a. binäre Suche, BubbleSort, QuickSort); Datenströme (Standard-Eingabe und -Ausgabe, einfache 2D-Grafik, Dateien)<br>\n**Angestrebte Lernergebnisse und Studieninhalte:** Studierende sollen nach Absolvierung der Lehrveranstaltungen in der Lage sein, Begriffe der Informatik und der Programmierung zu nennen und zu erläutern; einfache Algorithmen (iterativ und rekursiv) zu verstehen, deren Ablauf zu beschreiben, sowie selbst zu erstellen; eigene Datentypen zu konzipieren und anzuwenden; einfache objektorientierte Programme mit Polymorphie, Vererbung und Schnittstellen zu entwickeln; die behandelten dynamischen Datenstrukturen anzuwenden.<br>\n**Teilnahmevoraussetzungen:** Formal: Keine | Inhaltlich: Basismodul - Mathematische und logische Grundlagen, Basismodul - Python-Programmierung<br>\n**Prüfungsformen:** Klausur (Pnr. 4510)<br>\n**Voraussetzungen für die Zulassung zur Modulprüfung:** -keine-<br>\n**Voraussetzungen für die Vergabe von ECTS-Leistungspunkten:** Erbrachte Studienleistungen (SL) in den Lehrveranstaltungen (b) und (c) | Bestandene Modulprüfung: 4 ECTS-Leistungspunkte<br>\n**Sonstige Informationen:** -keine-",
            "| Modul / Veranstaltung | MP | SL | LP | SWS |\n| :--- | :--- | :--- | :--- | :--- |\n| **Basismodul - Grundlagen der Computerlinguistik und formale Grammatikbeschreibung [2/2]** | **1 MP** | **2 SL** | **8 LP** | **4 SWS** |\n| Grammatikformalismen (Seminar) | | Pnr. 2203 | 2 LP | 2 SWS |\n| Grammatikformalismen (Übung) | | Pnr. 2204 | 2 LP | 2 SWS |\n| Modulprüfung (Klausur) | Pnr. 2210 | | 4 LP | |\n| **Basismodul - Python-Programmierung [2/2]** | **1 MP** | **2 SL** | **8 LP** | **4 SWS** |\n| Fortgeschrittene Python-Programmierung mit NLP-Anwendungen (Seminar) | | Pnr. 2303 | 2 LP | 2 SWS |\n| Fortgeschrittene Python-Programmierung mit NLP-Anwendungen (Übung) | | Pnr. 2304 | 2 LP | 2 SWS |\n| Modulprüfung (Klausur) | Pnr. 2310 | | 4 LP | |\n| **Basiswissen Linguistik - Semantik und Pragmatik** | **1 MP** | **2 SL** | **9 LP** | **6 SWS** |\n| Vorlesung | | Pnr. 1401 | 4 LP | 4 SWS |\n| Tutorium | | Pnr. 1402 | 2 LP | 2 SWS |\n| Modulprüfung (Klausur) | Pnr. 1410 | | 3 LP | |\n| **Basismodul - Statistische Methoden in der Computerlinguistik [1/2]** | **0 MP** | **1 SL** | **4 LP** | **4 SWS** |\n| Wahrscheinlichkeitstheorie und Statistik (Seminar und Übung) | | Pnr. 2401 | 4 LP | 4 SWS |\n| **Profilbildungsbereich** | | | **1 LP** | |"
        ]
    },
    {
        "user_input": "Gibt es eine Übung für den Kurs Mathematische Grundlagen?",
        "reference": "Nein, für den Kurs \"Mathematische Grundlagen\" gibt es keine begleitende Übung. Es handelt sich dabei ausschließlich um ein Seminar.",
        "response": "Ja, es gibt eine Übung für den Kurs Mathematische Grundlagen (Modul 2100).",
        "retrieved_contexts": [
            "### Modul: Basismodul - Mathematische und logische Grundlagen\n**Englischer Titel:** Basis module - mathematical and logical foundations<br>\n**Modul-Nummer:** 2100<br>\n**ECTS-Leistungspunkte:** 12 ECTS-Leistungspunkte<br>\n**Workload:** 360 Stunden<br>\n**Dauer:** 1 Semester<br>\n**Lehrveranstaltungen und Lehrformen:** a: Einführung in die computationelle Logik (Seminar & Übung) / 2101 | b: Mathematische Grundlagen (Seminar) / 2102<br>\n**Belegung:** Seminar und Übung (a) und Seminar (b)<br>\n**Empfohlenes Studiensemester:** a: 1. Fachsemester (Wintersemester) | b: 1. Fachsemester (Wintersemester) | Prüfung im 1. Fachsemester (Wintersemester)<br>\n**Häufigkeit des Angebots:** a: Jedes Wintersemester | b: Jedes Wintersemester<br>\n**Geplante Gruppengröße:** a: Ca. 60 Studierende | b: Ca. 60 Studierende<br>\n**Kontaktzeit:** a: 4 SWS/60 Stunden / 2 ECTS-Leistungspunkte | b: 4 SWS/60 Stunden / 2 ECTS-Leistungspunkte<br>\n**Selbststudium:** a: 60 Stunden / 2 ECTS-Leistungspunkte | b: 60 Stunden/2 ECTS-Leistungspunkte<br>\n**ECTS-Leistungspunkte für die Modulprüfung:** 4 ECTS-Leistungspunkte<br>\n**Inhalte:** Aufbereitung der mathematischen Schulkenntnisse und deren Vertiefung, um formale Methoden der Mathematik einsetzen zu können wie z.B. Mengenlehre, Vektorrechnung oder Beweisführung. Bedeutung der Logik; menschliche Sprache und formale Sprache; Einführung in die Aussagenlogik und Prädikatenlogik; Modelle, Wahrheitswerte und formale Beweise.<br>\n**Angestrebte Lernergebnisse und Studieninhalte:** Die Studierenden beherrschen wesentliche logische und mathematische Verfahren und haben Verständnis von grundlegenden logischen und mathematischen Methoden sowie deren Anwendung in spezifischen Fällen. Sie haben das formale Rüstzeug, um die wichtigsten Methoden der formalen Linguistik und Computerlinguistik zu verstehen.<br>\n**Teilnahmevoraussetzungen:** Formal: Keine | Inhaltlich: Keine<br>\n**Prüfungsformen:** Portfolio (Pnr. 2110)<br>\n**Voraussetzungen für die Zulassung zur Modulprüfung:** -keine-<br>\n**Voraussetzungen für die Vergabe von ECTS-Leistungspunkten:** Erbrachte Studienleistungen (SL) in den Lehrveranstaltungen (a) und (b) und bestandene Modulprüfung.<br>\n**Sonstige Informationen:** -keine-",
            "### Modul: Aufbaumodul - Mathematische Linguistik\n**Englischer Titel:** Advanced module - mathematical linguistics<br>\n**Modul-Nummer:** 4200<br>\n**ECTS-Leistungspunkte:** 6 ECTS-Leistungspunkte<br>\n**Workload:** 180 Stunden<br>\n**Dauer:** 1 Semester<br>\n**Lehrveranstaltungen und Lehrformen:** a: Automatentheorie & Formale Sprachen (Seminar) / 4201 | b: Übung zu Automatentheorie & Formale Sprachen (Übung) / 4202<br>\n**Belegung:** Seminar (a) und Übung (b)<br>\n**Empfohlenes Studiensemester:** a: 3. Fachsemester (Wintersemester) | b: 3. Fachsemester (Wintersemester)<br>\n**Häufigkeit des Angebots:** a: Jedes Wintersemester | b: Jedes Wintersemester<br>\n**Geplante Gruppengröße:** a: Ca. 60 Studierende | b: Ca. 60 Studierende<br>\n**Kontaktzeit:** a: 2 SWS / 30 Stunden / 1 ECTS-Leistungspunkt | b: 2 SWS/30 Stunden / 1 ECTS-Leistungspunkt<br>\n**Selbststudium:** a: 60 Stunden / 2 ECTS-Leistungspunkte | b: 60 Stunden/2 ECTS-Leistungspunkte<br>\n**ECTS-Leistungspunkte für die Modulprüfung:** -keine-<br>\n**Inhalte:** Sprachklassen basierend auf der Chomsky-Hierarchie (Automaten, Grammatiken); Sprachen und Relationen, rationale Relationen und Finite-State-Methoden; Komplexitätstheorie und Lernbarkeitstheorie; Abschlusseigenschaften und Entscheidungsprobleme wichtiger Sprachklassen.<br>\n**Angestrebte Lernergebnisse und Studieninhalte:** Vertrautheit mit den mathematischen und informatischen Grundlagen der Linguistik und Computerlinguistik. Verständnis von Beweisverfahren. Fähigkeit, Sprachen, Grammatiken und Automaten aufeinander zu beziehen und passende Entsprechungen zu konstruieren.<br>\n**Teilnahmevoraussetzungen:** Formal: keine | Inhaltlich: Basismodul - Mathematische und logische Grundlagen, Basismodul - Grundlagen der Computerlinguistik und formale Grammatikbeschreibung<br>\n**Prüfungsformen:** -keine-<br>\n**Voraussetzungen für die Zulassung zur Modulprüfung:** -keine-<br>\n**Voraussetzungen für die Vergabe von ECTS-Leistungspunkten:** Erbrachte Studienleistungen (SL) in allen Lehrveranstaltungen<br>\n**Sonstige Informationen:** -keine-",
            "(2) Das Berufsfeldpraktikum gibt einen Einblick in einschlägige Berufsfelder und die Berufspraxis und ermöglicht eine Erprobung von Fachkenntnissen in der Praxis. Auf diese Weise sollen den Studierenden konkrete berufsqualifizierende Fähigkeiten und Handlungskompetenzen vermittelt und der Übergang in die Berufswelt erleichtert werden."
        ]
    },
    {
        "user_input": "Wann soll ich das Praktikum machen?",
        "reference": "Es wird empfohlen, das Berufsfeldpraktikum nach dem vierten oder fünften Semester zu absolvieren.",
        "response": "Das Praktikum soll in der Regel im 5. Fachsemester (Wintersemester) absolviert werden.",
        "retrieved_contexts": [
            "(1) In einigen Studiengängen ist ein obligatorisches Berufsfeldpraktikum zu absolvieren, das von vier Wochen bis zu drei Monaten dauern kann. Das Berufsfeldpraktikum kann auch in Abschnitten absolviert werden. Einschlägige Berufstätigkeiten und Praxiserfahrungen können im Einzelfall auf das Berufsfeldpraktikum angerechnet werden. Für je vier Wochen Berufsfeldpraktikum werden mindestens 5 LP angerechnet.",
            "(1) Die Anfertigung der Bachelorarbeit erfolgt in der Regel im sechsten Studiensemester.",
            "### Modul: Praktikum & Orientierung\n**Englischer Titel:** Internship & orientation<br>\n**Modul-Nummer:** 3000<br>\n**ECTS-Leistungspunkte:** 12 ECTS-Leistungspunkte<br>\n**Workload:** 360 Stunden<br>\n**Dauer:** 2 Semester<br>\n**Lehrveranstaltungen und Lehrformen:** a: Orientierungsseminar (Seminar) / 3001 | b: Praktikum (in der Regel 6 Wochen in Vollzeit) / 3010<br>\n**Belegung:** Seminar (a)<br>\n**Empfohlenes Studiensemester:** a: 4. Fachsemester (Sommersemester) | b: 5. Fachsemester (Wintersemester)<br>\n**Häufigkeit des Angebots:** a: Jedes Sommersemester | b: Jedes Semester<br>\n**Geplante Gruppengröße:** a: Ca. 60 Studierende | b: Ca. 60 Studierende<br>\n**Kontaktzeit:** a: 2 SWS / 30 Stunden / 1 ECTS-Leistungspunkt | b: keine<br>\n**Selbststudium:** a: 60 Stunden / 2 ECTS-Leistungspunkte | b: 270 Stunden/9 ECTS-Leistungspunkte<br>\n**ECTS-Leistungspunkte für die Modulprüfung:** -keine-<br>\n**Inhalte:** a: Das Seminar bietet Orientierung für die zweite Studienphase insbesondere in Bezug auf Studienorganisation (Schwerpunktsetzung, Auslandsaufenthalt, Praktikum, ...); Abschlussarbeit (Themenwahl, wissenschaftliches Arbeiten, ...); Berufsperspektiven (Bewerbungsverfahren, Berufsfeldorientierung, ...); Anschlussstudiengänge (wissenschaftliche Karriere, ...). | b: Berufsorientierte Anwendung der im Studium vermittelten Qualifikationen<br>\n**Angestrebte Lernergebnisse und Studieninhalte:** Die Studierenden entwickeln Entwicklungsziele für ihre Zukunft und lernen, welche Schritte sie zur Realisierung ergreifen können. Sie erlangen Orientierung sowohl für den weiteren Studienaufbau als auch für ihren beruflichen Werdegang. Berufliche Wünsche und Möglichkeiten können sie realistischer beurteilen. Sie erwerben erweiterte Methodenkenntnis aus der beruflichen Praxis und gewinnen ein verstärktes Selbstvertrauen durch Praxiserprobung des bisher erworbenen Wissens. Sie vertiefen ihre Kenntnisse zum wissenschaftlichen Arbeiten, können eigene Forschungsfragen formulieren, diese angemessen einengen und die zur Beantwortung notwendigen Schritte planen und umsetzen.<br>\n**Teilnahmevoraussetzungen:** Formal: 4. Fachsemester oder höher | Inhaltlich: Basismodul - Mathematische und logische Grundlagen, Basismodul - Grundlagen der Computerlinguistik und formale Grammatikbeschreibung, Basismodul - Python-Programmierung<br>\n**Prüfungsformen:** -keine-<br>\n**Voraussetzungen für die Zulassung zur Modulprüfung:** -keine-<br>\n**Voraussetzungen für die Vergabe von ECTS-Leistungspunkten:** Erbrachte Studienleistungen (SL) in (a) und 6-wöchiges Praktikum nachgewiesen über Praktikumsnachweis und Praktikumsbericht.<br>\n**Sonstige Informationen:** -keine-"
        ]
    },
    {
        "user_input": "Gibt es eine generelle Anwesenheitspflicht für Vorlesungen?",
        "reference": "Nein, bei Vorlesungen kann keine Anwesenheitspflicht festgelegt werden.",
        "response": "Dazu enthalten die bereitgestellten Dokumente keine Informationen.",
        "retrieved_contexts": [
            "Eine Pflicht zur Anwesenheit in Lehrveranstaltungen kann in allen Modulen oder Modulteilen vorgeschrieben werden, in denen die regelmäßige Anwesenheit und die aktive Teilnahme für das Erreichen des Lernziels erforderlich ist. Generell gilt dies für Exkursionen, Forschungsprojekte, Praktika, Sprachkurse und Übungen. Seminare sind grundsätzlich auf die kontinuierliche Beteiligung aller Studierenden am Dialog ausgerichtet und können mit einer Anwesenheitspflicht belegt werden, sofern nicht mehr als 25 Personen teilnehmen. Bei Vorlesungen kann keine Anwesenheitspflicht festgelegt werden. Für andere Lehrveranstaltungen gilt eine Anwesenheitspflicht nur dann, wenn sie im jeweiligen fächerspezifischen Anhang explizit festgelegt ist. Die Anwesenheitspflicht ist erfüllt, wenn ein/e Studierende/r 80% der Veranstaltungszeit beigewohnt hat.",
            "Die Lehre ist als Präsenzstudium organisiert. Im Studium müssen die Studierenden nach den Bestimmungen dieser Prüfungsordnung Pflicht- und Wahlpflichtveranstaltungen einschließlich des Profilbildungsbereiches belegen.",
            "(1) In allen Lehrveranstaltungen sind Studienleistungen obligatorisch. Studienleistungen im Sinne dieser Prüfungsordnung werden durch die aktive Teilnahme an Lehrveranstaltungen erbracht. Studienleistungen sind auf die in der Modulbeschreibung definierten Inhalte und Kompetenzen ausgerichtet. Der Workload von Studienleistungen ist durch die Modulbeschreibung begrenzt. Studienleistungen sind unbenotet und können als Prüfungsvoraussetzung bestimmt werden. Näheres regelt der fächerspezifische Anhang."
        ]
    },
    {
        "user_input": "Wann gilt die Anwesenheitspflicht in einer Lehrveranstaltung als erfüllt?",
        "reference": "Die Anwesenheitspflicht ist erfüllt, wenn ein Studierender oder eine Studierende 80% der Veranstaltungszeit beigewohnt hat.",
        "response": "Die Anwesenheitspflicht gilt als erfüllt, wenn ein/e Studierende/r 80% der Veranstaltungszeit beigewohnt hat.",
        "retrieved_contexts": [
            "Eine Pflicht zur Anwesenheit in Lehrveranstaltungen kann in allen Modulen oder Modulteilen vorgeschrieben werden, in denen die regelmäßige Anwesenheit und die aktive Teilnahme für das Erreichen des Lernziels erforderlich ist. Generell gilt dies für Exkursionen, Forschungsprojekte, Praktika, Sprachkurse und Übungen. Seminare sind grundsätzlich auf die kontinuierliche Beteiligung aller Studierenden am Dialog ausgerichtet und können mit einer Anwesenheitspflicht belegt werden, sofern nicht mehr als 25 Personen teilnehmen. Bei Vorlesungen kann keine Anwesenheitspflicht festgelegt werden. Für andere Lehrveranstaltungen gilt eine Anwesenheitspflicht nur dann, wenn sie im jeweiligen fächerspezifischen Anhang explizit festgelegt ist. Die Anwesenheitspflicht ist erfüllt, wenn ein/e Studierende/r 80% der Veranstaltungszeit beigewohnt hat.",
            "Die Lehre ist als Präsenzstudium organisiert. Im Studium müssen die Studierenden nach den Bestimmungen dieser Prüfungsordnung Pflicht- und Wahlpflichtveranstaltungen einschließlich des Profilbildungsbereiches belegen.",
            "### § 8 Anwesenheitspflicht"
        ]
    },
    {
        "user_input": "Gibt es eine Klausur in Wahrscheinlichkeitstheorie?",
        "reference": "Nein, im \"Basismodul - Statistische Methoden in der Computerlinguistik\", zu dem die Wahrscheinlichkeitstheorie gehört, gibt es gar keine Modulprüfung und somit auch keine Klausur. Es müssen lediglich Studienleistungen erbracht werden.",
        "response": "Dazu enthalten die bereitgestellten Dokumente keine Informationen.",
        "retrieved_contexts": [
            "### Modul: Basismodul - Statistische Methoden in der Computerlinguistik\n**Englischer Titel:** Basis module - statistical methods in computational linguistics<br>\n**Modul-Nummer:** 2400<br>\n**ECTS-Leistungspunkte:** 6 ECTS-Leistungspunkte<br>\n**Workload:** 180 Stunden<br>\n**Dauer:** 2 Semester<br>\n**Lehrveranstaltungen und Lehrformen:** a: Wahrscheinlichkeitstheorie und Statistik (Seminar und Übung) / 2401 | b: Linguistische Ressourcen (Seminar) / 2402<br>\n**Belegung:** Seminar mit Übung (a) und Seminar (b)<br>\n**Empfohlenes Studiensemester:** a: 2. Fachsemester (Sommersemester) | b: 3. Fachsemester (Wintersemester)<br>\n**Häufigkeit des Angebots:** a: Jedes Wintersemester | b: Jedes Sommersemester<br>\n**Geplante Gruppengröße:** a: Ca. 60 Studierende | b: Ca. 60 Studierende<br>\n**Kontaktzeit:** a: 4 SWS/60 Stunden / 2 ECTS-Leistungspunkte | b: 2 SWS/30 Stunden / 1 ECTS-Leistungspunkt<br>\n**Selbststudium:** a: 60 Stunden / 2 ECTS-Leistungspunkte | b: 30 Stunden / 1 ECTS-Leistungspunkt<br>\n**ECTS-Leistungspunkte für die Modulprüfung:** -keine-<br>\n**Inhalte:** Dieses Modul vermittelt grundlegende Kenntnisse in Wahrscheinlichkeitstheorie und in statistischen Methoden der Computerlinguistik, sowie deren Anwendung mittels Korpora und Datensätzen. Unter anderem werden folgende Bereiche abgedeckt: Statistik und statistische Programmierung in einer geeigneten Programmiersprache (z.B. R); Aufbau und Pflege linguistischer Ressourcen (Korpora, Datenbanken, ...).<br>\n**Angestrebte Lernergebnisse und Studieninhalte:** Kenntnisse der Grundlagen der Wahrscheinlichkeitstheorie und Grundbegriffe der Statistik. Fähigkeit, statistische Analysen selbst zu konzipieren und implementieren. Fähigkeit, Korpora zu erstellen und für Experimente und Analysen durchzuführen.<br>\n**Teilnahmevoraussetzungen:** Formal: keine | Inhaltlich: Basismodul Mathematische und logische Grundlagen<br>\n**Prüfungsformen:** -keine-<br>\n**Voraussetzungen für die Zulassung zur Modulprüfung:** -keine-<br>\n**Voraussetzungen für die Vergabe von ECTS-Leistungspunkten:** Erbrachte Studienleistungen (SL) oder Hausaufgaben in allen Lehrveranstaltungen<br>\n**Sonstige Informationen:** -keine-",
            "Die Lehre ist als Präsenzstudium organisiert. Im Studium müssen die Studierenden nach den Bestimmungen dieser Prüfungsordnung Pflicht- und Wahlpflichtveranstaltungen einschließlich des Profilbildungsbereiches belegen.",
            "(1) In allen Lehrveranstaltungen sind Studienleistungen obligatorisch. Studienleistungen im Sinne dieser Prüfungsordnung werden durch die aktive Teilnahme an Lehrveranstaltungen erbracht. Studienleistungen sind auf die in der Modulbeschreibung definierten Inhalte und Kompetenzen ausgerichtet. Der Workload von Studienleistungen ist durch die Modulbeschreibung begrenzt. Studienleistungen sind unbenotet und können als Prüfungsvoraussetzung bestimmt werden. Näheres regelt der fächerspezifische Anhang."
        ]
    },
    {
        "user_input": "Wie lang dauert eine Klausur?",
        "reference": "Die Dauer einer Klausurarbeit beträgt in der Regel 90 Minuten.",
        "response": "Die Dauer einer Klausur beträgt in der Regel 90 Minuten.",
        "retrieved_contexts": [
            "(3) Die Dauer einer Klausurarbeit beträgt in der Regel 90 Minuten. Ausnahmsweise kann die Bearbeitungszeit abhängig vom Workload des Moduls auf höchstens 180 Minuten verlängert oder auf mindestens 45 Minuten verkürzt werden. Die Bewertung einer Klausur wird durch die Dozentinnen und Dozenten vorgenommen. Die Bewertung ist der Kandidatin oder dem Kandidaten nach spätestens acht Wochen bekannt zu machen. Näheres regelt der fächerspezifische Anhang.",
            "(1) Die Regelstudienzeit bis zum vollständigen Abschluss der Bachelorprüfung beträgt drei oder ausnahmsweise vier Studienjahre. Ausnahmen sind im fächerspezifischen Anhang beschrieben. Ein Studienjahr besteht aus zwei Semestern. Der Bachelorstudiengang ist so konzipiert, dass er mit einem durchschnittlichen Arbeitsaufwand (workload) von 900 Stunden pro Semester abgeschlossen werden kann.",
            "(4) Eine Studienarbeit besteht aus der mündlichen Präsentation und schriftlichen Ausarbeitung einer Thematik aus dem Stoffgebiet einer oder mehrerer Lehrveranstaltungen. Alternativ kann eine Klausur von 45 Minuten Dauer an die Stelle der schriftlichen Ausarbeitung treten. Die Dauer der mündlichen Präsentation beträgt mindestens 15 Minuten. Der Umfang der schriftlichen Ausarbeitung soll mindestens 1500 Wörter (circa 5 Seiten) und höchstens 4500 Wörter (circa 15 Seiten) betragen. Die Bewertung einer Studienarbeit wird durch die Dozentin oder den Dozenten vorgenommen. Die Bewertung ist der Kandidatin oder dem Kandidaten nach spätestens acht Wochen nach Abgabe der schriftlichen Ausarbeitung bekannt zu machen."
        ]
    },
    {
        "user_input": "Wie oft darf ich eine nicht bestandene Modulprüfung wiederholen?",
        "reference": "Eine nicht bestandene Modulprüfung kann insgesamt zweimal wiederholt werden.",
        "response": "Eine nicht bestandene Modulprüfung kann zweimal wiederholt werden.",
        "retrieved_contexts": [
            "(5) Eine nicht bestandene Modulprüfung, beziehungsweise eine mit weniger als \"ausreichend\" bewertete Prüfungsleistung als Teil der Gruppenarbeit, kann zweimal wiederholt werden.",
            "(3) Eine bestandene Prüfung kann nicht wiederholt werden.",
            "(4) Ist eine Prüfung nicht bestanden, oder gilt sie im Sinne von § 17 Absatz 2 oder 4 beziehungsweise § 16 Absatz 1 als nicht bestanden, erteilt die oder der Vorsitzende des Prüfungsausschusses beziehungsweise ihre oder seine Stellvertretung der Kandidatin oder dem Kandidaten hierüber einen schriftlichen Bescheid, der auch darüber Auskunft gibt, ob die Prüfung wiederholt werden kann. Der Bescheid über die nicht bestandene Prüfung ist mit einer Rechtsbehelfsbelehrung zu versehen."
        ]
    },
    {
        "user_input": "Wie stark zählt die Bachelorarbeit für meine Abschlussnote?",
        "reference": "Die Note der Bachelorarbeit wird bei der Ermittlung der Gesamtnote dreifach gewichtet. Im Vergleich dazu gehen alle anderen Modulprüfungen nur einfach in die Gesamtnote ein.",
        "response": "Die Bachelorarbeit zählt bei integrierten Studiengängen dreifach oder vierfach gewichtet.",
        "retrieved_contexts": [
            "(5) Die Bachelorarbeit wird mit 12 ECTS-Leistungspunkten gewertet.",
            "(6) Die Gesamtnote der Bachelorprüfung bei Kern- und Ergänzungsfachstudiengängen errechnet sich zu 20 Prozent aus der Note der Bachelorarbeit, zu 50 Prozent aus dem gewichteten arithmetischen Mittel aller Modulnoten des Kernfaches, und zu 30 Prozent aus dem gewichteten arithmetischen Mittel aller Modulnoten des Ergänzungsfaches. Modulnoten können nach Maßgabe des fächerspezifischen Anhangs doppelt oder dreifach gewichtet werden. Alle Dezimalstellen außer der ersten werden ohne Rundung gestrichen.",
            "(5) Die Gesamtnote der Bachelorprüfung bei integrierten Studiengängen errechnet sich als gewichtetes arithmetisches Mittel aus den Modulnoten und der Bachelorarbeit. Alle Dezimalstellen außer der ersten werden ohne Rundung gestrichen. Die Bachelorarbeit wird nach Maßgabe des fächerspezifischen Anhangs dreifach oder vierfach gewichtet. Die Gewichtung der Modulnoten ist im fächerspezifischen Anhang angegeben."
        ]
    },
    {
        "user_input": "Was passiert, wenn ich in einer Präsenzprüfung generative Künstliche Intelligenz benutze?",
        "reference": "Der Einsatz generativer Künstlicher Intelligenz im Rahmen von Präsenzprüfungen ist unzulässig. Dies gilt als Täuschungsversuch.",
        "response": "Wenn Sie in einer Präsenzprüfung generative Künstliche Intelligenz nutzen, gilt dies als Täuschungsversuch und die Prüfungsleistung wird mit \"nicht ausreichend\" bewertet.",
        "retrieved_contexts": [
            "(5) Versuchen Kandidatinnen oder Kandidaten, das Ergebnis einer Prüfungsleistung durch Täuschung, zum Beispiel Benutzung nicht zugelassener Hilfsmittel, zu beeinflussen, gilt die betreffende Prüfungsleistung als mit \"nicht ausreichend\" (5,0) bewertet. Der Einsatz generativer Künstlicher Intelligenz im Rahmen von Präsenzprüfungen ist unzulässig. Als Täuschungsversuch gelten auch nicht als Solche gekennzeichnete Zitate aus Internetquellen. Wer als Kandidatin oder Kandidat den ordnungsgemäßen Ablauf der Prüfung stört, kann von den jeweiligen Prüfenden oder Aufsichtführenden nach Abmahnung von der Fortsetzung der Prüfungsleistung ausgeschlossen werden; in diesem Fall gilt die betreffende Prüfungsleistung als mit \"nicht ausreichend\" (5,0) bewertet. Die Gründe für den Ausschluss sind aktenkundig zu machen. Wer von der weiteren Erbringung einer Prüfungsleistung ausgeschlossen wird, kann verlangen, dass diese Entscheidung vom Prüfungsausschuss überprüft wird. Dies gilt entsprechend bei der Feststellung einer Täuschung im Sinne von Satz 1.",
            "(2) Waren die Voraussetzungen für die Zulassung zu einer Prüfung nicht erfüllt, ohne dass die Kandidatin oder der Kandidat hierüber täuschen wollte, und wird diese Tatsache erst nach Aushändigung des Zeugnisses bekannt, wird dieser Mangel durch das Bestehen der Prüfung geheilt. Hat die Kandidatin oder der Kandidat die Zulassung vorsätzlich zu Unrecht erwirkt, entscheidet der Prüfungsausschuss unter Beachtung des Verwaltungsverfahrensgesetzes für das Land Nordrhein-Westfalen über die Rechtsfolgen.",
            "(1) Hat die Kandidatin oder der Kandidat bei einer Prüfung getäuscht und wird diese Tatsache erst nach der Aushändigung des Zeugnisses bekannt, kann der Prüfungsausschuss nachträglich die Noten für diejenigen Prüfungsleistungen, bei deren Erbringung die Kandidatin oder der Kandidat getäuscht hat, entsprechend berichtigen und die Prüfung ganz oder teilweise für nicht bestanden erklären."
        ]
    },
    {
        "user_input": "Muss ich Kurse aus der Linguistik für das interdisziplinäre Vertiefungsmodul belegen?",
        "reference": "Nein, Linguistik-Kurse sind keine Pflicht. Das Modul sieht vor, dass du zwei Vorlesungen oder Seminare aus der Linguistik oder der Informatik wählst, wobei lediglich der Informatik-Anteil von 4 SWS vorgeschrieben ist.",
        "response": "Nein, Kurse aus der Linguistik müssen nicht belegt werden. Das interdisziplinäre Vertiefungsmodul (Modul 5100) erfordert ausschließlich Veranstaltungen aus den Bereichen Linguistik und Informatik, wobei mindestens 4 SWS in der Informatik belegt werden müssen.",
        "retrieved_contexts": [
            "### Modul: Vertiefungsmodul - Interdisziplinär\n**Englischer Titel:** Specialization module - interdisciplinary<br>\n**Modul-Nummer:** 5100<br>\n**ECTS-Leistungspunkte:** 12 ECTS-Leistungspunkte<br>\n**Workload:** 360 Stunden<br>\n**Dauer:** 2 Semester<br>\n**Lehrveranstaltungen und Lehrformen:** Zwei Vorlesungen oder Seminare aus Linguistik oder Informatik | Vorlesung Linguistik: 5101, 5105 | Vorlesung Informatik: 5102, 5106 | Seminar Linguistik: 5103, 5107 | Seminar Informatik: 5104, 5108<br>\n**Belegung:** Nach Vorgabe der gewählten Veranstaltungen<br>\n**Empfohlenes Studiensemester:** 4. Fachsemester (Sommersemester) | 5. Fachsemester (Wintersemester)<br>\n**Häufigkeit des Angebots:** Jedes Semester<br>\n**Geplante Gruppengröße:** Nach Vorgabe der gewählten Veranstaltungen<br>\n**Kontaktzeit:** Nach Vorgabe der gewählten Veranstaltungen<br>\n**Selbststudium:** Nach Vorgabe der gewählten Veranstaltungen<br>\n**ECTS-Leistungspunkte für die Modulprüfung:** Nach Vorgabe der gewählten Veranstaltungen<br>\n**Inhalte:** Mögliche Inhalte sind Themen der Linguistik und Informatik. Relevante mögliche Themen in der Linguistik sind z.B.: Phonetik und Phonologie, Psycho- und Neurolinguistik, historische Linguistik. Es müssen Veranstaltungen im Umfang von mindestens 4 SWS in der Informatik belegt werden. Dabei darf keine Doppelung von Inhalten der Module aus der Computerlinguistik entstehen. Für die Computerlinguistik relevante mögliche Themen in der Informatik sind z.B.: Professionelle Softwareentwicklung, Datenbanksysteme, Nichtkooperative Spieltheorie, Komplexitätstheorie, Numerische Optimierung, Dialogsysteme, Überblick Künstliche Intelligenz.<br>\n**Angestrebte Lernergebnisse und Studieninhalte:** Vertiefte Kenntnisse in Spezialgebieten von Linguistik/Computerlinguistik/Informatik<br>\n**Teilnahmevoraussetzungen:** Formal: keine<br>\n**Prüfungsformen:** Mündliche Prüfung (Pnr. 5110) oder Klausur (Pnr. 5120) oder Hausarbeit (Pnr. 5130) oder Studienarbeit (Pnr. 5140) oder Projektarbeit (Pnr. 5150)<br>\n**Voraussetzungen für die Zulassung zur Modulprüfung:** -keine<br>\n**Voraussetzungen für die Vergabe von ECTS-Leistungspunkten:** Bestandene Modulprüfung, aktive und erfolgreiche Mitwirkung in den Seminaren und theoretischen und praktischen Übungen.<br>\n**Sonstige Informationen:** -keine-",
            "### Modul: Aufbaumodul - Mathematische Linguistik\n**Englischer Titel:** Advanced module - mathematical linguistics<br>\n**Modul-Nummer:** 4200<br>\n**ECTS-Leistungspunkte:** 6 ECTS-Leistungspunkte<br>\n**Workload:** 180 Stunden<br>\n**Dauer:** 1 Semester<br>\n**Lehrveranstaltungen und Lehrformen:** a: Automatentheorie & Formale Sprachen (Seminar) / 4201 | b: Übung zu Automatentheorie & Formale Sprachen (Übung) / 4202<br>\n**Belegung:** Seminar (a) und Übung (b)<br>\n**Empfohlenes Studiensemester:** a: 3. Fachsemester (Wintersemester) | b: 3. Fachsemester (Wintersemester)<br>\n**Häufigkeit des Angebots:** a: Jedes Wintersemester | b: Jedes Wintersemester<br>\n**Geplante Gruppengröße:** a: Ca. 60 Studierende | b: Ca. 60 Studierende<br>\n**Kontaktzeit:** a: 2 SWS / 30 Stunden / 1 ECTS-Leistungspunkt | b: 2 SWS/30 Stunden / 1 ECTS-Leistungspunkt<br>\n**Selbststudium:** a: 60 Stunden / 2 ECTS-Leistungspunkte | b: 60 Stunden/2 ECTS-Leistungspunkte<br>\n**ECTS-Leistungspunkte für die Modulprüfung:** -keine-<br>\n**Inhalte:** Sprachklassen basierend auf der Chomsky-Hierarchie (Automaten, Grammatiken); Sprachen und Relationen, rationale Relationen und Finite-State-Methoden; Komplexitätstheorie und Lernbarkeitstheorie; Abschlusseigenschaften und Entscheidungsprobleme wichtiger Sprachklassen.<br>\n**Angestrebte Lernergebnisse und Studieninhalte:** Vertrautheit mit den mathematischen und informatischen Grundlagen der Linguistik und Computerlinguistik. Verständnis von Beweisverfahren. Fähigkeit, Sprachen, Grammatiken und Automaten aufeinander zu beziehen und passende Entsprechungen zu konstruieren.<br>\n**Teilnahmevoraussetzungen:** Formal: keine | Inhaltlich: Basismodul - Mathematische und logische Grundlagen, Basismodul - Grundlagen der Computerlinguistik und formale Grammatikbeschreibung<br>\n**Prüfungsformen:** -keine-<br>\n**Voraussetzungen für die Zulassung zur Modulprüfung:** -keine-<br>\n**Voraussetzungen für die Vergabe von ECTS-Leistungspunkten:** Erbrachte Studienleistungen (SL) in allen Lehrveranstaltungen<br>\n**Sonstige Informationen:** -keine-",
            "### Modul: Vertiefungsmodul - Computerlinguistik 1\n**Englischer Titel:** Specialization module - computational linguistics 1<br>\n**Modul-Nummer:** 5200<br>\n**ECTS-Leistungspunkte:** 12 ECTS-Leistungspunkte<br>\n**Workload:** 360 Stunden<br>\n**Dauer:** 1 Semester<br>\n**Lehrveranstaltungen und Lehrformen:** a: Seminar Computerlinguistik (Seminar) / 5201 | b: Seminar Computerlinguistik (Seminar) / 5202<br>\n**Belegung:** Seminar (a) und Seminar (b)<br>\n**Empfohlenes Studiensemester:** a: 5. Fachsemester (Wintersemester) | b: 5. Fachsemester (Wintersemester)<br>\n**Häufigkeit des Angebots:** Jedes Wintersemester<br>\n**Geplante Gruppengröße:** a: Ca. 30 Studierende | b: Ca. 30 Studierende<br>\n**Kontaktzeit:** a: 4 SWS/30 Stunden / 2 ECTS-Leistungspunkte | b: 4 SWS/30 Stunden / 2 ECTS-Leistungspunkte<br>\n**Selbststudium:** Im 5. Fachsemester: 240 Stunden / 8 ECTS-Leistungspunkte<br>\n**ECTS-Leistungspunkte für die Modulprüfung:** -keine-<br>\n**Inhalte:** Mögliche Inhalte sind Themen der Computerlinguistik. Das können sein: Nichtklassische (modale, fuzzy oder substrukturelle) Logiken; besondere Grammatikformalismen (Kategorialgrammatik); Vertiefungsseminare im Bereich maschinelles Lernen und Deep Learning. Über die Zulassung von nicht im Vorlesungsverzeichnis zugeordneten Veranstaltungen zu diesem Modul entscheiden die Modulverantwortlichen.<br>\n**Angestrebte Lernergebnisse und Studieninhalte:** Studierende lernen vertiefte Kenntnisse in Spezialgebieten der Computerlinguistik.<br>\n**Teilnahmevoraussetzungen:** Formal: Basismodul - Mathematische und logische Grundlagen, Basismodul - Grundlagen der Computerlinguistik und formale Grammatikbeschreibung, Aufbaumodul - Maschinelles Lernen | Inhaltlich: Je nach Thema<br>\n**Prüfungsformen:** -keine-<br>\n**Voraussetzungen für die Zulassung zur Modulprüfung:** -keine-<br>\n**Voraussetzungen für die Vergabe von ECTS-Leistungspunkten:** Aktive und erfolgreiche Mitwirkung im Forschungsseminar<br>\n**Sonstige Informationen:** -keine-"
        ]
    },
    {
        "user_input": "Wie lang ist die offizielle Bearbeitungszeit für die Bachelorarbeit?",
        "reference": "Die Bearbeitungszeit für die Bachelorarbeit beträgt maximal drei Monate.",
        "response": "Die offizielle Bearbeitungszeit für die Bachelorarbeit endet in der Regel zwei Monate nach dem Abschluss der praktischen Projektarbeit.",
        "retrieved_contexts": [
            "(1) Die Regelstudienzeit bis zum vollständigen Abschluss der Bachelorprüfung beträgt drei oder ausnahmsweise vier Studienjahre. Ausnahmen sind im fächerspezifischen Anhang beschrieben. Ein Studienjahr besteht aus zwei Semestern. Der Bachelorstudiengang ist so konzipiert, dass er mit einem durchschnittlichen Arbeitsaufwand (workload) von 900 Stunden pro Semester abgeschlossen werden kann.",
            "(10) Die Bearbeitungszeit für Studienarbeiten endet zwei Monate nach Abschluss der mündlichen Leistung, spätestens zum Vorlesungsbeginn des darauffolgenden Semesters. Die Bearbeitungszeit für Hausarbeiten beträgt in der Regel zwei Monate. Sie kann vom zuständigen Prüfungsausschuss um bis zu einen Monat verlängert werden, wenn die Aufgabenstellung dies zwingend erfordert. Die Themen werden im laufenden Semester vergeben. Die Bearbeitungszeit für den schriftlichen Bericht bei Projektarbeiten endet in der Regel zwei Monate nach dem Abschluss der praktischen Projektarbeit. Sie kann vom zuständigen Prüfungsausschuss um bis zu einen Monat verlängert werden, wenn die Aufgabenstellung dies zwingend erfordert. Verzögert sich die Bearbeitung durch von der Kandidatin oder dem Kandidaten nicht zu vertretende Umstände, kann sowohl für Hausarbeiten als auch für Projektarbeiten eine Nachfrist von bis zu 4 Wochen eingeräumt werden.",
            "(1) Die Anfertigung der Bachelorarbeit erfolgt in der Regel im sechsten Studiensemester."
        ]
    }
]