[
    {
        "user_input": "Welche Kurse sollte ich im ersten Semester belegen?",
        "reference": "Laut dem exemplarischen Studienverlaufsplan solltest du im ersten Semester folgende Kurse belegen: Mathematische Grundlagen, Einf\u00fchrung in die computationelle Logik, Einf\u00fchrung in die Computerlinguistik, Einf\u00fchrung in die Programmierung mit Python, Morphologie und Syntax.",
        "response": "Im ersten Semester des Studium der Computerlinguistik sollten folgende Kurse belegt werden:\n\n*   Mathematische und logische Grundlagen (Einf\u00fchrung in die computationelle Logik, Mathematische Grundlagen, Modulpr\u00fcfung)\n*   Grundlagen der Computerlinguistik und formale Grammatikbeschreibung (Einf\u00fchrung in die Computerlinguistik, Einf\u00fchrung in die Computerlinguistik, Einf\u00fchrung in die Computerlinguistik)\n*   Python-Programmierung (Einf\u00fchrung in die Programmierung mit Python, Einf\u00fchrung in die Programmierung mit Python)\n*   Basiswissen Linguistik (Morphologie und Syntax)",
        "retrieved_contexts": [
            "Phase 1 des Studiums der Computerlinguistik konzentriert sich auf den Erwerb von Basiswissen. Dies beinhaltet die Vermittlung mathematischer und logischer Konzepte und Methoden, die f\u00fcr die Computerlinguistik wesentlich sind. Eine Einf\u00fchrung in die Computerlinguistik gibt einen \u00dcberblick \u00fcber zentrale Fragestellungen und g\u00e4ngige Methoden in diesen Bereichen. Die Studierenden erwerben Kenntnisse \u00fcber Formalismen und Methoden der Grammatikmodellierung sowie eine Einf\u00fchrung in die Statistik. Erg\u00e4nzend dazu werden Einf\u00fchrungen in die f\u00fcr die Computerlinguistik zentralen sprachwissenschaftlichen Bereiche Morphologie/Syntax und Semantik/Pragmatik vermittelt. Der Studienplan sieht f\u00fcr das erste Jahr zudem einen Einstieg in die computerlinguistische Programmierung mit Python vor, welche neben Grundlagen auch aktuelle Methoden der Sprachtechnologie lehrt.",
            "Im 1. Semester des Bachelor Computerlinguistik sind insgesamt 4 Module mit 2 MP, 8 Veranstaltungen, 22 SWS und 30 LP vorgesehen, davon 1 LP im PBB. Das Basismodul Mathematische und logische Grundlagen umfasst 1 MP, 2 SL, 12 LP und 8 SWS. Darin enthalten sind Einf\u00fchrung in die computationelle Logik (Seminar mit \u00dcbung, 4 LP, 4 SWS, Pnr. 2101), Mathematische Grundlagen (Seminar, 4 LP, 4 SWS, Pnr. 2102) und die Modulpr\u00fcfung (Portfolio, 4 LP, Pnr. 2110). Das Basismodul Grundlagen der Computerlinguistik und formale Grammatikbeschreibung [1/2] beinhaltet 2 SL, 4 LP und 4 SWS, mit den Veranstaltungen Einf\u00fchrung in die Computerlinguistik (Seminar, 2 LP, 2 SWS, Pnr. 2201) und Einf\u00fchrung in die Computerlinguistik (\u00dcbung, 2 LP, 2 SWS, Pnr. 2202). Das Basismodul Python-Programmierung [1/2] hat ebenfalls 2 SL, 4 LP und 4 SWS, mit den Veranstaltungen Einf\u00fchrung in die Programmierung mit Python (Seminar, 2 LP, 2 SWS, Pnr. 2301) und Einf\u00fchrung in die Programmierung mit Python (\u00dcbung, 2 LP, 2 SWS, Pnr. 2302). Das Basiswissen Linguistik - Morphologie und Syntax besteht aus 1 MP, 2 SL, 9 LP und 6 SWS, inklusive Vorlesung (2 LP, 4 SWS, Pnr. 1301), Tutorium (2 LP, 2 SWS, Pnr. 1302) und Modulpr\u00fcfung (Klausur, 3 LP, Pnr. 1310). Der Profilbildungsbereich liefert 1 LP.",
            "Der Aufbau des Studiums der Computerlinguistik l\u00e4sst sich in drei Phasen gliedern. Die ersten beiden Semester widmen sich dem Erwerb von Basiswissen f\u00fcr die Computerlinguistik. In den Semestern 3 und 4 werden weitere Fachkompetenzen aufgebaut. Die letzten beiden Semester sind der weiteren Spezialisierung und dem Studienabschluss im Fach Computerlinguistik gewidmet."
        ]
    },
    {
        "user_input": "Kann ich auch im Sommersemester anfangen?",
        "reference": "Nein, das Studium ist f\u00fcr einen Beginn im Wintersemester ausgelegt.",
        "response": "Ja, das Modul kann im Sommersemester (6. Fachsemester) beginnen.",
        "retrieved_contexts": [
            "Das Modul Abschlussarbeit und Forschungskolloquium (Modul-Nummer: 5900) hat einen Umfang von 15 ECTS-Leistungspunkten und einen Workload von 450 Stunden. Die Dauer dieses Moduls betr\u00e4gt 1 Semester. Die Lehrveranstaltungen f\u00fcr dieses Modul sind Forschungskolloquium Computerlinguistik (Kolloquium) mit der Nummer 5901 und Seminar (Seminar) mit der Nummer 5902. Die Belegung f\u00fcr dieses Modul erfordert die Teilnahme am Forschungskolloquium (a) oder am Seminar (b). Das empfohlene Studiensemester f\u00fcr dieses Modul ist das 6. Fachsemester (Sommersemester) f\u00fcr beide Lehrveranstaltungen. Dieses Modul wird jedes Sommersemester angeboten. Die geplante Gruppengr\u00f6\u00dfe f\u00fcr das Forschungskolloquium (a) und das Seminar (b) des Moduls Abschlussarbeit und Forschungskolloquium betr\u00e4gt jeweils ca. 30 Studierende. Die Kontaktzeit f\u00fcr das Forschungskolloquium (a) betr\u00e4gt 2 SWS/30 Stunden / 1 ECTS-Leistungspunkt. Die Kontaktzeit f\u00fcr das Seminar (b) betr\u00e4gt ebenfalls 2 SWS/30 Stunden / 1 ECTS-Leistungspunkt. Im 6. Fachsemester betr\u00e4gt das Selbststudium 60 Stunden / 2 ECTS-Leistungspunkte. Die ECTS-Leistungspunkte f\u00fcr die Modulpr\u00fcfung des Moduls Abschlussarbeit und Forschungskolloquium betragen 12 ECTS-Leistungspunkte. Die Inhalte dieses Moduls beinhalten im Forschungskolloquium, dass jede zweite Woche (meist ausw\u00e4rtige) G\u00e4ste ihre aktuelle Forschungsarbeit vorstellen. Die Woche davor werden die Inhalte der Vortr\u00e4ge anhand von Artikeln besprochen und vorbereitet. Das Thema der Bachelorarbeit kann frei gew\u00e4hlt werden, muss aber im Bereich Computerlinguistik liegen. Die angestrebten Lernergebnisse und Studieninhalte dieses Moduls bef\u00e4higen die Studierenden, aktuelle Forschungsarbeit der Computerlinguistik kennenzulernen und selbst\u00e4ndig wissenschaftlich zu arbeiten. Teilnahmevoraussetzungen f\u00fcr das Modul Abschlussarbeit und Forschungskolloquium sind formal alle Basis- und Aufbaumodule. Die Pr\u00fcfungsform des Moduls Abschlussarbeit und Forschungskolloquium ist die Bachelorarbeit (Pnr. 6000). Es gibt keine Voraussetzungen f\u00fcr die Zulassung zur Pr\u00fcfung. Die Voraussetzungen f\u00fcr die Vergabe von ECTS-Leistungspunkten f\u00fcr das Modul Abschlussarbeit und Forschungskolloquium sind die aktive und erfolgreiche Mitwirkung im Forschungsseminar und eine bestandene Bachelorarbeit. Sonstige Informationen f\u00fcr das Modul Abschlussarbeit und Forschungskolloquium sind nicht vorhanden.",
            "Das Modul Praktikum & Orientierung (Modul-Nummer: 3000) hat einen Umfang von 12 ECTS-Leistungspunkten und einen Workload von 360 Stunden. Die Dauer dieses Moduls betr\u00e4gt 2 Semester. Die Lehrveranstaltungen f\u00fcr dieses Modul sind Orientierungsseminar (Seminar) mit der Nummer 3001 und Praktikum (in der Regel 6 Wochen in Vollzeit) mit der Nummer 3010. Die Belegung f\u00fcr dieses Modul erfordert die Teilnahme am Seminar (a). Das empfohlene Studiensemester f\u00fcr das Orientierungsseminar (a) ist das 4. Fachsemester (Sommersemester), und f\u00fcr das Praktikum (b) das 5. Fachsemester (Wintersemester). Dieses Modul wird jedes Sommersemester (a) und jedes Semester (b) angeboten. Die geplante Gruppengr\u00f6\u00dfe f\u00fcr das Orientierungsseminar (a) betr\u00e4gt ca. 60 Studierende, und f\u00fcr das Praktikum (b) ca. 60 Studierende. Die Kontaktzeit f\u00fcr das Orientierungsseminar (a) betr\u00e4gt 2 SWS / 30 Stunden / 1 ECTS-Leistungspunkt. F\u00fcr das Praktikum (b) gibt es keine Kontaktzeit. Das Selbststudium f\u00fcr das Orientierungsseminar (a) betr\u00e4gt 60 Stunden / 2 ECTS-Leistungspunkte. Das Selbststudium f\u00fcr das Praktikum (b) betr\u00e4gt 270 Stunden/9 ECTS-Leistungspunkte. Es gibt keine ECTS-Leistungspunkte f\u00fcr die Modulpr\u00fcfung dieses Moduls. Die Inhalte des Moduls Praktikum & Orientierung umfassen im Seminar (a) die Orientierung f\u00fcr die zweite Studienphase, insbesondere in Bezug auf Studienorganisation (Schwerpunktsetzung, Auslandsaufenthalt, Praktikum, ...), Abschlussarbeit (Themenwahl, wissenschaftliches Arbeiten, ...), Berufsperspektiven (Bewerbungsverfahren, Berufsfeldorientierung, ...), und Anschlussstudieng\u00e4nge (wissenschaftliche Karriere, ...). Das Praktikum (b) dient der berufsorientierten Anwendung der im Studium vermittelten Qualifikationen. Die angestrebten Lernergebnisse und Studieninhalte dieses Moduls bef\u00e4higen die Studierenden, Entwicklungsziele f\u00fcr ihre Zukunft zu entwickeln und zu lernen, welche Schritte sie zur Realisierung ergreifen k\u00f6nnen. Sie erlangen Orientierung sowohl f\u00fcr den weiteren Studienaufbau als auch f\u00fcr ihren beruflichen Werdegang. Berufliche W\u00fcnsche und M\u00f6glichkeiten k\u00f6nnen sie realistischer beurteilen. Sie erwerben erweiterte Methodenkenntnis aus der beruflichen Praxis und gewinnen ein verst\u00e4rktes Selbstvertrauen durch Praxiserprobung des bisher erworbenen Wissens. Sie vertiefen ihre Kenntnisse zum wissenschaftlichen Arbeiten, k\u00f6nnen eigene Forschungsfragen formulieren, diese angemessen eingrenzen und die zur Beantwortung notwendigen Schritte planen und umsetzen. Teilnahmevoraussetzungen f\u00fcr das Modul Praktikum & Orientierung sind im 4. Fachsemester oder h\u00f6her, und inhaltlich das Basismodul - Mathematische und logische Grundlagen, das Basismodul - Grundlagen der Computerlinguistik und formale Grammatikbeschreibung und das Basismodul - Python-Programmierung. F\u00fcr dieses Modul gibt es keine Pr\u00fcfungsformen. Es gibt keine Voraussetzungen f\u00fcr die Zulassung zur Modulpr\u00fcfung. Die Voraussetzungen f\u00fcr die Vergabe von ECTS-Leistungspunkten f\u00fcr das Modul Praktikum & Orientierung sind erbrachte Studienleistungen (SL) in (a) und ein nachgewiesenes 6-w\u00f6chiges Praktikum \u00fcber Praktikumsnachweis und Praktikumsbericht. Sonstige Informationen f\u00fcr das Modul Praktikum & Orientierung sind nicht vorhanden.",
            "Der Aufbau des Studiums der Computerlinguistik l\u00e4sst sich in drei Phasen gliedern. Die ersten beiden Semester widmen sich dem Erwerb von Basiswissen f\u00fcr die Computerlinguistik. In den Semestern 3 und 4 werden weitere Fachkompetenzen aufgebaut. Die letzten beiden Semester sind der weiteren Spezialisierung und dem Studienabschluss im Fach Computerlinguistik gewidmet."
        ]
    },
    {
        "user_input": "Muss ich flie\u00dfend Englisch sprechen k\u00f6nnen um Computerlinguistik zu studieren?",
        "reference": "Flie\u00dfendes Englisch wird nicht vorausgesetzt, jedoch ben\u00f6tigst du Englischkenntnisse auf dem Niveau B1. Dies entspricht vergleichsweise einem erfolgreichen vierj\u00e4hrigen Schulunterricht an einer weiterf\u00fchrenden Schule.",
        "response": "F\u00fcr die Zulassung zum Bachelorstudiengang Computerlinguistik sind Kenntnisse des Englischen auf dem Niveau B1 erforderlich.",
        "retrieved_contexts": [
            "Die vorliegende Lesefassung vom 26.09.2025 beschreibt die Studiengangs\u00fcbersicht f\u00fcr den Bachelor Computerlinguistik PO 2025. Der Studiengang Computerlinguistik ist ein integrierter Studiengang, der ausschlie\u00dflich im Wintersemester beginnt. Der gesamte Studienumfang betr\u00e4gt 180 ECTS-Leistungspunkte (LP). F\u00fcr die Zulassung zum Studium sind Kenntnisse des Englischen auf dem Niveau B1 erforderlich, was einem erfolgreichen vierj\u00e4hrigen Schulunterricht an einer weiterf\u00fchrenden Schule entspricht. Es gibt keine Angabe zu einem Prop\u00e4deutikum im Profilbildungsbereich. Insgesamt sind 9 Modulpr\u00fcfungen sowie die Bachelorarbeit zu absolvieren.",
            "Im 2. Semester des Bachelor Computerlinguistik sind 4 Module mit 3 MP, 7 Veranstaltungen, 18 SWS und 30 LP vorgesehen, davon 1 LP im PBB. Das Basismodul Grundlagen der Computerlinguistik und formale Grammatikbeschreibung [2/2] umfasst 1 MP, 2 SL, 8 LP und 4 SWS, mit den Veranstaltungen Grammatikformalismen (Seminar, 2 LP, 2 SWS, Pnr. 2203), Grammatikformalismen (\u00dcbung, 2 LP, 2 SWS, Pnr. 2204) und Modulpr\u00fcfung (Klausur, 4 LP, Pnr. 2210). Das Basismodul Python-Programmierung [2/2] beinhaltet 1 MP, 2 SL, 8 LP und 4 SWS, mit den Veranstaltungen Fortgeschrittene Python-Programmierung mit NLP-Anwendungen (Seminar, 2 LP, 2 SWS, Pnr. 2303), Fortgeschrittene Python-Programmierung mit NLP-Anwendungen (\u00dcbung, 2 LP, 2 SWS, Pnr. 2304) und Modulpr\u00fcfung (Klausur, 4 LP, Pnr. 2310). Das Basiswissen Linguistik - Semantik und Pragmatik besteht aus 1 MP, 2 SL, 9 LP und 6 SWS, mit Vorlesung (4 LP, 4 SWS, Pnr. 1401), Tutorium (2 LP, 2 SWS, Pnr. 1402) und Modulpr\u00fcfung (Klausur, 3 LP, Pnr. 1410). Das Basismodul Statistische Methoden in der Computerlinguistik [1/2] hat 0 MP, 1 SL, 4 LP und 4 SWS, mit der Veranstaltung Wahrscheinlichkeitstheorie und Statistik (Seminar und \u00dcbung, 4 LP, 4 SWS, Pnr. 2401). Der Profilbildungsbereich liefert 1 LP.",
            "Es gibt keine Angabe zu den Voraussetzungen f\u00fcr Pr\u00fcfungen im Bachelor Computerlinguistik. Eine Besonderheit des Studiengangs ist, dass die zweite Wiederholung einer Modulpr\u00fcfung als m\u00fcndliche Pr\u00fcfung erfolgen darf. Bei der Gewichtung der Pr\u00fcfungen f\u00fcr die Gesamtnote wird die Bachelorarbeit dreifach gewichtet, w\u00e4hrend alle Modulpr\u00fcfungen einfach z\u00e4hlen. Es gibt keine Angabe zur Pr\u00fcfungssprache nach \u00a7 6 (4). Ein Auslandsaufenthalt ist optional und das Mobilit\u00e4tsfenster hierf\u00fcr ist das 5. Semester. Es gibt keine Angabe zu Exkursionen."
        ]
    },
    {
        "user_input": "Muss ich f\u00fcr den Python-Kurs Vorkenntnisse haben?",
        "reference": "Nein, f\u00fcr das Modul \"Python-Programmierung\" werden weder formale noch inhaltliche Vorkenntnisse vorausgesetzt.",
        "response": "Nein, es sind keine Vorkenntnisse erforderlich.",
        "retrieved_contexts": [
            "Das Modul Basismodul - Python-Programmierung (Modul-Nummer: 2300) erstreckt sich \u00fcber 2 Semester, umfasst 12 ECTS-Leistungspunkte und hat einen Workload von 360 Stunden. Die Lehrveranstaltungen dieses Basismoduls sind Einf\u00fchrung in die Programmierung mit Python (Seminar) mit der Nummer 2301, Einf\u00fchrung in die Programmierung mit Python (\u00dcbung) mit der Nummer 2302, Fortgeschrittene Python-Programmierung mit NLP-Anwendungen (Seminar) mit der Nummer 2303 und Fortgeschrittene Python-Programmierung mit NLP-Anwendungen (\u00dcbung) mit der Nummer 2304. Die Belegung f\u00fcr das Basismodul - Python-Programmierung erfordert die Teilnahme am Seminar (a) mit \u00dcbung (b) sowie am Seminar (c) mit \u00dcbung (d). Das empfohlene Studiensemester f\u00fcr die erste H\u00e4lfte (a, b) ist das 1. Fachsemester (Wintersemester), f\u00fcr die zweite H\u00e4lfte (c, d) das 2. Fachsemester (Sommersemester), mit einer Pr\u00fcfung im 2. Fachsemester (Sommersemester). Die Lehrveranstaltungen des Basismoduls - Python-Programmierung werden jedes Wintersemester (a, b) und jedes Sommersemester (c, d) angeboten. Die geplante Gruppengr\u00f6\u00dfe f\u00fcr alle vier Lehrveranstaltungen des Basismoduls - Python-Programmierung betr\u00e4gt ca. 60 Studierende. Die Kontaktzeit f\u00fcr Einf\u00fchrung in die Programmierung mit Python (a) und (b) betr\u00e4gt jeweils 2 SWS / 30 Stunden und 1 ECTS-Leistungspunkt. Ebenso betr\u00e4gt die Kontaktzeit f\u00fcr Fortgeschrittene Python-Programmierung mit NLP-Anwendungen (c) und (d) jeweils 2 SWS / 30 Stunden und 1 ECTS-Leistungspunkt. Das Selbststudium f\u00fcr Einf\u00fchrung in die Programmierung mit Python (a) und (b) betr\u00e4gt jeweils 30 Stunden und 1 ECTS-Leistungspunkt. Das Selbststudium f\u00fcr Fortgeschrittene Python-Programmierung mit NLP-Anwendungen (c) und (d) betr\u00e4gt ebenfalls jeweils 30 Stunden und 1 ECTS-Leistungspunkt. Die ECTS-Leistungspunkte f\u00fcr die Modulpr\u00fcfung des Basismoduls - Python-Programmierung betragen 4 ECTS-Leistungspunkte, was einem Workload von 120 Stunden entspricht. Die Inhalte des Basismoduls - Python-Programmierung umfassen im Wintersemester Grundlagen der Python-Programmierung, Datentypen in Python, g\u00e4ngige Programmkonstrukte und elementare Textverarbeitung. Im Sommersemester werden objektorientierte und funktionale Programmierung mit Python, der Einsatz von Programm-Bibliotheken in den Bereichen Data Science und NLP (Natural Language Processing) sowie Grundz\u00fcge der Software-Entwicklung behandelt. Die angestrebten Lernergebnisse und Studieninhalte des Basismoduls - Python-Programmierung bef\u00e4higen die Studierenden, grundlegende F\u00e4higkeiten in der Programmierung mit der Programmiersprache Python zu erwerben sowie Kenntnisse \u00fcber fortgeschrittene Konzepte der Python-Programmierung (objektorientierte und funktionale Programmierung). Au\u00dferdem werden Grundkenntnisse des Einsatzes von Python in den Bereichen Data Science und NLP erworben, sowie die F\u00e4higkeit, ein kleines Software-Projekt durchzuf\u00fchren und zu pr\u00e4sentieren. F\u00fcr die Teilnahme am Basismodul - Python-Programmierung sind keine formalen oder inhaltlichen Teilnahmevoraussetzungen erforderlich. Die Pr\u00fcfungsform des Basismoduls - Python-Programmierung ist eine Projektarbeit (Pnr. 2310). Es gibt keine Voraussetzungen f\u00fcr die Zulassung zur Modulpr\u00fcfung. Die Voraussetzungen f\u00fcr die Vergabe von ECTS-Leistungspunkten f\u00fcr das Basismodul - Python-Programmierung sind erbrachte Studienleistungen (SL) in den Lehrveranstaltungen (a) und (b) f\u00fcr 4 ECTS-Leistungspunkte, erbrachte Studienleistungen (SL) in den Lehrveranstaltungen (c) und (d) f\u00fcr 4 ECTS-Leistungspunkte, sowie eine bestandene Modulpr\u00fcfung f\u00fcr 4 ECTS-Leistungspunkte. Sonstige Informationen f\u00fcr das Basismodul - Python-Programmierung sind nicht vorhanden.",
            "Das Modul Aufbaumodul - Objektorientierte Programmierung (Modul-Nummer: 4500) hat einen Umfang von 12 ECTS-Leistungspunkten und einen Workload von 360 Stunden. Die Dauer dieses Aufbaumoduls betr\u00e4gt 1 Semester. Die Lehrveranstaltungen f\u00fcr dieses Aufbaumodul sind Programmierung (Vorlesung) mit der Nummer 4501, \u00dcbung zur Vorlesung (\u00dcbung) mit der Nummer 4502 und Praktische \u00dcbung zur Vorlesung (Praktische \u00dcbung) mit der Nummer 4503. Die Belegung f\u00fcr dieses Aufbaumodul erfordert die Teilnahme an Vorlesung (a) mit \u00dcbung (b) und praktischer \u00dcbung (c). Das empfohlene Studiensemester f\u00fcr dieses Aufbaumodul ist das 3. Fachsemester (Wintersemester) f\u00fcr alle drei Lehrveranstaltungen. Dieses Aufbaumodul wird jedes Wintersemester angeboten. Die geplante Gruppengr\u00f6\u00dfe f\u00fcr die Vorlesung (a) des Aufbaumoduls - Objektorientierte Programmierung ist unbegrenzt, f\u00fcr die \u00dcbung (b) ca. 30 Studierende und f\u00fcr die Praktische \u00dcbung (c) ca. 30 Studierende. Die Kontaktzeit f\u00fcr die Vorlesung (a) betr\u00e4gt 4 SWS/60 Stunden/2 ECTS-Leistungspunkte. Die Kontaktzeit f\u00fcr die \u00dcbung (b) betr\u00e4gt 2 SWS/30 Stunden/1 ECTS-Leistungspunkt. Die Kontaktzeit f\u00fcr die Praktische \u00dcbung (c) betr\u00e4gt 2 SWS / 30 Stunden/1 ECTS-Leistungspunkt. Das Selbststudium f\u00fcr die Vorlesung (a) betr\u00e4gt 60 Stunden / 2 ECTS-Leistungspunkte. Das Selbststudium f\u00fcr die \u00dcbung (b) betr\u00e4gt 30 Stunden/1 ECTS-Leistungspunkt. Das Selbststudium f\u00fcr die Praktische \u00dcbung (c) betr\u00e4gt 30 Stunden / 1 ECTS-Leistungspunkt. Die ECTS-Leistungspunkte f\u00fcr die Modulpr\u00fcfung des Aufbaumoduls - Objektorientierte Programmierung betragen 4 ECTS-Leistungspunkte. Die Inhalte dieses Aufbaumoduls vermitteln grundlegende Programmierkenntnisse in einer objektorientierten Programmiersprache. Dar\u00fcber hinaus werden einf\u00fchrend Aspekte von Algorithmen und Datenstrukturen behandelt. Es wird keine Programmiererfahrung vorausgesetzt. Behandelt werden grundlegende Begriffe der Informatik; primitive Datentypen und Variablen; Kontrollstrukturen; eigene Datentypen (Klassen) und Arrays; Programmstrukturen im Speicher (Heap, Stack); Konzepte der Objektorientierung (Polymorphie, Schnittstellen); Rekursion; Fehlerbehandlung; dynamische Datenstrukturen (Listen, Bin\u00e4rb\u00e4ume, Hashing); Suchen und Sortieren (ausgew\u00e4hlte Algorithmen, u.a. bin\u00e4re Suche, BubbleSort, QuickSort); Datenstr\u00f6me (Standard-Eingabe und -Ausgabe, einfache 2D-Grafik, Dateien). Die angestrebten Lernergebnisse und Studieninhalte des Aufbaumoduls - Objektorientierte Programmierung bef\u00e4higen die Studierenden, Begriffe der Informatik und der Programmierung zu nennen und zu erl\u00e4utern; einfache Algorithmen (iterativ und rekursiv) zu verstehen, deren Ablauf zu beschreiben, sowie selbst zu erstellen; eigene Datentypen zu konzipieren und anzuwenden; einfache objektorientierte Programme mit Polymorphie, Vererbung und Schnittstellen zu entwickeln; die behandelten dynamischen Datenstrukturen anzuwenden. Formale Teilnahmevoraussetzungen f\u00fcr das Aufbaumodul - Objektorientierte Programmierung sind keine, inhaltliche Teilnahmevoraussetzungen sind das Basismodul - Mathematische und logische Grundlagen und das Basismodul - Python-Programmierung. Die Pr\u00fcfungsform des Aufbaumoduls - Objektorientierte Programmierung ist eine Klausur (Pnr. 4510). Es gibt keine Voraussetzungen f\u00fcr die Zulassung zur Modulpr\u00fcfung. Die Voraussetzungen f\u00fcr die Vergabe von ECTS-Leistungspunkten f\u00fcr das Aufbaumodul - Objektorientierte Programmierung sind erbrachte Studienleistungen (SL) in den Lehrveranstaltungen (b) und (c) sowie eine bestandene Modulpr\u00fcfung f\u00fcr 4 ECTS-Leistungspunkte. Sonstige Informationen f\u00fcr das Aufbaumodul - Objektorientierte Programmierung sind nicht vorhanden.",
            "Im 1. Semester des Bachelor Computerlinguistik sind insgesamt 4 Module mit 2 MP, 8 Veranstaltungen, 22 SWS und 30 LP vorgesehen, davon 1 LP im PBB. Das Basismodul Mathematische und logische Grundlagen umfasst 1 MP, 2 SL, 12 LP und 8 SWS. Darin enthalten sind Einf\u00fchrung in die computationelle Logik (Seminar mit \u00dcbung, 4 LP, 4 SWS, Pnr. 2101), Mathematische Grundlagen (Seminar, 4 LP, 4 SWS, Pnr. 2102) und die Modulpr\u00fcfung (Portfolio, 4 LP, Pnr. 2110). Das Basismodul Grundlagen der Computerlinguistik und formale Grammatikbeschreibung [1/2] beinhaltet 2 SL, 4 LP und 4 SWS, mit den Veranstaltungen Einf\u00fchrung in die Computerlinguistik (Seminar, 2 LP, 2 SWS, Pnr. 2201) und Einf\u00fchrung in die Computerlinguistik (\u00dcbung, 2 LP, 2 SWS, Pnr. 2202). Das Basismodul Python-Programmierung [1/2] hat ebenfalls 2 SL, 4 LP und 4 SWS, mit den Veranstaltungen Einf\u00fchrung in die Programmierung mit Python (Seminar, 2 LP, 2 SWS, Pnr. 2301) und Einf\u00fchrung in die Programmierung mit Python (\u00dcbung, 2 LP, 2 SWS, Pnr. 2302). Das Basiswissen Linguistik - Morphologie und Syntax besteht aus 1 MP, 2 SL, 9 LP und 6 SWS, inklusive Vorlesung (2 LP, 4 SWS, Pnr. 1301), Tutorium (2 LP, 2 SWS, Pnr. 1302) und Modulpr\u00fcfung (Klausur, 3 LP, Pnr. 1310). Der Profilbildungsbereich liefert 1 LP."
        ]
    },
    {
        "user_input": "Gibt es eine \u00dcbung f\u00fcr den Kurs Mathematische Grundlagen?",
        "reference": "Nein, f\u00fcr den Kurs \"Mathematische Grundlagen\" gibt es keine begleitende \u00dcbung. Es handelt sich dabei ausschlie\u00dflich um ein Seminar.",
        "response": "Nein, es gibt keine \u00dcbung f\u00fcr den Kurs Mathematische Grundlagen.",
        "retrieved_contexts": [
            "Das Modul Basismodul - Mathematische und logische Grundlagen (Modul-Nummer: 2100) hat einen Umfang von 12 ECTS-Leistungspunkten und einen Workload von 360 Stunden. Die Dauer des Basismoduls - Mathematische und logische Grundlagen betr\u00e4gt 1 Semester. Es beinhaltet die Lehrveranstaltungen Einf\u00fchrung in die computationelle Logik (Seminar & \u00dcbung) mit der Nummer 2101 und Mathematische Grundlagen (Seminar) mit der Nummer 2102. Die Belegung f\u00fcr das Basismodul - Mathematische und logische Grundlagen erfordert die Teilnahme an Seminar und \u00dcbung (a) sowie am Seminar (b). Das empfohlene Studiensemester f\u00fcr dieses Basismodul ist das 1. Fachsemester (Wintersemester) f\u00fcr beide Lehrveranstaltungen, mit einer Pr\u00fcfung im 1. Fachsemester (Wintersemester). Die Lehrveranstaltungen des Basismoduls - Mathematische und logische Grundlagen werden jedes Wintersemester angeboten. Die geplante Gruppengr\u00f6\u00dfe f\u00fcr beide Lehrveranstaltungen des Basismoduls - Mathematische und logische Grundlagen betr\u00e4gt ca. 60 Studierende. Die Kontaktzeit f\u00fcr Einf\u00fchrung in die computationelle Logik (a) betr\u00e4gt 4 SWS/60 Stunden und 2 ECTS-Leistungspunkte, und f\u00fcr Mathematische Grundlagen (b) ebenfalls 4 SWS/60 Stunden und 2 ECTS-Leistungspunkte. Das Selbststudium f\u00fcr Einf\u00fchrung in die computationelle Logik (a) betr\u00e4gt 60 Stunden und 2 ECTS-Leistungspunkte, und f\u00fcr Mathematische Grundlagen (b) ebenfalls 60 Stunden und 2 ECTS-Leistungspunkte. Die ECTS-Leistungspunkte f\u00fcr die Modulpr\u00fcfung des Basismoduls - Mathematische und logische Grundlagen betragen 4 ECTS-Leistungspunkte. Die Inhalte des Basismoduls - Mathematische und logische Grundlagen umfassen die Aufbereitung und Vertiefung mathematischer Schulkenntnisse, um formale Methoden der Mathematik wie Mengenlehre, Vektorrechnung oder Beweisf\u00fchrung anwenden zu k\u00f6nnen. Die Bedeutung der Logik, menschliche und formale Sprache, sowie eine Einf\u00fchrung in die Aussagenlogik und Pr\u00e4dikatenlogik, Modelle, Wahrheitswerte und formale Beweise sind ebenfalls Teil der Inhalte. Die angestrebten Lernergebnisse und Studieninhalte des Basismoduls - Mathematische und logische Grundlagen bef\u00e4higen die Studierenden, wesentliche logische und mathematische Verfahren zu beherrschen und grundlegende logische und mathematische Methoden sowie deren Anwendung zu verstehen. Sie erlangen das formale R\u00fcstzeug, um die wichtigsten Methoden der formalen Linguistik und Computerlinguistik zu verstehen. F\u00fcr die Teilnahme am Basismodul - Mathematische und logische Grundlagen sind keine formalen oder inhaltlichen Teilnahmevoraussetzungen erforderlich. Die Pr\u00fcfungsform des Basismoduls - Mathematische und logische Grundlagen ist ein Portfolio (Pnr. 2110). Es gibt keine Voraussetzungen f\u00fcr die Zulassung zur Modulpr\u00fcfung des Basismoduls - Mathematische und logische Grundlagen. Die Voraussetzungen f\u00fcr die Vergabe von ECTS-Leistungspunkten f\u00fcr das Basismodul - Mathematische und logische Grundlagen sind erbrachte Studienleistungen (SL) in den Lehrveranstaltungen (a) und (b) sowie eine bestandene Modulpr\u00fcfung. Sonstige Informationen f\u00fcr das Basismodul - Mathematische und logische Grundlagen sind nicht vorhanden.",
            "Im 1. Semester des Bachelor Computerlinguistik sind insgesamt 4 Module mit 2 MP, 8 Veranstaltungen, 22 SWS und 30 LP vorgesehen, davon 1 LP im PBB. Das Basismodul Mathematische und logische Grundlagen umfasst 1 MP, 2 SL, 12 LP und 8 SWS. Darin enthalten sind Einf\u00fchrung in die computationelle Logik (Seminar mit \u00dcbung, 4 LP, 4 SWS, Pnr. 2101), Mathematische Grundlagen (Seminar, 4 LP, 4 SWS, Pnr. 2102) und die Modulpr\u00fcfung (Portfolio, 4 LP, Pnr. 2110). Das Basismodul Grundlagen der Computerlinguistik und formale Grammatikbeschreibung [1/2] beinhaltet 2 SL, 4 LP und 4 SWS, mit den Veranstaltungen Einf\u00fchrung in die Computerlinguistik (Seminar, 2 LP, 2 SWS, Pnr. 2201) und Einf\u00fchrung in die Computerlinguistik (\u00dcbung, 2 LP, 2 SWS, Pnr. 2202). Das Basismodul Python-Programmierung [1/2] hat ebenfalls 2 SL, 4 LP und 4 SWS, mit den Veranstaltungen Einf\u00fchrung in die Programmierung mit Python (Seminar, 2 LP, 2 SWS, Pnr. 2301) und Einf\u00fchrung in die Programmierung mit Python (\u00dcbung, 2 LP, 2 SWS, Pnr. 2302). Das Basiswissen Linguistik - Morphologie und Syntax besteht aus 1 MP, 2 SL, 9 LP und 6 SWS, inklusive Vorlesung (2 LP, 4 SWS, Pnr. 1301), Tutorium (2 LP, 2 SWS, Pnr. 1302) und Modulpr\u00fcfung (Klausur, 3 LP, Pnr. 1310). Der Profilbildungsbereich liefert 1 LP.",
            "Das Modul Basismodul - Grundlagen der Computerlinguistik und formale Grammatikbeschreibung (Modul-Nummer: 2200) erstreckt sich \u00fcber 2 Semester, hat einen Umfang von 12 ECTS-Leistungspunkten und einen Workload von 360 Stunden. Die Lehrveranstaltungen f\u00fcr dieses Basismodul sind Einf\u00fchrung in die Computerlinguistik (Seminar) mit der Nummer 2201, Einf\u00fchrung in die Computerlinguistik (\u00dcbung) mit der Nummer 2202, Grammatikformalismen (Seminar) mit der Nummer 2203 und Grammatikformalismen (\u00dcbung) mit der Nummer 2204. Die Belegung f\u00fcr das Basismodul - Grundlagen der Computerlinguistik und formale Grammatikbeschreibung erfordert die Teilnahme am Seminar (a) mit \u00dcbung (b) sowie am Seminar (c) mit \u00dcbung (d). Das empfohlene Studiensemester f\u00fcr die erste H\u00e4lfte (a, b) ist das 1. Fachsemester (Wintersemester), f\u00fcr die zweite H\u00e4lfte (c, d) das 2. Fachsemester (Sommersemester), mit einer Pr\u00fcfung im 2. Fachsemester (Sommersemester). Die Lehrveranstaltungen dieses Basismoduls werden jedes Wintersemester (a, b) und jedes Sommersemester (c, d) angeboten. Die geplante Gruppengr\u00f6\u00dfe f\u00fcr alle vier Lehrveranstaltungen des Basismoduls - Grundlagen der Computerlinguistik und formale Grammatikbeschreibung betr\u00e4gt ca. 60 Studierende. Die Kontaktzeit f\u00fcr Einf\u00fchrung in die Computerlinguistik (a) und (b) betr\u00e4gt jeweils 2 SWS / 30 Stunden und 1 ECTS-Leistungspunkt. Ebenso betr\u00e4gt die Kontaktzeit f\u00fcr Grammatikformalismen (c) und (d) jeweils 2 SWS / 30 Stunden und 1 ECTS-Leistungspunkt. Das Selbststudium f\u00fcr Einf\u00fchrung in die Computerlinguistik (a) und (b) betr\u00e4gt jeweils 30 Stunden und 1 ECTS-Leistungspunkt. Das Selbststudium f\u00fcr Grammatikformalismen (c) und (d) betr\u00e4gt ebenfalls jeweils 30 Stunden und 1 ECTS-Leistungspunkt. Die ECTS-Leistungspunkte f\u00fcr die Modulpr\u00fcfung des Basismoduls - Grundlagen der Computerlinguistik und formale Grammatikbeschreibung betragen 4 ECTS-Leistungspunkte, was einem Workload von 120 Stunden entspricht. Die Inhalte des Basismoduls - Grundlagen der Computerlinguistik und formale Grammatikbeschreibung beinhalten im Seminar \"Einf\u00fchrung in die Computerlinguistik\" einen \u00dcberblick \u00fcber Ziele, Methoden und theoretische Ans\u00e4tze der Computerlinguistik, erg\u00e4nzt durch Beispiele aus relevanten Anwendungsgebieten, wobei sowohl symbolische Repr\u00e4sentationen als auch datengetriebene Methoden behandelt werden. Das Seminar \"Grammatikformalismen\" f\u00fchrt in Methoden und Probleme der syntaktischen Modellierung mithilfe von Formalismen wie HPSG, TAG, CCG usw. ein. Die angestrebten Lernergebnisse und Studieninhalte des Basismoduls - Grundlagen der Computerlinguistik und formale Grammatikbeschreibung vermitteln Wissen \u00fcber Ziele der Computerlinguistik sowie Vertrautheit mit den grundlegenden formalen und probabilistischen Methoden der Computerlinguistik. Studierende erlangen Kenntnisse \u00fcber g\u00e4ngige computerlinguistische Formalismen zur Implementierung von Grammatiken. F\u00fcr die Teilnahme am Basismodul - Grundlagen der Computerlinguistik und formale Grammatikbeschreibung sind keine formalen oder inhaltlichen Teilnahmevoraussetzungen erforderlich. Die Pr\u00fcfungsform des Basismoduls - Grundlagen der Computerlinguistik und formale Grammatikbeschreibung ist eine Klausur (Pnr. 2210). Es gibt keine Voraussetzungen f\u00fcr die Zulassung zur Modulpr\u00fcfung. Die Voraussetzungen f\u00fcr die Vergabe von ECTS-Leistungspunkten f\u00fcr das Basismodul - Grundlagen der Computerlinguistik und formale Grammatikbeschreibung sind erbrachte Studienleistungen (SL) in den Lehrveranstaltungen (a) und (b) f\u00fcr 4 ECTS-Leistungspunkte, erbrachte Studienleistungen (SL) in den Lehrveranstaltungen (c) und (d) f\u00fcr 4 ECTS-Leistungspunkte, sowie eine bestandene Modulpr\u00fcfung f\u00fcr 4 ECTS-Leistungspunkte. Sonstige Informationen f\u00fcr das Basismodul - Grundlagen der Computerlinguistik und formale Grammatikbeschreibung sind nicht vorhanden."
        ]
    },
    {
        "user_input": "Wann soll ich das Praktikum machen?",
        "reference": "Es wird empfohlen, das Berufsfeldpraktikum nach dem vierten oder f\u00fcnften Semester zu absolvieren.",
        "response": "Das Praktikum soll im 5. Fachsemester (Wintersemester) absolviert werden.",
        "retrieved_contexts": [
            "Das obligatorische Berufsfeldpraktikum, beschrieben in \u00a7 9, ist in einigen Studieng\u00e4ngen zu absolvieren und kann von vier Wochen bis zu drei Monaten dauern, auch in Abschnitten. Einschl\u00e4gige Berufst\u00e4tigkeiten und Praxiserfahrungen k\u00f6nnen im Einzelfall angerechnet werden. F\u00fcr je vier Wochen Berufsfeldpraktikum werden mindestens 5 LP angerechnet. Das Berufsfeldpraktikum soll Einblicke in einschl\u00e4gige Berufsfelder und die Berufspraxis erm\u00f6glichen sowie eine Erprobung von Fachkenntnissen in der Praxis bieten, um berufsqualifizierende F\u00e4higkeiten und Handlungskompetenzen zu vermitteln und den \u00dcbergang in die Berufswelt zu erleichtern. Die Beratung bei der Vermittlung von Praktikumspl\u00e4tzen und die fachliche Betreuung w\u00e4hrend des Praktikums werden durch die Studiengangbeauftragte oder den Studiengangbeauftragten koordiniert. Das Berufsfeldpraktikum wird mit einem Praktikumsbericht abgeschlossen. N\u00e4heres regeln die Praktikumsordnungen der einzelnen Studieng\u00e4nge.",
            "Nach dem vierten oder f\u00fcnften Semester des Bachelor Computerlinguistik ist ein mindestens 6-w\u00f6chiges Berufsfeldpraktikum oder eine Projektarbeit mit einschl\u00e4gig computerlinguistischem Inhalt zu absolvieren. Dieses Praktikum im Bachelor Computerlinguistik dient dazu, Einblicke in die Berufspraxis zu vermitteln und den \u00dcbergang in die Berufswelt zu erleichtern. Die Wahl des Praktikumsplatzes f\u00fcr das Praktikum im Bachelor Computerlinguistik erfolgt im Einvernehmen mit dem/der Praktikumsbeauftragten der Abteilung f\u00fcr Computerlinguistik. Der/die Praktikumsbeauftragte unterst\u00fctzt bei der Vermittlung von Praktikumspl\u00e4tzen und bietet fachliche Praktikumsberatung und -begleitung f\u00fcr das Praktikum im Bachelor Computerlinguistik an. \u00dcber das absolvierte Praktikum ist ein kurzer Bericht von ca. 3-5 Seiten zu verfassen und ein Zeugnis der Praktikumsstelle einzureichen.",
            "Das Modul Praktikum & Orientierung (Modul-Nummer: 3000) hat einen Umfang von 12 ECTS-Leistungspunkten und einen Workload von 360 Stunden. Die Dauer dieses Moduls betr\u00e4gt 2 Semester. Die Lehrveranstaltungen f\u00fcr dieses Modul sind Orientierungsseminar (Seminar) mit der Nummer 3001 und Praktikum (in der Regel 6 Wochen in Vollzeit) mit der Nummer 3010. Die Belegung f\u00fcr dieses Modul erfordert die Teilnahme am Seminar (a). Das empfohlene Studiensemester f\u00fcr das Orientierungsseminar (a) ist das 4. Fachsemester (Sommersemester), und f\u00fcr das Praktikum (b) das 5. Fachsemester (Wintersemester). Dieses Modul wird jedes Sommersemester (a) und jedes Semester (b) angeboten. Die geplante Gruppengr\u00f6\u00dfe f\u00fcr das Orientierungsseminar (a) betr\u00e4gt ca. 60 Studierende, und f\u00fcr das Praktikum (b) ca. 60 Studierende. Die Kontaktzeit f\u00fcr das Orientierungsseminar (a) betr\u00e4gt 2 SWS / 30 Stunden / 1 ECTS-Leistungspunkt. F\u00fcr das Praktikum (b) gibt es keine Kontaktzeit. Das Selbststudium f\u00fcr das Orientierungsseminar (a) betr\u00e4gt 60 Stunden / 2 ECTS-Leistungspunkte. Das Selbststudium f\u00fcr das Praktikum (b) betr\u00e4gt 270 Stunden/9 ECTS-Leistungspunkte. Es gibt keine ECTS-Leistungspunkte f\u00fcr die Modulpr\u00fcfung dieses Moduls. Die Inhalte des Moduls Praktikum & Orientierung umfassen im Seminar (a) die Orientierung f\u00fcr die zweite Studienphase, insbesondere in Bezug auf Studienorganisation (Schwerpunktsetzung, Auslandsaufenthalt, Praktikum, ...), Abschlussarbeit (Themenwahl, wissenschaftliches Arbeiten, ...), Berufsperspektiven (Bewerbungsverfahren, Berufsfeldorientierung, ...), und Anschlussstudieng\u00e4nge (wissenschaftliche Karriere, ...). Das Praktikum (b) dient der berufsorientierten Anwendung der im Studium vermittelten Qualifikationen. Die angestrebten Lernergebnisse und Studieninhalte dieses Moduls bef\u00e4higen die Studierenden, Entwicklungsziele f\u00fcr ihre Zukunft zu entwickeln und zu lernen, welche Schritte sie zur Realisierung ergreifen k\u00f6nnen. Sie erlangen Orientierung sowohl f\u00fcr den weiteren Studienaufbau als auch f\u00fcr ihren beruflichen Werdegang. Berufliche W\u00fcnsche und M\u00f6glichkeiten k\u00f6nnen sie realistischer beurteilen. Sie erwerben erweiterte Methodenkenntnis aus der beruflichen Praxis und gewinnen ein verst\u00e4rktes Selbstvertrauen durch Praxiserprobung des bisher erworbenen Wissens. Sie vertiefen ihre Kenntnisse zum wissenschaftlichen Arbeiten, k\u00f6nnen eigene Forschungsfragen formulieren, diese angemessen eingrenzen und die zur Beantwortung notwendigen Schritte planen und umsetzen. Teilnahmevoraussetzungen f\u00fcr das Modul Praktikum & Orientierung sind im 4. Fachsemester oder h\u00f6her, und inhaltlich das Basismodul - Mathematische und logische Grundlagen, das Basismodul - Grundlagen der Computerlinguistik und formale Grammatikbeschreibung und das Basismodul - Python-Programmierung. F\u00fcr dieses Modul gibt es keine Pr\u00fcfungsformen. Es gibt keine Voraussetzungen f\u00fcr die Zulassung zur Modulpr\u00fcfung. Die Voraussetzungen f\u00fcr die Vergabe von ECTS-Leistungspunkten f\u00fcr das Modul Praktikum & Orientierung sind erbrachte Studienleistungen (SL) in (a) und ein nachgewiesenes 6-w\u00f6chiges Praktikum \u00fcber Praktikumsnachweis und Praktikumsbericht. Sonstige Informationen f\u00fcr das Modul Praktikum & Orientierung sind nicht vorhanden."
        ]
    },
    {
        "user_input": "Gibt es eine generelle Anwesenheitspflicht f\u00fcr Vorlesungen?",
        "reference": "Nein, bei Vorlesungen kann keine Anwesenheitspflicht festgelegt werden.",
        "response": "Dazu enthalten die bereitgestellten Dokumente keine Informationen.",
        "retrieved_contexts": [
            "Eine Anwesenheitspflicht in Lehrveranstaltungen kann gem\u00e4\u00df \u00a7 8 in allen Modulen oder Modulteilen vorgeschrieben werden, bei denen regelm\u00e4\u00dfige Anwesenheit und aktive Teilnahme f\u00fcr das Erreichen des Lernziels erforderlich sind. Dies gilt generell f\u00fcr Exkursionen, Forschungsprojekte, Praktika, Sprachkurse und \u00dcbungen. Seminare k\u00f6nnen mit einer Anwesenheitspflicht belegt werden, sofern nicht mehr als 25 Personen teilnehmen, da sie auf kontinuierliche Beteiligung am Dialog ausgerichtet sind. Bei Vorlesungen ist keine Anwesenheitspflicht festlegbar. F\u00fcr andere Lehrveranstaltungen gilt eine Anwesenheitspflicht nur, wenn sie im f\u00e4cherspezifischen Anhang explizit festgelegt ist. Die Anwesenheitspflicht ist erf\u00fcllt, wenn ein Studierender 80% der Veranstaltungszeit beigewohnt hat.",
            "Im Bereich Studium und Lehre, beginnend mit \u00a7 6, wird die Anforderungen des Studiums festgelegt. Die Lehre ist als Pr\u00e4senzstudium organisiert. Die Studierenden m\u00fcssen gem\u00e4\u00df dieser Pr\u00fcfungsordnung Pflicht- und Wahlpflichtveranstaltungen einschlie\u00dflich des Profilbildungsbereiches belegen.",
            "Studienleistungen sind gem\u00e4\u00df \u00a7 7 obligatorisch in allen Lehrveranstaltungen. Sie werden durch aktive Teilnahme an Lehrveranstaltungen erbracht und sind auf die in der Modulbeschreibung definierten Inhalte und Kompetenzen ausgerichtet. Der Workload von Studienleistungen ist durch die Modulbeschreibung begrenzt. Studienleistungen sind unbenotet und k\u00f6nnen als Pr\u00fcfungsvoraussetzung bestimmt werden; n\u00e4heres regelt der f\u00e4cherspezifische Anhang. Die konkreten Anforderungen f\u00fcr Studienleistungen m\u00fcssen sp\u00e4testens zu Beginn der Belegfrist f\u00fcr Studierende in der Veranstaltungsank\u00fcndigung im elektronischen Campus Management System der Heinrich-Heine-Universit\u00e4t D\u00fcsseldorf bekannt gegeben werden. Mit der Anmeldung zu Lehrveranstaltungen und Studienleistungen legen die Studierenden eine verbindliche Modul- bzw. Bereichszuordnung in ihrem Studiengang fest, die nachtr\u00e4glich nicht mehr \u00e4nderbar ist. Diese Verbindlichkeit gilt unabh\u00e4ngig vom Bestehen, Nichtbestehen oder der sp\u00e4teren Anrechnung der Leistung, wobei Ausnahmen im f\u00e4cherspezifischen Anhang m\u00f6glich sind. Nach erfolgreichem Abschluss eines Moduls oder Bereichs k\u00f6nnen dort keine weiteren Lehrveranstaltungen oder Studienleistungen mehr angemeldet werden. F\u00fcr die Nutzung von E-Learning-Angeboten gelten analoge Regeln."
        ]
    },
    {
        "user_input": "Wann gilt die Anwesenheitspflicht in einer Lehrveranstaltung als erf\u00fcllt?",
        "reference": "Die Anwesenheitspflicht ist erf\u00fcllt, wenn ein Studierender oder eine Studierende 80% der Veranstaltungszeit beigewohnt hat.",
        "response": "Die Anwesenheitspflicht gilt als erf\u00fcllt, wenn ein Studierender 80% der Veranstaltungszeit beigewohnt hat.",
        "retrieved_contexts": [
            "Eine Anwesenheitspflicht in Lehrveranstaltungen kann gem\u00e4\u00df \u00a7 8 in allen Modulen oder Modulteilen vorgeschrieben werden, bei denen regelm\u00e4\u00dfige Anwesenheit und aktive Teilnahme f\u00fcr das Erreichen des Lernziels erforderlich sind. Dies gilt generell f\u00fcr Exkursionen, Forschungsprojekte, Praktika, Sprachkurse und \u00dcbungen. Seminare k\u00f6nnen mit einer Anwesenheitspflicht belegt werden, sofern nicht mehr als 25 Personen teilnehmen, da sie auf kontinuierliche Beteiligung am Dialog ausgerichtet sind. Bei Vorlesungen ist keine Anwesenheitspflicht festlegbar. F\u00fcr andere Lehrveranstaltungen gilt eine Anwesenheitspflicht nur, wenn sie im f\u00e4cherspezifischen Anhang explizit festgelegt ist. Die Anwesenheitspflicht ist erf\u00fcllt, wenn ein Studierender 80% der Veranstaltungszeit beigewohnt hat.",
            "Im Bereich Studium und Lehre, beginnend mit \u00a7 6, wird die Anforderungen des Studiums festgelegt. Die Lehre ist als Pr\u00e4senzstudium organisiert. Die Studierenden m\u00fcssen gem\u00e4\u00df dieser Pr\u00fcfungsordnung Pflicht- und Wahlpflichtveranstaltungen einschlie\u00dflich des Profilbildungsbereiches belegen.",
            "Studienleistungen sind gem\u00e4\u00df \u00a7 7 obligatorisch in allen Lehrveranstaltungen. Sie werden durch aktive Teilnahme an Lehrveranstaltungen erbracht und sind auf die in der Modulbeschreibung definierten Inhalte und Kompetenzen ausgerichtet. Der Workload von Studienleistungen ist durch die Modulbeschreibung begrenzt. Studienleistungen sind unbenotet und k\u00f6nnen als Pr\u00fcfungsvoraussetzung bestimmt werden; n\u00e4heres regelt der f\u00e4cherspezifische Anhang. Die konkreten Anforderungen f\u00fcr Studienleistungen m\u00fcssen sp\u00e4testens zu Beginn der Belegfrist f\u00fcr Studierende in der Veranstaltungsank\u00fcndigung im elektronischen Campus Management System der Heinrich-Heine-Universit\u00e4t D\u00fcsseldorf bekannt gegeben werden. Mit der Anmeldung zu Lehrveranstaltungen und Studienleistungen legen die Studierenden eine verbindliche Modul- bzw. Bereichszuordnung in ihrem Studiengang fest, die nachtr\u00e4glich nicht mehr \u00e4nderbar ist. Diese Verbindlichkeit gilt unabh\u00e4ngig vom Bestehen, Nichtbestehen oder der sp\u00e4teren Anrechnung der Leistung, wobei Ausnahmen im f\u00e4cherspezifischen Anhang m\u00f6glich sind. Nach erfolgreichem Abschluss eines Moduls oder Bereichs k\u00f6nnen dort keine weiteren Lehrveranstaltungen oder Studienleistungen mehr angemeldet werden. F\u00fcr die Nutzung von E-Learning-Angeboten gelten analoge Regeln."
        ]
    },
    {
        "user_input": "Gibt es eine Klausur in Wahrscheinlichkeitstheorie?",
        "reference": "Nein, im \"Basismodul - Statistische Methoden in der Computerlinguistik\", zu dem die Wahrscheinlichkeitstheorie geh\u00f6rt, gibt es gar keine Modulpr\u00fcfung und somit auch keine Klausur. Es m\u00fcssen lediglich Studienleistungen erbracht werden.",
        "response": "Nein, es gibt keine Klausur in Wahrscheinlichkeitstheorie.",
        "retrieved_contexts": [
            "Das Modul Basismodul - Statistische Methoden in der Computerlinguistik (Modul-Nummer: 2400) erstreckt sich \u00fcber 2 Semester, hat einen Umfang von 6 ECTS-Leistungspunkten und einen Workload von 180 Stunden. Die Lehrveranstaltungen f\u00fcr dieses Basismodul sind Wahrscheinlichkeitstheorie und Statistik (Seminar und \u00dcbung) mit der Nummer 2401 und Linguistische Ressourcen (Seminar) mit der Nummer 2402. Die Belegung f\u00fcr dieses Basismodul erfordert die Teilnahme an Seminar mit \u00dcbung (a) und Seminar (b). Das empfohlene Studiensemester f\u00fcr Wahrscheinlichkeitstheorie und Statistik (a) ist das 2. Fachsemester (Sommersemester), und f\u00fcr Linguistische Ressourcen (b) das 3. Fachsemester (Wintersemester). Dieses Basismodul wird jedes Wintersemester (a) und jedes Sommersemester (b) angeboten. Die geplante Gruppengr\u00f6\u00dfe f\u00fcr beide Lehrveranstaltungen des Basismoduls - Statistische Methoden in der Computerlinguistik betr\u00e4gt ca. 60 Studierende. Die Kontaktzeit f\u00fcr Wahrscheinlichkeitstheorie und Statistik (a) betr\u00e4gt 4 SWS/60 Stunden / 2 ECTS-Leistungspunkte. Die Kontaktzeit f\u00fcr Linguistische Ressourcen (b) betr\u00e4gt 2 SWS/30 Stunden / 1 ECTS-Leistungspunkt. Das Selbststudium f\u00fcr Wahrscheinlichkeitstheorie und Statistik (a) betr\u00e4gt 60 Stunden / 2 ECTS-Leistungspunkte. Das Selbststudium f\u00fcr Linguistische Ressourcen (b) betr\u00e4gt 30 Stunden / 1 ECTS-Leistungspunkt. Es gibt keine ECTS-Leistungspunkte f\u00fcr die Modulpr\u00fcfung dieses Basismoduls. Die Inhalte des Basismoduls - Statistische Methoden in der Computerlinguistik vermitteln grundlegende Kenntnisse in Wahrscheinlichkeitstheorie und statistischen Methoden der Computerlinguistik sowie deren Anwendung mittels Korpora und Datens\u00e4tzen. Behandelt werden unter anderem Statistik und statistische Programmierung in einer geeigneten Programmiersprache (z.B. R), sowie der Aufbau und die Pflege linguistischer Ressourcen (Korpora, Datenbanken, ...). Die angestrebten Lernergebnisse und Studieninhalte dieses Basismoduls umfassen Kenntnisse der Grundlagen der Wahrscheinlichkeitstheorie und Grundbegriffe der Statistik. Studierende entwickeln die F\u00e4higkeit, statistische Analysen selbst zu konzipieren und zu implementieren. Sie erlangen die F\u00e4higkeit, Korpora zu erstellen und f\u00fcr Experimente und Analysen durchzuf\u00fchren. Formale Teilnahmevoraussetzungen f\u00fcr das Basismodul - Statistische Methoden in der Computerlinguistik sind keine, inhaltliche Teilnahmevoraussetzungen sind das Basismodul Mathematische und logische Grundlagen. F\u00fcr dieses Basismodul gibt es keine Pr\u00fcfungsformen. Es gibt keine Voraussetzungen f\u00fcr die Zulassung zur Modulpr\u00fcfung. Die Voraussetzungen f\u00fcr die Vergabe von ECTS-Leistungspunkten f\u00fcr das Basismodul - Statistische Methoden in der Computerlinguistik sind erbrachte Studienleistungen (SL) oder Hausaufgaben in allen Lehrveranstaltungen. Sonstige Informationen f\u00fcr das Basismodul - Statistische Methoden in der Computerlinguistik sind nicht vorhanden.",
            "Modulpr\u00fcfungen, wie in \u00a7 11 erl\u00e4utert, beziehen sich auf die in der Modulbeschreibung vorgegebenen Kompetenzziele unter Bezugnahme auf Lehrveranstaltungen oder Themenschwerpunkte des Moduls. Eine nachtr\u00e4gliche Umbuchung ist nicht m\u00f6glich, und die Verbindlichkeit gilt unabh\u00e4ngig vom Bestehen, Nichtbestehen oder der sp\u00e4teren Anrechnung, wobei Ausnahmen im f\u00e4cherspezifischen Anhang getroffen werden k\u00f6nnen. Werden Modulpr\u00fcfungen im Kontext von Lehrveranstaltungen abgelegt, steht den Studierenden die Wahl der Lehrveranstaltung unter Ber\u00fccksichtigung des f\u00e4cherspezifischen Anhangs frei. Grunds\u00e4tzlich ist jedem Modul genau eine Modulpr\u00fcfung zugeordnet, in begr\u00fcndeten Ausnahmef\u00e4llen k\u00f6nnen es auch mehrere sein, n\u00e4heres regelt der f\u00e4cherspezifische Anhang. Zu jeder Modulpr\u00fcfung ist eine gesonderte Meldung erforderlich, wobei nur zugelassen wird, wer die Zulassungsvoraussetzungen gem\u00e4\u00df \u00a7 12 erf\u00fcllt. Meldetermine werden im elektronischen Campus Management System und in der jeweiligen Lehrveranstaltung bekannt gegeben. Abmeldung und R\u00fccktritt von Pr\u00fcfungen sind in \u00a7 17 geregelt. Modulpr\u00fcfungen erfolgen als Klausur (auch elektronisch), m\u00fcndliche Pr\u00fcfung, Studienarbeit, Hausarbeit, Portfolio oder Projektarbeit mit individuell zurechenbarer Pr\u00fcfungsleistung. Die Kandidatin oder der Kandidat soll nachweisen, dass sie oder er ein Problem aus dem Stoffgebiet erkennen und L\u00f6sungswege finden kann. Mindestens eine Modulabschlusspr\u00fcfung muss in Form einer Hausarbeit oder Studienarbeit und mindestens eine in Form einer m\u00fcndlichen Pr\u00fcfung abgelegt werden. Form, Umfang, Dauer und Terminierung einer Modulabschlusspr\u00fcfung entscheiden die Pr\u00fcferin oder der Pr\u00fcfer unter Ber\u00fccksichtigung der W\u00fcnsche der Kandidatin oder des Kandidaten und der Vorgaben des Modulhandbuchs und der Pr\u00fcfungsordnung. Die Pr\u00fcfungen werden in der Regel in deutscher Sprache abgenommen, in Absprache auch in einer anderen Sprache; die Pr\u00fcfungssprache in Fremdsprachenphilologien ist im f\u00e4cherspezifischen Anhang geregelt. Die Bewertung von Pr\u00fcfungen ist den Studierenden jeweils nach sp\u00e4testens acht Wochen bekannt zu geben.",
            "Im 2. Semester des Bachelor Computerlinguistik sind 4 Module mit 3 MP, 7 Veranstaltungen, 18 SWS und 30 LP vorgesehen, davon 1 LP im PBB. Das Basismodul Grundlagen der Computerlinguistik und formale Grammatikbeschreibung [2/2] umfasst 1 MP, 2 SL, 8 LP und 4 SWS, mit den Veranstaltungen Grammatikformalismen (Seminar, 2 LP, 2 SWS, Pnr. 2203), Grammatikformalismen (\u00dcbung, 2 LP, 2 SWS, Pnr. 2204) und Modulpr\u00fcfung (Klausur, 4 LP, Pnr. 2210). Das Basismodul Python-Programmierung [2/2] beinhaltet 1 MP, 2 SL, 8 LP und 4 SWS, mit den Veranstaltungen Fortgeschrittene Python-Programmierung mit NLP-Anwendungen (Seminar, 2 LP, 2 SWS, Pnr. 2303), Fortgeschrittene Python-Programmierung mit NLP-Anwendungen (\u00dcbung, 2 LP, 2 SWS, Pnr. 2304) und Modulpr\u00fcfung (Klausur, 4 LP, Pnr. 2310). Das Basiswissen Linguistik - Semantik und Pragmatik besteht aus 1 MP, 2 SL, 9 LP und 6 SWS, mit Vorlesung (4 LP, 4 SWS, Pnr. 1401), Tutorium (2 LP, 2 SWS, Pnr. 1402) und Modulpr\u00fcfung (Klausur, 3 LP, Pnr. 1410). Das Basismodul Statistische Methoden in der Computerlinguistik [1/2] hat 0 MP, 1 SL, 4 LP und 4 SWS, mit der Veranstaltung Wahrscheinlichkeitstheorie und Statistik (Seminar und \u00dcbung, 4 LP, 4 SWS, Pnr. 2401). Der Profilbildungsbereich liefert 1 LP."
        ]
    },
    {
        "user_input": "Wie lang dauert eine Klausur?",
        "reference": "Die Dauer einer Klausurarbeit betr\u00e4gt in der Regel 90 Minuten.",
        "response": "Die Dauer einer Klausur betr\u00e4gt in der Regel 90 Minuten und kann je nach Workload des Moduls auf bis zu 180 Minuten verl\u00e4ngert oder auf mindestens 45 Minuten verk\u00fcrzt werden.",
        "retrieved_contexts": [
            "Schriftliche Modulpr\u00fcfungen, wie in \u00a7 14 beschrieben, k\u00f6nnen als Klausuren oder dokumentierte Einzelberichte ausgestaltet sein. Klausuren k\u00f6nnen Multiple-Choice-Aufgaben enthalten. Bei elektronischer Durchf\u00fchrung und Auswertung sind Authentizit\u00e4t und Integrit\u00e4t der Pr\u00fcfungsergebnisse sicherzustellen. Besteht eine Klausur aus Multiple-Choice-Aufgaben, wird die Bestehensgrenze von dem Pr\u00fcfer oder der Pr\u00fcferin nach fachlichen Kriterien festgelegt, unter Ber\u00fccksichtigung des Mittelwerts und der Verteilung der erzielten Leistungen. Die Dauer einer Klausurarbeit betr\u00e4gt in der Regel 90 Minuten, kann aber je nach Workload des Moduls auf bis zu 180 Minuten verl\u00e4ngert oder auf mindestens 45 Minuten verk\u00fcrzt werden. Die Bewertung einer Klausur erfolgt durch die Dozentinnen und Dozenten und wird der Kandidatin oder dem Kandidaten nach sp\u00e4testens acht Wochen bekannt gemacht. N\u00e4heres regelt der f\u00e4cherspezifische Anhang. Eine Studienarbeit besteht aus einer m\u00fcndlichen Pr\u00e4sentation und schriftlichen Ausarbeitung einer Thematik; alternativ kann eine Klausur von 45 Minuten Dauer an die Stelle der schriftlichen Ausarbeitung treten. Die Dauer der m\u00fcndlichen Pr\u00e4sentation betr\u00e4gt mindestens 15 Minuten. Der Umfang der schriftlichen Ausarbeitung soll mindestens 1500 W\u00f6rter (ca. 5 Seiten) und h\u00f6chstens 4500 W\u00f6rter (ca. 15 Seiten) betragen. Die Bewertung einer Studienarbeit wird durch die Dozentin oder den Dozenten vorgenommen und der Kandidatin oder dem Kandidaten nach sp\u00e4testens acht Wochen nach Abgabe bekannt gemacht. Eine Hausarbeit besteht aus der schriftlichen Ausarbeitung einer Thematik mit einem Umfang von mindestens 3000 W\u00f6rtern (ca. 10 Seiten) und h\u00f6chstens 6000 W\u00f6rtern (ca. 20 Seiten). Die Bewertung einer Hausarbeit wird durch die Dozentin oder den Dozenten vorgenommen und der Kandidatin oder dem Kandidaten nach sp\u00e4testens acht Wochen nach Abgabe bekannt gemacht. Eine Projektarbeit umfasst die selbstst\u00e4ndige Anwendung fachspezifischer Methoden sowie eine m\u00fcndliche Pr\u00e4sentation und schriftliche Ausarbeitung der Ergebnisse. Ein schriftlicher Test kann Teil einer Projektarbeit sein. Die Dauer der m\u00fcndlichen Pr\u00e4sentation betr\u00e4gt mindestens 15 Minuten und h\u00f6chstens 45 Minuten. Der Umfang der schriftlichen Ausarbeitung soll mindestens 1500 W\u00f6rter (ca. 5 Seiten) und h\u00f6chstens 7500 W\u00f6rter (ca. 25 Seiten) betragen, wobei der Umfang bei Tabellen, Schaubildern und Abbildungen \u00fcberschritten werden darf. Die Dauer eines schriftlichen Tests betr\u00e4gt in der Regel 60 Minuten. Die Bewertung einer Projektarbeit erfolgt durch die Veranstalterin oder den Veranstalter der Lehrveranstaltung bzw. die Betreuerin oder den Betreuer und wird sp\u00e4testens acht Wochen nach Abgabe bekannt gemacht. Ein Portfolio ist eine systematische Zusammenstellung verschiedener studentischer Arbeitsergebnisse, die den Lernprozess zur Erreichung der Lernergebnisse und Kompetenzen eines Moduls widerspiegeln soll. Ein Portfolio umfasst mindestens zwei unterschiedliche, in sich abgeschlossene Objekte. Der Umfang wird von den Lehrenden festgelegt und entspricht dem Workload einer Hausarbeit. Studienarbeiten, Hausarbeiten und Projektarbeiten k\u00f6nnen auch als Gruppenarbeit durchgef\u00fchrt werden, wenn der Beitrag der einzelnen Kandidatinnen und Kandidaten klar abgrenzbar und bewertbar ist. Studienarbeiten, Hausarbeiten, Projektarbeiten und Portfolios muss eine Versicherung der Kandidatinnen und Kandidaten beiliegen, dass sie die Arbeit selbstst\u00e4ndig verfasst und keine anderen als die angegebenen Quellen benutzt haben. Zitate m\u00fcssen unter Angabe der Quelle kenntlich gemacht werden. Sofern generative K\u00fcnstliche Intelligenz genutzt wurde, ist dies in einem entsprechenden Absatz methodisch zu reflektieren und zu dokumentieren. Die Versicherung der selbstst\u00e4ndigen Abfassung gilt auch f\u00fcr gelieferte Zeichnungen, Skizzen, Ton- und Videoaufnahmen oder graphische Darstellungen. Die Arbeiten sind in digitaler Form in einem g\u00e4ngigen Textverarbeitungsformat einzureichen; die Nutzung von HHU-Mailadressen und Verschl\u00fcsselung wird empfohlen. Bei begr\u00fcndetem Verdacht kann eine \u00dcberpr\u00fcfung mittels Plagiatssoftware erfolgen. Das Urheberrecht der Verfasserin oder des Verfassers bleibt gewahrt. Die Bearbeitungszeit f\u00fcr Studienarbeiten endet zwei Monate nach Abschluss der m\u00fcndlichen Leistung, sp\u00e4testens zum Vorlesungsbeginn des darauffolgenden Semesters. Die Bearbeitungszeit f\u00fcr Hausarbeiten betr\u00e4gt in der Regel zwei Monate und kann vom Pr\u00fcfungsausschuss um bis zu einen Monat verl\u00e4ngert werden. Die Themen werden im laufenden Semester vergeben. Die Bearbeitungszeit f\u00fcr den schriftlichen Bericht bei Projektarbeiten endet in der Regel zwei Monate nach Abschluss der praktischen Projektarbeit und kann um bis zu einen Monat verl\u00e4ngert werden. Verz\u00f6gert sich die Bearbeitung durch nicht zu vertretende Umst\u00e4nde, kann eine Nachfrist von bis zu 4 Wochen einger\u00e4umt werden.",
            "M\u00fcndliche Modulpr\u00fcfungen, wie in \u00a7 13 dargelegt, dauern mindestens 15 und h\u00f6chstens 30 Minuten und werden als Einzelpr\u00fcfung vor einer Pr\u00fcferin oder einem Pr\u00fcfer in Anwesenheit einer sachkundigen Beisitzerin oder eines sachkundigen Beisitzers gem\u00e4\u00df \u00a7 25 Absatz 5 abgelegt. Die Beisitzerin oder der Beisitzer f\u00fchrt in der Regel das Protokoll, das die wesentlichen Gegenst\u00e4nde und Ergebnisse festh\u00e4lt. Vor der Festsetzung der Note h\u00f6rt die Pr\u00fcferin oder der Pr\u00fcfer die Beisitzerin oder den Beisitzer. Die Bewertung ist der Kandidatin oder dem Kandidaten unmittelbar nach Ende der Pr\u00fcfung bekannt zu machen. M\u00fcndliche Pr\u00fcfungen k\u00f6nnen im Einvernehmen mit den Kandidatinnen oder Kandidaten auch als Gruppenpr\u00fcfung mit bis zu 3 Teilnehmerinnen und Teilnehmern durchgef\u00fchrt werden, wobei die Dauer pro Kandidatin oder Kandidat mindestens 15 und h\u00f6chstens 20 Minuten betr\u00e4gt.",
            "Die Zulassung zu Modulpr\u00fcfungen, wie in \u00a7 12 beschrieben, ist m\u00f6glich, wenn die Kandidatin oder der Kandidat an der Heinrich-Heine-Universit\u00e4t f\u00fcr den betreffenden Bachelorstudiengang eingeschrieben oder als Zweith\u00f6rerin oder Zweith\u00f6rer zugelassen ist und die fachbezogenen Voraussetzungen gem\u00e4\u00df dem f\u00e4cherspezifischen Anhang erf\u00fcllt. Ausgenommen sind Studierende ausl\u00e4ndischer Hochschulen, die in bi-, tri- oder multinationalen Studieng\u00e4ngen ihr Studium abschlie\u00dfen und an ihrer Heimatuniversit\u00e4t eingeschrieben sind. Ebenfalls zugelassen sind Kandidatinnen und Kandidaten, die eine Zugangspr\u00fcfung f\u00fcr beruflich Qualifizierte gem\u00e4\u00df \u00a7 49 Absatz 6 HG erfolgreich bestanden haben. Diese Pr\u00fcfung umfasst eine Klausurarbeit von zwei Zeitstunden und eine m\u00fcndliche Pr\u00fcfung von 20 bis 30 Minuten Dauer, die fachliche und methodische Voraussetzungen nachweisen. Die Anforderungen an Durchf\u00fchrung und Bewertung entsprechen Klausuren und m\u00fcndlichen Pr\u00fcfungen gem\u00e4\u00df \u00a7 13 Absatz 1 und \u00a7 14 Absatz 3. Die Note errechnet sich als arithmetisches Mittel, wobei jede Teilleistung mindestens als bestanden gewertet sein muss; alle Dezimalstellen au\u00dfer der ersten werden ohne Rundung gestrichen. Ein Probestudium gem\u00e4\u00df \u00a7 5 Berufsbildungshochschulzugangsverordnung dauert zwei Semester, und ein Test gem\u00e4\u00df \u00a7 10 Absatz 5 Satz 2 Berufsbildungshochschulzugangsverordnung ist der m\u00fcndliche Pr\u00fcfungsteil. Der Antrag ist \u00fcber die Studierenden- und Pr\u00fcfungsverwaltung an den Pr\u00fcfungsausschuss zu stellen. Der Zulassungsantrag zu Modulpr\u00fcfungen erfolgt \u00fcber das elektronische Campus-Management-System der Heinrich-Heine-Universit\u00e4t D\u00fcsseldorf. \u00dcber die Zulassung entscheidet die oder der Vorsitzende des Pr\u00fcfungsausschusses oder deren oder dessen Stellvertretung. Eine Zulassung darf nur abgelehnt werden, wenn die Voraussetzungen nicht erf\u00fcllt sind, die Zulassungsbedingungen im f\u00e4cherspezifischen Anhang nicht erf\u00fcllt sind oder die Kandidatin oder der Kandidat eine Bachelorpr\u00fcfung in demselben Studiengang an einer Hochschule im Geltungsbereich des Hochschulrahmengesetzes endg\u00fcltig nicht bestanden hat."
        ]
    },
    {
        "user_input": "Wie oft darf ich eine nicht bestandene Modulpr\u00fcfung wiederholen?",
        "reference": "Eine nicht bestandene Modulpr\u00fcfung kann insgesamt zweimal wiederholt werden.",
        "response": "Eine nicht bestandene Modulpr\u00fcfung kann zweimal wiederholt werden.",
        "retrieved_contexts": [
            "Das Bestehen, Nichtbestehen und die Wiederholung von Pr\u00fcfungen sind in \u00a7 19 geregelt. Die Bachelorpr\u00fcfung ist bestanden und das Studium abgeschlossen, wenn die Bachelorarbeit bestanden ist, alle notwendigen Modulpr\u00fcfungen bestanden sind, alle notwendigen Studienleistungen vorliegen, der Nachweis des Besuchs von gegebenenfalls vorgesehenen Praktika vorliegt und insgesamt 180 beziehungsweise 240 ECTS-Leistungspunkte erreicht wurden. Pr\u00fcfungen werden bescheinigt. Eine bestandene Pr\u00fcfung kann nicht wiederholt werden. Ist eine Pr\u00fcfung nicht bestanden oder gilt sie als nicht bestanden, erteilt der Pr\u00fcfungsausschuss einen schriftlichen Bescheid, der auch \u00fcber die M\u00f6glichkeit der Wiederholung Auskunft gibt. Eine nicht bestandene Modulpr\u00fcfung oder eine mit weniger als \"ausreichend\" bewertete Pr\u00fcfungsleistung als Teil einer Gruppenarbeit kann zweimal wiederholt werden. Eine mit weniger als \"ausreichend\" bewertete Bachelorarbeit oder ein individueller Teil einer Bachelorarbeit kann einmal wiederholt werden. Bei Wiederholung der Bachelorarbeit ist eine R\u00fcckgabe des Themas nur zul\u00e4ssig, wenn bei der ersten Anfertigung nicht von dieser M\u00f6glichkeit Gebrauch gemacht wurde. Die Wiederholungspr\u00fcfung soll innerhalb eines Jahres nach Abschluss der nicht bestandenen Pr\u00fcfung abgeschlossen sein. Pr\u00fcfungsleistungen in Wiederholungspr\u00fcfungen sind, bei deren endg\u00fcltigem Nichtbestehen keine Ausgleichsm\u00f6glichkeit vorgesehen ist, von zwei Pr\u00fcferinnen oder Pr\u00fcfern zu begutachten und zu bewerten. Die Note ergibt sich aus dem arithmetischen Mittel der Einzelbewertungen, wobei alle Dezimalstellen au\u00dfer der ersten ohne Rundung gestrichen werden. Die Bachelorpr\u00fcfung ist endg\u00fcltig nicht bestanden, wenn die Bachelorarbeit nicht bestanden und nicht wiederholbar ist, eine verpflichtende Modulpr\u00fcfung nicht bestanden und nicht wiederholbar ist, oder eine Modulpr\u00fcfung in einem Wahlpflichtbereich nicht bestanden, nicht wiederholbar ist und die notwendige Bestehensgrenze nicht erreicht werden kann. Das endg\u00fcltige Nichtbestehen der Bachelorpr\u00fcfung wird bescheinigt.",
            "Modulpr\u00fcfungen, wie in \u00a7 11 erl\u00e4utert, beziehen sich auf die in der Modulbeschreibung vorgegebenen Kompetenzziele unter Bezugnahme auf Lehrveranstaltungen oder Themenschwerpunkte des Moduls. Eine nachtr\u00e4gliche Umbuchung ist nicht m\u00f6glich, und die Verbindlichkeit gilt unabh\u00e4ngig vom Bestehen, Nichtbestehen oder der sp\u00e4teren Anrechnung, wobei Ausnahmen im f\u00e4cherspezifischen Anhang getroffen werden k\u00f6nnen. Werden Modulpr\u00fcfungen im Kontext von Lehrveranstaltungen abgelegt, steht den Studierenden die Wahl der Lehrveranstaltung unter Ber\u00fccksichtigung des f\u00e4cherspezifischen Anhangs frei. Grunds\u00e4tzlich ist jedem Modul genau eine Modulpr\u00fcfung zugeordnet, in begr\u00fcndeten Ausnahmef\u00e4llen k\u00f6nnen es auch mehrere sein, n\u00e4heres regelt der f\u00e4cherspezifische Anhang. Zu jeder Modulpr\u00fcfung ist eine gesonderte Meldung erforderlich, wobei nur zugelassen wird, wer die Zulassungsvoraussetzungen gem\u00e4\u00df \u00a7 12 erf\u00fcllt. Meldetermine werden im elektronischen Campus Management System und in der jeweiligen Lehrveranstaltung bekannt gegeben. Abmeldung und R\u00fccktritt von Pr\u00fcfungen sind in \u00a7 17 geregelt. Modulpr\u00fcfungen erfolgen als Klausur (auch elektronisch), m\u00fcndliche Pr\u00fcfung, Studienarbeit, Hausarbeit, Portfolio oder Projektarbeit mit individuell zurechenbarer Pr\u00fcfungsleistung. Die Kandidatin oder der Kandidat soll nachweisen, dass sie oder er ein Problem aus dem Stoffgebiet erkennen und L\u00f6sungswege finden kann. Mindestens eine Modulabschlusspr\u00fcfung muss in Form einer Hausarbeit oder Studienarbeit und mindestens eine in Form einer m\u00fcndlichen Pr\u00fcfung abgelegt werden. Form, Umfang, Dauer und Terminierung einer Modulabschlusspr\u00fcfung entscheiden die Pr\u00fcferin oder der Pr\u00fcfer unter Ber\u00fccksichtigung der W\u00fcnsche der Kandidatin oder des Kandidaten und der Vorgaben des Modulhandbuchs und der Pr\u00fcfungsordnung. Die Pr\u00fcfungen werden in der Regel in deutscher Sprache abgenommen, in Absprache auch in einer anderen Sprache; die Pr\u00fcfungssprache in Fremdsprachenphilologien ist im f\u00e4cherspezifischen Anhang geregelt. Die Bewertung von Pr\u00fcfungen ist den Studierenden jeweils nach sp\u00e4testens acht Wochen bekannt zu geben.",
            "Es gibt keine Angabe zu den Voraussetzungen f\u00fcr Pr\u00fcfungen im Bachelor Computerlinguistik. Eine Besonderheit des Studiengangs ist, dass die zweite Wiederholung einer Modulpr\u00fcfung als m\u00fcndliche Pr\u00fcfung erfolgen darf. Bei der Gewichtung der Pr\u00fcfungen f\u00fcr die Gesamtnote wird die Bachelorarbeit dreifach gewichtet, w\u00e4hrend alle Modulpr\u00fcfungen einfach z\u00e4hlen. Es gibt keine Angabe zur Pr\u00fcfungssprache nach \u00a7 6 (4). Ein Auslandsaufenthalt ist optional und das Mobilit\u00e4tsfenster hierf\u00fcr ist das 5. Semester. Es gibt keine Angabe zu Exkursionen."
        ]
    },
    {
        "user_input": "Wie stark z\u00e4hlt die Bachelorarbeit f\u00fcr meine Abschlussnote?",
        "reference": "Die Note der Bachelorarbeit wird bei der Ermittlung der Gesamtnote dreifach gewichtet. Im Vergleich dazu gehen alle anderen Modulpr\u00fcfungen nur einfach in die Gesamtnote ein.",
        "response": "Die Bachelorarbeit wird dreifach oder vierfach gewichtet und hat einen Gewichtungsanteil von 20 % bei Kern- und Erg\u00e4nzungsfachstudieng\u00e4ngen.",
        "retrieved_contexts": [
            "Die Bewertung der Pr\u00fcfungsleistungen und die Gesamtnote sind in \u00a7 18 dargelegt. F\u00fcr die Bewertung benoteter Pr\u00fcfungsleistungen sind die Noten 1 (sehr gut) bis 5 (nicht ausreichend) zu verwenden. Durch Erniedrigen oder Erh\u00f6hen der einzelnen Noten um 0,3 k\u00f6nnen Zwischenwerte gebildet werden, wobei die Noten 0,7; 4,3; 4,7 und 5,3 ausgeschlossen sind. Eine benotete Pr\u00fcfung ist bestanden, wenn die Note mindestens \"ausreichend\" (bis 4,0) ist. Eine unbenotete Pr\u00fcfung ist bestanden, wenn die in der Modulbeschreibung festgelegten Anforderungen erf\u00fcllt sind. Die Note der Bachelorarbeit ergibt sich wie folgt: Wenn die Noten beider Gutachten mindestens \"ausreichend\" (4,0) sind und nicht mehr als 2,0 auseinander liegen, errechnet sich die Endnote als Durchschnitt. Bei zwei Mal \"nicht ausreichend\" (5,0) ist die Endnote \"nicht ausreichend\" (5,0). Wenn eine Note \"nicht ausreichend\" (5,0) und die andere mindestens \"ausreichend\" (4,0) ist oder die Noten mehr als 2,0 auseinander liegen, wird eine dritte Gutachterin oder ein dritter Gutachter bestellt. Die Endnote errechnet sich als Durchschnitt der beiden besseren Noten, wenn sie mindestens \"ausreichend\" (4,0) sind. Alle Dezimalstellen au\u00dfer der ersten werden ohne Rundung gestrichen. Sind zwei der drei Noten \"nicht ausreichend\" (5,0), ist die Endnote \"nicht ausreichend\" (5,0). In Modulen mit genau einer benoteten Pr\u00fcfung entspricht die Modulnote der Pr\u00fcfungsnote. In Modulen mit mehr als einer benoteten Pr\u00fcfung errechnet sich die Modulnote aus dem arithmetischen Mittel aller benoteten Pr\u00fcfungen des Moduls. Die Gesamtnote der Bachelorpr\u00fcfung bei integrierten Studieng\u00e4ngen errechnet sich als gewichtetes arithmetisches Mittel aus den Modulnoten und der Bachelorarbeit, wobei die Bachelorarbeit nach Ma\u00dfgabe des f\u00e4cherspezifischen Anhangs dreifach oder vierfach gewichtet wird. Die Gewichtung der Modulnoten ist im f\u00e4cherspezifischen Anhang angegeben. Die Gesamtnote der Bachelorpr\u00fcfung bei Kern- und Erg\u00e4nzungsfachstudieng\u00e4ngen errechnet sich zu 20 Prozent aus der Note der Bachelorarbeit, zu 50 Prozent aus dem gewichteten arithmetischen Mittel aller Modulnoten des Kernfachs und zu 30 Prozent aus dem gewichteten arithmetischen Mittel aller Modulnoten des Erg\u00e4nzungsfachs. Modulnoten k\u00f6nnen nach Ma\u00dfgabe des f\u00e4cherspezifischen Anhangs doppelt oder dreifach gewichtet werden. Im Bachelorpr\u00fcfungszeugnis und auf den Leistungs\u00fcbersichten werden alle Noten sowie die Gesamtnote angegeben. Die Endnote wird wie folgt lautet: bis 1,5: sehr gut; von 1,6 bis 2,5: gut; von 2,6 bis 3,5: befriedigend; von 3,6 bis 4,0: ausreichend. Bei Vorliegen einer ausreichend gro\u00dfen Datenbasis werden die Noten zus\u00e4tzlich als ECTS-Noten ausgewiesen.",
            "Das Bestehen, Nichtbestehen und die Wiederholung von Pr\u00fcfungen sind in \u00a7 19 geregelt. Die Bachelorpr\u00fcfung ist bestanden und das Studium abgeschlossen, wenn die Bachelorarbeit bestanden ist, alle notwendigen Modulpr\u00fcfungen bestanden sind, alle notwendigen Studienleistungen vorliegen, der Nachweis des Besuchs von gegebenenfalls vorgesehenen Praktika vorliegt und insgesamt 180 beziehungsweise 240 ECTS-Leistungspunkte erreicht wurden. Pr\u00fcfungen werden bescheinigt. Eine bestandene Pr\u00fcfung kann nicht wiederholt werden. Ist eine Pr\u00fcfung nicht bestanden oder gilt sie als nicht bestanden, erteilt der Pr\u00fcfungsausschuss einen schriftlichen Bescheid, der auch \u00fcber die M\u00f6glichkeit der Wiederholung Auskunft gibt. Eine nicht bestandene Modulpr\u00fcfung oder eine mit weniger als \"ausreichend\" bewertete Pr\u00fcfungsleistung als Teil einer Gruppenarbeit kann zweimal wiederholt werden. Eine mit weniger als \"ausreichend\" bewertete Bachelorarbeit oder ein individueller Teil einer Bachelorarbeit kann einmal wiederholt werden. Bei Wiederholung der Bachelorarbeit ist eine R\u00fcckgabe des Themas nur zul\u00e4ssig, wenn bei der ersten Anfertigung nicht von dieser M\u00f6glichkeit Gebrauch gemacht wurde. Die Wiederholungspr\u00fcfung soll innerhalb eines Jahres nach Abschluss der nicht bestandenen Pr\u00fcfung abgeschlossen sein. Pr\u00fcfungsleistungen in Wiederholungspr\u00fcfungen sind, bei deren endg\u00fcltigem Nichtbestehen keine Ausgleichsm\u00f6glichkeit vorgesehen ist, von zwei Pr\u00fcferinnen oder Pr\u00fcfern zu begutachten und zu bewerten. Die Note ergibt sich aus dem arithmetischen Mittel der Einzelbewertungen, wobei alle Dezimalstellen au\u00dfer der ersten ohne Rundung gestrichen werden. Die Bachelorpr\u00fcfung ist endg\u00fcltig nicht bestanden, wenn die Bachelorarbeit nicht bestanden und nicht wiederholbar ist, eine verpflichtende Modulpr\u00fcfung nicht bestanden und nicht wiederholbar ist, oder eine Modulpr\u00fcfung in einem Wahlpflichtbereich nicht bestanden, nicht wiederholbar ist und die notwendige Bestehensgrenze nicht erreicht werden kann. Das endg\u00fcltige Nichtbestehen der Bachelorpr\u00fcfung wird bescheinigt.",
            "Die Annahme und Bewertung der Bachelorarbeit, wie in \u00a7 16 beschrieben, erfolgt durch fristgerechte Ablieferung in elektronischer Form (PDF-Dokument) durch Hochladen im elektronischen Campus-Management-System. Das Datum der Abgabe wird aktenkundig gemacht. Bei Nichteinhaltung der Frist gilt die Arbeit als mit \"nicht ausreichend\" (5,0) bewertet. Auf Verlangen k\u00f6nnen zwei gebundene Exemplare der Arbeit eingereicht werden. Die Bachelorarbeit wird von zwei Pr\u00fcferinnen oder Pr\u00fcfern unabh\u00e4ngig voneinander begutachtet und bewertet. Die Pr\u00fcferinnen oder Pr\u00fcfer werden von der oder dem Vorsitzenden des Pr\u00fcfungsausschusses oder deren oder dessen Stellvertretung bestellt. Erstgutachterin oder Erstgutachter ist die Betreuerin oder der Betreuer. Die Zweitgutachterin oder der Zweitgutachter zeichnet das Erstgutachten gegen oder erstellt ein zus\u00e4tzliches Gutachten. Bei abweichender Beurteilung kann eine dritte Gutachterin oder ein dritter Gutachter bestellt werden. Die Endnote ergibt sich nach \u00a7 18 Absatz 2. Die Bewertung der Bachelorarbeit ist der Kandidatin oder dem Kandidaten nach sp\u00e4testens acht Wochen mitzuteilen."
        ]
    },
    {
        "user_input": "Was passiert, wenn ich in einer Pr\u00e4senzpr\u00fcfung generative K\u00fcnstliche Intelligenz benutze?",
        "reference": "Der Einsatz generativer K\u00fcnstlicher Intelligenz im Rahmen von Pr\u00e4senzpr\u00fcfungen ist unzul\u00e4ssig. Dies gilt als T\u00e4uschungsversuch.",
        "response": "Der Einsatz generativer K\u00fcnstlicher Intelligenz im Rahmen von Pr\u00e4senzpr\u00fcfungen ist unzul\u00e4ssig.",
        "retrieved_contexts": [
            "Abmeldung, Vers\u00e4umnis, R\u00fccktritt, T\u00e4uschung und Ordnungsversto\u00df werden in \u00a7 17 geregelt. Von einer Modulpr\u00fcfung in Form einer Klausur oder m\u00fcndlichen Pr\u00fcfung kann sich die Kandidatin oder der Kandidat bis sp\u00e4testens eine Woche vor dem jeweiligen Pr\u00fcfungstermin abmelden. Bei R\u00fccktritt nach dieser Frist, Nichterscheinen, R\u00fccktritt nach Beginn der Pr\u00fcfung oder Nichterbringung einer schriftlichen Pr\u00fcfungsleistung innerhalb der Bearbeitungszeit m\u00fcssen triftige Gr\u00fcnde geltend gemacht werden, andernfalls gilt die Pr\u00fcfungsleistung als \"nicht ausreichend\" (5,0) bewertet. Als triftige Gr\u00fcnde gelten insbesondere Krankheit, Mutterschutz, Kinderbetreuung im Rahmen der Elternzeit und notwendige Pflege naher Angeh\u00f6riger. Krankheiten w\u00e4hrend einer Pr\u00fcfung sind unverz\u00fcglich den Pr\u00fcfenden und dem Pr\u00fcfungsausschuss anzuzeigen. Die geltend gemachten Gr\u00fcnde m\u00fcssen dem Pr\u00fcfungsausschuss unverz\u00fcglich in Textform angezeigt und glaubhaft gemacht werden; bei Krankheit ist ein \u00e4rztliches Attest vorzulegen. Wenn die Gr\u00fcnde anerkannt werden, wird ein neuer Termin festgesetzt und die bereits vorliegenden Pr\u00fcfungsergebnisse angerechnet. \u00c4rztliche Atteste sind per E-Mail \u00fcber die Studierenden- und Pr\u00fcfungsverwaltung an den Pr\u00fcfungsausschuss zu richten. Das Verfahren ist auf der Internetseite der HHU bekanntgegeben. Versuche, das Ergebnis einer Pr\u00fcfungsleistung durch T\u00e4uschung zu beeinflussen, f\u00fchren zur Bewertung als \"nicht ausreichend\" (5,0). Der Einsatz generativer K\u00fcnstlicher Intelligenz im Rahmen von Pr\u00e4senzpr\u00fcfungen ist unzul\u00e4ssig. Als T\u00e4uschungsversuch gelten auch nicht gekennzeichnete Zitate aus Internetquellen. Wer den ordnungsgem\u00e4\u00dfen Ablauf einer Pr\u00fcfung st\u00f6rt, kann nach Abmahnung von der Fortsetzung ausgeschlossen werden; in diesem Fall gilt die Pr\u00fcfungsleistung als \"nicht ausreichend\" (5,0) bewertet. Die Gr\u00fcnde f\u00fcr den Ausschluss sind aktenkundig zu machen. Wer ausgeschlossen wird, kann die \u00dcberpr\u00fcfung der Entscheidung durch den Pr\u00fcfungsausschuss verlangen. Dies gilt entsprechend bei Feststellung einer T\u00e4uschung. Belastende Entscheidungen des Pr\u00fcfungsausschusses sind unverz\u00fcglich schriftlich mitzuteilen und zu begr\u00fcnden. Vor einer Entscheidung ist der Kandidatin oder dem Kandidaten Gelegenheit zum rechtlichen Geh\u00f6r zu geben.",
            "Die Ung\u00fcltigkeit der Bachelorpr\u00fcfung wird in \u00a7 20 behandelt. Wenn die Kandidatin oder der Kandidat bei einer Pr\u00fcfung get\u00e4uscht hat und dies nach Aush\u00e4ndigung des Zeugnisses bekannt wird, kann der Pr\u00fcfungsausschuss nachtr\u00e4glich die Noten f\u00fcr die betroffenen Pr\u00fcfungsleistungen berichtigen und die Pr\u00fcfung f\u00fcr nicht bestanden erkl\u00e4ren. Waren die Zulassungsvoraussetzungen nicht erf\u00fcllt, ohne dass T\u00e4uschung vorlag, und wird dies nach Aush\u00e4ndigung des Zeugnisses bekannt, wird der Mangel durch das Bestehen der Pr\u00fcfung geheilt. Hat die Kandidatin oder der Kandidat die Zulassung vors\u00e4tzlich erwirkt, entscheidet der Pr\u00fcfungsausschuss \u00fcber die Rechtsfolgen. Vor einer Entscheidung ist der Kandidatin oder dem Kandidaten Gelegenheit zur \u00c4u\u00dferung zu geben. Das unrichtige Pr\u00fcfungszeugnis wird eingezogen; gegebenenfalls wird ein neues erteilt. Eine Entscheidung nach \u00a7 20 Absatz 1 und Absatz 2 Satz 2 ist nach einer Frist von f\u00fcnf Jahren ab dem Datum des Pr\u00fcfungszeugnisses ausgeschlossen.",
            "Im Bereich Studium und Lehre, beginnend mit \u00a7 6, wird die Anforderungen des Studiums festgelegt. Die Lehre ist als Pr\u00e4senzstudium organisiert. Die Studierenden m\u00fcssen gem\u00e4\u00df dieser Pr\u00fcfungsordnung Pflicht- und Wahlpflichtveranstaltungen einschlie\u00dflich des Profilbildungsbereiches belegen."
        ]
    },
    {
        "user_input": "Muss ich Kurse aus der Linguistik f\u00fcr das interdisziplin\u00e4re Vertiefungsmodul belegen?",
        "reference": "Nein, Linguistik-Kurse sind keine Pflicht. Das Modul sieht vor, dass du zwei Vorlesungen oder Seminare aus der Linguistik oder der Informatik w\u00e4hlst, wobei lediglich der Informatik-Anteil von 4 SWS vorgeschrieben ist.",
        "response": "Nein, Kurse aus der Linguistik m\u00fcssen nicht belegt werden. Das interdisziplin\u00e4re Vertiefungsmodul (Modul-Nummer 5100) umfasst Veranstaltungen aus Linguistik, Informatik und Computerlinguistik, wobei mindestens eine Veranstaltung aus der Informatik zu belegen ist.",
        "retrieved_contexts": [
            "Das Modul Vertiefungsmodul - Interdisziplin\u00e4r (Modul-Nummer: 5100) erstreckt sich \u00fcber 2 Semester, hat einen Umfang von 12 ECTS-Leistungspunkten und einen Workload von 360 Stunden. Die Lehrveranstaltungen f\u00fcr dieses Vertiefungsmodul sind zwei Vorlesungen oder Seminare aus Linguistik oder Informatik, wobei Vorlesungen Linguistik (5101, 5105), Vorlesungen Informatik (5102, 5106), Seminare Linguistik (5103, 5107) und Seminare Informatik (5104, 5108) zur Auswahl stehen. Die Belegung f\u00fcr dieses Vertiefungsmodul erfolgt nach Vorgabe der gew\u00e4hlten Veranstaltungen. Das empfohlene Studiensemester f\u00fcr dieses Vertiefungsmodul ist das 4. Fachsemester (Sommersemester) und das 5. Fachsemester (Wintersemester). Dieses Vertiefungsmodul wird jedes Semester angeboten. Die geplante Gruppengr\u00f6\u00dfe sowie die Kontaktzeit und das Selbststudium f\u00fcr dieses Vertiefungsmodul richten sich nach den gew\u00e4hlten Veranstaltungen. Die ECTS-Leistungspunkte f\u00fcr die Modulpr\u00fcfung dieses Vertiefungsmoduls richten sich ebenfalls nach den gew\u00e4hlten Veranstaltungen. Die Inhalte dieses Vertiefungsmoduls umfassen Themen der Linguistik und Informatik. M\u00f6gliche Themen in der Linguistik sind beispielsweise Phonetik und Phonologie, Psycho- und Neurolinguistik, historische Linguistik. Es m\u00fcssen Veranstaltungen im Umfang von mindestens 4 SWS in der Informatik belegt werden, wobei keine Doppelung von Inhalten der Module aus der Computerlinguistik entstehen darf. F\u00fcr die Computerlinguistik relevante m\u00f6gliche Themen in der Informatik sind beispielsweise Professionelle Softwareentwicklung, Datenbanksysteme, Nichtkooperative Spieltheorie, Komplexit\u00e4tstheorie, Numerische Optimierung, Dialogsysteme, \u00dcberblick K\u00fcnstliche Intelligenz. Die angestrebten Lernergebnisse und Studieninhalte dieses Vertiefungsmoduls umfassen vertiefte Kenntnisse in Spezialgebieten von Linguistik, Computerlinguistik und Informatik. Formale Teilnahmevoraussetzungen f\u00fcr das Vertiefungsmodul - Interdisziplin\u00e4r sind keine. Die Pr\u00fcfungsformen f\u00fcr dieses Vertiefungsmodul sind M\u00fcndliche Pr\u00fcfung (Pnr. 5110) oder Klausur (Pnr. 5120) oder Hausarbeit (Pnr. 5130) oder Studienarbeit (Pnr. 5140) oder Projektarbeit (Pnr. 5150). Es gibt keine Voraussetzungen f\u00fcr die Zulassung zur Modulpr\u00fcfung. Die Voraussetzungen f\u00fcr die Vergabe von ECTS-Leistungspunkten f\u00fcr das Vertiefungsmodul - Interdisziplin\u00e4r sind eine bestandene Modulpr\u00fcfung und die aktive und erfolgreiche Mitwirkung in den Seminaren und theoretischen und praktischen \u00dcbungen. Sonstige Informationen f\u00fcr das Vertiefungsmodul - Interdisziplin\u00e4r sind nicht vorhanden.",
            "Phase 3 des Studiums der Computerlinguistik fokussiert auf Spezialisierung und Berufsorientierung. Im letzten Studienjahr geht es darum, aufbauend auf den zuvor erworbenen Grundlagen und Methoden, Fachkompetenzen weiter auszubauen und sich durch die Wahl der Bereiche, in denen im letzten Jahr APs abgelegt werden, die Durchf\u00fchrung eines Praktikums und das Thema der Abschlussarbeit weiter zu spezialisieren und in Richtung m\u00f6glicher anschlie\u00dfender T\u00e4tigkeitsfelder zu orientieren. In den beiden computerlinguistischen Vertiefungsmodulen werden regelm\u00e4\u00dfig unterschiedliche thematische Seminare angeboten, aus denen die Studierenden frei w\u00e4hlen k\u00f6nnen. In einem der Seminare des Vertiefungsmoduls 2 muss eine MP angelegt werden. Themen dieser Seminare umfassen beispielsweise Vektorsemantik, gro\u00dfe Sprachmodelle, Transformer-Architekturen in computerlinguistischen Anwendungen, Advanced Constituency Parsing, Dependency Parsing, Finite-State Morphology, Semantic Role Labeling, Discourse Representation Theory und Fuzzy Logic. Zus\u00e4tzlich gibt es das interdisziplin\u00e4re Vertiefungsmodul, das den Studierenden erm\u00f6glicht, neben Veranstaltungen aus der Computerlinguistik auch Veranstaltungen aus Linguistik und Informatik zu belegen, die nicht notwendigerweise dezidiert computerlinguistisch sind. Im Rahmen dieses interdisziplin\u00e4ren Vertiefungsmoduls ist mindestens eine Veranstaltung aus der Informatik zu belegen. Neben diesen Modulen, die flexible Spezialisierungen in Computerlinguistik, Linguistik und Informatik erm\u00f6glichen, sind im letzten Studienjahr ein Praktikum zur Berufsorientierung und die Anfertigung der Bachelorarbeit vorgesehen. Die Bachelorarbeit wird in der Regel im letzten Semester durchgef\u00fchrt, parallel zum Besuch des Forschungskolloquiums der Computerlinguistik. Das Forschungskolloquium bietet interessante Einblicke in aktuelle Forschungsthemen und liefert Anregungen und Inspiration f\u00fcr die Bachelorarbeit. Das 5. Semester kann als Mobilit\u00e4tssemester gew\u00e4hlt werden, da Kurse von anderen Universit\u00e4ten in den Vertiefungsmodulen anerkannt werden k\u00f6nnen.",
            "Im 5. Semester des Bachelor Computerlinguistik sind 3 Module mit 1 MP, 3 Veranstaltungen, 12 SWS und 30 LP vorgesehen, davon 1 LP im PBB. Das Praktikum & Orientierung [2/2] umfasst 1 SL und 9 LP, mit der Veranstaltung Praktikum (in der Regel 6 Wochen Vollzeit, 9 LP, Pnr. 3010). Das Vertiefungsmodul - Interdisziplin\u00e4r [2/2] beinhaltet 1 MP, 1 SL, 8 LP und 4 SWS, mit der Veranstaltung Seminar nach Wahl (4 LP, 4 SWS, Pnr. 5103) und Modulpr\u00fcfung (4 LP, Pnr. 5110). Das Vertiefungsmodul - Computerlinguistik 1 hat 2 SL, 12 LP und 8 SWS, mit den Veranstaltungen Seminar nach Wahl im Bereich Computerlinguistik (6 LP, 4 SWS, Pnr. 5201) und Seminar nach Wahl im Bereich Computerlinguistik (6 LP, 4 SWS, Pnr. 5202). Der Profilbildungsbereich liefert 1 LP."
        ]
    },
    {
        "user_input": "Wie lang ist die offizielle Bearbeitungszeit f\u00fcr die Bachelorarbeit?",
        "reference": "Die Bearbeitungszeit f\u00fcr die Bachelorarbeit betr\u00e4gt maximal drei Monate.",
        "response": "Die Bearbeitungszeit f\u00fcr die Bachelorarbeit betr\u00e4gt maximal drei Monate.",
        "retrieved_contexts": [
            "Die Bachelorarbeit, wie in \u00a7 15 dargelegt, wird in der Regel im sechsten Studiensemester angefertigt. Sie bezieht sich meist auf den Inhalt eines Aufbaumoduls des Abschlussjahrs, in Kern- und Erg\u00e4nzungsfachstudieng\u00e4ngen auf den Inhalt eines Aufbaumoduls des betreffenden Kernfachs. N\u00e4heres kann im f\u00e4cherspezifischen Anhang geregelt sein. Mit Zustimmung kann das Thema auch aus einem anderen Themenbereich stammen. Die Kandidatinnen und Kandidaten k\u00f6nnen den Themenbereich vorschlagen. Die oder der Vorsitzende des Pr\u00fcfungsausschusses oder deren oder dessen Stellvertretung bestellt auf Antrag die Betreuerin oder den Betreuer, die oder der das Thema formuliert und genehmigt. Das Thema wird in digitaler Form \u00fcber das Elektronische Campus-Management-System ausgeh\u00e4ndigt und der Zeitpunkt der Ausgabe wird aktenkundig gemacht. Die Bearbeitungszeit betr\u00e4gt maximal drei Monate, eine Nachfrist von bis zu vier Wochen kann ausnahmsweise gew\u00e4hrt werden. Bei Erkrankung innerhalb der Nachfrist kann eine weitere Nachfrist von bis zu zwei Wochen gew\u00e4hrt werden. Das Thema der Bachelorarbeit kann bis vier Wochen nach Ausgabe zur\u00fcckgegeben werden, dies ist einmalig m\u00f6glich. Die Kandidatinnen und Kandidaten sollen nachweisen, dass sie eine Fragestellung des Fachs selbstst\u00e4ndig nach wissenschaftlichen Methoden bearbeiten und die Ergebnisse sachgerecht darstellen k\u00f6nnen. Das Thema darf nicht mit einer bereits abgelegten Abschlusspr\u00fcfung deckungsgleich sein und muss so begrenzt sein, dass es innerhalb der Frist bearbeitet werden kann. Die Bachelorarbeit kann wahlweise in deutscher oder englischer Sprache abgefasst werden, in Germanistik muss sie in deutscher, in Anglistik und Amerikanistik in englischer Sprache erfolgen. Weitere Ausnahmen k\u00f6nnen gestattet werden. Die Bachelorarbeit kann auch in Form einer Gruppenarbeit zugelassen werden, wenn der Beitrag der einzelnen Kandidatinnen und Kandidaten klar abgrenzbar und bewertbar ist. Der Bachelorarbeit ist eine Versicherung beizuf\u00fcgen, dass sie selbstst\u00e4ndig verfasst wurde und keine anderen als die angegebenen Quellen benutzt wurden. Zitate m\u00fcssen kenntlich gemacht werden. Die Versicherung der selbstst\u00e4ndigen Abfassung gilt auch f\u00fcr gelieferte Zeichnungen, Skizzen oder graphische Darstellungen. Der Umfang der Bachelorarbeit, beziehungsweise bei Gruppenarbeiten der einzelnen Beitr\u00e4ge, muss 9.000 bis 15.000 W\u00f6rter (ca. 30 bis 50 Seiten) betragen. Ist im f\u00e4cherspezifischen Anhang der Umfang in Zeichen angegeben, gilt dies. Bei experimentellen oder gestalterischen Leistungen verringert sich der Textumfang entsprechend.",
            "Schriftliche Modulpr\u00fcfungen, wie in \u00a7 14 beschrieben, k\u00f6nnen als Klausuren oder dokumentierte Einzelberichte ausgestaltet sein. Klausuren k\u00f6nnen Multiple-Choice-Aufgaben enthalten. Bei elektronischer Durchf\u00fchrung und Auswertung sind Authentizit\u00e4t und Integrit\u00e4t der Pr\u00fcfungsergebnisse sicherzustellen. Besteht eine Klausur aus Multiple-Choice-Aufgaben, wird die Bestehensgrenze von dem Pr\u00fcfer oder der Pr\u00fcferin nach fachlichen Kriterien festgelegt, unter Ber\u00fccksichtigung des Mittelwerts und der Verteilung der erzielten Leistungen. Die Dauer einer Klausurarbeit betr\u00e4gt in der Regel 90 Minuten, kann aber je nach Workload des Moduls auf bis zu 180 Minuten verl\u00e4ngert oder auf mindestens 45 Minuten verk\u00fcrzt werden. Die Bewertung einer Klausur erfolgt durch die Dozentinnen und Dozenten und wird der Kandidatin oder dem Kandidaten nach sp\u00e4testens acht Wochen bekannt gemacht. N\u00e4heres regelt der f\u00e4cherspezifische Anhang. Eine Studienarbeit besteht aus einer m\u00fcndlichen Pr\u00e4sentation und schriftlichen Ausarbeitung einer Thematik; alternativ kann eine Klausur von 45 Minuten Dauer an die Stelle der schriftlichen Ausarbeitung treten. Die Dauer der m\u00fcndlichen Pr\u00e4sentation betr\u00e4gt mindestens 15 Minuten. Der Umfang der schriftlichen Ausarbeitung soll mindestens 1500 W\u00f6rter (ca. 5 Seiten) und h\u00f6chstens 4500 W\u00f6rter (ca. 15 Seiten) betragen. Die Bewertung einer Studienarbeit wird durch die Dozentin oder den Dozenten vorgenommen und der Kandidatin oder dem Kandidaten nach sp\u00e4testens acht Wochen nach Abgabe bekannt gemacht. Eine Hausarbeit besteht aus der schriftlichen Ausarbeitung einer Thematik mit einem Umfang von mindestens 3000 W\u00f6rtern (ca. 10 Seiten) und h\u00f6chstens 6000 W\u00f6rtern (ca. 20 Seiten). Die Bewertung einer Hausarbeit wird durch die Dozentin oder den Dozenten vorgenommen und der Kandidatin oder dem Kandidaten nach sp\u00e4testens acht Wochen nach Abgabe bekannt gemacht. Eine Projektarbeit umfasst die selbstst\u00e4ndige Anwendung fachspezifischer Methoden sowie eine m\u00fcndliche Pr\u00e4sentation und schriftliche Ausarbeitung der Ergebnisse. Ein schriftlicher Test kann Teil einer Projektarbeit sein. Die Dauer der m\u00fcndlichen Pr\u00e4sentation betr\u00e4gt mindestens 15 Minuten und h\u00f6chstens 45 Minuten. Der Umfang der schriftlichen Ausarbeitung soll mindestens 1500 W\u00f6rter (ca. 5 Seiten) und h\u00f6chstens 7500 W\u00f6rter (ca. 25 Seiten) betragen, wobei der Umfang bei Tabellen, Schaubildern und Abbildungen \u00fcberschritten werden darf. Die Dauer eines schriftlichen Tests betr\u00e4gt in der Regel 60 Minuten. Die Bewertung einer Projektarbeit erfolgt durch die Veranstalterin oder den Veranstalter der Lehrveranstaltung bzw. die Betreuerin oder den Betreuer und wird sp\u00e4testens acht Wochen nach Abgabe bekannt gemacht. Ein Portfolio ist eine systematische Zusammenstellung verschiedener studentischer Arbeitsergebnisse, die den Lernprozess zur Erreichung der Lernergebnisse und Kompetenzen eines Moduls widerspiegeln soll. Ein Portfolio umfasst mindestens zwei unterschiedliche, in sich abgeschlossene Objekte. Der Umfang wird von den Lehrenden festgelegt und entspricht dem Workload einer Hausarbeit. Studienarbeiten, Hausarbeiten und Projektarbeiten k\u00f6nnen auch als Gruppenarbeit durchgef\u00fchrt werden, wenn der Beitrag der einzelnen Kandidatinnen und Kandidaten klar abgrenzbar und bewertbar ist. Studienarbeiten, Hausarbeiten, Projektarbeiten und Portfolios muss eine Versicherung der Kandidatinnen und Kandidaten beiliegen, dass sie die Arbeit selbstst\u00e4ndig verfasst und keine anderen als die angegebenen Quellen benutzt haben. Zitate m\u00fcssen unter Angabe der Quelle kenntlich gemacht werden. Sofern generative K\u00fcnstliche Intelligenz genutzt wurde, ist dies in einem entsprechenden Absatz methodisch zu reflektieren und zu dokumentieren. Die Versicherung der selbstst\u00e4ndigen Abfassung gilt auch f\u00fcr gelieferte Zeichnungen, Skizzen, Ton- und Videoaufnahmen oder graphische Darstellungen. Die Arbeiten sind in digitaler Form in einem g\u00e4ngigen Textverarbeitungsformat einzureichen; die Nutzung von HHU-Mailadressen und Verschl\u00fcsselung wird empfohlen. Bei begr\u00fcndetem Verdacht kann eine \u00dcberpr\u00fcfung mittels Plagiatssoftware erfolgen. Das Urheberrecht der Verfasserin oder des Verfassers bleibt gewahrt. Die Bearbeitungszeit f\u00fcr Studienarbeiten endet zwei Monate nach Abschluss der m\u00fcndlichen Leistung, sp\u00e4testens zum Vorlesungsbeginn des darauffolgenden Semesters. Die Bearbeitungszeit f\u00fcr Hausarbeiten betr\u00e4gt in der Regel zwei Monate und kann vom Pr\u00fcfungsausschuss um bis zu einen Monat verl\u00e4ngert werden. Die Themen werden im laufenden Semester vergeben. Die Bearbeitungszeit f\u00fcr den schriftlichen Bericht bei Projektarbeiten endet in der Regel zwei Monate nach Abschluss der praktischen Projektarbeit und kann um bis zu einen Monat verl\u00e4ngert werden. Verz\u00f6gert sich die Bearbeitung durch nicht zu vertretende Umst\u00e4nde, kann eine Nachfrist von bis zu 4 Wochen einger\u00e4umt werden.",
            "Die Annahme und Bewertung der Bachelorarbeit, wie in \u00a7 16 beschrieben, erfolgt durch fristgerechte Ablieferung in elektronischer Form (PDF-Dokument) durch Hochladen im elektronischen Campus-Management-System. Das Datum der Abgabe wird aktenkundig gemacht. Bei Nichteinhaltung der Frist gilt die Arbeit als mit \"nicht ausreichend\" (5,0) bewertet. Auf Verlangen k\u00f6nnen zwei gebundene Exemplare der Arbeit eingereicht werden. Die Bachelorarbeit wird von zwei Pr\u00fcferinnen oder Pr\u00fcfern unabh\u00e4ngig voneinander begutachtet und bewertet. Die Pr\u00fcferinnen oder Pr\u00fcfer werden von der oder dem Vorsitzenden des Pr\u00fcfungsausschusses oder deren oder dessen Stellvertretung bestellt. Erstgutachterin oder Erstgutachter ist die Betreuerin oder der Betreuer. Die Zweitgutachterin oder der Zweitgutachter zeichnet das Erstgutachten gegen oder erstellt ein zus\u00e4tzliches Gutachten. Bei abweichender Beurteilung kann eine dritte Gutachterin oder ein dritter Gutachter bestellt werden. Die Endnote ergibt sich nach \u00a7 18 Absatz 2. Die Bewertung der Bachelorarbeit ist der Kandidatin oder dem Kandidaten nach sp\u00e4testens acht Wochen mitzuteilen."
        ]
    }
]