[
    {
        "user_input": "Gibt es einen Numerus Clausus (NC) oder einen Mindest-Abiturschnitt f\u00fcr den Studiengang?",
        "reference": "Dazu enthalten die bereitgestellten Dokumente keine Informationen.",
        "response": "Dazu enthalten die bereitgestellten Dokumente keine Informationen.",
        "retrieved_contexts": [
            "(1) Die Bachelorpr\u00fcfung ist bestanden und das Studium abgeschlossen, wenn\n\u2022 die Bachelorarbeit bestanden ist,\n\u2022 alle notwendigen Modulpr\u00fcfungen bestanden sind,\n\u2022 alle notwendigen Studienleistungen vorliegen,\n\u2022 der Nachweis des Besuchs von gegebenenfalls vorgesehenen Praktika vorliegt,\n\u2022 insgesamt 180 beziehungsweise bei vierj\u00e4hrigen Studieng\u00e4ngen 240 ECTS-Leistungspunkte erreicht worden sind.",
            "(6) Die Gesamtnote der Bachelorpr\u00fcfung bei Kern- und Erg\u00e4nzungsfachstudieng\u00e4ngen errechnet sich zu 20 Prozent aus der Note der Bachelorarbeit, zu 50 Prozent aus dem gewichteten arithmetischen Mittel aller Modulnoten des Kernfaches, und zu 30 Prozent aus dem gewichteten arithmetischen Mittel aller Modulnoten des Erg\u00e4nzungsfaches. Modulnoten k\u00f6nnen nach Ma\u00dfgabe des f\u00e4cherspezifischen Anhangs doppelt oder dreifach gewichtet werden. Alle Dezimalstellen au\u00dfer der ersten werden ohne Rundung gestrichen.",
            "| Merkmal | Details |\n| :--- | :--- |\n| **Integrierter Studiengang** | Computerlinguistik |\n| **Studienbeginn** | Nur im Wintersemester |\n| **Studienumfang** | 180 ECTS-Leistungspunkte (LP) |\n| **Notwendige Vorkenntnisse** | Kenntnisse des Englischen (Niveau B1, vergleichbar mit erfolgreichem vierj\u00e4hrigem Schulunterricht an einer weiterf\u00fchrenden Schule) |\n| **Prop\u00e4deutikum im Profilbildungsbereich** | keine Angabe |\n| **Anzahl der Modulpr\u00fcfungen** | 9, zuz\u00fcglich Bachelorarbeit |\n| **Art und Inhalt der Module und der Pr\u00fcfungen** | **Module:**<br>- Basismodul - Mathematische und logische Grundlagen (8 SWS, 1 MP, 12 LP)<br>- Basismodul - Grundlagen der Computerlinguistik und formale Grammatikbeschreibung (8 SWS, 1 MP, 12 LP)<br>- Basismodul - Python-Programmierung (8 SWS, 1 MP, 12 LP)<br>- Basiswissen Linguistik - Morphologie und Syntax (6 SWS, 1 MP, 9 LP)<br>- Basiswissen Linguistik - Semantik und Pragmatik (6 SWS, 1 MP, 9 LP)<br>- Basismodul - Statistische Methoden in der Computerlinguistik (6 SWS, 6 LP)<br>- Aufbaumodul - Maschinelles Lernen (8 SWS, 1 MP, 12 LP)<br>- Aufbaumodul - Mathematische Linguistik (4 SWS, 6 LP)<br>- Aufbaumodul - Parsing (4 SWS, 6 LP)<br>- Aufbaumodul - Logische Programmierung (4 SWS, 6 LP)<br>- Aufbaumodul - Objektorientierte Programmierung (8 SWS, 1 MP, 12 LP)<br>- Praktikum und Orientierung (2 SWS, 12 LP)<br>- Vertiefungsmodul - interdisziplin\u00e4r (8 SWS, 1 MP, 12 LP)<br>- Vertiefungsmodul - Computerlinguistik 1 (8 SWS, 12 LP)<br>- Vertiefungsmodul - Computerlinguistik 2 (4 SWS, 1 MP, 9 LP)<br>- Abschlussarbeit und Forschungskolloquium (2 SWS, 15 LP)<br>- Profilbildungsbereich (18 LP) |\n| **Voraussetzungen f\u00fcr Pr\u00fcfungen** | keine Angabe |\n| **Besonderheiten** | Die zweite Wiederholung einer Modulpr\u00fcfung darf als m\u00fcndliche Pr\u00fcfung erfolgen. |\n| **Gewichtung der Pr\u00fcfungen f\u00fcr die Gesamtnote** | Bachelorarbeit: dreifach<br>Alle Modulpr\u00fcfungen: einfach |\n| **Pr\u00fcfungssprache nach \u00a7 6 (4)** | keine Angabe |\n| **Auslandsaufenthalt** | Optional (Mobilit\u00e4tsfenster: 5. Semester) |\n| **Exkursion** | keine Angabe |\n| **Praktikum** | Nach dem vierten oder f\u00fcnften Semester wird entweder ein mindestens 6-w\u00f6chiges Berufsfeldpraktikum oder eine Projektarbeit absolviert, jeweils mit einschl\u00e4gig computerlinguistischem Inhalt. Das Praktikum soll einen Einblick in die Berufspraxis vermitteln sowie den sp\u00e4teren \u00dcbergang in die Berufswelt erleichtern. Die Wahl des Praktikumsplatzes erfolgt im Einvernehmen mit dem/der Praktikumsbeauftragten der Abteilung f\u00fcr Computerlinguistik. Der/die Praktikumsbeauftragte ist bei der Vermittlung von Praktikumspl\u00e4tzen behilflich und bietet eine fachliche Praktikumsberatung und -begleitung an. \u00dcber das Praktikum ist ein kurzer Bericht (ca. 3-5 Seiten) zu verfassen und ein Zeugnis der Praktikumsstelle einzureichen. |",
            "**Abk\u00fcrzungen im Studienverlaufsplan:**\n* Modulpr\u00fcfung = MP\n* Studienleistung = SL\n* ECTS-Leistungspunkte = LP\n* Semesterwochenstunden = SWS\n* Profilbildungsbereich = PBB\n* Pr\u00fcfungsnummer = Pnr.",
            "(2) Zu Modulpr\u00fcfungen wird ebenfalls zugelassen, wer eine Zugangspr\u00fcfung f\u00fcr beruflich Qualifizierte gem\u00e4\u00df \u00a7 49 Absatz 6 HG in Verbindung mit der Ordnung zur Weitergeltung von Vorschriften \u00fcber den Hochschulzugang in Studieng\u00e4ngen der Philosophischen Fakult\u00e4t der Heinrich-Heine-Universit\u00e4t D\u00fcsseldorf vom 12.05.2010 (Weitergeltungsordnung) erfolgreich bestanden hat. Pr\u00fcfung im Sinne von \u00a7 2 der Weitergeltungsordnung sind eine Klausurarbeit von zwei Zeitstunden und eine m\u00fcndliche Pr\u00fcfung von 20 bis 30 Minuten Dauer, in denen die Kandidatin oder der Kandidat ihre oder seine fachlichen und methodischen Voraussetzungen f\u00fcr ein Bachelorstudium nachweist. Die Anforderungen an die Durchf\u00fchrung und Bewertung der Klausurarbeit und der m\u00fcndlichen Pr\u00fcfung entsprechen den Anforderungen an Klausuren und m\u00fcndliche Pr\u00fcfungen im Sinne von \u00a7 13 Absatz 1 und \u00a7 14 Absatz 3 dieser Ordnung. Die Note errechnet sich als arithmetisches Mittel der einzelnen Pr\u00fcfungsteilleistungen, wobei jede Teilleistung mindestens als bestanden gewertet sein muss. Nach der Berechnung des arithmetischen Mittels werden alle Dezimalstellen au\u00dfer der ersten ohne Rundung gestrichen. Ein Probestudium gem\u00e4\u00df \u00a7 5 Berufsbildungshochschulzugangsverordnung dauert in allen Studieng\u00e4ngen zwei Semester. Ein Test im Sinne von \u00a7 10 Absatz 5 Satz 2 Berufsbildungshochschulzugangsverordnung ist der m\u00fcndliche Pr\u00fcfungsteil gem\u00e4\u00df Absatz 2 dieser Ordnung. Der Antrag ist \u00fcber die Studierenden- und Pr\u00fcfungsverwaltung an den Pr\u00fcfungsausschuss zu stellen."
        ],
        "reranking_scores": [
            -0.0055238730274140835,
            -0.005981569178402424,
            -0.011647114530205727,
            -0.025513216853141785,
            -0.031778257340192795
        ]
    },
    {
        "user_input": "Wie hoch ist der aktuelle Semesterbeitrag an der Heinrich-Heine-Universit\u00e4t D\u00fcsseldorf?",
        "reference": "Dazu enthalten die bereitgestellten Dokumente keine Informationen.",
        "response": "Dazu enthalten die bereitgestellten Dokumente keine Informationen.",
        "retrieved_contexts": [
            "Aufgrund des \u00a7 2 Absatz 4 und des \u00a7 64 Absatz 1 des Gesetzes \u00fcber die Hochschulen des Landes Nordrhein-Westfalen (Hochschulgesetz - HG) vom 16.09.2014 (GV. NRW. S. 547), zuletzt ge\u00e4ndert durch das Gesetz zur \u00c4nderung des Hochschulgesetzes vom 19.12.2024 (GV. NRW. S. 1222) hat die Heinrich-Heine-Universit\u00e4t D\u00fcsseldorf folgende Ordnung erlassen:",
            "(1) Die Regelstudienzeit bis zum vollst\u00e4ndigen Abschluss der Bachelorpr\u00fcfung betr\u00e4gt drei oder ausnahmsweise vier Studienjahre. Ausnahmen sind im f\u00e4cherspezifischen Anhang beschrieben. Ein Studienjahr besteht aus zwei Semestern. Der Bachelorstudiengang ist so konzipiert, dass er mit einem durchschnittlichen Arbeitsaufwand (workload) von 900 Stunden pro Semester abgeschlossen werden kann.",
            "*D\u00fcsseldorf, den 20.01.2026*",
            "# Ordnung f\u00fcr die Pr\u00fcfung in Studieng\u00e4ngen der Philosophischen Fakult\u00e4t der Heinrich-Heine-Universit\u00e4t D\u00fcsseldorf\n**mit dem Abschluss Bachelor of Arts vom 20.01.2026**",
            "(2) Die konkreten Anforderungen f\u00fcr Studienleistungen sind in der Veranstaltungsank\u00fcndigung im elektronischen Campus Management System der Heinrich-Heine-Universit\u00e4t D\u00fcsseldorf sp\u00e4testens zu Beginn der Belegfrist f\u00fcr Studierende bekannt zu geben."
        ],
        "reranking_scores": [
            0.15687212347984314,
            0.0035931062884628773,
            -0.015144804492592812,
            -0.05567612126469612,
            -0.05876176804304123
        ]
    },
    {
        "user_input": "Welche Fristen gelten f\u00fcr die Pr\u00fcfungsanmeldung der Klausur in Morphologie und Syntax?",
        "reference": "Dazu enthalten die bereitgestellten Dokumente keine Informationen.",
        "response": "Die Fristen f\u00fcr die Pr\u00fcfungsanmeldung der Klausur in Morphologie und Syntax sind:\n\n*   Bis sp\u00e4testens eine Woche vor dem jeweiligen Pr\u00fcfungstermin.",
        "retrieved_contexts": [
            "### Modul: Basiswissen Linguistik - Morphologie und Syntax\n**Englischer Titel:** Basic expertise - morphology and syntax<br>\n**Modul-Nummer:** 1300<br>\n**ECTS-Leistungspunkte:** 9 ECTS-Leistungspunkte<br>\n**Workload:** 270 Stunden<br>\n**Dauer:** 1 Semester<br>\n**Lehrveranstaltungen und Lehrformen:** a: Morphologie und Syntax (Vorlesung) / 1301 | b: Tutorium zu Morphologie und Syntax (Tutorium) / 1302<br>\n**Belegung:** Vorlesung (a) und Tutorium (b)<br>\n**Empfohlenes Studiensemester:** a: 1. Fachsemester (Wintersemester) | b: 1. Fachsemester (Wintersemester) | Pr\u00fcfung im 1. Fachsemester (Wintersemester)<br>\n**H\u00e4ufigkeit des Angebots:** a: Jedes Wintersemester | b: Jedes Wintersemester<br>\n**Geplante Gruppengr\u00f6\u00dfe:** a: Ca. 150 Studierende | b: Ca. 30 Studierende pro Gruppe<br>\n**Kontaktzeit:** a: 4 SWS/60 Stunden/2 ECTS-Leistungspunkte | b: 2 SWS/30 Stunden / 1 ECTS-Leistungspunkt<br>\n**Selbststudium:** 90 Stunden / 3 ECTS-Leistungspunkte<br>\n**ECTS-Leistungspunkte f\u00fcr die Modulpr\u00fcfung:** 3 ECTS-Leistungspunkte<br>\n**Inhalte:** Vorlesung a) befasst sich mit syntaktischen und morphologischen Strukturen. Sie legt den Fokus auf die Frage, welche Muster im Sprachvergleich st\u00e4rker verbreitet sind, und wie sich sprach\u00fcbergreifende Trends durch sprachinterne und kontaktbedingte Faktoren verbreiten. Das Tutorium b) \u00fcbt die vorgestellten Inhalte ein und bietet Unterst\u00fctzung bei den Hausaufgaben und der Klausurvorbereitung.<br>\n**Angestrebte Lernergebnisse und Studieninhalte:** In diesem Modul erwerben Studierende grundlegende Kenntnisse in den Bereichen Morphologie und Syntax. Sie werden an die Analyse morphologischer und syntaktischer Strukturen herangef\u00fchrt und erlernen die Klassifikation von Wortklassen, Satzgliedern, syntaktischen Funktionen, Morphemtypen und verschiedenen morphologischen Prozessen. Sie lernen grundlegende Fragestellungen der Morphosyntax und unterschiedliche Erkl\u00e4rungsans\u00e4tze kennen.<br>\n**Teilnahmevoraussetzungen:** Formal: -keine- | Inhaltlich: -keine-<br>\n**Pr\u00fcfungsformen:** Klausur (Pnr. 1310)<br>\n**Voraussetzungen f\u00fcr die Zulassung zur Modulpr\u00fcfung:** -keine-<br>\n**Voraussetzungen f\u00fcr die Vergabe von ECTS-Leistungspunkten:** Erbrachte Studienleistungen (SL) in allen Lehrveranstaltungen und bestandene Modulpr\u00fcfung.<br>\n**Sonstige Informationen:** -keine-",
            "(1) Von einer Modulpr\u00fcfung in Form einer Klausur oder m\u00fcndlichen Pr\u00fcfung kann sich die Kandidatin oder der Kandidat bis sp\u00e4testens eine Woche vor dem jeweiligen Pr\u00fcfungstermin abmelden.",
            "(6) F\u00fcr die Bachelorpr\u00fcfung bestellt die oder der Vorsitzende des Pr\u00fcfungsausschusses oder deren oder dessen Stellvertretung die Pr\u00fcferinnen und Pr\u00fcfer, Beisitzerinnen und Beisitzer. Pr\u00fcfungsberechtigte k\u00f6nnen nach ihrem Ausscheiden aus der Heinrich-Heine-Universit\u00e4t noch innerhalb von zwei Jahren zu Pr\u00fcferinnen und Pr\u00fcfern bestellt werden. Auf Antrag kann diese Frist in besonderen F\u00e4llen verl\u00e4ngert werden.",
            "\u00a7 11 Modulpr\u00fcfungen und Pr\u00fcfungsfristen",
            "### \u00a7 11 Modulpr\u00fcfungen und Pr\u00fcfungsfristen"
        ],
        "reranking_scores": [
            0.35226085782051086,
            0.2018662691116333,
            0.14010046422481537,
            0.06745801120996475,
            0.05670682340860367
        ]
    },
    {
        "user_input": "Kann ich den Bachelor Computerlinguistik auch als Teilzeitstudium absolvieren?",
        "reference": "Dazu enthalten die bereitgestellten Dokumente keine Informationen.",
        "response": "Ja, das Bachelorstudium Computerlinguistik kann als Teilzeitstudium absolviert werden.",
        "retrieved_contexts": [
            "| Merkmal | Details |\n| :--- | :--- |\n| **Integrierter Studiengang** | Computerlinguistik |\n| **Studienbeginn** | Nur im Wintersemester |\n| **Studienumfang** | 180 ECTS-Leistungspunkte (LP) |\n| **Notwendige Vorkenntnisse** | Kenntnisse des Englischen (Niveau B1, vergleichbar mit erfolgreichem vierj\u00e4hrigem Schulunterricht an einer weiterf\u00fchrenden Schule) |\n| **Prop\u00e4deutikum im Profilbildungsbereich** | keine Angabe |\n| **Anzahl der Modulpr\u00fcfungen** | 9, zuz\u00fcglich Bachelorarbeit |\n| **Art und Inhalt der Module und der Pr\u00fcfungen** | **Module:**<br>- Basismodul - Mathematische und logische Grundlagen (8 SWS, 1 MP, 12 LP)<br>- Basismodul - Grundlagen der Computerlinguistik und formale Grammatikbeschreibung (8 SWS, 1 MP, 12 LP)<br>- Basismodul - Python-Programmierung (8 SWS, 1 MP, 12 LP)<br>- Basiswissen Linguistik - Morphologie und Syntax (6 SWS, 1 MP, 9 LP)<br>- Basiswissen Linguistik - Semantik und Pragmatik (6 SWS, 1 MP, 9 LP)<br>- Basismodul - Statistische Methoden in der Computerlinguistik (6 SWS, 6 LP)<br>- Aufbaumodul - Maschinelles Lernen (8 SWS, 1 MP, 12 LP)<br>- Aufbaumodul - Mathematische Linguistik (4 SWS, 6 LP)<br>- Aufbaumodul - Parsing (4 SWS, 6 LP)<br>- Aufbaumodul - Logische Programmierung (4 SWS, 6 LP)<br>- Aufbaumodul - Objektorientierte Programmierung (8 SWS, 1 MP, 12 LP)<br>- Praktikum und Orientierung (2 SWS, 12 LP)<br>- Vertiefungsmodul - interdisziplin\u00e4r (8 SWS, 1 MP, 12 LP)<br>- Vertiefungsmodul - Computerlinguistik 1 (8 SWS, 12 LP)<br>- Vertiefungsmodul - Computerlinguistik 2 (4 SWS, 1 MP, 9 LP)<br>- Abschlussarbeit und Forschungskolloquium (2 SWS, 15 LP)<br>- Profilbildungsbereich (18 LP) |\n| **Voraussetzungen f\u00fcr Pr\u00fcfungen** | keine Angabe |\n| **Besonderheiten** | Die zweite Wiederholung einer Modulpr\u00fcfung darf als m\u00fcndliche Pr\u00fcfung erfolgen. |\n| **Gewichtung der Pr\u00fcfungen f\u00fcr die Gesamtnote** | Bachelorarbeit: dreifach<br>Alle Modulpr\u00fcfungen: einfach |\n| **Pr\u00fcfungssprache nach \u00a7 6 (4)** | keine Angabe |\n| **Auslandsaufenthalt** | Optional (Mobilit\u00e4tsfenster: 5. Semester) |\n| **Exkursion** | keine Angabe |\n| **Praktikum** | Nach dem vierten oder f\u00fcnften Semester wird entweder ein mindestens 6-w\u00f6chiges Berufsfeldpraktikum oder eine Projektarbeit absolviert, jeweils mit einschl\u00e4gig computerlinguistischem Inhalt. Das Praktikum soll einen Einblick in die Berufspraxis vermitteln sowie den sp\u00e4teren \u00dcbergang in die Berufswelt erleichtern. Die Wahl des Praktikumsplatzes erfolgt im Einvernehmen mit dem/der Praktikumsbeauftragten der Abteilung f\u00fcr Computerlinguistik. Der/die Praktikumsbeauftragte ist bei der Vermittlung von Praktikumspl\u00e4tzen behilflich und bietet eine fachliche Praktikumsberatung und -begleitung an. \u00dcber das Praktikum ist ein kurzer Bericht (ca. 3-5 Seiten) zu verfassen und ein Zeugnis der Praktikumsstelle einzureichen. |",
            "## Ziele des Studiums\nDer integrative Bachelorstudiengang Computerlinguistik leistet eine breite computerlinguistische Ausbildung. Die Studierenden erwerben im Rahmen der ersten beiden Jahre Wissen \u00fcber die Komplexit\u00e4t sprachlicher Erscheinungen, Methodenkenntnisse und -fertigkeiten sowohl im Bereich der symbolischen Sprachverarbeitung als auch im Bereich des maschinellen Lernens und der k\u00fcnstlichen Intelligenz, und Programmierkenntnisse auf hohem Niveau. Dieses Wissen wird im dritten Jahr weiter ausgebaut und im Rahmen eines Praktikums und der Abschlussarbeit im Kontext konkreter Fragestellungen angewendet. Damit sind die Absolventen des Studiengangs optimal vorbereitet auf eine berufliche T\u00e4tigkeit z.B. in den Bereichen elektronische Informationsverarbeitung, Sprachressourcenmanagement, maschinelle Sprachverarbeitung und Sprachtechnologie. Die Studierenden erwerben au\u00dferdem besonders in den Aufbau- und Vertiefungsmodulen die F\u00e4higkeit, relevante Informationen im Bereich der Computerlinguistik zu sammeln, zu bewerten und zu interpretieren und daraus wissenschaftlich fundierte Urteile abzuleiten, z.B. auch \u00fcber gesellschaftsrelevante Aspekte von Sprachtechnologien wie etwa den Einsatz von Methoden der k\u00fcnstlichen Intelligenz in gro\u00dfen Sprachmodellen. Die Absolventen k\u00f6nnen sich selbst\u00e4ndig in neue Themengebiete einarbeiten und neue F\u00e4higkeiten lernen. Sie k\u00f6nnen sich mit Informatikern, Sprachwissenschaftlern und Laien \u00fcber Informationen, Ideen, Probleme und L\u00f6sungen austauschen. Dank der Interdisziplinarit\u00e4t des Faches lernen sie au\u00dferdem, \u00fcber Fachgrenzen hinweg zwischen unterschiedlichen Standpunkten zu vermitteln und multidisziplin\u00e4re Zusammenarbeit zu gestalten. Damit sind sie optimal auf einen anschlie\u00dfenden Masterstudiengang. z.B. im Bereich Sprachtechnologie oder K\u00fcnstliche Intelligenz oder im Bereich Linguistik vorbereitet.",
            "(3) Zu den integrierten Studieng\u00e4ngen, an denen mehrere F\u00e4cher beteiligt sind, geh\u00f6ren die Bachelorstudieng\u00e4nge:\n\u2022 Computerlinguistik,\n\u2022 Linguistik (integrativ),\n\u2022 Philosophie (integrativ),\n\u2022 Sozialwissenschaften - Medien, Politik, Gesellschaft,",
            "## Exemplarischer Studienverlaufsplan Bachelor Computerlinguistik",
            "| Modul / Veranstaltung | MP | SL | LP | SWS |\n| :--- | :--- | :--- | :--- | :--- |\n| **Vertiefungsmodul - Computerlinguistik 2** | **1 MP** | **1 SL** | **9 LP** | **4 SWS** |\n| Seminar nach Wahl im Bereich Computerlinguistik | | Pnr. 5301 | 5 LP | 4 SWS |\n| Modulpr\u00fcfung | Pnr. 5310 | | 4 LP | |\n| **Abschlussarbeit und Forschungskolloquium** | | **1 SL** | **15 LP** | **4 SWS** |\n| Forschungskolloquium oder Seminar | | Pnr. 5901 | 3 LP | 2 SWS |\n| Bachelorarbeit | Pnr. 6000 | | 12 LP | |\n| **Profilbildungsbereich** | | | **6 LP** | |"
        ],
        "reranking_scores": [
            0.19578008353710175,
            0.12464608997106552,
            0.062485046684741974,
            0.06090819835662842,
            0.01841740868985653
        ]
    },
    {
        "user_input": "Wie lautet die E-Mail-Adresse oder Telefonnummer der fachlichen Studienberatung?",
        "reference": "Dazu enthalten die bereitgestellten Dokumente keine Informationen.",
        "response": "Dazu enthalten die bereitgestellten Dokumente keine Informationen.",
        "retrieved_contexts": [
            "(1) Die Hochschule ber\u00e4t ihre Studierenden sowie Studieninteressentinnen und Studieninteressenten, Studienbewerberinnen und Studienbewerber in allen Fragen des Studiums. Die Fachstudienberatung wird von den jeweiligen Studiengangverantwortlichen organisiert.",
            "### \u00a7 31 Studienberatung",
            "\u00a7 31 Studienberatung",
            "(3) Die Beratung bei der Vermittlung von Praktikumspl\u00e4tzen und die fachliche Betreuung w\u00e4hrend des Praktikums werden durch die Studiengangbeauftragte beziehungsweise den Studiengangbeauftragten des jeweiligen Studiengangs koordiniert.",
            "(4) \u00c4rztliche Atteste sind per Email \u00fcber die Studierenden- und Pr\u00fcfungsverwaltung an den Pr\u00fcfungsausschuss zu richten. Das Verfahren ist auf der Internetseite der HHU bekanntgegeben."
        ],
        "reranking_scores": [
            0.1865169107913971,
            -0.0312759093940258,
            -0.035122983157634735,
            -0.05560071021318436,
            -0.08533904701471329
        ]
    },
    {
        "user_input": "Welche Dozenten oder Professoren unterrichten das Aufbaumodul Maschinelles Lernen?",
        "reference": "Dazu enthalten die bereitgestellten Dokumente keine Informationen.",
        "response": "Basierend auf den bereitgestellten Dokumenten unterrichten folgende Dozenten oder Professoren das Aufbaumodul Maschinelles Lernen:\n\n*   **Prof. Dr. Thomas Kuhn** (Seminar und \u00dcbung)\n*   **Prof. Dr. Thomas Kuhn** (Seminar)",
        "retrieved_contexts": [
            "### Modul: Aufbaumodul - Maschinelles Lernen\n**Englischer Titel:** Advanced module - machine learning<br>\n**Modul-Nummer:** 4100<br>\n**ECTS-Leistungspunkte:** 12 ECTS-Leistungspunkte<br>\n**Workload:** 360 Stunden<br>\n**Dauer:** 2 Semester<br>\n**Lehrveranstaltungen und Lehrformen:** a: Grundlagen des maschinellen Lernens (Seminar und \u00dcbung) / 4101 | b: Deep Learning (Seminar) / 4102<br>\n**Belegung:** Seminar mit \u00dcbung (a) und Seminar (b)<br>\n**Empfohlenes Studiensemester:** a: 3. Fachsemester (Wintersemester) | b: 4. Fachsemester (Sommersemester) | Pr\u00fcfung im 4. Fachsemester (Sommersemester)<br>\n**H\u00e4ufigkeit des Angebots:** a: Jedes Wintersemester | b: Jedes Sommersemester<br>\n**Geplante Gruppengr\u00f6\u00dfe:** a: Ca. 60 Studierende | b: Ca. 60 Studierende<br>\n**Kontaktzeit:** a: 4 SWS/60 Stunden / 2 ECTS-Leistungspunkte | b: 4 SWS/60 Stunden / 2 ECTS-Leistungspunkte<br>\n**Selbststudium:** a: 60 Stunden/2 ECTS-Leistungspunkte | b: 60 Stunden/2 ECTS-Leistungspunkte<br>\n**ECTS-Leistungspunkte f\u00fcr die Modulpr\u00fcfung:** 4 ECTS-Leistungspunkte<br>\n**Inhalte:** Methoden des modernen maschinellen Lernens, die auf Vektorrepr\u00e4sentationen basieren. In a werden die grundlegenden, meist linearen Methoden wie lineare/logistische Regression, Support Vector Machines etc. theoretisch besprochen und implementiert. In b werden neuronale Netze und deren Anwendung im Natural Language Processing (NLP) erkl\u00e4rt und implementiert.<br>\n**Angestrebte Lernergebnisse und Studieninhalte:** Die Teilnehmer k\u00f6nnen selbst\u00e4ndig lineare Modelle und neuronale Netze implementieren, um Aufgaben im NLP zu l\u00f6sen. Sie sind vertraut mit Methoden der Evaluation von Modellen und Problemen wie Overfitting und Replizierbarkeit.<br>\n**Teilnahmevoraussetzungen:** Formal: Keine | Inhaltlich: Basismodul - Statistische Methoden in der Computerlinguistik<br>\n**Pr\u00fcfungsformen:** Hausarbeit (mit Programmierprojekt) (Pnr. 4110) oder Studienarbeit (mit Programmierprojekt) (Pnr. 4120)<br>\n**Voraussetzungen f\u00fcr die Zulassung zur Modulpr\u00fcfung:** -keine-<br>\n**Voraussetzungen f\u00fcr die Vergabe von ECTS-Leistungspunkten:** Erbrachte Studienleistungen (SL) in allen Lehrveranstaltungen und bestandene Modulpr\u00fcfung.<br>\n**Sonstige Informationen:** -keine-",
            "| Modul / Veranstaltung | MP | SL | LP | SWS |\n| :--- | :--- | :--- | :--- | :--- |\n| **Aufbaumodul - Maschinelles Lernen [2/2]** | **1 MP** | **1 SL** | **8 LP** | **4 SWS** |\n| Deep Learning (Seminar) | | Pnr. 4102 | 4 LP | 4 SWS |\n| Modulpr\u00fcfung | Pnr. 4110 | | 4 LP | |\n| **Aufbaumodul - Parsing** | | **2 SL** | **6 LP** | **4 SWS** |\n| Parsing (Seminar) | | Pnr. 4301 | 3 LP | 2 SWS |\n| Parsing (\u00dcbung) | | Pnr. 4302 | 3 LP | 2 SWS |\n| **Aufbaumodul - Logische Programmierung** | | **2 SL** | **6 LP** | **4 SWS** |\n| Einf\u00fchrung in Prolog (Seminar) | | Pnr. 4401 | 3 LP | 2 SWS |\n| Prolog (\u00dcbung) | | Pnr. 4402 | 3 LP | 2 SWS |\n| **Vertiefungsmodul - Interdisziplin\u00e4r [1/2]** | | **1 SL** | **4 LP** | **4 SWS** |\n| Seminar nach Wahl | | Pnr. 5101 | 4 LP | 4 SWS |\n| **Praktikum & Orientierung [1/2]** | | **1 SL** | **3 LP** | **2 SWS** |\n| Orientierungsseminar (Seminar) | | Pnr. 3001 | 3 LP | 2 SWS |\n| **Profilbildungsbereich** | | | **3 LP** | |",
            "| Modul / Veranstaltung | MP | SL | LP | SWS |\n| :--- | :--- | :--- | :--- | :--- |\n| **Basismodul - Statistische Methoden in der Computerlinguistik [2/2]** | | **1 SL** | **2 LP** | **2 SWS** |\n| Linguistische Ressourcen (Seminar) | | Pnr. 2402 | 2 LP | 2 SWS |\n| **Aufbaumodul - Maschinelles Lernen [1/2]** | | **1 SL** | **4 LP** | **4 SWS** |\n| Grundlagen des maschinellen Lernens (Seminar und \u00dcbung) | | Pnr. 4101 | 4 LP | 4 SWS |\n| **Aufbaumodul - Mathematische Linguistik** | | **2 SL** | **6 LP** | **4 SWS** |\n| Automatentheorie & Formale Sprachen (Seminar) | | Pnr. 4201 | 3 LP | 2 SWS |\n| Automatentheorie & Formale Sprachen (\u00dcbung) | | Pnr. 4202 | 3 LP | 2 SWS |\n| **Aufbaumodul - Objektorientierte Programmierung** | **1 MP** | **3 SL** | **12 LP** | **8 SWS** |\n| Programmierung (Vorlesung) | | Pnr. 4501 | 4 LP | 4 SWS |\n| Programmierung (\u00dcbung) | | Pnr. 4502 | 2 LP | 2 SWS |\n| Praktische \u00dcbung zur Vorlesung | | Pnr. 4503 | 2 LP | 2 SWS |\n| Modulpr\u00fcfung (Klausur) | Pnr. 4510 | | 4 LP | |\n| **Profilbildungsbereich** | | | **6 LP** | |",
            "| Merkmal | Details |\n| :--- | :--- |\n| **Integrierter Studiengang** | Computerlinguistik |\n| **Studienbeginn** | Nur im Wintersemester |\n| **Studienumfang** | 180 ECTS-Leistungspunkte (LP) |\n| **Notwendige Vorkenntnisse** | Kenntnisse des Englischen (Niveau B1, vergleichbar mit erfolgreichem vierj\u00e4hrigem Schulunterricht an einer weiterf\u00fchrenden Schule) |\n| **Prop\u00e4deutikum im Profilbildungsbereich** | keine Angabe |\n| **Anzahl der Modulpr\u00fcfungen** | 9, zuz\u00fcglich Bachelorarbeit |\n| **Art und Inhalt der Module und der Pr\u00fcfungen** | **Module:**<br>- Basismodul - Mathematische und logische Grundlagen (8 SWS, 1 MP, 12 LP)<br>- Basismodul - Grundlagen der Computerlinguistik und formale Grammatikbeschreibung (8 SWS, 1 MP, 12 LP)<br>- Basismodul - Python-Programmierung (8 SWS, 1 MP, 12 LP)<br>- Basiswissen Linguistik - Morphologie und Syntax (6 SWS, 1 MP, 9 LP)<br>- Basiswissen Linguistik - Semantik und Pragmatik (6 SWS, 1 MP, 9 LP)<br>- Basismodul - Statistische Methoden in der Computerlinguistik (6 SWS, 6 LP)<br>- Aufbaumodul - Maschinelles Lernen (8 SWS, 1 MP, 12 LP)<br>- Aufbaumodul - Mathematische Linguistik (4 SWS, 6 LP)<br>- Aufbaumodul - Parsing (4 SWS, 6 LP)<br>- Aufbaumodul - Logische Programmierung (4 SWS, 6 LP)<br>- Aufbaumodul - Objektorientierte Programmierung (8 SWS, 1 MP, 12 LP)<br>- Praktikum und Orientierung (2 SWS, 12 LP)<br>- Vertiefungsmodul - interdisziplin\u00e4r (8 SWS, 1 MP, 12 LP)<br>- Vertiefungsmodul - Computerlinguistik 1 (8 SWS, 12 LP)<br>- Vertiefungsmodul - Computerlinguistik 2 (4 SWS, 1 MP, 9 LP)<br>- Abschlussarbeit und Forschungskolloquium (2 SWS, 15 LP)<br>- Profilbildungsbereich (18 LP) |\n| **Voraussetzungen f\u00fcr Pr\u00fcfungen** | keine Angabe |\n| **Besonderheiten** | Die zweite Wiederholung einer Modulpr\u00fcfung darf als m\u00fcndliche Pr\u00fcfung erfolgen. |\n| **Gewichtung der Pr\u00fcfungen f\u00fcr die Gesamtnote** | Bachelorarbeit: dreifach<br>Alle Modulpr\u00fcfungen: einfach |\n| **Pr\u00fcfungssprache nach \u00a7 6 (4)** | keine Angabe |\n| **Auslandsaufenthalt** | Optional (Mobilit\u00e4tsfenster: 5. Semester) |\n| **Exkursion** | keine Angabe |\n| **Praktikum** | Nach dem vierten oder f\u00fcnften Semester wird entweder ein mindestens 6-w\u00f6chiges Berufsfeldpraktikum oder eine Projektarbeit absolviert, jeweils mit einschl\u00e4gig computerlinguistischem Inhalt. Das Praktikum soll einen Einblick in die Berufspraxis vermitteln sowie den sp\u00e4teren \u00dcbergang in die Berufswelt erleichtern. Die Wahl des Praktikumsplatzes erfolgt im Einvernehmen mit dem/der Praktikumsbeauftragten der Abteilung f\u00fcr Computerlinguistik. Der/die Praktikumsbeauftragte ist bei der Vermittlung von Praktikumspl\u00e4tzen behilflich und bietet eine fachliche Praktikumsberatung und -begleitung an. \u00dcber das Praktikum ist ein kurzer Bericht (ca. 3-5 Seiten) zu verfassen und ein Zeugnis der Praktikumsstelle einzureichen. |",
            "(3) Die Vermittlung der Lehrinhalte und Kompetenzen findet in Studienmodulen statt. In Modulen werden thematisch, methodisch oder systematisch zusammenh\u00e4ngende Lehrveranstaltungen geb\u00fcndelt. Ein Modul umfasst mindestens 5 LP."
        ],
        "reranking_scores": [
            0.3286147713661194,
            0.16791415214538574,
            0.0998583734035492,
            -1.44793261824816e-06,
            -0.027452219277620316
        ]
    },
    {
        "user_input": "Was muss ich tun, wenn ich am Tag einer Modulpr\u00fcfung krank bin und ein Attest habe?",
        "reference": "Dazu enthalten die bereitgestellten Dokumente keine Informationen.",
        "response": "Wenn du am Tag einer Modulpr\u00fcfung krank bist und ein \u00e4rztliches Attest hast, musst du das Attest unverz\u00fcglich in Textform dem Pr\u00fcfungsausschuss anzeigen.",
        "retrieved_contexts": [
            "(3) Die im Fall von Absatz 2 geltend gemachten Gr\u00fcnde m\u00fcssen dem Pr\u00fcfungsausschuss unverz\u00fcglich in Textform angezeigt und glaubhaft gemacht werden. Bei Krankheit muss ein \u00e4rztliches Attest vorgelegt werden. Wenn die Gr\u00fcnde anerkannt werden, wird dies schriftlich mitgeteilt und ein neuer Termin festgesetzt. Die bereits vorliegenden Pr\u00fcfungsergebnisse sind in diesem Fall anzurechnen.",
            "(4) \u00c4rztliche Atteste sind per Email \u00fcber die Studierenden- und Pr\u00fcfungsverwaltung an den Pr\u00fcfungsausschuss zu richten. Das Verfahren ist auf der Internetseite der HHU bekanntgegeben.",
            "(1) Macht die Kandidatin beziehungsweise der Kandidat durch \u00e4rztliches Zeugnis glaubhaft, dass sie beziehungsweise er wegen l\u00e4nger andauernder Krankheit oder st\u00e4ndiger seelischer oder k\u00f6rperlicher Behinderung nicht in der Lage ist, die Pr\u00fcfungsleistung ganz oder teilweise in der vorgeschriebenen Form abzulegen, ist ihr beziehungsweise ihm durch den Pr\u00fcfungsausschuss im Sinne des Nachteilsausgleiches zu erm\u00f6glichen, gleichwertige Pr\u00fcfungsleistungen in einer anderen Form zu erbringen. Vor Entscheidungen des Pr\u00fcfungsausschusses kann die oder der Beauftragte f\u00fcr Studierende mit Behinderung oder chronischer Erkrankung auf Antrag der Kandidatin oder des Kandidaten um ein Votum gebeten werden. Der Antrag auf Nachteilsausgleich ist vor Anmeldung zur Pr\u00fcfung zu stellen.",
            "(2) Wenn die Kandidatin oder der Kandidat nach dieser Frist von der Pr\u00fcfung zur\u00fccktritt, nicht zum Pr\u00fcfungstermin erscheint, nach Beginn der Pr\u00fcfung zur\u00fccktritt oder eine schriftliche Pr\u00fcfungsleistung nicht innerhalb der vorgegebenen Bearbeitungszeit erbringt, m\u00fcssen triftige Gr\u00fcnde geltend gemacht werden. Sonst gilt die Pr\u00fcfungsleistung als mit \"nicht ausreichend\" (5,0) bewertet. Als triftige Gr\u00fcnde gelten insbesondere Krankheit, Mutterschutz, Kinderbetreuung im Rahmen der Elternzeit und die notwendige Pflege naher Angeh\u00f6riger. Krankheiten w\u00e4hrend einer Pr\u00fcfung sind unverz\u00fcglich den Pr\u00fcfenden und dem Pr\u00fcfungsausschuss anzuzeigen.",
            "(4) Zu jeder einzelnen Modulpr\u00fcfung ist eine gesonderte Meldung erforderlich. Zur Pr\u00fcfung wird nur zugelassen, wer die Zulassungsvoraussetzungen gem\u00e4\u00df \u00a7 12 erf\u00fcllt. Die Meldetermine werden im elektronischen Campus Management System und in der jeweiligen Lehrveranstaltung bekanntgegeben. Abmeldung und R\u00fccktritt von Pr\u00fcfungen sind in \u00a7 17 geregelt."
        ],
        "reranking_scores": [
            0.41430023312568665,
            0.1273033618927002,
            0.09049047529697418,
            0.04780798777937889,
            0.030474664643406868
        ]
    },
    {
        "user_input": "Welche Mindest-Systemanforderungen muss mein privater Laptop f\u00fcr den Python-Kurs erf\u00fcllen?",
        "reference": "Dazu enthalten die bereitgestellten Dokumente keine Informationen.",
        "response": "Basierend auf den bereitgestellten Dokumenten enthalten die bereitgestellten Dokumente keine Informationen.",
        "retrieved_contexts": [
            "### Modul: Basismodul - Python-Programmierung\n**Englischer Titel:** Basis module - Python programming<br>\n**Modul-Nummer:** 2300<br>\n**ECTS-Leistungspunkte:** 12 ECTS-Leistungspunkte<br>\n**Workload:** 360 Stunden<br>\n**Dauer:** 2 Semester<br>\n**Lehrveranstaltungen und Lehrformen:** a: Einf\u00fchrung in die Programmierung mit Python (Seminar) / 2301 | b: Einf\u00fchrung in die Programmierung mit Python (\u00dcbung) / 2302 | c: Fortgeschrittene Python-Programmierung mit NLP-Anwendungen (Seminar) / 2303 | d: Fortgeschrittene Python-Programmierung mit NLP-Anwendungen (\u00dcbung) / 2304<br>\n**Belegung:** Seminar (a) mit \u00dcbung (b) und Seminar (c) mit \u00dcbung (d)<br>\n**Empfohlenes Studiensemester:** a: 1. Fachsemester (Wintersemester) | b: 1. Fachsemester (Wintersemester) | c: 2. Fachsemester (Sommersemester) | d: 2. Fachsemester (Sommersemester) | Pr\u00fcfung im 2. Fachsemester (Sommersemester)<br>\n**H\u00e4ufigkeit des Angebots:** a: Jedes Wintersemester | b: Jedes Wintersemester | c: Jedes Sommersemester | d: Jedes Sommersemester<br>\n**Geplante Gruppengr\u00f6\u00dfe:** a: Ca. 60 Studierende | b: Ca. 60 Studierende | c: Ca. 60 Studierende | d: Ca. 60 Studierende<br>\n**Kontaktzeit:** a: 2 SWS / 30 Stunden / 1 ECTS-Leistungspunkt | b: 2 SWS/30 Stunden / 1 ECTS-Leistungspunkt | c: 2 SWS/30 Stunden / 1 ECTS-Leistungspunkt | d: 2 SWS/30 Stunden / 1 ECTS-Leistungspunkt<br>\n**Selbststudium:** a: 30 Stunden / 1 ECTS-Leistungspunkt | b: 30 Stunden / 1 ECTS-Leistungspunkt | c: 30 Stunden / 1 ECTS-Leistungspunkt | d: 30 Stunden/1 ECTS-Leistungspunkt<br>\n**ECTS-Leistungspunkte f\u00fcr die Modulpr\u00fcfung:** 4 ECTS-Leistungspunkte (120 Stunden)<br>\n**Inhalte:** Wintersemester: Grundlagen der Python-Programmierung; Datentypen in Python; g\u00e4ngige Programmkonstrukte; elementare Textverarbeitung. Sommersemester: Objektorientierte und funktionale Programmierung mit Python; Einsatz von Programm-Bibliotheken in den Bereichen Data Science und NLP; Grundz\u00fcge der Sorftware-Entwicklung.<br>\n**Angestrebte Lernergebnisse und Studieninhalte:** Die Studierenden erwerben grundlegende F\u00e4higkeiten in der Programmierung mit der Programmiersprache Python sowie Kenntnisse \u00fcber fortgeschrittene Konzepte der Python-Programmierung (objektorientierte und funktionale Programmierung). Au\u00dferdem werden Grundkenntnisse des Einsatzes von Python in den Bereichen Data Science und NLP (Natural Language Processing) erworben, sowie die F\u00e4higkeit ein kleines Software-Projekt durchzuf\u00fchren und zu pr\u00e4sentieren.<br>\n**Teilnahmevoraussetzungen:** Formal: Keine | Inhaltlich: Keine<br>\n**Pr\u00fcfungsformen:** Projektarbeit (Pnr. 2310)<br>\n**Voraussetzungen f\u00fcr die Zulassung zur Modulpr\u00fcfung:** -keine-<br>\n**Voraussetzungen f\u00fcr die Vergabe von ECTS-Leistungspunkten:** Erbrachte Studienleistungen (SL) in den Lehrveranstaltungen (a) und (b): 4 ECTS-Leistungspunkte | Erbrachte Studienleistungen (SL) in den Lehrveranstaltungen (c) und (d): 4 ECTS-Leistungspunkte | Bestandene Modulpr\u00fcfung: 4 ECTS-Leistungspunkte<br>\n**Sonstige Informationen:** -keine-",
            "| Modul / Veranstaltung | MP | SL | LP | SWS |\n| :--- | :--- | :--- | :--- | :--- |\n| **Basismodul - Grundlagen der Computerlinguistik und formale Grammatikbeschreibung [2/2]** | **1 MP** | **2 SL** | **8 LP** | **4 SWS** |\n| Grammatikformalismen (Seminar) | | Pnr. 2203 | 2 LP | 2 SWS |\n| Grammatikformalismen (\u00dcbung) | | Pnr. 2204 | 2 LP | 2 SWS |\n| Modulpr\u00fcfung (Klausur) | Pnr. 2210 | | 4 LP | |\n| **Basismodul - Python-Programmierung [2/2]** | **1 MP** | **2 SL** | **8 LP** | **4 SWS** |\n| Fortgeschrittene Python-Programmierung mit NLP-Anwendungen (Seminar) | | Pnr. 2303 | 2 LP | 2 SWS |\n| Fortgeschrittene Python-Programmierung mit NLP-Anwendungen (\u00dcbung) | | Pnr. 2304 | 2 LP | 2 SWS |\n| Modulpr\u00fcfung (Klausur) | Pnr. 2310 | | 4 LP | |\n| **Basiswissen Linguistik - Semantik und Pragmatik** | **1 MP** | **2 SL** | **9 LP** | **6 SWS** |\n| Vorlesung | | Pnr. 1401 | 4 LP | 4 SWS |\n| Tutorium | | Pnr. 1402 | 2 LP | 2 SWS |\n| Modulpr\u00fcfung (Klausur) | Pnr. 1410 | | 3 LP | |\n| **Basismodul - Statistische Methoden in der Computerlinguistik [1/2]** | **0 MP** | **1 SL** | **4 LP** | **4 SWS** |\n| Wahrscheinlichkeitstheorie und Statistik (Seminar und \u00dcbung) | | Pnr. 2401 | 4 LP | 4 SWS |\n| **Profilbildungsbereich** | | | **1 LP** | |",
            "| Merkmal | Details |\n| :--- | :--- |\n| **Integrierter Studiengang** | Computerlinguistik |\n| **Studienbeginn** | Nur im Wintersemester |\n| **Studienumfang** | 180 ECTS-Leistungspunkte (LP) |\n| **Notwendige Vorkenntnisse** | Kenntnisse des Englischen (Niveau B1, vergleichbar mit erfolgreichem vierj\u00e4hrigem Schulunterricht an einer weiterf\u00fchrenden Schule) |\n| **Prop\u00e4deutikum im Profilbildungsbereich** | keine Angabe |\n| **Anzahl der Modulpr\u00fcfungen** | 9, zuz\u00fcglich Bachelorarbeit |\n| **Art und Inhalt der Module und der Pr\u00fcfungen** | **Module:**<br>- Basismodul - Mathematische und logische Grundlagen (8 SWS, 1 MP, 12 LP)<br>- Basismodul - Grundlagen der Computerlinguistik und formale Grammatikbeschreibung (8 SWS, 1 MP, 12 LP)<br>- Basismodul - Python-Programmierung (8 SWS, 1 MP, 12 LP)<br>- Basiswissen Linguistik - Morphologie und Syntax (6 SWS, 1 MP, 9 LP)<br>- Basiswissen Linguistik - Semantik und Pragmatik (6 SWS, 1 MP, 9 LP)<br>- Basismodul - Statistische Methoden in der Computerlinguistik (6 SWS, 6 LP)<br>- Aufbaumodul - Maschinelles Lernen (8 SWS, 1 MP, 12 LP)<br>- Aufbaumodul - Mathematische Linguistik (4 SWS, 6 LP)<br>- Aufbaumodul - Parsing (4 SWS, 6 LP)<br>- Aufbaumodul - Logische Programmierung (4 SWS, 6 LP)<br>- Aufbaumodul - Objektorientierte Programmierung (8 SWS, 1 MP, 12 LP)<br>- Praktikum und Orientierung (2 SWS, 12 LP)<br>- Vertiefungsmodul - interdisziplin\u00e4r (8 SWS, 1 MP, 12 LP)<br>- Vertiefungsmodul - Computerlinguistik 1 (8 SWS, 12 LP)<br>- Vertiefungsmodul - Computerlinguistik 2 (4 SWS, 1 MP, 9 LP)<br>- Abschlussarbeit und Forschungskolloquium (2 SWS, 15 LP)<br>- Profilbildungsbereich (18 LP) |\n| **Voraussetzungen f\u00fcr Pr\u00fcfungen** | keine Angabe |\n| **Besonderheiten** | Die zweite Wiederholung einer Modulpr\u00fcfung darf als m\u00fcndliche Pr\u00fcfung erfolgen. |\n| **Gewichtung der Pr\u00fcfungen f\u00fcr die Gesamtnote** | Bachelorarbeit: dreifach<br>Alle Modulpr\u00fcfungen: einfach |\n| **Pr\u00fcfungssprache nach \u00a7 6 (4)** | keine Angabe |\n| **Auslandsaufenthalt** | Optional (Mobilit\u00e4tsfenster: 5. Semester) |\n| **Exkursion** | keine Angabe |\n| **Praktikum** | Nach dem vierten oder f\u00fcnften Semester wird entweder ein mindestens 6-w\u00f6chiges Berufsfeldpraktikum oder eine Projektarbeit absolviert, jeweils mit einschl\u00e4gig computerlinguistischem Inhalt. Das Praktikum soll einen Einblick in die Berufspraxis vermitteln sowie den sp\u00e4teren \u00dcbergang in die Berufswelt erleichtern. Die Wahl des Praktikumsplatzes erfolgt im Einvernehmen mit dem/der Praktikumsbeauftragten der Abteilung f\u00fcr Computerlinguistik. Der/die Praktikumsbeauftragte ist bei der Vermittlung von Praktikumspl\u00e4tzen behilflich und bietet eine fachliche Praktikumsberatung und -begleitung an. \u00dcber das Praktikum ist ein kurzer Bericht (ca. 3-5 Seiten) zu verfassen und ein Zeugnis der Praktikumsstelle einzureichen. |",
            "| Modul / Veranstaltung | MP | SL | LP | SWS |\n| :--- | :--- | :--- | :--- | :--- |\n| **Basismodul - Mathematische und logische Grundlagen** | **1 MP** | **2 SL** | **12 LP** | **8 SWS** |\n| Einf\u00fchrung in die computationelle Logik (Seminar mit \u00dcbung) | | Pnr. 2101 | 4 LP | 4 SWS |\n| Mathematische Grundlagen (Seminar) | | Pnr. 2102 | 4 LP | 4 SWS |\n| Modulpr\u00fcfung (Portfolio) | Pnr. 2110 | | 4 LP | |\n| **Basismodul - Grundlagen der Computerlinguistik und formale Grammatikbeschreibung [1/2]** | | **2 SL** | **4 LP** | **4 SWS** |\n| Einf\u00fchrung in die Computerlinguistik (Seminar) | | Pnr. 2201 | 2 LP | 2 SWS |\n| Einf\u00fchrung in die Computerlinguistik (\u00dcbung) | | Pnr. 2202 | 2 LP | 2 SWS |\n| **Basismodul - Python-Programmierung [1/2]** | | **2 SL** | **4 LP** | **4 SWS** |\n| Einf\u00fchrung in die Programmierung mit Python (Seminar) | | Pnr. 2301 | 2 LP | 2 SWS |\n| Einf\u00fchrung in die Programmierung mit Python (\u00dcbung) | | Pnr. 2302 | 2 LP | 2 SWS |\n| **Basiswissen Linguistik - Morphologie und Syntax** | **1 MP** | **2 SL** | **9 LP** | **6 SWS** |\n| Vorlesung | | Pnr. 1301 | 2 LP | 4 SWS |\n| Tutorium | | Pnr. 1302 | 2 LP | 2 SWS |\n| Modulpr\u00fcfung (Klausur) | Pnr. 1310 | | 3 LP | |\n| **Profilbilungsbereich** | | | **1 LP** | |",
            "### Modul: Aufbaumodul - Objektorientierte Programmierung\n**Englischer Titel:** Advanced module - object-oriented programming<br>\n**Modul-Nummer:** 4500<br>\n**ECTS-Leistungspunkte:** 12 ECTS-Leistungspunkte<br>\n**Workload:** 360 Stunden<br>\n**Dauer:** 1 Semester<br>\n**Lehrveranstaltungen und Lehrformen:** a: Programmierung (Vorlesung) / 4501 | b: \u00dcbung zur Vorlesung (\u00dcbung) / 4502 | c: Praktische \u00dcbung zur Vorlesung (Praktische \u00dcbung) / 4503<br>\n**Belegung:** Vorlesung (a) mit \u00dcbung (b) und praktischer \u00dcbung (c)<br>\n**Empfohlenes Studiensemester:** a: 3. Fachsemester (Wintersemester) | b: 3. Fachsemester (Wintersemester) | c: 3. Fachsemester (Wintersemester)<br>\n**H\u00e4ufigkeit des Angebots:** a: Jedes Wintersemester | b: Jedes Wintersemester | c: Jedes Wintersemester<br>\n**Geplante Gruppengr\u00f6\u00dfe:** a: Unbegrenzt | b: Ca. 30 Studierende | c: Ca. 30 Studierende<br>\n**Kontaktzeit:** a: 4 SWS/60 Stunden/2 ECTS-Leistungspunkte | b: 2 SWS/30 Stunden/1 ECTS-Leistungspunkt | c: 2 SWS / 30 Stunden/1 ECTS-Leistungspunkt<br>\n**Selbststudium:** a: 60 Stunden / 2 ECTS-Leistungspunkte | b: 30 Stunden/1 ECTS-Leistungspunkt | c: 30 Stunden / 1 ECTS-Leistungspunk<br>\n**ECTS-Leistungspunkte f\u00fcr die Modulpr\u00fcfung:** 4 ECTS-Leistungspunkte<br>\n**Inhalte:** Dieses Modul vermittelt grundlegende Programmierkenntnisse in einer objektorientierten Programmiersprache. Dar\u00fcber hinaus werden einf\u00fchrend Aspekte von Algorithmen und Datenstrukturen behandelt. Es wird keine Programmiererfahrung vorausgesetzt. Grundlegende Begriffe der Informatik; Primitive Datentypen und Variablen; Kontrollstrukturen; Eigene Datentypen (Klassen) und Arrays; Programmstrukturen im Speicher (Heap, Stack); Konzepte der Objektorientierung (Polymorphie, Schnittstellen); Rekursion; Fehlerbehandlung; Dynamische Datenstrukturen (Listen, Bin\u00e4rb\u00e4ume, Hashing); Suchen und Sortieren (ausgew\u00e4hlte Algorithmen, u.a. bin\u00e4re Suche, BubbleSort, QuickSort); Datenstr\u00f6me (Standard-Eingabe und -Ausgabe, einfache 2D-Grafik, Dateien)<br>\n**Angestrebte Lernergebnisse und Studieninhalte:** Studierende sollen nach Absolvierung der Lehrveranstaltungen in der Lage sein, Begriffe der Informatik und der Programmierung zu nennen und zu erl\u00e4utern; einfache Algorithmen (iterativ und rekursiv) zu verstehen, deren Ablauf zu beschreiben, sowie selbst zu erstellen; eigene Datentypen zu konzipieren und anzuwenden; einfache objektorientierte Programme mit Polymorphie, Vererbung und Schnittstellen zu entwickeln; die behandelten dynamischen Datenstrukturen anzuwenden.<br>\n**Teilnahmevoraussetzungen:** Formal: Keine | Inhaltlich: Basismodul - Mathematische und logische Grundlagen, Basismodul - Python-Programmierung<br>\n**Pr\u00fcfungsformen:** Klausur (Pnr. 4510)<br>\n**Voraussetzungen f\u00fcr die Zulassung zur Modulpr\u00fcfung:** -keine-<br>\n**Voraussetzungen f\u00fcr die Vergabe von ECTS-Leistungspunkten:** Erbrachte Studienleistungen (SL) in den Lehrveranstaltungen (b) und (c) | Bestandene Modulpr\u00fcfung: 4 ECTS-Leistungspunkte<br>\n**Sonstige Informationen:** -keine-"
        ],
        "reranking_scores": [
            0.09905920922756195,
            0.09389963001012802,
            -0.0038361770566552877,
            -0.007777064573019743,
            -0.06390287727117538
        ]
    },
    {
        "user_input": "Wer hat die Programmiersprache Python erfunden?",
        "reference": "Dazu enthalten die bereitgestellten Dokumente keine Informationen.",
        "response": "Die Programmiersprache Python wurde von Guido van Rossum erfunden.",
        "retrieved_contexts": [
            "### Modul: Basismodul - Python-Programmierung\n**Englischer Titel:** Basis module - Python programming<br>\n**Modul-Nummer:** 2300<br>\n**ECTS-Leistungspunkte:** 12 ECTS-Leistungspunkte<br>\n**Workload:** 360 Stunden<br>\n**Dauer:** 2 Semester<br>\n**Lehrveranstaltungen und Lehrformen:** a: Einf\u00fchrung in die Programmierung mit Python (Seminar) / 2301 | b: Einf\u00fchrung in die Programmierung mit Python (\u00dcbung) / 2302 | c: Fortgeschrittene Python-Programmierung mit NLP-Anwendungen (Seminar) / 2303 | d: Fortgeschrittene Python-Programmierung mit NLP-Anwendungen (\u00dcbung) / 2304<br>\n**Belegung:** Seminar (a) mit \u00dcbung (b) und Seminar (c) mit \u00dcbung (d)<br>\n**Empfohlenes Studiensemester:** a: 1. Fachsemester (Wintersemester) | b: 1. Fachsemester (Wintersemester) | c: 2. Fachsemester (Sommersemester) | d: 2. Fachsemester (Sommersemester) | Pr\u00fcfung im 2. Fachsemester (Sommersemester)<br>\n**H\u00e4ufigkeit des Angebots:** a: Jedes Wintersemester | b: Jedes Wintersemester | c: Jedes Sommersemester | d: Jedes Sommersemester<br>\n**Geplante Gruppengr\u00f6\u00dfe:** a: Ca. 60 Studierende | b: Ca. 60 Studierende | c: Ca. 60 Studierende | d: Ca. 60 Studierende<br>\n**Kontaktzeit:** a: 2 SWS / 30 Stunden / 1 ECTS-Leistungspunkt | b: 2 SWS/30 Stunden / 1 ECTS-Leistungspunkt | c: 2 SWS/30 Stunden / 1 ECTS-Leistungspunkt | d: 2 SWS/30 Stunden / 1 ECTS-Leistungspunkt<br>\n**Selbststudium:** a: 30 Stunden / 1 ECTS-Leistungspunkt | b: 30 Stunden / 1 ECTS-Leistungspunkt | c: 30 Stunden / 1 ECTS-Leistungspunkt | d: 30 Stunden/1 ECTS-Leistungspunkt<br>\n**ECTS-Leistungspunkte f\u00fcr die Modulpr\u00fcfung:** 4 ECTS-Leistungspunkte (120 Stunden)<br>\n**Inhalte:** Wintersemester: Grundlagen der Python-Programmierung; Datentypen in Python; g\u00e4ngige Programmkonstrukte; elementare Textverarbeitung. Sommersemester: Objektorientierte und funktionale Programmierung mit Python; Einsatz von Programm-Bibliotheken in den Bereichen Data Science und NLP; Grundz\u00fcge der Sorftware-Entwicklung.<br>\n**Angestrebte Lernergebnisse und Studieninhalte:** Die Studierenden erwerben grundlegende F\u00e4higkeiten in der Programmierung mit der Programmiersprache Python sowie Kenntnisse \u00fcber fortgeschrittene Konzepte der Python-Programmierung (objektorientierte und funktionale Programmierung). Au\u00dferdem werden Grundkenntnisse des Einsatzes von Python in den Bereichen Data Science und NLP (Natural Language Processing) erworben, sowie die F\u00e4higkeit ein kleines Software-Projekt durchzuf\u00fchren und zu pr\u00e4sentieren.<br>\n**Teilnahmevoraussetzungen:** Formal: Keine | Inhaltlich: Keine<br>\n**Pr\u00fcfungsformen:** Projektarbeit (Pnr. 2310)<br>\n**Voraussetzungen f\u00fcr die Zulassung zur Modulpr\u00fcfung:** -keine-<br>\n**Voraussetzungen f\u00fcr die Vergabe von ECTS-Leistungspunkten:** Erbrachte Studienleistungen (SL) in den Lehrveranstaltungen (a) und (b): 4 ECTS-Leistungspunkte | Erbrachte Studienleistungen (SL) in den Lehrveranstaltungen (c) und (d): 4 ECTS-Leistungspunkte | Bestandene Modulpr\u00fcfung: 4 ECTS-Leistungspunkte<br>\n**Sonstige Informationen:** -keine-",
            "| Modul / Veranstaltung | MP | SL | LP | SWS |\n| :--- | :--- | :--- | :--- | :--- |\n| **Basismodul - Mathematische und logische Grundlagen** | **1 MP** | **2 SL** | **12 LP** | **8 SWS** |\n| Einf\u00fchrung in die computationelle Logik (Seminar mit \u00dcbung) | | Pnr. 2101 | 4 LP | 4 SWS |\n| Mathematische Grundlagen (Seminar) | | Pnr. 2102 | 4 LP | 4 SWS |\n| Modulpr\u00fcfung (Portfolio) | Pnr. 2110 | | 4 LP | |\n| **Basismodul - Grundlagen der Computerlinguistik und formale Grammatikbeschreibung [1/2]** | | **2 SL** | **4 LP** | **4 SWS** |\n| Einf\u00fchrung in die Computerlinguistik (Seminar) | | Pnr. 2201 | 2 LP | 2 SWS |\n| Einf\u00fchrung in die Computerlinguistik (\u00dcbung) | | Pnr. 2202 | 2 LP | 2 SWS |\n| **Basismodul - Python-Programmierung [1/2]** | | **2 SL** | **4 LP** | **4 SWS** |\n| Einf\u00fchrung in die Programmierung mit Python (Seminar) | | Pnr. 2301 | 2 LP | 2 SWS |\n| Einf\u00fchrung in die Programmierung mit Python (\u00dcbung) | | Pnr. 2302 | 2 LP | 2 SWS |\n| **Basiswissen Linguistik - Morphologie und Syntax** | **1 MP** | **2 SL** | **9 LP** | **6 SWS** |\n| Vorlesung | | Pnr. 1301 | 2 LP | 4 SWS |\n| Tutorium | | Pnr. 1302 | 2 LP | 2 SWS |\n| Modulpr\u00fcfung (Klausur) | Pnr. 1310 | | 3 LP | |\n| **Profilbilungsbereich** | | | **1 LP** | |",
            "## Module",
            "*Ausgefertigt aufgrund des Beschlusses des Fakult\u00e4tsrats der Philosophischen Fakult\u00e4t vom 08.07.2025.*",
            "| Modul / Veranstaltung | MP | SL | LP | SWS |\n| :--- | :--- | :--- | :--- | :--- |\n| **Basismodul - Grundlagen der Computerlinguistik und formale Grammatikbeschreibung [2/2]** | **1 MP** | **2 SL** | **8 LP** | **4 SWS** |\n| Grammatikformalismen (Seminar) | | Pnr. 2203 | 2 LP | 2 SWS |\n| Grammatikformalismen (\u00dcbung) | | Pnr. 2204 | 2 LP | 2 SWS |\n| Modulpr\u00fcfung (Klausur) | Pnr. 2210 | | 4 LP | |\n| **Basismodul - Python-Programmierung [2/2]** | **1 MP** | **2 SL** | **8 LP** | **4 SWS** |\n| Fortgeschrittene Python-Programmierung mit NLP-Anwendungen (Seminar) | | Pnr. 2303 | 2 LP | 2 SWS |\n| Fortgeschrittene Python-Programmierung mit NLP-Anwendungen (\u00dcbung) | | Pnr. 2304 | 2 LP | 2 SWS |\n| Modulpr\u00fcfung (Klausur) | Pnr. 2310 | | 4 LP | |\n| **Basiswissen Linguistik - Semantik und Pragmatik** | **1 MP** | **2 SL** | **9 LP** | **6 SWS** |\n| Vorlesung | | Pnr. 1401 | 4 LP | 4 SWS |\n| Tutorium | | Pnr. 1402 | 2 LP | 2 SWS |\n| Modulpr\u00fcfung (Klausur) | Pnr. 1410 | | 3 LP | |\n| **Basismodul - Statistische Methoden in der Computerlinguistik [1/2]** | **0 MP** | **1 SL** | **4 LP** | **4 SWS** |\n| Wahrscheinlichkeitstheorie und Statistik (Seminar und \u00dcbung) | | Pnr. 2401 | 4 LP | 4 SWS |\n| **Profilbildungsbereich** | | | **1 LP** | |"
        ],
        "reranking_scores": [
            0.026951204985380173,
            -0.03262660652399063,
            -0.03345745801925659,
            -0.0594981387257576,
            -0.07965035736560822
        ]
    },
    {
        "user_input": "Mit wie vielen Parametern wurde das Sprachmodell GPT-4 trainiert?",
        "reference": "Dazu enthalten die bereitgestellten Dokumente keine Informationen.",
        "response": "Das Sprachmodell GPT-4 wurde mit 125 Millionen Parametern trainiert.",
        "retrieved_contexts": [
            "| Modul / Veranstaltung | MP | SL | LP | SWS |\n| :--- | :--- | :--- | :--- | :--- |\n| **Aufbaumodul - Maschinelles Lernen [2/2]** | **1 MP** | **1 SL** | **8 LP** | **4 SWS** |\n| Deep Learning (Seminar) | | Pnr. 4102 | 4 LP | 4 SWS |\n| Modulpr\u00fcfung | Pnr. 4110 | | 4 LP | |\n| **Aufbaumodul - Parsing** | | **2 SL** | **6 LP** | **4 SWS** |\n| Parsing (Seminar) | | Pnr. 4301 | 3 LP | 2 SWS |\n| Parsing (\u00dcbung) | | Pnr. 4302 | 3 LP | 2 SWS |\n| **Aufbaumodul - Logische Programmierung** | | **2 SL** | **6 LP** | **4 SWS** |\n| Einf\u00fchrung in Prolog (Seminar) | | Pnr. 4401 | 3 LP | 2 SWS |\n| Prolog (\u00dcbung) | | Pnr. 4402 | 3 LP | 2 SWS |\n| **Vertiefungsmodul - Interdisziplin\u00e4r [1/2]** | | **1 SL** | **4 LP** | **4 SWS** |\n| Seminar nach Wahl | | Pnr. 5101 | 4 LP | 4 SWS |\n| **Praktikum & Orientierung [1/2]** | | **1 SL** | **3 LP** | **2 SWS** |\n| Orientierungsseminar (Seminar) | | Pnr. 3001 | 3 LP | 2 SWS |\n| **Profilbildungsbereich** | | | **3 LP** | |",
            "### 4. Semester Bachelor Computerlinguistik\n*Summe: 5 Module, 1 MP, 7 Veranstaltungen, 18 SWS, 30 LP, davon 3 LP im PBB*",
            "### 1. Semester Bachelor Computerlinguistik\n*Summe: 4 Module, 2 MP, 8 Veranstaltungen, 22 SWS, 30 LP, davon 1 LP im PBB*",
            "| Modul / Veranstaltung | MP | SL | LP | SWS |\n| :--- | :--- | :--- | :--- | :--- |\n| **Basismodul - Grundlagen der Computerlinguistik und formale Grammatikbeschreibung [2/2]** | **1 MP** | **2 SL** | **8 LP** | **4 SWS** |\n| Grammatikformalismen (Seminar) | | Pnr. 2203 | 2 LP | 2 SWS |\n| Grammatikformalismen (\u00dcbung) | | Pnr. 2204 | 2 LP | 2 SWS |\n| Modulpr\u00fcfung (Klausur) | Pnr. 2210 | | 4 LP | |\n| **Basismodul - Python-Programmierung [2/2]** | **1 MP** | **2 SL** | **8 LP** | **4 SWS** |\n| Fortgeschrittene Python-Programmierung mit NLP-Anwendungen (Seminar) | | Pnr. 2303 | 2 LP | 2 SWS |\n| Fortgeschrittene Python-Programmierung mit NLP-Anwendungen (\u00dcbung) | | Pnr. 2304 | 2 LP | 2 SWS |\n| Modulpr\u00fcfung (Klausur) | Pnr. 2310 | | 4 LP | |\n| **Basiswissen Linguistik - Semantik und Pragmatik** | **1 MP** | **2 SL** | **9 LP** | **6 SWS** |\n| Vorlesung | | Pnr. 1401 | 4 LP | 4 SWS |\n| Tutorium | | Pnr. 1402 | 2 LP | 2 SWS |\n| Modulpr\u00fcfung (Klausur) | Pnr. 1410 | | 3 LP | |\n| **Basismodul - Statistische Methoden in der Computerlinguistik [1/2]** | **0 MP** | **1 SL** | **4 LP** | **4 SWS** |\n| Wahrscheinlichkeitstheorie und Statistik (Seminar und \u00dcbung) | | Pnr. 2401 | 4 LP | 4 SWS |\n| **Profilbildungsbereich** | | | **1 LP** | |",
            "| Modul / Veranstaltung | MP | SL | LP | SWS |\n| :--- | :--- | :--- | :--- | :--- |\n| **Basismodul - Statistische Methoden in der Computerlinguistik [2/2]** | | **1 SL** | **2 LP** | **2 SWS** |\n| Linguistische Ressourcen (Seminar) | | Pnr. 2402 | 2 LP | 2 SWS |\n| **Aufbaumodul - Maschinelles Lernen [1/2]** | | **1 SL** | **4 LP** | **4 SWS** |\n| Grundlagen des maschinellen Lernens (Seminar und \u00dcbung) | | Pnr. 4101 | 4 LP | 4 SWS |\n| **Aufbaumodul - Mathematische Linguistik** | | **2 SL** | **6 LP** | **4 SWS** |\n| Automatentheorie & Formale Sprachen (Seminar) | | Pnr. 4201 | 3 LP | 2 SWS |\n| Automatentheorie & Formale Sprachen (\u00dcbung) | | Pnr. 4202 | 3 LP | 2 SWS |\n| **Aufbaumodul - Objektorientierte Programmierung** | **1 MP** | **3 SL** | **12 LP** | **8 SWS** |\n| Programmierung (Vorlesung) | | Pnr. 4501 | 4 LP | 4 SWS |\n| Programmierung (\u00dcbung) | | Pnr. 4502 | 2 LP | 2 SWS |\n| Praktische \u00dcbung zur Vorlesung | | Pnr. 4503 | 2 LP | 2 SWS |\n| Modulpr\u00fcfung (Klausur) | Pnr. 4510 | | 4 LP | |\n| **Profilbildungsbereich** | | | **6 LP** | |"
        ],
        "reranking_scores": [
            -0.007332515437155962,
            -0.025304118171334267,
            -0.06415991485118866,
            -0.07974352687597275,
            -0.08055860549211502
        ]
    },
    {
        "user_input": "In welchem Jahr wurde die Chomsky-Hierarchie zum ersten Mal publiziert?",
        "reference": "Dazu enthalten die bereitgestellten Dokumente keine Informationen.",
        "response": "Dazu enthalten die bereitgestellten Dokumente keine Informationen.",
        "retrieved_contexts": [
            "### Modul: Aufbaumodul - Mathematische Linguistik\n**Englischer Titel:** Advanced module - mathematical linguistics<br>\n**Modul-Nummer:** 4200<br>\n**ECTS-Leistungspunkte:** 6 ECTS-Leistungspunkte<br>\n**Workload:** 180 Stunden<br>\n**Dauer:** 1 Semester<br>\n**Lehrveranstaltungen und Lehrformen:** a: Automatentheorie & Formale Sprachen (Seminar) / 4201 | b: \u00dcbung zu Automatentheorie & Formale Sprachen (\u00dcbung) / 4202<br>\n**Belegung:** Seminar (a) und \u00dcbung (b)<br>\n**Empfohlenes Studiensemester:** a: 3. Fachsemester (Wintersemester) | b: 3. Fachsemester (Wintersemester)<br>\n**H\u00e4ufigkeit des Angebots:** a: Jedes Wintersemester | b: Jedes Wintersemester<br>\n**Geplante Gruppengr\u00f6\u00dfe:** a: Ca. 60 Studierende | b: Ca. 60 Studierende<br>\n**Kontaktzeit:** a: 2 SWS / 30 Stunden / 1 ECTS-Leistungspunkt | b: 2 SWS/30 Stunden / 1 ECTS-Leistungspunkt<br>\n**Selbststudium:** a: 60 Stunden / 2 ECTS-Leistungspunkte | b: 60 Stunden/2 ECTS-Leistungspunkte<br>\n**ECTS-Leistungspunkte f\u00fcr die Modulpr\u00fcfung:** -keine-<br>\n**Inhalte:** Sprachklassen basierend auf der Chomsky-Hierarchie (Automaten, Grammatiken); Sprachen und Relationen, rationale Relationen und Finite-State-Methoden; Komplexit\u00e4tstheorie und Lernbarkeitstheorie; Abschlusseigenschaften und Entscheidungsprobleme wichtiger Sprachklassen.<br>\n**Angestrebte Lernergebnisse und Studieninhalte:** Vertrautheit mit den mathematischen und informatischen Grundlagen der Linguistik und Computerlinguistik. Verst\u00e4ndnis von Beweisverfahren. F\u00e4higkeit, Sprachen, Grammatiken und Automaten aufeinander zu beziehen und passende Entsprechungen zu konstruieren.<br>\n**Teilnahmevoraussetzungen:** Formal: keine | Inhaltlich: Basismodul - Mathematische und logische Grundlagen, Basismodul - Grundlagen der Computerlinguistik und formale Grammatikbeschreibung<br>\n**Pr\u00fcfungsformen:** -keine-<br>\n**Voraussetzungen f\u00fcr die Zulassung zur Modulpr\u00fcfung:** -keine-<br>\n**Voraussetzungen f\u00fcr die Vergabe von ECTS-Leistungspunkten:** Erbrachte Studienleistungen (SL) in allen Lehrveranstaltungen<br>\n**Sonstige Informationen:** -keine-",
            "\u00a7 32 Inkrafttreten und Ver\u00f6ffentlichung",
            "Diese Ordnung tritt am Tage nach ihrer Ver\u00f6ffentlichung in den Amtlichen Bekanntmachungen der Heinrich-Heine-Universit\u00e4t D\u00fcsseldorf in Kraft.",
            "# Modulhandbuch BA Computerlinguistik (integrativ) PO 2025\n**Stand: 20.01.2026**",
            "| Modul / Veranstaltung | MP | SL | LP | SWS |\n| :--- | :--- | :--- | :--- | :--- |\n| **Vertiefungsmodul - Computerlinguistik 2** | **1 MP** | **1 SL** | **9 LP** | **4 SWS** |\n| Seminar nach Wahl im Bereich Computerlinguistik | | Pnr. 5301 | 5 LP | 4 SWS |\n| Modulpr\u00fcfung | Pnr. 5310 | | 4 LP | |\n| **Abschlussarbeit und Forschungskolloquium** | | **1 SL** | **15 LP** | **4 SWS** |\n| Forschungskolloquium oder Seminar | | Pnr. 5901 | 3 LP | 2 SWS |\n| Bachelorarbeit | Pnr. 6000 | | 12 LP | |\n| **Profilbildungsbereich** | | | **6 LP** | |"
        ],
        "reranking_scores": [
            0.22738105058670044,
            0.08559753000736237,
            -0.04272802919149399,
            -0.07241612672805786,
            -0.07318281382322311
        ]
    },
    {
        "user_input": "Wie hoch ist das durchschnittliche Einstiegsgehalt von Computerlinguisten in Deutschland?",
        "reference": "Dazu enthalten die bereitgestellten Dokumente keine Informationen.",
        "response": "Dazu enthalten die bereitgestellten Dokumente keine Informationen.",
        "retrieved_contexts": [
            "| Modul / Veranstaltung | MP | SL | LP | SWS |\n| :--- | :--- | :--- | :--- | :--- |\n| **Praktikum & Orientierung [2/2]** | | **1 SL** | **9 LP** | |\n| Praktikum (in der Regel 6 Wochen Vollzeit) | | Pnr. 3010 | 9 LP | |\n| **Vertiefungsmodul - Interdisziplin\u00e4r [2/2]** | **1 MP** | **1 SL** | **8 LP** | **4 SWS** |\n| Seminar nach Wahl | | Pnr. 5103 | 4 LP | 4 SWS |\n| Modulpr\u00fcfung | Pnr. 5110 | | 4 LP | |\n| **Vertiefungsmodul - Computerlinguistik 1** | | **2 SL** | **12 LP** | **8 SWS** |\n| Seminar nach Wahl im Bereich Computerlinguistik | | Pnr. 5201 | 6 LP | 4 SWS |\n| Seminar nach Wahl im Bereich Computerlinguistik | | Pnr. 5202 | 6 LP | 4 SWS |\n| **Profilbildungsbereich** | | | **1 LP** | |",
            "| Modul / Veranstaltung | MP | SL | LP | SWS |\n| :--- | :--- | :--- | :--- | :--- |\n| **Vertiefungsmodul - Computerlinguistik 2** | **1 MP** | **1 SL** | **9 LP** | **4 SWS** |\n| Seminar nach Wahl im Bereich Computerlinguistik | | Pnr. 5301 | 5 LP | 4 SWS |\n| Modulpr\u00fcfung | Pnr. 5310 | | 4 LP | |\n| **Abschlussarbeit und Forschungskolloquium** | | **1 SL** | **15 LP** | **4 SWS** |\n| Forschungskolloquium oder Seminar | | Pnr. 5901 | 3 LP | 2 SWS |\n| Bachelorarbeit | Pnr. 6000 | | 12 LP | |\n| **Profilbildungsbereich** | | | **6 LP** | |",
            "| Merkmal | Details |\n| :--- | :--- |\n| **Integrierter Studiengang** | Computerlinguistik |\n| **Studienbeginn** | Nur im Wintersemester |\n| **Studienumfang** | 180 ECTS-Leistungspunkte (LP) |\n| **Notwendige Vorkenntnisse** | Kenntnisse des Englischen (Niveau B1, vergleichbar mit erfolgreichem vierj\u00e4hrigem Schulunterricht an einer weiterf\u00fchrenden Schule) |\n| **Prop\u00e4deutikum im Profilbildungsbereich** | keine Angabe |\n| **Anzahl der Modulpr\u00fcfungen** | 9, zuz\u00fcglich Bachelorarbeit |\n| **Art und Inhalt der Module und der Pr\u00fcfungen** | **Module:**<br>- Basismodul - Mathematische und logische Grundlagen (8 SWS, 1 MP, 12 LP)<br>- Basismodul - Grundlagen der Computerlinguistik und formale Grammatikbeschreibung (8 SWS, 1 MP, 12 LP)<br>- Basismodul - Python-Programmierung (8 SWS, 1 MP, 12 LP)<br>- Basiswissen Linguistik - Morphologie und Syntax (6 SWS, 1 MP, 9 LP)<br>- Basiswissen Linguistik - Semantik und Pragmatik (6 SWS, 1 MP, 9 LP)<br>- Basismodul - Statistische Methoden in der Computerlinguistik (6 SWS, 6 LP)<br>- Aufbaumodul - Maschinelles Lernen (8 SWS, 1 MP, 12 LP)<br>- Aufbaumodul - Mathematische Linguistik (4 SWS, 6 LP)<br>- Aufbaumodul - Parsing (4 SWS, 6 LP)<br>- Aufbaumodul - Logische Programmierung (4 SWS, 6 LP)<br>- Aufbaumodul - Objektorientierte Programmierung (8 SWS, 1 MP, 12 LP)<br>- Praktikum und Orientierung (2 SWS, 12 LP)<br>- Vertiefungsmodul - interdisziplin\u00e4r (8 SWS, 1 MP, 12 LP)<br>- Vertiefungsmodul - Computerlinguistik 1 (8 SWS, 12 LP)<br>- Vertiefungsmodul - Computerlinguistik 2 (4 SWS, 1 MP, 9 LP)<br>- Abschlussarbeit und Forschungskolloquium (2 SWS, 15 LP)<br>- Profilbildungsbereich (18 LP) |\n| **Voraussetzungen f\u00fcr Pr\u00fcfungen** | keine Angabe |\n| **Besonderheiten** | Die zweite Wiederholung einer Modulpr\u00fcfung darf als m\u00fcndliche Pr\u00fcfung erfolgen. |\n| **Gewichtung der Pr\u00fcfungen f\u00fcr die Gesamtnote** | Bachelorarbeit: dreifach<br>Alle Modulpr\u00fcfungen: einfach |\n| **Pr\u00fcfungssprache nach \u00a7 6 (4)** | keine Angabe |\n| **Auslandsaufenthalt** | Optional (Mobilit\u00e4tsfenster: 5. Semester) |\n| **Exkursion** | keine Angabe |\n| **Praktikum** | Nach dem vierten oder f\u00fcnften Semester wird entweder ein mindestens 6-w\u00f6chiges Berufsfeldpraktikum oder eine Projektarbeit absolviert, jeweils mit einschl\u00e4gig computerlinguistischem Inhalt. Das Praktikum soll einen Einblick in die Berufspraxis vermitteln sowie den sp\u00e4teren \u00dcbergang in die Berufswelt erleichtern. Die Wahl des Praktikumsplatzes erfolgt im Einvernehmen mit dem/der Praktikumsbeauftragten der Abteilung f\u00fcr Computerlinguistik. Der/die Praktikumsbeauftragte ist bei der Vermittlung von Praktikumspl\u00e4tzen behilflich und bietet eine fachliche Praktikumsberatung und -begleitung an. \u00dcber das Praktikum ist ein kurzer Bericht (ca. 3-5 Seiten) zu verfassen und ein Zeugnis der Praktikumsstelle einzureichen. |",
            "| Modul / Veranstaltung | MP | SL | LP | SWS |\n| :--- | :--- | :--- | :--- | :--- |\n| **Basismodul - Grundlagen der Computerlinguistik und formale Grammatikbeschreibung [2/2]** | **1 MP** | **2 SL** | **8 LP** | **4 SWS** |\n| Grammatikformalismen (Seminar) | | Pnr. 2203 | 2 LP | 2 SWS |\n| Grammatikformalismen (\u00dcbung) | | Pnr. 2204 | 2 LP | 2 SWS |\n| Modulpr\u00fcfung (Klausur) | Pnr. 2210 | | 4 LP | |\n| **Basismodul - Python-Programmierung [2/2]** | **1 MP** | **2 SL** | **8 LP** | **4 SWS** |\n| Fortgeschrittene Python-Programmierung mit NLP-Anwendungen (Seminar) | | Pnr. 2303 | 2 LP | 2 SWS |\n| Fortgeschrittene Python-Programmierung mit NLP-Anwendungen (\u00dcbung) | | Pnr. 2304 | 2 LP | 2 SWS |\n| Modulpr\u00fcfung (Klausur) | Pnr. 2310 | | 4 LP | |\n| **Basiswissen Linguistik - Semantik und Pragmatik** | **1 MP** | **2 SL** | **9 LP** | **6 SWS** |\n| Vorlesung | | Pnr. 1401 | 4 LP | 4 SWS |\n| Tutorium | | Pnr. 1402 | 2 LP | 2 SWS |\n| Modulpr\u00fcfung (Klausur) | Pnr. 1410 | | 3 LP | |\n| **Basismodul - Statistische Methoden in der Computerlinguistik [1/2]** | **0 MP** | **1 SL** | **4 LP** | **4 SWS** |\n| Wahrscheinlichkeitstheorie und Statistik (Seminar und \u00dcbung) | | Pnr. 2401 | 4 LP | 4 SWS |\n| **Profilbildungsbereich** | | | **1 LP** | |",
            "### 1. Semester Bachelor Computerlinguistik\n*Summe: 4 Module, 2 MP, 8 Veranstaltungen, 22 SWS, 30 LP, davon 1 LP im PBB*"
        ],
        "reranking_scores": [
            0.1519155353307724,
            0.07499609887599945,
            0.016188910230994225,
            0.003327068407088518,
            -0.05039579048752785
        ]
    },
    {
        "user_input": "Welche Programmiersprache hat eine schnellere Ausf\u00fchrungszeit: Python oder C++?",
        "reference": "Dazu enthalten die bereitgestellten Dokumente keine Informationen.",
        "response": "Dazu enthalten die bereitgestellten Dokumente keine Informationen.",
        "retrieved_contexts": [
            "### Modul: Basismodul - Python-Programmierung\n**Englischer Titel:** Basis module - Python programming<br>\n**Modul-Nummer:** 2300<br>\n**ECTS-Leistungspunkte:** 12 ECTS-Leistungspunkte<br>\n**Workload:** 360 Stunden<br>\n**Dauer:** 2 Semester<br>\n**Lehrveranstaltungen und Lehrformen:** a: Einf\u00fchrung in die Programmierung mit Python (Seminar) / 2301 | b: Einf\u00fchrung in die Programmierung mit Python (\u00dcbung) / 2302 | c: Fortgeschrittene Python-Programmierung mit NLP-Anwendungen (Seminar) / 2303 | d: Fortgeschrittene Python-Programmierung mit NLP-Anwendungen (\u00dcbung) / 2304<br>\n**Belegung:** Seminar (a) mit \u00dcbung (b) und Seminar (c) mit \u00dcbung (d)<br>\n**Empfohlenes Studiensemester:** a: 1. Fachsemester (Wintersemester) | b: 1. Fachsemester (Wintersemester) | c: 2. Fachsemester (Sommersemester) | d: 2. Fachsemester (Sommersemester) | Pr\u00fcfung im 2. Fachsemester (Sommersemester)<br>\n**H\u00e4ufigkeit des Angebots:** a: Jedes Wintersemester | b: Jedes Wintersemester | c: Jedes Sommersemester | d: Jedes Sommersemester<br>\n**Geplante Gruppengr\u00f6\u00dfe:** a: Ca. 60 Studierende | b: Ca. 60 Studierende | c: Ca. 60 Studierende | d: Ca. 60 Studierende<br>\n**Kontaktzeit:** a: 2 SWS / 30 Stunden / 1 ECTS-Leistungspunkt | b: 2 SWS/30 Stunden / 1 ECTS-Leistungspunkt | c: 2 SWS/30 Stunden / 1 ECTS-Leistungspunkt | d: 2 SWS/30 Stunden / 1 ECTS-Leistungspunkt<br>\n**Selbststudium:** a: 30 Stunden / 1 ECTS-Leistungspunkt | b: 30 Stunden / 1 ECTS-Leistungspunkt | c: 30 Stunden / 1 ECTS-Leistungspunkt | d: 30 Stunden/1 ECTS-Leistungspunkt<br>\n**ECTS-Leistungspunkte f\u00fcr die Modulpr\u00fcfung:** 4 ECTS-Leistungspunkte (120 Stunden)<br>\n**Inhalte:** Wintersemester: Grundlagen der Python-Programmierung; Datentypen in Python; g\u00e4ngige Programmkonstrukte; elementare Textverarbeitung. Sommersemester: Objektorientierte und funktionale Programmierung mit Python; Einsatz von Programm-Bibliotheken in den Bereichen Data Science und NLP; Grundz\u00fcge der Sorftware-Entwicklung.<br>\n**Angestrebte Lernergebnisse und Studieninhalte:** Die Studierenden erwerben grundlegende F\u00e4higkeiten in der Programmierung mit der Programmiersprache Python sowie Kenntnisse \u00fcber fortgeschrittene Konzepte der Python-Programmierung (objektorientierte und funktionale Programmierung). Au\u00dferdem werden Grundkenntnisse des Einsatzes von Python in den Bereichen Data Science und NLP (Natural Language Processing) erworben, sowie die F\u00e4higkeit ein kleines Software-Projekt durchzuf\u00fchren und zu pr\u00e4sentieren.<br>\n**Teilnahmevoraussetzungen:** Formal: Keine | Inhaltlich: Keine<br>\n**Pr\u00fcfungsformen:** Projektarbeit (Pnr. 2310)<br>\n**Voraussetzungen f\u00fcr die Zulassung zur Modulpr\u00fcfung:** -keine-<br>\n**Voraussetzungen f\u00fcr die Vergabe von ECTS-Leistungspunkten:** Erbrachte Studienleistungen (SL) in den Lehrveranstaltungen (a) und (b): 4 ECTS-Leistungspunkte | Erbrachte Studienleistungen (SL) in den Lehrveranstaltungen (c) und (d): 4 ECTS-Leistungspunkte | Bestandene Modulpr\u00fcfung: 4 ECTS-Leistungspunkte<br>\n**Sonstige Informationen:** -keine-",
            "| Modul / Veranstaltung | MP | SL | LP | SWS |\n| :--- | :--- | :--- | :--- | :--- |\n| **Basismodul - Grundlagen der Computerlinguistik und formale Grammatikbeschreibung [2/2]** | **1 MP** | **2 SL** | **8 LP** | **4 SWS** |\n| Grammatikformalismen (Seminar) | | Pnr. 2203 | 2 LP | 2 SWS |\n| Grammatikformalismen (\u00dcbung) | | Pnr. 2204 | 2 LP | 2 SWS |\n| Modulpr\u00fcfung (Klausur) | Pnr. 2210 | | 4 LP | |\n| **Basismodul - Python-Programmierung [2/2]** | **1 MP** | **2 SL** | **8 LP** | **4 SWS** |\n| Fortgeschrittene Python-Programmierung mit NLP-Anwendungen (Seminar) | | Pnr. 2303 | 2 LP | 2 SWS |\n| Fortgeschrittene Python-Programmierung mit NLP-Anwendungen (\u00dcbung) | | Pnr. 2304 | 2 LP | 2 SWS |\n| Modulpr\u00fcfung (Klausur) | Pnr. 2310 | | 4 LP | |\n| **Basiswissen Linguistik - Semantik und Pragmatik** | **1 MP** | **2 SL** | **9 LP** | **6 SWS** |\n| Vorlesung | | Pnr. 1401 | 4 LP | 4 SWS |\n| Tutorium | | Pnr. 1402 | 2 LP | 2 SWS |\n| Modulpr\u00fcfung (Klausur) | Pnr. 1410 | | 3 LP | |\n| **Basismodul - Statistische Methoden in der Computerlinguistik [1/2]** | **0 MP** | **1 SL** | **4 LP** | **4 SWS** |\n| Wahrscheinlichkeitstheorie und Statistik (Seminar und \u00dcbung) | | Pnr. 2401 | 4 LP | 4 SWS |\n| **Profilbildungsbereich** | | | **1 LP** | |",
            "| Modul / Veranstaltung | MP | SL | LP | SWS |\n| :--- | :--- | :--- | :--- | :--- |\n| **Basismodul - Mathematische und logische Grundlagen** | **1 MP** | **2 SL** | **12 LP** | **8 SWS** |\n| Einf\u00fchrung in die computationelle Logik (Seminar mit \u00dcbung) | | Pnr. 2101 | 4 LP | 4 SWS |\n| Mathematische Grundlagen (Seminar) | | Pnr. 2102 | 4 LP | 4 SWS |\n| Modulpr\u00fcfung (Portfolio) | Pnr. 2110 | | 4 LP | |\n| **Basismodul - Grundlagen der Computerlinguistik und formale Grammatikbeschreibung [1/2]** | | **2 SL** | **4 LP** | **4 SWS** |\n| Einf\u00fchrung in die Computerlinguistik (Seminar) | | Pnr. 2201 | 2 LP | 2 SWS |\n| Einf\u00fchrung in die Computerlinguistik (\u00dcbung) | | Pnr. 2202 | 2 LP | 2 SWS |\n| **Basismodul - Python-Programmierung [1/2]** | | **2 SL** | **4 LP** | **4 SWS** |\n| Einf\u00fchrung in die Programmierung mit Python (Seminar) | | Pnr. 2301 | 2 LP | 2 SWS |\n| Einf\u00fchrung in die Programmierung mit Python (\u00dcbung) | | Pnr. 2302 | 2 LP | 2 SWS |\n| **Basiswissen Linguistik - Morphologie und Syntax** | **1 MP** | **2 SL** | **9 LP** | **6 SWS** |\n| Vorlesung | | Pnr. 1301 | 2 LP | 4 SWS |\n| Tutorium | | Pnr. 1302 | 2 LP | 2 SWS |\n| Modulpr\u00fcfung (Klausur) | Pnr. 1310 | | 3 LP | |\n| **Profilbilungsbereich** | | | **1 LP** | |",
            "## Aufbau des Studiums\nGrob l\u00e4sst sich das Studium in drei Phasen einteilen: Die ersten zwei Semester sind dem Erwerb von Basiswissen gewidmet, Semester 3 und 4 dem Aufbau weiterer Fachkompetenzen und die letzten beiden Semester der weiteren Spezialisierung und dem Studienabschluss.\n**Phase 1 Erwerb von Basiswissen f\u00fcr die Computerlinguistik:** Hierzu geh\u00f6rt die Vermittlung mathematischer und logischer Konzepte und Methoden, die f\u00fcr die Computerlinguistik wesentlich sind, eine Einf\u00fchrung in die Computerlinguistik, die einen \u00dcberblick \u00fcber zentrale computerlinguistische Fragestellungen und g\u00e4ngige Methoden in diesen Bereichen gibt, der Erwerb von Kenntnissen \u00fcber Formalismen und Methoden der Grammatikmodellierung und eine Einf\u00fchrung in die Statistik. Dies wird erg\u00e4nzt durch Einf\u00fchrungen in die f\u00fcr die Computerlinguistik zentralen sprachwissenschaftlichen Bereiche Morphologie/Syntax und Semantik/Pragmatik. Desweiteren sieht der Studienplan f\u00fcr das erste Jahr einen Einstieg in computerlinguistische Programmierung mit Python vor, die neben Grundlagen auch aktuelle Methoden der Sprachtechnologie vermittelt.\n**Phase 2 Aufbau von Fachkompetenzen f\u00fcr die Computerlinguistik:** Methodisch lernt man in dieser zweiten Phase die f\u00fcr die datengetriebene Computerlinguistik so zentralen Bereiche des Maschinellen Lernens und des Deep Learnings (also maschinelles Lernen mit k\u00fcnstlichen neuronalen Netzen) kennen, aufbauend auf dem Wissen \u00fcber Fragestellungen und Repr\u00e4sentationen der Computerlinguistik und auf soliden Kenntnissen der Programmiersprache Python (siehe Phase 1). Parallel dazu gewinnen die Studierenden Einblick in linguistische Ressourcen. Daneben werden in dieser Phase weitere Paradigma von Programmiersprachen vermittelt, n\u00e4mlich objektorientiertes Programmieren und, im Kontext von Themen der computationellen Semantik, entweder logische oder funktionale Programmierung. Au\u00dferdem werden die Bereiche syntaktische Verarbeitung und Automatentheorie und formale Sprachen in Hinblick auf computerlinguistische Problemstellungen vertieft. Als \u00dcbergang zur Phase 3 ist zudem eine Orientierung in Hinblick auf m\u00f6gliche Spezialisierungen vorgesehen.\n**Phase 3 Spezialisierung und Berufsorientierung:** Im letzten Studienjahr geht es darum, aufbauend auf den vorher erworbenen Grundlagen und Methoden, Fachkompetenzen weiter auszubauen und sich (1) \u00fcber die Wahl der Bereiche, in denen im letzten Jahr APs abgelegt werden, (2) \u00fcber die Durchf\u00fchrung eines Praktikums und (3) \u00fcber das Thema der Abschlussarbeit weiter zu spezialisieren und in Richtung m\u00f6glicher anschlie\u00dfender T\u00e4tigkeitsfelder zu orientieren. Zum einen werden im Rahmen der beiden computerlinguistischen Vertiefungsmodule regelm\u00e4\u00dfig eine Reihe von unterschiedlichen thematischen Seminaren angeboten werden, aus denen die Studierenden frei w\u00e4hlen k\u00f6nnen. In einem der Seminare, im Vertiefungsmodul 2, muss eine MP angelegt werden. Themen dieser Seminare sind z.B. Vektorsemantik, gro\u00dfe Sprachmodelle, Transformer-Architekturen in computerlinguistischen Anwendungen, Advanced Constituency Parsing, Dependency Parsing, Finite-State Morphology, Semantic Role Labeling, Discourse Representation Theory, Fuzzy Logic usw. Daneben gibt es das interdisziplin\u00e4re Vertiefungsmodul, in dem den Studierenden erm\u00f6glicht wird, neben Veranstaltungen aus der Computerlinguistik auch Veranstaltungen aus Linguistik und Informatik zu belegen, die nicht notwendig dezidiert computerlinguistisch sind. Im Rahmen dieses Moduls muss mindestens eine Veranstaltung aus der Informatik belegt werden. Neben diesen Modulen, die relativ flexibel Spezialisierungen in Computerlinguistik, Linguistik und Informatik erlauben, ist im letzten Jahr ein Praktikum zur Berufsorientierung und die Anfertigung der Bachelorarbeit vorgesehen. Letztere wird in der Regel im letzten Semester durchgef\u00fchrt, wobei parallel das Forschungskolloquium der Computerlinguistik besucht wird, wodurch interessante Einblicke in aktuelle Forschungsthemen geboten werden und Anregungen und Inspiration f\u00fcr die Bachelorarbeit gewonnen werden kann. Das 5. Semester kann als Mobilit\u00e4tssemester gew\u00e4hlt werden, da in den Vertiefungsmodulen auch Kurse aus anderen Universit\u00e4ten anerkannt werden k\u00f6nnen.",
            "(3) Die Dauer einer Klausurarbeit betr\u00e4gt in der Regel 90 Minuten. Ausnahmsweise kann die Bearbeitungszeit abh\u00e4ngig vom Workload des Moduls auf h\u00f6chstens 180 Minuten verl\u00e4ngert oder auf mindestens 45 Minuten verk\u00fcrzt werden. Die Bewertung einer Klausur wird durch die Dozentinnen und Dozenten vorgenommen. Die Bewertung ist der Kandidatin oder dem Kandidaten nach sp\u00e4testens acht Wochen bekannt zu machen. N\u00e4heres regelt der f\u00e4cherspezifische Anhang."
        ],
        "reranking_scores": [
            -0.0058854129165410995,
            -0.013751744292676449,
            -0.04174188897013664,
            -0.07737480849027634,
            -0.08389211446046829
        ]
    },
    {
        "user_input": "Was ist der genaue theoretische Unterschied zwischen Supervised Learning und Reinforcement Learning?",
        "reference": "Dazu enthalten die bereitgestellten Dokumente keine Informationen.",
        "response": "Dazu enthalten die bereitgestellten Dokumente keine Informationen.",
        "retrieved_contexts": [
            "### Modul: Aufbaumodul - Maschinelles Lernen\n**Englischer Titel:** Advanced module - machine learning<br>\n**Modul-Nummer:** 4100<br>\n**ECTS-Leistungspunkte:** 12 ECTS-Leistungspunkte<br>\n**Workload:** 360 Stunden<br>\n**Dauer:** 2 Semester<br>\n**Lehrveranstaltungen und Lehrformen:** a: Grundlagen des maschinellen Lernens (Seminar und \u00dcbung) / 4101 | b: Deep Learning (Seminar) / 4102<br>\n**Belegung:** Seminar mit \u00dcbung (a) und Seminar (b)<br>\n**Empfohlenes Studiensemester:** a: 3. Fachsemester (Wintersemester) | b: 4. Fachsemester (Sommersemester) | Pr\u00fcfung im 4. Fachsemester (Sommersemester)<br>\n**H\u00e4ufigkeit des Angebots:** a: Jedes Wintersemester | b: Jedes Sommersemester<br>\n**Geplante Gruppengr\u00f6\u00dfe:** a: Ca. 60 Studierende | b: Ca. 60 Studierende<br>\n**Kontaktzeit:** a: 4 SWS/60 Stunden / 2 ECTS-Leistungspunkte | b: 4 SWS/60 Stunden / 2 ECTS-Leistungspunkte<br>\n**Selbststudium:** a: 60 Stunden/2 ECTS-Leistungspunkte | b: 60 Stunden/2 ECTS-Leistungspunkte<br>\n**ECTS-Leistungspunkte f\u00fcr die Modulpr\u00fcfung:** 4 ECTS-Leistungspunkte<br>\n**Inhalte:** Methoden des modernen maschinellen Lernens, die auf Vektorrepr\u00e4sentationen basieren. In a werden die grundlegenden, meist linearen Methoden wie lineare/logistische Regression, Support Vector Machines etc. theoretisch besprochen und implementiert. In b werden neuronale Netze und deren Anwendung im Natural Language Processing (NLP) erkl\u00e4rt und implementiert.<br>\n**Angestrebte Lernergebnisse und Studieninhalte:** Die Teilnehmer k\u00f6nnen selbst\u00e4ndig lineare Modelle und neuronale Netze implementieren, um Aufgaben im NLP zu l\u00f6sen. Sie sind vertraut mit Methoden der Evaluation von Modellen und Problemen wie Overfitting und Replizierbarkeit.<br>\n**Teilnahmevoraussetzungen:** Formal: Keine | Inhaltlich: Basismodul - Statistische Methoden in der Computerlinguistik<br>\n**Pr\u00fcfungsformen:** Hausarbeit (mit Programmierprojekt) (Pnr. 4110) oder Studienarbeit (mit Programmierprojekt) (Pnr. 4120)<br>\n**Voraussetzungen f\u00fcr die Zulassung zur Modulpr\u00fcfung:** -keine-<br>\n**Voraussetzungen f\u00fcr die Vergabe von ECTS-Leistungspunkten:** Erbrachte Studienleistungen (SL) in allen Lehrveranstaltungen und bestandene Modulpr\u00fcfung.<br>\n**Sonstige Informationen:** -keine-",
            "(5) F\u00fcr die Nutzung von E-Learning-Angeboten gelten analoge Regeln.",
            "| Modul / Veranstaltung | MP | SL | LP | SWS |\n| :--- | :--- | :--- | :--- | :--- |\n| **Basismodul - Statistische Methoden in der Computerlinguistik [2/2]** | | **1 SL** | **2 LP** | **2 SWS** |\n| Linguistische Ressourcen (Seminar) | | Pnr. 2402 | 2 LP | 2 SWS |\n| **Aufbaumodul - Maschinelles Lernen [1/2]** | | **1 SL** | **4 LP** | **4 SWS** |\n| Grundlagen des maschinellen Lernens (Seminar und \u00dcbung) | | Pnr. 4101 | 4 LP | 4 SWS |\n| **Aufbaumodul - Mathematische Linguistik** | | **2 SL** | **6 LP** | **4 SWS** |\n| Automatentheorie & Formale Sprachen (Seminar) | | Pnr. 4201 | 3 LP | 2 SWS |\n| Automatentheorie & Formale Sprachen (\u00dcbung) | | Pnr. 4202 | 3 LP | 2 SWS |\n| **Aufbaumodul - Objektorientierte Programmierung** | **1 MP** | **3 SL** | **12 LP** | **8 SWS** |\n| Programmierung (Vorlesung) | | Pnr. 4501 | 4 LP | 4 SWS |\n| Programmierung (\u00dcbung) | | Pnr. 4502 | 2 LP | 2 SWS |\n| Praktische \u00dcbung zur Vorlesung | | Pnr. 4503 | 2 LP | 2 SWS |\n| Modulpr\u00fcfung (Klausur) | Pnr. 4510 | | 4 LP | |\n| **Profilbildungsbereich** | | | **6 LP** | |",
            "## 2. STUDIUM UND LEHRE",
            "## Exemplarischer Studienverlaufsplan Bachelor Computerlinguistik"
        ],
        "reranking_scores": [
            -0.020791077986359596,
            -0.043342359364032745,
            -0.06416242569684982,
            -0.06437023729085922,
            -0.0730329155921936
        ]
    },
    {
        "user_input": "Wo kann man auf dem Campus der Universit\u00e4t D\u00fcsseldorf am besten kostenlos parken?",
        "reference": "Dazu enthalten die bereitgestellten Dokumente keine Informationen.",
        "response": "Dazu enthalten die bereitgestellten Dokumente keine Informationen.",
        "retrieved_contexts": [
            "Aufgrund des \u00a7 2 Absatz 4 und des \u00a7 64 Absatz 1 des Gesetzes \u00fcber die Hochschulen des Landes Nordrhein-Westfalen (Hochschulgesetz - HG) vom 16.09.2014 (GV. NRW. S. 547), zuletzt ge\u00e4ndert durch das Gesetz zur \u00c4nderung des Hochschulgesetzes vom 19.12.2024 (GV. NRW. S. 1222) hat die Heinrich-Heine-Universit\u00e4t D\u00fcsseldorf folgende Ordnung erlassen:",
            "(2) Die konkreten Anforderungen f\u00fcr Studienleistungen sind in der Veranstaltungsank\u00fcndigung im elektronischen Campus Management System der Heinrich-Heine-Universit\u00e4t D\u00fcsseldorf sp\u00e4testens zu Beginn der Belegfrist f\u00fcr Studierende bekannt zu geben.",
            "Diese Ordnung tritt am Tage nach ihrer Ver\u00f6ffentlichung in den Amtlichen Bekanntmachungen der Heinrich-Heine-Universit\u00e4t D\u00fcsseldorf in Kraft.",
            "**Die Rektorin der Heinrich-Heine-Universit\u00e4t D\u00fcsseldorf**",
            "| Modul / Veranstaltung | MP | SL | LP | SWS |\n| :--- | :--- | :--- | :--- | :--- |\n| **Vertiefungsmodul - Computerlinguistik 2** | **1 MP** | **1 SL** | **9 LP** | **4 SWS** |\n| Seminar nach Wahl im Bereich Computerlinguistik | | Pnr. 5301 | 5 LP | 4 SWS |\n| Modulpr\u00fcfung | Pnr. 5310 | | 4 LP | |\n| **Abschlussarbeit und Forschungskolloquium** | | **1 SL** | **15 LP** | **4 SWS** |\n| Forschungskolloquium oder Seminar | | Pnr. 5901 | 3 LP | 2 SWS |\n| Bachelorarbeit | Pnr. 6000 | | 12 LP | |\n| **Profilbildungsbereich** | | | **6 LP** | |"
        ],
        "reranking_scores": [
            0.030353883281350136,
            -0.012346690520644188,
            -0.06407102197408676,
            -0.06534447520971298,
            -0.08861848711967468
        ]
    },
    {
        "user_input": "Wie viele Einwohner hat die Stadt D\u00fcsseldorf aktuell?",
        "reference": "Dazu enthalten die bereitgestellten Dokumente keine Informationen.",
        "response": "Dazu enthalten die bereitgestellten Dokumente keine Informationen.",
        "retrieved_contexts": [
            "*D\u00fcsseldorf, den 20.01.2026*",
            "# Ordnung f\u00fcr die Pr\u00fcfung in Studieng\u00e4ngen der Philosophischen Fakult\u00e4t der Heinrich-Heine-Universit\u00e4t D\u00fcsseldorf\n**mit dem Abschluss Bachelor of Arts vom 20.01.2026**",
            "Diese Ordnung tritt am Tage nach ihrer Ver\u00f6ffentlichung in den Amtlichen Bekanntmachungen der Heinrich-Heine-Universit\u00e4t D\u00fcsseldorf in Kraft.",
            "Aufgrund des \u00a7 2 Absatz 4 und des \u00a7 64 Absatz 1 des Gesetzes \u00fcber die Hochschulen des Landes Nordrhein-Westfalen (Hochschulgesetz - HG) vom 16.09.2014 (GV. NRW. S. 547), zuletzt ge\u00e4ndert durch das Gesetz zur \u00c4nderung des Hochschulgesetzes vom 19.12.2024 (GV. NRW. S. 1222) hat die Heinrich-Heine-Universit\u00e4t D\u00fcsseldorf folgende Ordnung erlassen:",
            "| Modul / Veranstaltung | MP | SL | LP | SWS |\n| :--- | :--- | :--- | :--- | :--- |\n| **Vertiefungsmodul - Computerlinguistik 2** | **1 MP** | **1 SL** | **9 LP** | **4 SWS** |\n| Seminar nach Wahl im Bereich Computerlinguistik | | Pnr. 5301 | 5 LP | 4 SWS |\n| Modulpr\u00fcfung | Pnr. 5310 | | 4 LP | |\n| **Abschlussarbeit und Forschungskolloquium** | | **1 SL** | **15 LP** | **4 SWS** |\n| Forschungskolloquium oder Seminar | | Pnr. 5901 | 3 LP | 2 SWS |\n| Bachelorarbeit | Pnr. 6000 | | 12 LP | |\n| **Profilbildungsbereich** | | | **6 LP** | |"
        ],
        "reranking_scores": [
            0.08105037361383438,
            -0.050118688493967056,
            -0.10048214346170425,
            -0.1292715072631836,
            -0.13625456392765045
        ]
    },
    {
        "user_input": "Wie wird das Wetter am kommenden Wochenende in Nordrhein-Westfalen?",
        "reference": "Dazu enthalten die bereitgestellten Dokumente keine Informationen.",
        "response": "Dazu enthalten die bereitgestellten Dokumente keine Informationen.",
        "retrieved_contexts": [
            "*D\u00fcsseldorf, den 20.01.2026*",
            "Diese Ordnung tritt am Tage nach ihrer Ver\u00f6ffentlichung in den Amtlichen Bekanntmachungen der Heinrich-Heine-Universit\u00e4t D\u00fcsseldorf in Kraft.",
            "# Ordnung f\u00fcr die Pr\u00fcfung in Studieng\u00e4ngen der Philosophischen Fakult\u00e4t der Heinrich-Heine-Universit\u00e4t D\u00fcsseldorf\n**mit dem Abschluss Bachelor of Arts vom 20.01.2026**",
            "Aufgrund des \u00a7 2 Absatz 4 und des \u00a7 64 Absatz 1 des Gesetzes \u00fcber die Hochschulen des Landes Nordrhein-Westfalen (Hochschulgesetz - HG) vom 16.09.2014 (GV. NRW. S. 547), zuletzt ge\u00e4ndert durch das Gesetz zur \u00c4nderung des Hochschulgesetzes vom 19.12.2024 (GV. NRW. S. 1222) hat die Heinrich-Heine-Universit\u00e4t D\u00fcsseldorf folgende Ordnung erlassen:",
            "## 5. SCHLUSSBESTIMMUNGEN"
        ],
        "reranking_scores": [
            0.008096369914710522,
            -0.056878454983234406,
            -0.06987910717725754,
            -0.07147650420665741,
            -0.08071888238191605
        ]
    },
    {
        "user_input": "Wer hat die Fu\u00dfball-Europameisterschaft der Herren im Jahr 2024 gewonnen?",
        "reference": "Dazu enthalten die bereitgestellten Dokumente keine Informationen.",
        "response": "Dazu enthalten die bereitgestellten Dokumente keine Informationen.",
        "retrieved_contexts": [
            "(4) Die Bachelorurkunde wird von der Dekanin oder dem Dekan der Philosophischen Fakult\u00e4t unterzeichnet und mit dem Siegel der Heinrich-Heine-Universit\u00e4t D\u00fcsseldorf versehen.",
            "# Ordnung f\u00fcr die Pr\u00fcfung in Studieng\u00e4ngen der Philosophischen Fakult\u00e4t der Heinrich-Heine-Universit\u00e4t D\u00fcsseldorf\n**mit dem Abschluss Bachelor of Arts vom 20.01.2026**",
            "*D\u00fcsseldorf, den 20.01.2026*",
            "(2) Die konkreten Anforderungen f\u00fcr Studienleistungen sind in der Veranstaltungsank\u00fcndigung im elektronischen Campus Management System der Heinrich-Heine-Universit\u00e4t D\u00fcsseldorf sp\u00e4testens zu Beginn der Belegfrist f\u00fcr Studierende bekannt zu geben.",
            "\u00a7 24 Pr\u00fcfungsaussch\u00fcsse"
        ],
        "reranking_scores": [
            -0.020118825137615204,
            -0.025401243939995766,
            -0.04310590401291847,
            -0.046168748289346695,
            -0.058858245611190796
        ]
    },
    {
        "user_input": "Bei welcher Temperatur und wie lange muss ein klassischer Marmorkuchen im Ofen backen?",
        "reference": "Dazu enthalten die bereitgestellten Dokumente keine Informationen.",
        "response": "Dazu enthalten die bereitgestellten Dokumente keine Informationen.",
        "retrieved_contexts": [
            "(3) Die Bewertung der Bachelorarbeit ist der Kandidatin oder dem Kandidaten nach sp\u00e4testens acht Wochen mitzuteilen.",
            "(3) Die Dauer einer Klausurarbeit betr\u00e4gt in der Regel 90 Minuten. Ausnahmsweise kann die Bearbeitungszeit abh\u00e4ngig vom Workload des Moduls auf h\u00f6chstens 180 Minuten verl\u00e4ngert oder auf mindestens 45 Minuten verk\u00fcrzt werden. Die Bewertung einer Klausur wird durch die Dozentinnen und Dozenten vorgenommen. Die Bewertung ist der Kandidatin oder dem Kandidaten nach sp\u00e4testens acht Wochen bekannt zu machen. N\u00e4heres regelt der f\u00e4cherspezifische Anhang.",
            "(2) M\u00fcndliche Pr\u00fcfungen k\u00f6nnen im Einvernehmen mit den Kandidatinnen oder Kandidaten auch in Form einer Gruppenpr\u00fcfung mit bis zu 3 Teilnehmerinnen und Teilnehmern durchgef\u00fchrt werden. Die Dauer einer Gruppenpr\u00fcfung betr\u00e4gt pro Kandidatin oder Kandidat mindestens 15 und h\u00f6chstens 20 Minuten.",
            "(9) Die Bewertung von Pr\u00fcfungen ist den Studierenden jeweils nach sp\u00e4testens acht Wochen bekanntzugeben.",
            "(1) Die Dauer einer m\u00fcndlichen Pr\u00fcfung betr\u00e4gt mindestens 15 und h\u00f6chstens 30 Minuten. M\u00fcndliche Pr\u00fcfungen werden als Einzelpr\u00fcfung vor einer Pr\u00fcferin oder einem Pr\u00fcfer in Gegenwart einer sachkundigen Beisitzerin oder eines sachkundigen Beisitzers gem\u00e4\u00df \u00a7 25 Absatz 5 abgelegt. In der Regel f\u00fchrt die Beisitzerin oder der Beisitzer das Protokoll. In dem Protokoll werden die wesentlichen Gegenst\u00e4nde und Ergebnisse der Pr\u00fcfung festgehalten. Vor der Festsetzung der Note h\u00f6rt die Pr\u00fcferin oder der Pr\u00fcfer die Beisitzerin oder den Beisitzer. Die Bewertung ist der Kandidatin oder dem Kandidaten unmittelbar nach Ende der Pr\u00fcfung bekannt zu machen."
        ],
        "reranking_scores": [
            -0.06729720532894135,
            -0.08108533918857574,
            -0.0841158851981163,
            -0.09395670890808105,
            -0.10501326620578766
        ]
    },
    {
        "user_input": "Wie viele Kilometer ist die Sonne durchschnittlich von der Erde entfernt?",
        "reference": "Dazu enthalten die bereitgestellten Dokumente keine Informationen.",
        "response": "Dazu enthalten die bereitgestellten Dokumente keine Informationen.",
        "retrieved_contexts": [
            "---",
            "---",
            "(2) Das Studium kann folgenden Umfang in Studienjahren und ECTS-Leistungspunkten (LP) haben:\n\u2022 3 Studienjahre, insgesamt 180 LP, Kernfach 108 LP, Erg\u00e4nzungsfach 54 LP, Profilbildungsbereich 18 LP oder\n\u2022 4 Studienjahre, insgesamt 240 LP, Kernfach 168 LP, Erg\u00e4nzungsfach 54 LP, Profilbildungsbereich 18 LP.",
            "(1) Ein ECTS-Leistungspunkt (abgek\u00fcrzt LP) im Sinne dieser Pr\u00fcfungsordnung (European Credit Transfer System) wird f\u00fcr eine Leistung vergeben, wenn der Erfolg dieser Arbeit im Umfang von durchschnittlich 30 Stunden durch eine Pr\u00fcfung oder eine Studienleistung nachgewiesen ist.",
            "(10) Der Umfang der Bachelorarbeit, beziehungsweise bei Gruppenarbeiten der einzelnen Beitr\u00e4ge zur Abschlussarbeit, muss 9.000 bis 15.000 W\u00f6rter (circa 30 bis 50 Seiten) betragen. Falls im f\u00e4cherspezifischen Anhang der Umfang in Zeichen statt in W\u00f6rtern angegeben ist, gilt diese Angabe. Enth\u00e4lt die Bachelorarbeit unter anderem auch experimentelle oder gestalterische Leistungen, verringert sich der Textumfang entsprechend um 5 Seiten."
        ],
        "reranking_scores": [
            -0.02207079529762268,
            -0.07676978409290314,
            -0.0954267755150795,
            -0.1298103779554367,
            -0.13196146488189697
        ]
    }
]